collection,filename,__cover_filename,description,__tags,__photographer_name,source_url,__reddit_title,__reddit_score,__reddit_author,__reddit_post_created_at,__reddit_post_extracted_at,date,__created_at,hidden
gdsets_posters,gdsets_posters_1963_05_23a.jpg,,Poster - 5/23/63,[],,https://gdsets.com/63posters/1963_05_23a.jpg,,,,,,1963-05-23,1713480187303,true
gdsets_posters,gdsets_posters_1964_05_01c.jpg,,"Poster - 5/1,2/64",[],,https://gdsets.com/63posters/1964_05_01c.jpg,,,,,,1964-05-01,1713480187868,false
gdsets_posters,gdsets_posters_1964_01_26.jpg,,Poster - 1/26/64 @ Joe & The Jaguars(Mickey),[],,https://gdsets.com/63posters
gdsets_posters,gdsets_posters_1963_08_09.jpg,,"Poster - 8/9,10/63",[],,https://gdsets.com/63posters/1963_08_09.jpg,,,,,,1963-08-09,1713480187883,false
gdsets_posters,gdsets_posters_1963_05_03.jpg,,"Poster - 5/3,4/63",[],,https://gdsets.com/63posters/1963_05_03.jpg,,,,,,1963-05-03,1713480187991,false
gdsets_posters,gdsets_posters_1964_07_16.jpg,,Poster - 7/16-18/64,[],,https://gdsets.com/63posters/1964_07_16.jpg,,,,,,1964-07-16,1713480187995,false
gdsets_posters,gdsets_posters_1964_07_16a.jpg,,Poster - 7/16-18/64(uncertainprovenance),[],,https://gdsets.com/63posters
gdsets_posters,gdsets_posters_1965_06_18.jpg,,Poster - 6/18/65(uncertainprovenance),[],,https://gdsets.com/63posters
gdsets_posters,gdsets_posters_1964_05_01a.jpg,,"Poster - 5/1,2/64",[],,https://gdsets.com/63posters/1964_05_01a.jpg,,,,,,1964-05-01,1713480188340,false
gdsets_posters,gdsets_posters_1965_05_05.jpg,,Poster - 5/5/65(uncertainprovenance),[],,https://gdsets.com/63posters/1965_05_05.jpg,,,,,,1965-05-05,1713480188342,false
gdsets_posters,gdsets_posters_1963_05_23.jpg,,Poster - 5/23/63,[],,https://gdsets.com/63posters/1963_05_23.jpg,,,,,,1963-05-23,1713480188360,false
gdsets_posters,gdsets_posters_1965_11_27.jpg,,Poster - 11/27/65(uncertainprovenance),[],,https://gdsets.com/63posters
gdsets_posters,gdsets_posters_1964_05_01b.jpg,,"Poster - 5/1,2/64",[],,https://gdsets.com/63posters/1964_05_01b.jpg,,,,,,1964-05-01,1713480188652,false
gdsets_posters,gdsets_posters_1965_12_04.jpg,,Poster - 12/4/65(date uncertain),[],,https://gdsets.com/63posters/1965_12_04.jpg,,,,,,1965-12-04,1713480188819,false
gdsets_posters,gdsets_posters_1965_12_18.jpg,,Poster - 12/18/65(uncertainprovenance),[],,https://gdsets.com/63posters
gdsets_posters,gdsets_posters_1965_12_10c.jpg,,Poster - 12/10/65 (OHB)AOR 2.36,[],,https://gdsets.com/63posters/1965_12_10c.jpg,,,,,,1965-12-10,1713480189007,true
gdsets_posters,gdsets_posters_1965_12_18a (JG).jpg,,Poster - 12/18/65(uncertainprovenance),[],,https://gdsets.com/63posters/1965_12_18a 
gdsets_posters,gdsets_posters_1965_12_11c.jpg,,Poster - 12/11/65(uncertainprovenance),[],,https://gdsets.com/63posters
gdsets_posters,gdsets_posters_1965_12_10k.jpg,,Poster - 12/10/65 (OHB)AOR 2.36,[],,https://gdsets.com/63posters/1965_12_10k.jpg,,,,,,1965-12-10,1713480189210,false
gdsets_posters,gdsets_posters_1964_05_01.jpg,,"Poster - 5/1,2/64(uncertainprovenance)",[],,https://gdsets.com/63posters
gdsets_posters,gdsets_posters_1964_04_12.jpg,,Poster - 4/12/64,[],,https://gdsets.com/63posters/1964_04_12.jpg,,,,,,1964-04-12,1713480189386,false
gdsets_posters,gdsets_posters_1965_12_10b.jpg,,Poster - 12/10/65 (OHB)AOR 2.36,[],,https://gdsets.com/63posters/1965_12_10b.jpg,,,,,,1965-12-10,1713480189663,true
gdsets_posters,gdsets_posters_1965_04_27.jpg,,Poster - 4/27/65(Hugh Romney),[],,https://gdsets.com/63posters/1965_04_27.jpg,,,,,,1965-04-27,1713480189788,false
gdsets_posters,gdsets_posters_1965_12_10.jpg,,Poster - 12/10/65 (OP1)AOR 2.37,[],,https://gdsets.com/63posters/1965_12_10.jpg,,,,,,1965-12-10,1713480189790,false
gdsets_posters,gdsets_posters_1965_12_11b.jpg,,Poster - 12/11/65 (RP)AOR 2.4,[],,https://gdsets.com/63posters/1965_12_11b.jpg,,,,,,1965-12-11,1713480189881,true
gdsets_posters,gdsets_posters_1965_12_10a.jpg,,Poster - 12/10/65 (OHB)AOR 2.36,[],,https://gdsets.com/63posters/1965_12_10a.jpg,,,,,,1965-12-10,1713480189895,true
gdsets_posters,gdsets_posters_1965_12_11a.jpg,,Poster - 12/11/65 (OP1)AOR 2.4(hand colored),[],,https://gdsets.com/63posters
gdsets_posters,gdsets_posters_1964_09_00.jpg,,Poster - September1964,[],,https://gdsets.com/63posters/1964_09_00.jpg,,,,,,1964-09-00,1713480197170,false
gdsets_posters,gdsets_posters_1968_01_20.jpg,,Poster - 1/20/68 (OP1),[],,https://gdsets.com/68posters/1968_01_20.jpg,,,,,,1968-01-20,1713480382479,true
gdsets_posters,gdsets_posters_1968_01_26b.jpg,,"Poster - 1/26,27/68 @ Newspaper Ad",[],,https://gdsets.com/68posters
gdsets_posters,gdsets_posters_1968_01_26c.jpg,,"Poster - 1/26,27/68 @ AOR pg. 249(hand colored)",[],,https://gdsets.com/68posters
gdsets_posters,gdsets_posters_1968_01_29a.jpg,,Poster - 1/29/68,[],,https://gdsets.com/68posters/1968_01_29a.jpg,,,,,,1968-01-29,1713480382708,true
gdsets_posters,gdsets_posters_1968_01_29b.jpg,,Poster - 1/29/68 @ Newspaper Ad,[],,https://gdsets.com/68posters/1968_01_29b.jpg,,,,,,1968-01-29,1713480382988,false
gdsets_posters,gdsets_posters_1968_01_20a.jpg,,Poster - 1/20/68 (OHB),[],,https://gdsets.com/68posters/1968_01_20a.jpg,,,,,,1968-01-20,1713480383094,false
gdsets_posters,gdsets_posters_1968_01_26a.jpg,,"Poster - 1/26,27/68 @ AOR 3.104",[],,https://gdsets.com/68posters/1968_01_26a.jpg,,,,,,1968-01-26,1713480383106,false
gdsets_posters,gdsets_posters_1968_01_26.jpg,,"Poster - 1/26,27/68 @ AOR pg. 249",[],,https://gdsets.com/68posters/1968_01_26.jpg,,,,,,1968-01-26,1713480383107,false
gdsets_posters,gdsets_posters_1968_02_14a.jpg,,Poster - 2/14/68,[],,https://gdsets.com/68posters/1968_02_14a.jpg,,,,,,1968-02-14,1713480383329,true
gdsets_posters,gdsets_posters_1968_01_30a.jpg,,Poster - 1/30/68,[],,https://gdsets.com/68posters/1968_01_30a.jpg,,,,,,1968-01-30,1713480383422,false
gdsets_posters,gdsets_posters_1968_01_17.jpg,,Poster - 1/17/68 (OP1)AOR 2.169,[],,https://gdsets.com/68posters/1968_01_17.jpg,,,,,,1968-01-17,1713480383428,false
gdsets_posters,gdsets_posters_1968_02_16.jpg,,Poster - 2/16/68,[],,https://gdsets.com/68posters/1968_02_16.jpg,,,,,,1968-02-16,1713480383441,false
gdsets_posters,gdsets_posters_1968_02_17a.jpg,,Poster - 2/17/68,[],,https://gdsets.com/68posters/1968_02_17a.jpg,,,,,,1968-02-17,1713480383539,false
gdsets_posters,gdsets_posters_1968_01_29.jpg,,Poster - 1/29/68,[],,https://gdsets.com/68posters/1968_01_29.jpg,,,,,,1968-01-29,1713480383546,false
gdsets_posters,gdsets_posters_1968_02_02.jpg,,"Poster - 2/2,3/68 (OHB)AOR 3.103",[],,https://gdsets.com/68posters/1968_02_02.jpg,,,,,,1968-02-02,1713480383852,false
gdsets_posters,gdsets_posters_1968_03_01.jpg,,"Poster - 3/1,2/68 @ Newspaper Ad",[],,https://gdsets.com/68posters/1968_03_01.jpg,,,,,,1968-03-01,1713480383857,false
gdsets_posters,gdsets_posters_1968_02_02c.jpg,,"Poster - 2/2,3/68",[],,https://gdsets.com/68posters/1968_02_02c.jpg,,,,,,1968-02-02,1713480383962,true
gdsets_posters,gdsets_posters_1968_02_02a.jpg,,"Poster - 2/2,3/68 (OHB)AOR 3.103",[],,https://gdsets.com/68posters/1968_02_02a.jpg,,,,,,1968-02-02,1713480384067,true
gdsets_posters,gdsets_posters_1968_02_04.jpg,,Poster - 2/4/68,[],,https://gdsets.com/68posters/1968_02_04.jpg,,,,,,1968-02-04,1713480384094,false
gdsets_posters,gdsets_posters_1968_03_01a.jpg,,"Poster - 3/1,2/68 (OHB)",[],,https://gdsets.com/68posters/1968_03_01a.jpg,,,,,,1968-03-01,1713480384096,true
gdsets_posters,gdsets_posters_1968_03_08.jpg,,"Poster - 3/8,9/68(GD opened)",[],,https://gdsets.com/68posters/1968_03_08.jpg,,,,,,1968-03-08,1713480384182,false
gdsets_posters,gdsets_posters_1968_01_30.jpg,,Poster - 1/30/68,[],,https://gdsets.com/68posters/1968_01_30.jpg,,,,,,1968-01-30,1713480384199,false
gdsets_posters,gdsets_posters_1968_02_14 (AOR 2.174).jpg,,Poster - 2/14/68 (OP1)AOR 2.174,[],,https://gdsets.com/68posters/1968_02_14 (AOR
gdsets_posters,gdsets_posters_1968_03_11a.jpg,,Poster - 3/11/68,[],,https://gdsets.com/68posters/1968_03_11a.jpg,,,,,,1968-03-11,1713480384412,false
gdsets_posters,gdsets_posters_1968_02_22b.jpg,,Poster - 2/22-24/68 (OP1)AOR 3.29,[],,https://gdsets.com/68posters/1968_02_22b.jpg,,,,,,1968-02-22,1713480384517,true
gdsets_posters,gdsets_posters_1968_03_22a.jpg,,"Poster - 3/22,23/68 @ Newspaper Ad",[],,https://gdsets.com/68posters
gdsets_posters,gdsets_posters_1968_02_02b.jpg,,"Poster - 2/2,3/68 (OP1)AOR 3.103",[],,https://gdsets.com/68posters/1968_02_02b.jpg,,,,,,1968-02-02,1713480384637,true
gdsets_posters,gdsets_posters_1968_02_22a.jpg,,Poster - 2/22-24/68(RP2 proof sheet)AOR 3.29,[],,https://gdsets.com/68posters
gdsets_posters,gdsets_posters_1968_03_22b.jpg,,"Poster - 3/22,23/68 @ Newspaper Ad",[],,https://gdsets.com/68posters
gdsets_posters,gdsets_posters_1968_03_11.jpg,,Poster - 3/11/68,[],,https://gdsets.com/68posters/1968_03_11.jpg,,,,,,1968-03-11,1713480384991,false
gdsets_posters,gdsets_posters_1968_03_29a.jpg,,Poster - 3/29-31/68 (OHB-A)AOR 2.163,[],,https://gdsets.com/68posters
gdsets_posters,gdsets_posters_1968_03_22.jpg,,"Poster - 3/22,23/68 @ G/G-680322 (OPC-A)AOR 3.136",[],,https://gdsets.com/68posters
gdsets_posters,gdsets_posters_1968_04_12d.jpg,,Poster - 4/12-14/68(OP1),[],,https://gdsets.com/68posters/1968_04_12d.jpg,,,,,,1968-04-12,1713480385290,true
gdsets_posters,gdsets_posters_1968_03_24.jpg,,Poster - 3/24/68 (OP1)AOR 3.151,[],,https://gdsets.com/68posters/1968_03_24.jpg,,,,,,1968-03-24,1713480385309,false
gdsets_posters,gdsets_posters_1968_03_01b.jpg,,"Poster - 3/1,2/68 (OHB)",[],,https://gdsets.com/68posters/1968_03_01b.jpg,,,,,,1968-03-01,1713480385457,false
gdsets_posters,gdsets_posters_1968_03_15a.jpg,,Poster - 3/15-17/68 (OHB)AOR 2.172,[],,https://gdsets.com/68posters/1968_03_15a.jpg,,,,,,1968-03-15,1713480385483,true
gdsets_posters,gdsets_posters_1968_04_03.jpg,,Poster - 4/3/68,[],,https://gdsets.com/68posters/1968_04_03.jpg,,,,,,1968-04-03,1713480385580,false
gdsets_posters,gdsets_posters_1968_04_12f.jpg,,Poster - 4/12-14/68 @ Newspaper Ad,[],,https://gdsets.com/68posters/1968_04_12f.jpg,,,,,,1968-04-12,1713480385654,false
gdsets_posters,gdsets_posters_1968_02_22.jpg,,Poster - 2/22-24/68 (OP1)AOR 3.29,[],,https://gdsets.com/68posters/1968_02_22.jpg,,,,,,1968-02-22,1713480385694,false
gdsets_posters,gdsets_posters_1968_04_26.jpg,,Poster - 4/26-28/68,[],,https://gdsets.com/68posters/1968_04_26.jpg,,,,,,1968-04-26,1713480385792,false
gdsets_posters,gdsets_posters_1968_03_15.jpg,,Poster - 3/15-17/68 (OP1)AOR 2.172,[],,https://gdsets.com/68posters/1968_03_15.jpg,,,,,,1968-03-15,1713480385796,false
gdsets_posters,gdsets_posters_1968_04_26b.jpg,,Poster - 4/26-28/68 @ Newspaper Ad,[],,https://gdsets.com/68posters/1968_04_26b.jpg,,,,,,1968-04-26,1713480385812,false
gdsets_posters,gdsets_posters_1968_04_26a.jpg,,Poster - 4/26-28/68,[],,https://gdsets.com/68posters/1968_04_26a.jpg,,,,,,1968-04-26,1713480385908,true
gdsets_posters,gdsets_posters_1968_05_04.jpg,,Poster - 5/4/68 @ Newspaper Ad,[],,https://gdsets.com/68posters/1968_05_04.jpg,,,,,,1968-05-04,1713480386017,false
gdsets_posters,gdsets_posters_1968_05_07a.jpg,,Poster - 5/7-9/68 @ Newspaper Ad,[],,https://gdsets.com/68posters/1968_05_07a.jpg,,,,,,1968-05-07,1713480386025,true
gdsets_posters,gdsets_posters_1968_03_15b.jpg,,Poster - 3/15-17/68 @ AOR 2.172 @ Original Art,[],,https://gdsets.com/68posters
gdsets_posters,gdsets_posters_1968_03_29.jpg,,Poster - 3/29-31/68 (OP1)AOR 2.163,[],,https://gdsets.com/68posters/1968_03_29.jpg,,,,,,1968-03-29,1713480386039,false
gdsets_posters,gdsets_posters_1968_03_29b.jpg,,Poster - 3/29-31/68 @ Newspaper Ad,[],,https://gdsets.com/68posters/1968_03_29b.jpg,,,,,,1968-03-29,1713480386136,false
gdsets_posters,gdsets_posters_1968_05_12.jpg,,Poster - 5/12/68,[],,https://gdsets.com/68posters/1968_05_12.jpg,,,,,,1968-05-12,1713480386433,false
gdsets_posters,gdsets_posters_1968_05_07b.jpg,,Poster - 5/7-9/68 @ Newspaper Ad,[],,https://gdsets.com/68posters/1968_05_07b.jpg,,,,,,1968-05-07,1713480386458,true
gdsets_posters,gdsets_posters_1968_04_12a.jpg,,Poster - 4/12-14/68(OP1),[],,https://gdsets.com/68posters/1968_04_12a.jpg,,,,,,1968-04-12,1713480386530,false
gdsets_posters,gdsets_posters_1968_05_17c.jpg,,"Poster - 5/17,18/68 @ Newspaper Ad",[],,https://gdsets.com/68posters
gdsets_posters,gdsets_posters_1968_04_19.jpg,,Poster - 4/19-21/68,[],,https://gdsets.com/68posters/1968_04_19.jpg,,,,,,1968-04-19,1713480386671,false
gdsets_posters,gdsets_posters_1968_05_07d.jpg,,Poster - 5/7-9/68,[],,https://gdsets.com/68posters/1968_05_07d.jpg,,,,,,1968-05-07,1713480386674,false
gdsets_posters,gdsets_posters_1968_05_17d.jpg,,"Poster - 5/17,18/68",[],,https://gdsets.com/68posters/1968_05_17d.jpg,,,,,,1968-05-17,1713480386746,false
gdsets_posters,gdsets_posters_1968_05_18c.jpg,,Poster - 5/18/68,[],,https://gdsets.com/68posters/1968_05_18c.jpg,,,,,,1968-05-18,1713480386750,false
gdsets_posters,gdsets_posters_1968_05_18e.jpg,,Poster - 5/18/68,[],,https://gdsets.com/68posters/1968_05_18e.jpg,,,,,,1968-05-18,1713480386822,false
gdsets_posters,gdsets_posters_1968_05_18g.jpg,,Poster - 5/18/68 @ Program,[],,https://gdsets.com/68posters/1968_05_18g.jpg,,,,,,1968-05-18,1713480386973,false
gdsets_posters,gdsets_posters_1968_02_17.jpg,,Poster - 2/17/68 (OHB)AOR 3.27,[],,https://gdsets.com/68posters/1968_02_17.jpg,,,,,,1968-02-17,1713480387207,false
gdsets_posters,gdsets_posters_1968_05_21b.jpg,,Poster - 5/21/68 (OHB),[],,https://gdsets.com/68posters/1968_05_21b.jpg,,,,,,1968-05-21,1713480387235,false
gdsets_posters,gdsets_posters_1968_05_18a.jpg,,Poster - 5/18/68,[],,https://gdsets.com/68posters/1968_05_18a.jpg,,,,,,1968-05-18,1713480387299,false
gdsets_posters,gdsets_posters_1968_05_18 (AOR 2.341 OP).jpg,,Poster - 5/18/68 (OP1)AOR 2.341,[],,https://gdsets.com/68posters/1968_05_18 (AOR 2.341
gdsets_posters,gdsets_posters_1968_05_17.jpg,,"Poster - 5/17,18/68 (OHB)AOR pg. 255",[],,https://gdsets.com/68posters
gdsets_posters,gdsets_posters_1968_05_30h.jpg,,Poster - 5/30-6/1/68 @ AOR 2.160 @ Original Art,[],,https://gdsets.com/68posters
gdsets_posters,gdsets_posters_1968_05_24.jpg,,"Poster - 5/24,25/68",[],,https://gdsets.com/68posters/1968_05_24.jpg,,,,,,1968-05-24,1713480387428,false
gdsets_posters,gdsets_posters_1968_05_21.jpg,,Poster - 5/21/68 (OP1),[],,https://gdsets.com/68posters/1968_05_21.jpg,,,,,,1968-05-21,1713480387430,false
gdsets_posters,gdsets_posters_1968_05_30f.jpg,,Poster - 5/30-6/1/68 @ AOR 2.160 @ Original Art,[],,https://gdsets.com/68posters
gdsets_posters,gdsets_posters_1968_05_30g.jpg,,Poster - 5/30-6/1/68 @ AOR 2.160 @ Original Art,[],,https://gdsets.com/68posters
gdsets_posters,gdsets_posters_1968_05_21a.jpg,,Poster - 5/21/68 (OPC-A),[],,https://gdsets.com/68posters/1968_05_21a.jpg,,,,,,1968-05-21,1713480387473,true
gdsets_posters,gdsets_posters_1968_05_17b.jpg,,"Poster - 5/17,18/68 @ Newspaper Ad",[],,https://gdsets.com/68posters
gdsets_posters,gdsets_posters_1968_05_30e.jpg,,Poster - 5/30-6/1/68 @ AOR 2.160 @ Original Art,[],,https://gdsets.com/68posters
gdsets_posters,gdsets_posters_1968_05_30c.jpg,,Poster - 5/30-6/1/68 @ AOR 2.160 @ Original Art,[],,https://gdsets.com/68posters
gdsets_posters,gdsets_posters_1968_05_30d.jpg,,Poster - 5/30-6/1/68 @ AOR 2.160 @ Original Art,[],,https://gdsets.com/68posters
gdsets_posters,gdsets_posters_1968_05_18b.jpg,,Poster - 5/18/68,[],,https://gdsets.com/68posters/1968_05_18b.jpg,,,,,,1968-05-18,1713480387685,false
gdsets_posters,gdsets_posters_1968_05_17a.jpg,,"Poster - 5/17,18/68 @ Newspaper Ad",[],,https://gdsets.com/68posters
gdsets_posters,gdsets_posters_1968_05_30j.jpg,,Poster - 5/30-6/1/68 @ Newspaper Ad,[],,https://gdsets.com/68posters
gdsets_posters,gdsets_posters_1968_05_30b AOR 2.179.jpg,,Poster - 5/30-6/1/68 (Proof)AOR 2.179,[],,https://gdsets.com/68posters/1968_05_30b AOR
gdsets_posters,gdsets_posters_1968_06_07c.jpg,,Poster - 6/7-9/68 @ Newspaper Ad,[],,https://gdsets.com/68posters/1968_06_07c.jpg,,,,,,1968-06-07,1713480388064,false
gdsets_posters,gdsets_posters_1968_06_04.jpg,,Poster - 6/4/68,[],,https://gdsets.com/68posters/1968_06_04.jpg,,,,,,1968-06-04,1713480388175,false
gdsets_posters,gdsets_posters_1968_05_30i.jpg,,Poster - 5/30-6/1/68 @ Newspaper Ad,[],,https://gdsets.com/68posters
gdsets_posters,gdsets_posters_1968_05_30a.jpg,,Poster - 5/30-6/1/68 (OP1)AOR 2.160 @ Second State,[],,https://gdsets.com/68posters
gdsets_posters,gdsets_posters_1968_06_10.jpg,,Poster - Petulia (film)(GD appeared),[],,https://gdsets.com/68posters/1968_06_10.jpg,,,,,,1968-06-10,1713480388473,false
gdsets_posters,gdsets_posters_1968_06_14.jpg,,"Poster - 6/14,15/68 (OPC)",[],,https://gdsets.com/68posters/1968_06_14.jpg,,,,,,1968-06-14,1713480388476,false
gdsets_posters,gdsets_posters_1968_05_30k.jpg,,Poster - 5/30-6/1/68 @ Newspaper Ad,[],,https://gdsets.com/68posters/1968_05_30k.jpg,,,,,,1968-05-30,1713480388542,true
gdsets_posters,gdsets_posters_1968_06_19.jpg,,Poster - 6/19/68 (OP1)AOR 2.180,[],,https://gdsets.com/68posters/1968_06_19.jpg,,,,,,1968-06-19,1713480388542,false
gdsets_posters,gdsets_posters_1968_06_17.jpg,,Poster - 6/17/68,[],,https://gdsets.com/68posters/1968_06_17.jpg,,,,,,1968-06-17,1713480388542,false
gdsets_posters,gdsets_posters_1968_06_14b.jpg,,"Poster - 6/14,15/68 @ Newspaper Ad",[],,https://gdsets.com/68posters
gdsets_posters,gdsets_posters_1968_06_07b.jpg,,Poster - 6/7-9/68 @ Newspaper Ad,[],,https://gdsets.com/68posters/1968_06_07b.jpg,,,,,,1968-06-07,1713480388656,false
gdsets_posters,gdsets_posters_1968_06_07.jpg,,Poster - 6/7-9/68 @ AOR 2.165,[],,https://gdsets.com/68posters/1968_06_07.jpg,,,,,,1968-06-07,1713480388659,false
gdsets_posters,gdsets_posters_1968_05_30 (AOR 2.160).jpg,,Poster - 5/30-6/1/68 (OP1)AOR 2.160 @ First State,[],,https://gdsets.com/68posters/1968_05_30 (AOR
gdsets_posters,gdsets_posters_1968_06_21a.jpg,,Poster - 6/21/68,[],,https://gdsets.com/68posters/1968_06_21a.jpg,,,,,,1968-06-21,1713480388684,true
gdsets_posters,gdsets_posters_1968_06_07a.jpg,,Poster - 6/7-9/68 @ Newspaper Ad,[],,https://gdsets.com/68posters/1968_06_07a.jpg,,,,,,1968-06-07,1713480388772,false
gdsets_posters,gdsets_posters_1968_03_24a.jpg,,Poster - 3/24/68 (OHB)AOR 3.151,[],,https://gdsets.com/68posters/1968_03_24a.jpg,,,,,,1968-03-24,1713480388785,true
gdsets_posters,gdsets_posters_1968_06_21b.jpg,,Poster - 6/21/68,[],,https://gdsets.com/68posters/1968_06_21b.jpg,,,,,,1968-06-21,1713480388858,true
gdsets_posters,gdsets_posters_1968_06_14a.jpg,,"Poster - 6/14,15/68 @ Newspaper Ad",[],,https://gdsets.com/68posters
gdsets_posters,gdsets_posters_1968_07_11a.jpg,,Poster - 7/11/68,[],,https://gdsets.com/68posters/1968_07_11a.jpg,,,,,,1968-07-11,1713480388969,true
gdsets_posters,gdsets_posters_1968_07_11b.jpg,,Poster - 7/11/68,[],,https://gdsets.com/68posters/1968_07_11b.jpg,,,,,,1968-07-11,1713480388969,true
gdsets_posters,gdsets_posters_1968_07_11c.jpg,,Poster - 7/11/68,[],,https://gdsets.com/68posters/1968_07_11c.jpg,,,,,,1968-07-11,1713480389061,true
gdsets_posters,gdsets_posters_1968_07_12.jpg,,"Poster - 7/12,13/68",[],,https://gdsets.com/68posters/1968_07_12.jpg,,,,,,1968-07-12,1713480389164,false
gdsets_posters,gdsets_posters_1968_07_14.jpg,,Poster - 7/14/68,[],,https://gdsets.com/68posters/1968_07_14.jpg,,,,,,1968-07-14,1713480389266,false
gdsets_posters,gdsets_posters_1968_06_21.jpg,,Poster - 6/21/68,[],,https://gdsets.com/68posters/1968_06_21.jpg,,,,,,1968-06-21,1713480389409,false
gdsets_posters,gdsets_posters_1968_07_18.jpg,,Poster - Anthem Of The Sun Newspaper Ad,[],,https://gdsets.com/68posters
gdsets_posters,gdsets_posters_1968_07_25c.jpg,,Poster - 7/25-27/68 @ Proof AOR 3.116(cancelled),[],,https://gdsets.com/68posters
gdsets_posters,gdsets_posters_1968_08_02 (AOR 3.101).jpg,,"Poster - 8/2,3/68 @ AOR 3.101",[],,https://gdsets.com/68posters/1968_08_02 (AOR
gdsets_posters,gdsets_posters_1968_07_18a.jpg,,Poster - Anthem Of The Sun Promo Poster,[],,https://gdsets.com/68posters
gdsets_posters,gdsets_posters_1968_07_11.jpg,,Poster - 7/11/68,[],,https://gdsets.com/68posters/1968_07_11.jpg,,,,,,1968-07-11,1713480389850,true
gdsets_posters,gdsets_posters_1968_07_11d.jpg,,Poster - 7/11/68,[],,https://gdsets.com/68posters/1968_07_11d.jpg,,,,,,1968-07-11,1713480389883,false
gdsets_posters,gdsets_posters_1968_07_27.jpg,,Poster - 7/27/68(Nekoosa papermill promo),[],,https://gdsets.com/68posters
gdsets_posters,gdsets_posters_1968_08_04a (OHB fr).jpg,,Poster - 8/4/68(OHB front)AOR 3.61,[],,https://gdsets.com/68posters/1968_08_04a (OHB
gdsets_posters,gdsets_posters_1968_08_04b (OHB bk).jpg,,Poster - 8/4/68(OHB back)AOR 3.61,[],,https://gdsets.com/68posters/1968_08_04b (OHB
gdsets_posters,gdsets_posters_1968_07_25b.jpg,,Poster - 7/25-27/68 @ Proof AOR 3.116(cancelled),[],,https://gdsets.com/68posters
gdsets_posters,gdsets_posters_1968_08_04c.jpg,,Poster - 8/4/68(OHB front)AOR 3.61,[],,https://gdsets.com/68posters/1968_08_04c.jpg,,,,,,1968-08-04,1713480390204,true
gdsets_posters,gdsets_posters_1968_07_25e.jpg,,Poster - 7/25-27/68 @ Progressive Proof AOR 3.113(cancelled),[],,https://gdsets.com/68posters
gdsets_posters,gdsets_posters_1968_08_04bb.jpg,,Poster - 8/4/68(OHB front)AOR 3.61,[],,https://gdsets.com/68posters
gdsets_posters,gdsets_posters_1968_08_04g.jpg,,Poster - 8/4/68,[],,https://gdsets.com/68posters/1968_08_04g.jpg,,,,,,1968-08-04,1713480390608,false
gdsets_posters,gdsets_posters_1968_07_18b.jpg,,Poster - Anthem Of The Sun Newspaper Ad,[],,https://gdsets.com/68posters
gdsets_posters,gdsets_posters_1968_08_04gg.jpg,,Poster - 8/4/68,[],,https://gdsets.com/68posters/1968_08_04gg.jpg,,,,,,1968-08-04,1713480390827,false
gdsets_posters,gdsets_posters_1968_05_07.jpg,,Poster - 5/7-9/68 @ Newspaper Ad,[],,https://gdsets.com/68posters/1968_05_07.jpg,,,,,,1968-05-07,1713480390864,false
gdsets_posters,gdsets_posters_1968_07_25.jpg,,Poster - 7/25-27/68(OP1)AOR 3.116(cancelled),[],,https://gdsets.com/68posters
gdsets_posters,gdsets_posters_1968_08_04i.jpg,,Poster - 8/4/68 @ Program,[],,https://gdsets.com/68posters/1968_08_04i.jpg,,,,,,1968-08-04,1713480391170,true
gdsets_posters,gdsets_posters_1968_08_04hh.jpg,,Poster - 8/4/68,[],,https://gdsets.com/68posters/1968_08_04hh.jpg,,,,,,1968-08-04,1713480391201,true
gdsets_posters,gdsets_posters_1968_08_20c.jpg,,Poster - 8/20-22/68 @ BG133 (OPC-D),[],,https://gdsets.com/68posters/1968_08_20c.jpg,,,,,,1968-08-20,1713480391260,true
gdsets_posters,gdsets_posters_1968_08_20b.jpg,,Poster - 8/20-22/68 @ BG133 (OPC-B),[],,https://gdsets.com/68posters/1968_08_20b.jpg,,,,,,1968-08-20,1713480391272,true
gdsets_posters,gdsets_posters_1968_07_25aa.jpg,,Poster - 7/25-27/68(RP2)AOR 3.116(cancelled),[],,https://gdsets.com/68posters
gdsets_posters,gdsets_posters_1968_08_20a.jpg,,Poster - 8/20-22/68 @ BG133 (OPC-A),[],,https://gdsets.com/68posters
gdsets_posters,gdsets_posters_1968_07_25a.jpg,,Poster - 7/25-27/68(OHB)AOR 3.116(cancelled),[],,https://gdsets.com/68posters
gdsets_posters,gdsets_posters_1968_08_04h.jpg,,Poster - 8/4/68,[],,https://gdsets.com/68posters/1968_08_04h.jpg,,,,,,1968-08-04,1713480391828,false
gdsets_posters,gdsets_posters_1968_08_23a.jpg,,"Poster - 8/23,24/68",[],,https://gdsets.com/68posters/1968_08_23a.jpg,,,,,,1968-08-23,1713480391957,false
gdsets_posters,gdsets_posters_1968_07_25d.jpg,,Poster - 7/25-27/68 @ Progressive Proof AOR 3.113(cancelled),[],,https://gdsets.com/68posters
gdsets_posters,gdsets_posters_1968_08_04e.jpg,,Poster - 8/4/68 @ Newspaper Ad,[],,https://gdsets.com/68posters/1968_08_04e.jpg,,,,,,1968-08-04,1713480392130,false
gdsets_posters,gdsets_posters_1968_08_23.jpg,,"Poster - 8/23,24/68 @ Newspaper Ad",[],,https://gdsets.com/68posters/1968_08_23.jpg,,,,,,1968-08-23,1713480392132,false
gdsets_posters,gdsets_posters_1968_08_04d.jpg,,Poster - 8/4/68 @ Newspaper Ad,[],,https://gdsets.com/68posters/1968_08_04d.jpg,,,,,,1968-08-04,1713480392143,false
gdsets_posters,gdsets_posters_1968_08_30d.jpg,,Poster - 8/30-9/1/68 @ BG134/135(OPC-F),[],,https://gdsets.com/68posters
gdsets_posters,gdsets_posters_1968_08_30e.jpg,,Poster - 8/30-9/1/68 (OHB),[],,https://gdsets.com/68posters/1968_08_30e.jpg,,,,,,1968-08-30,1713480392401,false
gdsets_posters,gdsets_posters_1968_09_01.jpg,,Poster - 9/1/68 @ AOR 2.239,[],,https://gdsets.com/68posters/1968_09_01.jpg,,,,,,1968-09-01,1713480392508,false
gdsets_posters,gdsets_posters_1968_08_30f.jpg,,Poster - 8/30-9/1/68 @ Newspaper Ad,[],,https://gdsets.com/68posters
gdsets_posters,gdsets_posters_1968_08_04ff.jpg,,Poster - 8/4/68 @ Newspaper Ad,[],,https://gdsets.com/68posters/1968_08_04ff.jpg,,,,,,1968-08-04,1713480392618,true
gdsets_posters,gdsets_posters_1968_08_04f.jpg,,Poster - 8/4/68 @ Newspaper Ad,[],,https://gdsets.com/68posters/1968_08_04f.jpg,,,,,,1968-08-04,1713480392626,false
gdsets_posters,gdsets_posters_1968_08_20.jpg,,Poster - 8/20-22/68 @ BG133 (OP1),[],,https://gdsets.com/68posters/1968_08_20.jpg,,,,,,1968-08-20,1713480392746,false
gdsets_posters,gdsets_posters_1968_08_30c.jpg,,Poster - 8/30-9/1/68 @ BG134 (OPC-C),[],,https://gdsets.com/68posters
gdsets_posters,gdsets_posters_1968_08_30a.jpg,,Poster - 8/30-9/1/68 @ BG134 (OP1),[],,https://gdsets.com/68posters/1968_08_30a.jpg,,,,,,1968-08-30,1713480392830,true
gdsets_posters,gdsets_posters_1968_08_20d.jpg,,Poster - 8/20-22/68 @ Newspaper Ad,[],,https://gdsets.com/68posters/1968_08_20d.jpg,,,,,,1968-08-20,1713480392841,false
gdsets_posters,gdsets_posters_1968_09_02a.jpg,,Poster - 9/2/68,[],,https://gdsets.com/68posters/1968_09_02a.jpg,,,,,,1968-09-02,1713480392931,false
gdsets_posters,gdsets_posters_1968_09_02c.jpg,,Poster - 9/2/68,[],,https://gdsets.com/68posters/1968_09_02c.jpg,,,,,,1968-09-02,1713480392931,false
gdsets_posters,gdsets_posters_1968_09_02d AOR 3.8.jpg,,Poster - 9/2/68 @ AOR 3.8,[],,https://gdsets.com/68posters/1968_09_02d AOR
gdsets_posters,gdsets_posters_1968_09_02b.jpg,,Poster - 9/2/68,[],,https://gdsets.com/68posters/1968_09_02b.jpg,,,,,,1968-09-02,1713480393033,false
gdsets_posters,gdsets_posters_1968_09_01a.jpg,,Poster - 9/1/68 @ AOR 2.237,[],,https://gdsets.com/68posters/1968_09_01a.jpg,,,,,,1968-09-01,1713480393049,false
gdsets_posters,gdsets_posters_1968_08_30.jpg,,Poster - 8/30-9/1/68 @ BG134 (OP1),[],,https://gdsets.com/68posters/1968_08_30.jpg,,,,,,1968-08-30,1713480393151,true
gdsets_posters,gdsets_posters_1968_09_02f.jpg,,Poster - 9/2/68,[],,https://gdsets.com/68posters/1968_09_02f.jpg,,,,,,1968-09-02,1713480393235,false
gdsets_posters,gdsets_posters_1968_09_01b.jpg,,Poster - 9/1/68 @ Newspaper Ad,[],,https://gdsets.com/68posters/1968_09_01b.jpg,,,,,,1968-09-01,1713480393314,false
gdsets_posters,gdsets_posters_1968_09_02g.jpg,,Poster - 9/2/68,[],,https://gdsets.com/68posters/1968_09_02g.jpg,,,,,,1968-09-02,1713480393340,false
gdsets_posters,gdsets_posters_1968_09_02.jpg,,Poster - 9/2/68,[],,https://gdsets.com/68posters/1968_09_02.jpg,,,,,,1968-09-02,1713480393460,false
gdsets_posters,gdsets_posters_1968_09_20b.jpg,,Poster - 9/20/68 @ Newspaper Ad,[],,https://gdsets.com/68posters/1968_09_20b.jpg,,,,,,1968-09-20,1713480393568,false
gdsets_posters,gdsets_posters_1968_09_22a.jpg,,Poster - 9/22/68 (OP),[],,https://gdsets.com/68posters/1968_09_22a.jpg,,,,,,1968-09-22,1713480393568,true
gdsets_posters,gdsets_posters_1968_09_20.jpg,,Poster - 9/20/68 @ Newspaper Ad,[],,https://gdsets.com/68posters/1968_09_20.jpg,,,,,,1968-09-20,1713480393586,false
gdsets_posters,gdsets_posters_1968_09_02h.jpg,,Poster - 9/2/68,[],,https://gdsets.com/68posters/1968_09_02h.jpg,,,,,,1968-09-02,1713480393780,false
gdsets_posters,gdsets_posters_1968_09_22.jpg,,Poster - 9/22/68 (OP),[],,https://gdsets.com/68posters/1968_09_22.jpg,,,,,,1968-09-22,1713480393780,false
gdsets_posters,gdsets_posters_1968_09_02i.jpg,,Poster - 9/2/68,[],,https://gdsets.com/68posters/1968_09_02i.jpg,,,,,,1968-09-02,1713480393782,false
gdsets_posters,gdsets_posters_1968_09_22e.jpg,,Poster - 9/22/68 @ Newspaper Ad,[],,https://gdsets.com/68posters/1968_09_22e.jpg,,,,,,1968-09-22,1713480393789,false
gdsets_posters,gdsets_posters_1968_09_20a.jpg,,Poster - 9/20/68 (OP1),[],,https://gdsets.com/68posters/1968_09_20a.jpg,,,,,,1968-09-20,1713480393876,false
gdsets_posters,gdsets_posters_1968_08_30b.jpg,,Poster - 8/30-9/1/68 @ BG134 (RP2),[],,https://gdsets.com/68posters/1968_08_30b.jpg,,,,,,1968-08-30,1713480393882,true
gdsets_posters,gdsets_posters_1968_09_22c.jpg,,Poster - 9/22/68 (OHB),[],,https://gdsets.com/68posters/1968_09_22c.jpg,,,,,,1968-09-22,1713480393886,true
gdsets_posters,gdsets_posters_1968_09_27cx.jpg,,"Poster - 9/27,28/68(cancelled)",[],,https://gdsets.com/68posters/1968_09_27cx.jpg,,,,,,1968-09-27,1713480393978,false
gdsets_posters,gdsets_posters_1968_10_11a.jpg,,Poster - 10/11-13/68 @ FD141 (OPC-A),[],,https://gdsets.com/68posters
gdsets_posters,gdsets_posters_1968_10_11c.jpg,,Poster - 10/11-13/68 @ FD141/142(OPC-C),[],,https://gdsets.com/68posters
gdsets_posters,gdsets_posters_1968_10_08a.jpg,,Poster - 10/8-10/68 (OHB)AOR 2.118,[],,https://gdsets.com/68posters/1968_10_08a.jpg,,,,,,1968-10-08,1713480394381,true
gdsets_posters,gdsets_posters_1968_10_11d.jpg,,Poster - 10/11-13/68 @ Newspaper Ad,[],,https://gdsets.com/68posters
gdsets_posters,gdsets_posters_1968_10_18b.jpg,,Poster - 10/18/68 (RP2)AOR 3.91,[],,https://gdsets.com/68posters/1968_10_18b.jpg,,,,,,1968-10-18,1713480394397,true
gdsets_posters,gdsets_posters_1968_10_20.jpg,,Poster - 10/20/68,[],,https://gdsets.com/68posters/1968_10_20.jpg,,,,,,1968-10-20,1713480394479,false
gdsets_posters,gdsets_posters_1968_11_01.jpg,,Poster - 11/1/68,[],,https://gdsets.com/68posters/1968_11_01.jpg,,,,,,1968-11-01,1713480394493,false
gdsets_posters,gdsets_posters_1968_11_04.jpg,,Poster - 11/4/68,[],,https://gdsets.com/68posters/1968_11_04.jpg,,,,,,1968-11-04,1713480394614,false
gdsets_posters,gdsets_posters_1968_10_20b.jpg,,Poster - 10/20/68 @ Newspaper Ad,[],,https://gdsets.com/68posters/1968_10_20b.jpg,,,,,,1968-10-20,1713480394706,false
gdsets_posters,gdsets_posters_1968_10_11.jpg,,Poster - 10/11-13/68 @ FD141 (OP1),[],,https://gdsets.com/68posters/1968_10_11.jpg,,,,,,1968-10-11,1713480394707,false
gdsets_posters,gdsets_posters_1968_11_01 (OHB).jpg,,Poster - 11/1/68 (OHB),[],,https://gdsets.com/68posters/1968_11_01 (OHB).jpg,,,,,,1968-11-01,1713480394737,false
gdsets_posters,gdsets_posters_1968_10_11b.jpg,,Poster - 10/11-13/68 @ FD141 (OPC-A)(Hendrix/Redding auto),[],,https://gdsets.com/68posters
gdsets_posters,gdsets_posters_1968_09_22f.jpg,,Poster - 9/22/68 @ Newspaper Ad,[],,https://gdsets.com/68posters/1968_09_22f.jpg,,,,,,1968-09-22,1713480394811,false
gdsets_posters,gdsets_posters_1968_10_18c.jpg,,Poster - 10/18/68 @ AOR 3.91 @ Newspaper Ad,[],,https://gdsets.com/68posters
gdsets_posters,gdsets_posters_1968_10_18a.jpg,,Poster - 10/18/68 (OP1)AOR 3.91,[],,https://gdsets.com/68posters/1968_10_18a.jpg,,,,,,1968-10-18,1713480395165,true
gdsets_posters,gdsets_posters_1968_11_07a.jpg,,Poster - 11/7-10/68 @ BG144 (OPC-A),[],,https://gdsets.com/68posters/1968_11_07a.jpg,,,,,,1968-11-07,1713480395169,true
gdsets_posters,gdsets_posters_1968_10_08.jpg,,Poster - 10/8-10/68 (OP1)AOR 2.118,[],,https://gdsets.com/68posters/1968_10_08.jpg,,,,,,1968-10-08,1713480395169,false
gdsets_posters,gdsets_posters_1968_10_20a.jpg,,Poster - 10/20/68 @ Newspaper Ad,[],,https://gdsets.com/68posters/1968_10_20a.jpg,,,,,,1968-10-20,1713480395169,false
gdsets_posters,gdsets_posters_1968_11_13.jpg,,Poster - 11/13/68 @ Newspaper Ad,[],,https://gdsets.com/68posters/1968_11_13.jpg,,,,,,1968-11-13,1713480395254,false
gdsets_posters,gdsets_posters_1968_11_15a.jpg,,Poster - 11/15/68 @ Newspaper Ad,[],,https://gdsets.com/68posters/1968_11_15a.jpg,,,,,,1968-11-15,1713480395461,false
gdsets_posters,gdsets_posters_1968_11_07b.jpg,,Poster - 11/7-10/68 @ BG144 (OPC-B),[],,https://gdsets.com/68posters
gdsets_posters,gdsets_posters_1968_11_13b.jpg,,Poster - 11/13/68 @ Newspaper Ad,[],,https://gdsets.com/68posters/1968_11_13b.jpg,,,,,,1968-11-13,1713480395719,false
gdsets_posters,gdsets_posters_1968_11_29.jpg,,Poster - 11/29/68,[],,https://gdsets.com/68posters/1968_11_29.jpg,,,,,,1968-11-29,1713480395807,false
gdsets_posters,gdsets_posters_1968_11_27d.jpg,,"Poster - 11/27,28/68",[],,https://gdsets.com/68posters/1968_11_27d.jpg,,,,,,1968-11-27,1713480395822,false
gdsets_posters,gdsets_posters_1968_11_13a.jpg,,Poster - 11/13/68 @ Newspaper Ad,[],,https://gdsets.com/68posters/1968_11_13a.jpg,,,,,,1968-11-13,1713480395906,false
gdsets_posters,gdsets_posters_1968_11_30.jpg,,Poster - 11/30/68,[],,https://gdsets.com/68posters/1968_11_30.jpg,,,,,,1968-11-30,1713480396004,false
gdsets_posters,gdsets_posters_1968_11_07.jpg,,Poster - 11/7-10/68 @ BG144 (OP1),[],,https://gdsets.com/68posters/1968_11_07.jpg,,,,,,1968-11-07,1713480396005,false
gdsets_posters,gdsets_posters_1968_11_30b.jpg,,Poster - 11/30/68,[],,https://gdsets.com/68posters/1968_11_30b.jpg,,,,,,1968-11-30,1713480396012,false
gdsets_posters,gdsets_posters_1968_11_07c.jpg,,Poster - 11/7-10/68 @ BG144/145(OPC-D),[],,https://gdsets.com/68posters
gdsets_posters,gdsets_posters_1968_11_30c.jpg,,Poster - 11/30/68,[],,https://gdsets.com/68posters/1968_11_30c.jpg,,,,,,1968-11-30,1713480396235,false
gdsets_posters,gdsets_posters_1968_11_27c.jpg,,"Poster - 11/27,28/68 @ Newspaper Ad",[],,https://gdsets.com/68posters
gdsets_posters,gdsets_posters_1968_11_27a.jpg,,"Poster - 11/27,28/68 @ Newspaper Ad",[],,https://gdsets.com/68posters
gdsets_posters,gdsets_posters_1968_11_30a.jpg,,Poster - 11/30/68,[],,https://gdsets.com/68posters/1968_11_30a.jpg,,,,,,1968-11-30,1713480396283,false
gdsets_posters,gdsets_posters_1968_11_27b.jpg,,"Poster - 11/27,28/68 @ Newspaper Ad",[],,https://gdsets.com/68posters
gdsets_posters,gdsets_posters_1968_11_27.jpg,,"Poster - 11/27,28/68 @ Newspaper Ad",[],,https://gdsets.com/68posters
gdsets_posters,gdsets_posters_1968_12_06.jpg,,Poster - 12/6/68(OHB),[],,https://gdsets.com/68posters/1968_12_06.jpg,,,,,,1968-12-06,1713480396531,false
gdsets_posters,gdsets_posters_1968_12_06b.jpg,,Poster - 12/6/68 @ Newspaper Ad,[],,https://gdsets.com/68posters/1968_12_06b.jpg,,,,,,1968-12-06,1713480396539,false
gdsets_posters,gdsets_posters_1968_12_06a.jpg,,Poster - 12/6/68 @ Newspaper Ad,[],,https://gdsets.com/68posters/1968_12_06a.jpg,,,,,,1968-12-06,1713480396658,false
gdsets_posters,gdsets_posters_1968_12_07b.jpg,,Poster - 12/7/68,[],,https://gdsets.com/68posters/1968_12_07b.jpg,,,,,,1968-12-07,1713480396663,false
gdsets_posters,gdsets_posters_1968_12_09 (GD cx).jpg,,Poster - 12/9/68(GD cancelled),[],,https://gdsets.com/68posters/1968_12_09 (GD
gdsets_posters,gdsets_posters_1968_11_17.jpg,,Poster - 11/17/68,[],,https://gdsets.com/68posters/1968_11_17.jpg,,,,,,1968-11-17,1713480396732,false
gdsets_posters,gdsets_posters_1968_12_07a.jpg,,Poster - 12/7/68,[],,https://gdsets.com/68posters/1968_12_07a.jpg,,,,,,1968-12-07,1713480396757,true
gdsets_posters,gdsets_posters_1968_12_01a.jpg,,Poster - 12/1/68 @ Newspaper Ad,[],,https://gdsets.com/68posters/1968_12_01a.jpg,,,,,,1968-12-01,1713480396824,true
gdsets_posters,gdsets_posters_1968_12_20b.jpg,,"Poster - 12/20,21/68 (OHB)AOR 3.54",[],,https://gdsets.com/68posters
gdsets_posters,gdsets_posters_1968_12_01.jpg,,Poster - 12/1/68 @ G/G-681127 (OPC)AOR 3.150,[],,https://gdsets.com/68posters
gdsets_posters,gdsets_posters_1968_12_20c.jpg,,"Poster - 12/20,21/68",[],,https://gdsets.com/68posters/1968_12_20c.jpg,,,,,,1968-12-20,1713480397105,false
gdsets_posters,gdsets_posters_1968_12_29g.jpg,,Poster - 12/29/68 @ Newspaper Ad,[],,https://gdsets.com/68posters/1968_12_29g.jpg,,,,,,1968-12-29,1713480397333,false
gdsets_posters,gdsets_posters_1968_12_29a.jpg,,Poster - 12/29/68,[],,https://gdsets.com/68posters/1968_12_29a.jpg,,,,,,1968-12-29,1713480397345,true
gdsets_posters,gdsets_posters_1968_09_22d.jpg,,Poster - 9/22/68 @ Newspaper Ad,[],,https://gdsets.com/68posters/1968_09_22d.jpg,,,,,,1968-09-22,1713480397355,false
gdsets_posters,gdsets_posters_1968_12_20.jpg,,"Poster - 12/20,21/68 (OHB)AOR 3.54",[],,https://gdsets.com/68posters/1968_12_20.jpg,,,,,,1968-12-20,1713480397435,false
gdsets_posters,gdsets_posters_1968_12_29j.jpg,,Poster - 12/29/68 @ Newspaper Ad,[],,https://gdsets.com/68posters/1968_12_29j.jpg,,,,,,1968-12-29,1713480397659,false
gdsets_posters,gdsets_posters_1968_12_07.jpg,,Poster - 12/7/68,[],,https://gdsets.com/68posters/1968_12_07.jpg,,,,,,1968-12-07,1713480397665,false
gdsets_posters,gdsets_posters_1968_12_29.jpg,,Poster - 12/29/68,[],,https://gdsets.com/68posters/1968_12_29.jpg,,,,,,1968-12-29,1713480397755,false
gdsets_posters,gdsets_posters_1968_12_29i.jpg,,Poster - 12/29/68,[],,https://gdsets.com/68posters/1968_12_29i.jpg,,,,,,1968-12-29,1713480397792,false
gdsets_posters,gdsets_posters_1968_12_29aa.jpg,,Poster - 12/29/68,[],,https://gdsets.com/68posters/1968_12_29aa.jpg,,,,,,1968-12-29,1713480397793,true
gdsets_posters,gdsets_posters_1968_12_29b.jpg,,Poster - 12/29/68 @ Program,[],,https://gdsets.com/68posters/1968_12_29b.jpg,,,,,,1968-12-29,1713480397895,false
gdsets_posters,gdsets_posters_1968_12_29h.jpg,,Poster - 12/29/68 @ Newspaper Ad,[],,https://gdsets.com/68posters/1968_12_29h.jpg,,,,,,1968-12-29,1713480397908,false
gdsets_posters,gdsets_posters_1968_11_17a.jpg,,Poster - 11/17/68 @ Newspaper Ad,[],,https://gdsets.com/68posters/1968_11_17a.jpg,,,,,,1968-11-17,1713480398048,true
gdsets_posters,gdsets_posters_1968_12_29k.jpg,,Poster - 12/29/68,[],,https://gdsets.com/68posters/1968_12_29k.jpg,,,,,,1968-12-29,1713480398140,false
gdsets_posters,gdsets_posters_1968_12_13b.jpg,,"Poster - 12/13,14/68 @ AOR 3.92 @ Newspaper Ad",[],,https://gdsets.com/68posters
gdsets_posters,gdsets_posters_1968_12_13a.jpg,,"Poster - 12/13,14/68 @ AOR 3.92 @ Newspaper Ad",[],,https://gdsets.com/68posters
gdsets_posters,gdsets_posters_1968_12_31a.jpg,,Poster - 12/31/68 @ BG152/153 (OP2),[],,https://gdsets.com/68posters/1968_12_31a.jpg,,,,,,1968-12-31,1713480398333,true
gdsets_posters,gdsets_posters_1968_12_29l.jpg,,Poster - 12/29/68,[],,https://gdsets.com/68posters/1968_12_29l.jpg,,,,,,1968-12-29,1713480398383,false
gdsets_posters,gdsets_posters_1968_12_31c.jpg,,Poster - 12/31/68 @ BG152/153(OPC-C),[],,https://gdsets.com/68posters
gdsets_posters,gdsets_posters_1968_12_31b.jpg,,Poster - 12/31/68 @ BG152 (OPC-A),[],,https://gdsets.com/68posters/1968_12_31b.jpg,,,,,,1968-12-31,1713480398516,true
gdsets_posters,gdsets_posters_1968_12_31g.jpg,,Poster - 12/31/68 @ Newspaper Ad,[],,https://gdsets.com/68posters/1968_12_31g.jpg,,,,,,1968-12-31,1713480398617,false
gdsets_posters,gdsets_posters_1968_12_13.jpg,,"Poster - 12/13,14/68 (OP1)AOR 3.92",[],,https://gdsets.com/68posters/1968_12_13.jpg,,,,,,1968-12-13,1713480398618,false
gdsets_posters,gdsets_posters_1968_12_31.jpg,,Poster - 12/31/68 @ BG152 (OP1),[],,https://gdsets.com/68posters/1968_12_31.jpg,,,,,,1968-12-31,1713480398734,false
gdsets_posters,gdsets_posters_1968_11_15.jpg,,Poster - 11/15/68 (OP1),[],,https://gdsets.com/68posters/1968_11_15.jpg,,,,,,1968-11-15,1713480398749,false
gdsets_posters,gdsets_posters_1969_01_17.jpg,,Poster - 1/17/69 @ Newspaper Ad,[],,https://gdsets.com/68posters/1969_01_17.jpg,,,,,,1969-01-17,1713480398835,false
gdsets_posters,gdsets_posters_1969_01_02a.jpg,,Poster - 1/2/69 @ BG154 (OPC-B),[],,https://gdsets.com/68posters/1969_01_02a.jpg,,,,,,1969-01-02,1713480398853,true
gdsets_posters,gdsets_posters_1969_01_17a.jpg,,Poster - 1/17/69 @ Newspaper Ad,[],,https://gdsets.com/68posters/1969_01_17a.jpg,,,,,,1969-01-17,1713480398958,false
gdsets_posters,gdsets_posters_1969_01_02c.jpg,,Poster - 1/2/69 @ BG154/155(OPC-D),[],,https://gdsets.com/68posters/1969_01_02c.jpg,,,,,,1969-01-02,1713480399071,false
gdsets_posters,gdsets_posters_1969_01_02.jpg,,Poster - 1/2/69 @ BG154 (OP1),[],,https://gdsets.com/68posters/1969_01_02.jpg,,,,,,1969-01-02,1713480399188,false
gdsets_posters,gdsets_posters_1968_12_31d.jpg,,Poster - 12/31/68 @ BG152/153(OPC-D),[],,https://gdsets.com/68posters
gdsets_posters,gdsets_posters_1968_12_31f.jpg,,Poster - 12/31/68 @ Newspaper Ad,[],,https://gdsets.com/68posters/1968_12_31f.jpg,,,,,,1968-12-31,1713480399506,false
gdsets_posters,gdsets_posters_1968_12_20d.jpg,,"Poster - 12/20,21/68 @ Newspaper Ad",[],,https://gdsets.com/68posters
gdsets_posters,gdsets_posters_1969_02_06.jpg,,Poster - 2/6/69 @ Newspaper Ad,[],,https://gdsets.com/68posters/1969_02_06.jpg,,,,,,1969-02-06,1713480399701,false
gdsets_posters,gdsets_posters_1969_01_31a AOR 3.128.jpg,,Poster - 1/31-2/1/69 @ AOR 3.128,[],,https://gdsets.com/68posters/1969_01_31a AOR
gdsets_posters,gdsets_posters_1969_02_02b.jpg,,Poster - 2/2/69 @ Newspaper Ad,[],,https://gdsets.com/68posters/1969_02_02b.jpg,,,,,,1969-02-02,1713480399761,false
gdsets_posters,gdsets_posters_1969_02_02.jpg,,Poster - 2/2/69 (OP1),[],,https://gdsets.com/68posters/1969_02_02.jpg,,,,,,1969-02-02,1713480399857,true
gdsets_posters,gdsets_posters_1969_02_06a.jpg,,Poster - 2/6/69 @ Newspaper Ad,[],,https://gdsets.com/68posters/1969_02_06a.jpg,,,,,,1969-02-06,1713480399858,false
gdsets_posters,gdsets_posters_1969_01_31b.jpg,,Poster - 1/31-2/1/69 @ Newspaper Ad,[],,https://gdsets.com/68posters
gdsets_posters,gdsets_posters_1969_01_24e AOR 2.24(RP4).jpg,,Poster - 1/24-26/69 (RP4)AOR 2.24,[],,https://gdsets.com/68posters/1969_01_24e AOR 2.24
gdsets_posters,gdsets_posters_1969_02_06b.jpg,,Poster - 2/6/69,[],,https://gdsets.com/68posters/1969_02_06b.jpg,,,,,,1969-02-06,1713480400107,false
gdsets_posters,gdsets_posters_1968_12_31e.jpg,,Poster - 12/31/68 @ Newspaper Ad,[],,https://gdsets.com/68posters/1968_12_31e.jpg,,,,,,1968-12-31,1713480400109,false
gdsets_posters,gdsets_posters_1969_02_02a.jpg,,Poster - 2/2/69 @ Artist Proof,[],,https://gdsets.com/68posters/1969_02_02a.jpg,,,,,,1969-02-02,1713480400246,false
gdsets_posters,gdsets_posters_1969_02_07a.jpg,,Poster - 2/7/69,[],,https://gdsets.com/68posters/1969_02_07a.jpg,,,,,,1969-02-07,1713480400316,false
gdsets_posters,gdsets_posters_1969_02_09a.jpg,,Poster - 2/9/69,[],,https://gdsets.com/68posters/1969_02_09a.jpg,,,,,,1969-02-09,1713480400519,true
gdsets_posters,gdsets_posters_1969_01_24d.jpg,,Poster - 1/24-26/69(RP3 proof)AOR 2.24,[],,https://gdsets.com/68posters
gdsets_posters,gdsets_posters_1969_02_09.jpg,,Poster - 2/9/69,[],,https://gdsets.com/68posters/1969_02_09.jpg,,,,,,1969-02-09,1713480400561,false
gdsets_posters,gdsets_posters_1969_01_24b AOR 2.24(RP2).jpg,,Poster - 1/24-26/69 (RP2)AOR 2.24,[],,https://gdsets.com/68posters/1969_01_24b AOR 2.24
gdsets_posters,gdsets_posters_1969_01_31.jpg,,Poster - 1/31-2/1/69 @ AOR 3.128,[],,https://gdsets.com/68posters/1969_01_31.jpg,,,,,,1969-01-31,1713480400656,true
gdsets_posters,gdsets_posters_1969_02_11b.jpg,,"Poster - 2/11,12/69",[],,https://gdsets.com/68posters/1969_02_11b.jpg,,,,,,1969-02-11,1713480400661,false
gdsets_posters,gdsets_posters_1969_01_24c AOR 2.24 (RP3).jpg,,Poster - 1/24-26/69 (RP3)AOR 2.24,[],,https://gdsets.com/68posters/1969_01_24c AOR 2.24 
gdsets_posters,gdsets_posters_1969_02_21a.jpg,,"Poster - 2/21,22/69",[],,https://gdsets.com/68posters/1969_02_21a.jpg,,,,,,1969-02-21,1713480400744,false
gdsets_posters,gdsets_posters_1969_02_14.jpg,,"Poster - 2/14,15/69 @ Newspaper Ad",[],,https://gdsets.com/68posters/1969_02_14.jpg,,,,,,1969-02-14,1713480400748,true
gdsets_posters,gdsets_posters_1969_01_24g.jpg,,Poster - 1/24-26/69 @ Newspaper Ad,[],,https://gdsets.com/68posters/1969_01_24g.jpg,,,,,,1969-01-24,1713480400801,false
gdsets_posters,gdsets_posters_1969_02_14a.jpg,,"Poster - 2/14,15/69 @ Newspaper Ad",[],,https://gdsets.com/68posters
gdsets_posters,gdsets_posters_1969_02_11c.jpg,,"Poster - 2/11,12/69 @ Program",[],,https://gdsets.com/68posters/1969_02_11c.jpg,,,,,,1969-02-11,1713480401031,false
gdsets_posters,gdsets_posters_1969_02_11.jpg,,"Poster - 2/11,12/69",[],,https://gdsets.com/68posters/1969_02_11.jpg,,,,,,1969-02-11,1713480401078,false
gdsets_posters,gdsets_posters_1969_02_21.jpg,,"Poster - 2/21,22/69",[],,https://gdsets.com/68posters/1969_02_21.jpg,,,,,,1969-02-21,1713480401167,false
gdsets_posters,gdsets_posters_1969_02_07.jpg,,Poster - 2/7/69 (OP1)AOR 3.160,[],,https://gdsets.com/68posters/1969_02_07.jpg,,,,,,1969-02-07,1713480401273,false
gdsets_posters,gdsets_posters_1969_02_11a.jpg,,"Poster - 2/11,12/69",[],,https://gdsets.com/68posters/1969_02_11a.jpg,,,,,,1969-02-11,1713480401383,false
gdsets_posters,gdsets_posters_1969_02_27a.jpg,,Poster - 2/27-3/2/69 @ BG162 (OPC-A),[],,https://gdsets.com/68posters
gdsets_posters,gdsets_posters_1969_01_24 (AOR 2.24 OP).jpg,,Poster - 1/24-26/69 (OP1)AOR 2.24,[],,https://gdsets.com/68posters/1969_01_24 (AOR 2.24
gdsets_posters,gdsets_posters_1969_03_29a.jpg,,Poster - 3/29/69 @ Newspaper Ad,[],,https://gdsets.com/68posters/1969_03_29a.jpg,,,,,,1969-03-29,1713480401607,true
gdsets_posters,gdsets_posters_1969_02_27d.jpg,,Poster - 2/27-3/2/69 @ BG162 (OPC-E),[],,https://gdsets.com/68posters
gdsets_posters,gdsets_posters_1969_02_27b.jpg,,Poster - 2/27-3/2/69 @ BG162 (OPC-B),[],,https://gdsets.com/68posters
gdsets_posters,gdsets_posters_1969_03_23a.jpg,,Poster - 3/23/69(cancelled),[],,https://gdsets.com/68posters/1969_03_23a.jpg,,,,,,1969-03-23,1713480401724,true
gdsets_posters,gdsets_posters_1969_02_27e.jpg,,Poster - 2/27-3/2/69 @ BG162 (OP1),[],,https://gdsets.com/68posters/1969_02_27e.jpg,,,,,,1969-02-27,1713480401847,false
gdsets_posters,gdsets_posters_1969_02_27.jpg,,Poster - 2/27-3/2/69 @ BG162 (OP1),[],,https://gdsets.com/68posters/1969_02_27.jpg,,,,,,1969-02-27,1713480401850,true
gdsets_posters,gdsets_posters_1969_02_27c.jpg,,Poster - 2/27-3/2/69 @ BG162/163(OPC-D),[],,https://gdsets.com/68posters
gdsets_posters,gdsets_posters_1969_04_13.jpg,,Poster - 4/13/69 @ Newspaper Ad,[],,https://gdsets.com/68posters/1969_04_13.jpg,,,,,,1969-04-13,1713480402256,false
gdsets_posters,gdsets_posters_1969_01_24f.jpg,,Poster - 1/24-26/69 @ Newspaper Ad,[],,https://gdsets.com/68posters/1969_01_24f.jpg,,,,,,1969-01-24,1713480402343,false
gdsets_posters,gdsets_posters_1969_04_04a.jpg,,Poster - 4/4-6/69 (OP1)AOR 2.26,[],,https://gdsets.com/68posters/1969_04_04a.jpg,,,,,,1969-04-04,1713480402364,true
gdsets_posters,gdsets_posters_1969_04_04b.jpg,,Poster - 4/4-6/69 (OP2)AOR 2.26,[],,https://gdsets.com/68posters/1969_04_04b.jpg,,,,,,1969-04-04,1713480402380,true
gdsets_posters,gdsets_posters_1969_04_17b.jpg,,Poster - 4/17/69 @ Newspaper Ad,[],,https://gdsets.com/68posters/1969_04_17b.jpg,,,,,,1969-04-17,1713480402474,false
gdsets_posters,gdsets_posters_1969_04_15.jpg,,Poster - 4/15/69,[],,https://gdsets.com/68posters/1969_04_15.jpg,,,,,,1969-04-15,1713480402481,false
gdsets_posters,gdsets_posters_1969_04_18 (AOR 3.130).jpg,,Poster - 4/18/69 (OP1)AOR 3.130,[],,https://gdsets.com/68posters/1969_04_18 (AOR
gdsets_posters,gdsets_posters_1969_03_29.jpg,,Poster - 3/29/69,[],,https://gdsets.com/68posters/1969_03_29.jpg,,,,,,1969-03-29,1713480402503,false
gdsets_posters,gdsets_posters_1969_04_18a.jpg,,Poster - 4/18/69 (OP1)AOR 3.130,[],,https://gdsets.com/68posters/1969_04_18a.jpg,,,,,,1969-04-18,1713480402693,true
gdsets_posters,gdsets_posters_1969_04_18b.jpg,,Poster - 4/18/69 (OP1)AOR 3.130,[],,https://gdsets.com/68posters/1969_04_18b.jpg,,,,,,1969-04-18,1713480402802,true
gdsets_posters,gdsets_posters_1969_04_17.jpg,,Poster - 4/17/69,[],,https://gdsets.com/68posters/1969_04_17.jpg,,,,,,1969-04-17,1713480402909,false
gdsets_posters,gdsets_posters_1969_04_04.jpg,,Poster - 4/4-6/69 (OP1)AOR 2.25,[],,https://gdsets.com/68posters/1969_04_04.jpg,,,,,,1969-04-04,1713480402920,false
gdsets_posters,gdsets_posters_1969_04_12.jpg,,Poster - 4/12/69 @ AOR 4.156,[],,https://gdsets.com/68posters/1969_04_12.jpg,,,,,,1969-04-12,1713480403089,false
gdsets_posters,gdsets_posters_1969_04_21b.jpg,,Poster - 4/21-23/69 @ AOR 3.175,[],,https://gdsets.com/68posters/1969_04_21b.jpg,,,,,,1969-04-21,1713480403122,true
gdsets_posters,gdsets_posters_1969_04_04c.jpg,,Poster - 4/4-6/69 (OP3)AOR 2.26,[],,https://gdsets.com/68posters/1969_04_04c.jpg,,,,,,1969-04-04,1713480403124,false
gdsets_posters,gdsets_posters_1969_04_20.jpg,,Poster - 4/20/69,[],,https://gdsets.com/68posters/1969_04_20.jpg,,,,,,1969-04-20,1713480403238,false
gdsets_posters,gdsets_posters_1969_04_27.jpg,,Poster - 4/27/69,[],,https://gdsets.com/68posters/1969_04_27.jpg,,,,,,1969-04-27,1713480403239,true
gdsets_posters,gdsets_posters_1969_04_21a AOR 3.175.jpg,,Poster - 4/21-23/69 @ AOR 3.175,[],,https://gdsets.com/68posters/1969_04_21a AOR
gdsets_posters,gdsets_posters_1969_04_27a.jpg,,Poster - 4/27/69 @ Newspaper Ad,[],,https://gdsets.com/68posters/1969_04_27a.jpg,,,,,,1969-04-27,1713480403259,false
gdsets_posters,gdsets_posters_1969_03_23.jpg,,Poster - 3/23/69(cancelled),[],,https://gdsets.com/68posters/1969_03_23.jpg,,,,,,1969-03-23,1713480403259,false
gdsets_posters,gdsets_posters_1969_04_25.jpg,,"Poster - 4/25,26/69",[],,https://gdsets.com/68posters/1969_04_25.jpg,,,,,,1969-04-25,1713480403341,false
gdsets_posters,gdsets_posters_1969_04_17a.jpg,,Poster - 4/17/69,[],,https://gdsets.com/68posters/1969_04_17a.jpg,,,,,,1969-04-17,1713480403361,true
gdsets_posters,gdsets_posters_1969_03_21a.jpg,,"Poster - 3/21,22/69(OHB)AOR 3.48",[],,https://gdsets.com/68posters/1969_03_21a.jpg,,,,,,1969-03-21,1713480403365,false
gdsets_posters,gdsets_posters_1969_04_25a.jpg,,"Poster - 4/25,26/69 @ Newspaper Ad",[],,https://gdsets.com/68posters
gdsets_posters,gdsets_posters_1969_04_27b.jpg,,Poster - 4/27/69 @ Newspaper Ad,[],,https://gdsets.com/68posters/1969_04_27b.jpg,,,,,,1969-04-27,1713480403422,false
gdsets_posters,gdsets_posters_1969_03_21.jpg,,"Poster - 3/21,22/69 @ Newspaper Ad",[],,https://gdsets.com/68posters/1969_03_21.jpg,,,,,,1969-03-21,1713480403655,false
gdsets_posters,gdsets_posters_1969_03_21b.jpg,,"Poster - 3/21,22/69 @ Newspaper Ad",[],,https://gdsets.com/68posters
gdsets_posters,gdsets_posters_1969_05_02c.jpg,,"Poster - 5/2,3/69 @ Newspaper Ad",[],,https://gdsets.com/68posters/1969_05_02c.jpg,,,,,,1969-05-02,1713480403774,false
gdsets_posters,gdsets_posters_1969_05_03.jpg,,Poster - 5/3/69,[],,https://gdsets.com/68posters/1969_05_03.jpg,,,,,,1969-05-03,1713480403845,false
gdsets_posters,gdsets_posters_1969_05_02a.jpg,,"Poster - 5/2,3/69 @ BG171 (OPC-A)",[],,https://gdsets.com/68posters/1969_05_02a.jpg,,,,,,1969-05-02,1713480403866,true
gdsets_posters,gdsets_posters_1969_05_11.jpg,,Poster - 5/11/69 @ AOR 3.102,[],,https://gdsets.com/68posters/1969_05_11.jpg,,,,,,1969-05-11,1713480403956,true
gdsets_posters,gdsets_posters_1969_05_23.jpg,,Poster - 5/23-25/69,[],,https://gdsets.com/68posters/1969_05_23.jpg,,,,,,1969-05-23,1713480403963,false
gdsets_posters,gdsets_posters_1969_05_11a.jpg,,Poster - 5/11/69 @ Newspaper Ad,[],,https://gdsets.com/68posters/1969_05_11a.jpg,,,,,,1969-05-11,1713480404070,false
gdsets_posters,gdsets_posters_1969_05_11b (AOR 3.102).jpg,,Poster - 5/11/69 @ AOR 3.102,[],,https://gdsets.com/68posters/1969_05_11b (AOR
gdsets_posters,gdsets_posters_1969_05_23c.jpg,,Poster - 5/23-25/69 @ Newspaper Ad,[],,https://gdsets.com/68posters/1969_05_23c.jpg,,,,,,1969-05-23,1713480404074,false
gdsets_posters,gdsets_posters_1969_05_23b.jpg,,Poster - 5/23-25/69,[],,https://gdsets.com/68posters/1969_05_23b.jpg,,,,,,1969-05-23,1713480404076,false
gdsets_posters,gdsets_posters_1969_05_02.jpg,,"Poster - 5/2,3/69 @ BG171 (OP1)",[],,https://gdsets.com/68posters/1969_05_02.jpg,,,,,,1969-05-02,1713480404088,false
gdsets_posters,gdsets_posters_1969_05_02b.jpg,,"Poster - 5/2,3/69 @ BG170/171(OPC-D)",[],,https://gdsets.com/68posters
gdsets_posters,gdsets_posters_1969_05_16.jpg,,Poster - 5/16/69,[],,https://gdsets.com/68posters/1969_05_16.jpg,,,,,,1969-05-16,1713480404282,false
gdsets_posters,gdsets_posters_1969_05_29.jpg,,Poster - 5/29/69 (OP1)AOR 4.116,[],,https://gdsets.com/68posters/1969_05_29.jpg,,,,,,1969-05-29,1713480404383,false
gdsets_posters,gdsets_posters_1969_05_28 (AOR 2.204).jpg,,Poster - 5/28/69 (OHB)AOR 2.204,[],,https://gdsets.com/68posters/1969_05_28 (AOR
gdsets_posters,gdsets_posters_1969_05_30.jpg,,"Poster - 5/30,31/69",[],,https://gdsets.com/68posters/1969_05_30.jpg,,,,,,1969-05-30,1713480404383,true
gdsets_posters,gdsets_posters_1969_05_29a.jpg,,Poster - 5/29/69 @ Newspaper Ad,[],,https://gdsets.com/68posters/1969_05_29a.jpg,,,,,,1969-05-29,1713480404491,false
gdsets_posters,gdsets_posters_1969_05_10a.jpg,,Poster - 5/10/69(incorrect dates),[],,https://gdsets.com/68posters/1969_05_10a.jpg,,,,,,1969-05-10,1713480404585,true
gdsets_posters,gdsets_posters_1969_05_10.jpg,,Poster - 5/10/69(incorrect dates),[],,https://gdsets.com/68posters/1969_05_10.jpg,,,,,,1969-05-10,1713480404586,true
gdsets_posters,gdsets_posters_1969_05_30c.jpg,,"Poster - 5/30,31/69",[],,https://gdsets.com/68posters/1969_05_30c.jpg,,,,,,1969-05-30,1713480404697,true
gdsets_posters,gdsets_posters_1969_05_30f.jpg,,Poster - 5/30/69,[],,https://gdsets.com/68posters/1969_05_30f.jpg,,,,,,1969-05-30,1713480404796,false
gdsets_posters,gdsets_posters_1969_05_23d.jpg,,Poster - 5/23-25/69 @ Newspaper Ad,[],,https://gdsets.com/68posters/1969_05_23d.jpg,,,,,,1969-05-23,1713480404797,false
gdsets_posters,gdsets_posters_1969_05_30e.jpg,,"Poster - 5/30,31/69",[],,https://gdsets.com/68posters/1969_05_30e.jpg,,,,,,1969-05-30,1713480404798,true
gdsets_posters,gdsets_posters_1969_04_21.jpg,,Poster - 4/21-23/69 @ AOR 3.175,[],,https://gdsets.com/68posters/1969_04_21.jpg,,,,,,1969-04-21,1713480404802,false
gdsets_posters,gdsets_posters_1969_05_30a.jpg,,"Poster - 5/30,31/69",[],,https://gdsets.com/68posters/1969_05_30a.jpg,,,,,,1969-05-30,1713480404803,false
gdsets_posters,gdsets_posters_1969_05_30b.jpg,,"Poster - 5/30,31/69",[],,https://gdsets.com/68posters/1969_05_30b.jpg,,,,,,1969-05-30,1713480404888,true
gdsets_posters,gdsets_posters_1969_05_31.jpg,,Poster - 5/31/69,[],,https://gdsets.com/68posters/1969_05_31.jpg,,,,,,1969-05-31,1713480404890,false
gdsets_posters,gdsets_posters_1969_05_30d.jpg,,"Poster - 5/30,31/69",[],,https://gdsets.com/68posters/1969_05_30d.jpg,,,,,,1969-05-30,1713480404891,true
gdsets_posters,gdsets_posters_1969_05_10b.jpg,,Poster - 5/10/69 (OHB)(correct dates),[],,https://gdsets.com/68posters
gdsets_posters,gdsets_posters_1969_06_05f.jpg,,Poster - 6/5-8/69 @ BG176 @ Original Art,[],,https://gdsets.com/68posters
gdsets_posters,gdsets_posters_1969_06_11.jpg,,Poster - 6/11/69,[],,https://gdsets.com/68posters/1969_06_11.jpg,,,,,,1969-06-11,1713480405287,false
gdsets_posters,gdsets_posters_1969_06_05d.jpg,,Poster - 6/5-8/69 @ BG176 (OPC-D?),[],,https://gdsets.com/68posters/1969_06_05d.jpg,,,,,,1969-06-05,1713480405373,true
gdsets_posters,gdsets_posters_1969_06_13b.jpg,,Poster - 6/13/69 (OHB),[],,https://gdsets.com/68posters/1969_06_13b.jpg,,,,,,1969-06-13,1713480405375,true
gdsets_posters,gdsets_posters_1969_06_05b.jpg,,Poster - 6/5-8/69 @ BG176 (OPC-A),[],,https://gdsets.com/68posters/1969_06_05b.jpg,,,,,,1969-06-05,1713480405381,false
gdsets_posters,gdsets_posters_1969_06_20c.jpg,,Poster - Pigpen Contest(part 1),[],,https://gdsets.com/68posters/1969_06_20c.jpg,,,,,,1969-06-20,1713480405604,false
gdsets_posters,gdsets_posters_1969_06_20a.jpg,,"Poster - 6/20,21/69",[],,https://gdsets.com/68posters/1969_06_20a.jpg,,,,,,1969-06-20,1713480405619,true
gdsets_posters,gdsets_posters_1969_06_05.jpg,,Poster - 6/5-8/69 @ BG176 (OP1),[],,https://gdsets.com/68posters/1969_06_05.jpg,,,,,,1969-06-05,1713480405619,true
gdsets_posters,gdsets_posters_1969_06_14 (OHB).jpg,,Poster - 6/14/69 (OHB),[],,https://gdsets.com/68posters/1969_06_14 (OHB).jpg,,,,,,1969-06-14,1713480405725,true
gdsets_posters,gdsets_posters_1969_06_05e.jpg,,Poster - 6/5-8/69 @ BG176 (OP1),[],,https://gdsets.com/68posters/1969_06_05e.jpg,,,,,,1969-06-05,1713480405824,true
gdsets_posters,gdsets_posters_1969_07_03.jpg,,Poster - 7/3/69,[],,https://gdsets.com/68posters/1969_07_03.jpg,,,,,,1969-07-03,1713480405935,false
gdsets_posters,gdsets_posters_1969_06_05c.jpg,,Poster - 6/5-8/69 @ BG176/177(OPC-C),[],,https://gdsets.com/68posters
gdsets_posters,gdsets_posters_1969_07_08.jpg,,Poster - 7/8/69,[],,https://gdsets.com/68posters/1969_07_08.jpg,,,,,,1969-07-08,1713480406159,false
gdsets_posters,gdsets_posters_1969_07_08a.jpg,,Poster - 7/8/69,[],,https://gdsets.com/68posters/1969_07_08a.jpg,,,,,,1969-07-08,1713480406161,false
gdsets_posters,gdsets_posters_1969_06_20b.jpg,,"Poster - 6/20,21/69 (OPC)",[],,https://gdsets.com/68posters/1969_06_20b.jpg,,,,,,1969-06-20,1713480406161,true
gdsets_posters,gdsets_posters_1969_07_04a.jpg,,"Poster - 7/4,5/69 @ Newspaper Ad",[],,https://gdsets.com/68posters/1969_07_04a.jpg,,,,,,1969-07-04,1713480406162,false
gdsets_posters,gdsets_posters_1969_06_20bb.jpg,,"Poster - 6/20,21/69 @ Newspaper Ad",[],,https://gdsets.com/68posters
gdsets_posters,gdsets_posters_1969_07_04.jpg,,"Poster - 7/4,5/69",[],,https://gdsets.com/68posters/1969_07_04.jpg,,,,,,1969-07-04,1713480406272,false
gdsets_posters,gdsets_posters_1969_06_14.jpg,,Poster - 6/14/69 (OHB),[],,https://gdsets.com/68posters/1969_06_14.jpg,,,,,,1969-06-14,1713480406272,false
gdsets_posters,gdsets_posters_1969_07_04b.jpg,,"Poster - 7/4,5/69 @ Newspaper Ad",[],,https://gdsets.com/68posters/1969_07_04b.jpg,,,,,,1969-07-04,1713480406278,false
gdsets_posters,gdsets_posters_1969_06_05a.jpg,,Poster - 6/5-8/69 @ BG176 (RP2),[],,https://gdsets.com/68posters/1969_06_05a.jpg,,,,,,1969-06-05,1713480406473,true
gdsets_posters,gdsets_posters_1969_06_29.jpg,,Poster - 6/29/69 (OP1)AOR 2.329,[],,https://gdsets.com/68posters/1969_06_29.jpg,,,,,,1969-06-29,1713480406480,false
gdsets_posters,gdsets_posters_1969_07_11a.jpg,,"Poster - 7/11,12/69",[],,https://gdsets.com/68posters/1969_07_11a.jpg,,,,,,1969-07-11,1713480406480,false
gdsets_posters,gdsets_posters_1969_07_11.jpg,,"Poster - 7/11,12/69",[],,https://gdsets.com/68posters/1969_07_11.jpg,,,,,,1969-07-11,1713480406586,true
gdsets_posters,gdsets_posters_1969_07_16a.jpg,,Poster - 7/16/69,[],,https://gdsets.com/68posters/1969_07_16a.jpg,,,,,,1969-07-16,1713480406594,true
gdsets_posters,gdsets_posters_1969_07_11c.jpg,,"Poster - 7/11,12/69 @ Newspaper Ad",[],,https://gdsets.com/68posters
gdsets_posters,gdsets_posters_1969_07_16.jpg,,Poster - 7/16/69,[],,https://gdsets.com/68posters/1969_07_16.jpg,,,,,,1969-07-16,1713480406777,false
gdsets_posters,gdsets_posters_1969_07_11d.jpg,,"Poster - 7/11,12/69 @ Newspaper Ad",[],,https://gdsets.com/68posters
gdsets_posters,gdsets_posters_1969_08_01.jpg,,Poster - 8/1/69 @ Newspaper Ad,[],,https://gdsets.com/68posters/1969_08_01.jpg,,,,,,1969-08-01,1713480406814,false
gdsets_posters,gdsets_posters_1969_08_01a.jpg,,Poster - 8/1/69 @ Newspaper Ad,[],,https://gdsets.com/68posters/1969_08_01a.jpg,,,,,,1969-08-01,1713480406874,false
gdsets_posters,gdsets_posters_1969_07_16b.jpg,,Poster - 7/16/69,[],,https://gdsets.com/68posters/1969_07_16b.jpg,,,,,,1969-07-16,1713480406970,true
gdsets_posters,gdsets_posters_1969_06_06.jpg,,Poster - KSAN ad,[],,https://gdsets.com/68posters/1969_06_06.jpg,,,,,,1969-06-06,1713480407150,false
gdsets_posters,gdsets_posters_1969_08_01b.jpg,,Poster - 8/1/69(probable fake),[],,https://gdsets.com/68posters/1969_08_01b.jpg,,,,,,1969-08-01,1713480407155,false
gdsets_posters,gdsets_posters_1969_08_02c.jpg,,Poster - 8/2/69(cancelled),[],,https://gdsets.com/68posters/1969_08_02c.jpg,,,,,,1969-08-02,1713480407250,false
gdsets_posters,gdsets_posters_1969_07_11b.jpg,,"Poster - 7/11,12/69 @ Newspaper Ad",[],,https://gdsets.com/68posters
gdsets_posters,gdsets_posters_1969_08_16b.jpg,,Poster - 8/16/69 (OP1)AOR 3.1(24 @ x36 version),[],,https://gdsets.com/68posters
gdsets_posters,gdsets_posters_1969_08_16ff OHB.jpg,,Poster - 8/16/69 (OHB)AOR 3.2,[],,https://gdsets.com/68posters/1969_08_16ff
gdsets_posters,gdsets_posters_1969_08_16d (AOR 3.1 Wallkill).jpg,,Poster - 8/16/69 (OP1)AOR 3.1(Wallkill version),[],,https://gdsets.com/68posters/1969_08_16d (AOR
gdsets_posters,gdsets_posters_1969_08_02a.jpg,,"Poster - 8/2,3/69 @ Newspaper Ad",[],,https://gdsets.com/68posters/1969_08_02a.jpg,,,,,,1969-08-02,1713480407775,false
gdsets_posters,gdsets_posters_1969_08_16.jpg,,Poster - 8/16/69,[],,https://gdsets.com/68posters/1969_08_16.jpg,,,,,,1969-08-16,1713480407821,false
gdsets_posters,gdsets_posters_1969_08_16e.jpg,,Poster - 8/16/69 @ Bus Poster,[],,https://gdsets.com/68posters/1969_08_16e.jpg,,,,,,1969-08-16,1713480407909,false
gdsets_posters,gdsets_posters_1969_06_20d.jpg,,Poster - Pigpen Contest(part 2),[],,https://gdsets.com/68posters/1969_06_20d.jpg,,,,,,1969-06-20,1713480407994,false
gdsets_posters,gdsets_posters_1969_08_20a (AOR 3.110 OHB).jpg,,Poster - 8/20/69 (OHB)AOR 3.110,[],,https://gdsets.com/68posters/1969_08_20a (AOR 3.110
gdsets_posters,gdsets_posters_1969_08_02.jpg,,"Poster - 8/23/69""",[],,https://gdsets.com/68posters/1969_08_02.jpg,,,,,,1969-08-16,1713480408023,true
gdsets_posters,gdsets_posters_1969_08_16m.jpg,,Poster - 8/16/69 @ Program,[],,https://gdsets.com/68posters/1969_08_16m.jpg,,,,,,1969-08-16,1713480408110,false
gdsets_posters,gdsets_posters_1969_08_16a.jpg,,Poster - 8/16/69,[],,https://gdsets.com/68posters/1969_08_16a.jpg,,,,,,1969-08-16,1713480408112,false
gdsets_posters,gdsets_posters_1969_08_20c (AOR 3.110 (OHB).jpg,,Poster - 8/20/69 (OHB)AOR 3.110,[],,https://gdsets.com/68posters/1969_08_20c (AOR 3.110 
gdsets_posters,gdsets_posters_1969_06_13.jpg,,Poster - 6/13/69 (OHB),[],,https://gdsets.com/68posters/1969_06_13.jpg,,,,,,1969-06-13,1713480408235,false
gdsets_posters,gdsets_posters_1969_08_20b.jpg,,Poster - 8/20/69 (OHB)AOR 3.110,[],,https://gdsets.com/68posters/1969_08_20b.jpg,,,,,,1969-08-20,1713480408320,true
gdsets_posters,gdsets_posters_1969_09_01.jpg,,Poster - 9/1/69,[],,https://gdsets.com/68posters/1969_09_01.jpg,,,,,,1969-09-01,1713480408492,true
gdsets_posters,gdsets_posters_1969_08_20.jpg,,Poster - 8/20/69 (OP1)AOR 3.110,[],,https://gdsets.com/68posters/1969_08_20.jpg,,,,,,1969-08-20,1713480408493,false
gdsets_posters,gdsets_posters_1969_08_16aa.jpg,,Poster - 8/16/69 @ Newspaper Ad,[],,https://gdsets.com/68posters/1969_08_16aa.jpg,,,,,,1969-08-16,1713480408502,false
gdsets_posters,gdsets_posters_1969_08_24a.jpg,,Poster - 8/24/69,[],,https://gdsets.com/68posters/1969_08_24a.jpg,,,,,,1969-08-24,1713480408609,true
gdsets_posters,gdsets_posters_1969_08_16f.jpg,,Poster - 8/16/69 (OP1)AOR 3.2,[],,https://gdsets.com/68posters/1969_08_16f.jpg,,,,,,1969-08-16,1713480408714,false
gdsets_posters,gdsets_posters_1969_09_01c.jpg,,Poster - 9/1/69,[],,https://gdsets.com/68posters/1969_09_01c.jpg,,,,,,1969-09-01,1713480408818,false
gdsets_posters,gdsets_posters_1969_08_29.jpg,,Poster - 8/28-30/69,[],,https://gdsets.com/68posters/1969_08_29.jpg,,,,,,1969-08-29,1713480408820,false
gdsets_posters,gdsets_posters_1969_08_23.jpg,,Poster - 8/23/69,[],,https://gdsets.com/68posters/1969_08_23.jpg,,,,,,1969-08-23,1713480408820,false
gdsets_posters,gdsets_posters_1969_09_01a.jpg,,Poster - 9/1/69,[],,https://gdsets.com/68posters/1969_09_01a.jpg,,,,,,1969-09-01,1713480408823,true
gdsets_posters,gdsets_posters_1969_09_26.jpg,,"Poster - 9/26,27/69",[],,https://gdsets.com/68posters/1969_09_26.jpg,,,,,,1969-09-26,1713480408828,false
gdsets_posters,gdsets_posters_1969_09_01e.jpg,,Poster - 9/1/69 @ Newspaper Ad,[],,https://gdsets.com/68posters/1969_09_01e.jpg,,,,,,1969-09-01,1713480408911,true
gdsets_posters,gdsets_posters_1969_09_29.jpg,,Poster - 9/29-10/1/69 @ Newspaper Ad,[],,https://gdsets.com/68posters/1969_09_29.jpg,,,,,,1969-09-29,1713480408912,false
gdsets_posters,gdsets_posters_1969_10_01.jpg,,Poster - 10/1/69 @ Newspaper Ad,[],,https://gdsets.com/68posters/1969_10_01.jpg,,,,,,1969-10-01,1713480409011,false
gdsets_posters,gdsets_posters_1969_08_22.jpg,,Poster - 8/22/69 (OP1)AOR 2.233(cancelled),[],,https://gdsets.com/68posters
gdsets_posters,gdsets_posters_1969_08_24.jpg,,Poster - 8/24/69,[],,https://gdsets.com/68posters/1969_08_24.jpg,,,,,,1969-08-24,1713480409100,false
gdsets_posters,gdsets_posters_1969_10_02.jpg,,Poster - 10/2-4/69,[],,https://gdsets.com/68posters/1969_10_02.jpg,,,,,,1969-10-02,1713480409295,false
gdsets_posters,gdsets_posters_1969_10_05.jpg,,Poster - 10/5/69,[],,https://gdsets.com/68posters/1969_10_05.jpg,,,,,,1969-10-05,1713480409303,false
gdsets_posters,gdsets_posters_1969_10_22.jpg,,Poster - 10/22/69,[],,https://gdsets.com/68posters/1969_10_22.jpg,,,,,,1969-10-22,1713480409408,false
gdsets_posters,gdsets_posters_1969_10_14.jpg,,Poster - 10/14-16/69,[],,https://gdsets.com/68posters/1969_10_14.jpg,,,,,,1969-10-14,1713480409413,false
gdsets_posters,gdsets_posters_1969_10_17.jpg,,Poster - 10/17/69,[],,https://gdsets.com/68posters/1969_10_17.jpg,,,,,,1969-10-17,1713480409426,false
gdsets_posters,gdsets_posters_1969_09_26a.jpg,,"Poster - 9/26,27/69 @ Newspaper Ad",[],,https://gdsets.com/68posters
gdsets_posters,gdsets_posters_1969_10_05a.jpg,,Poster - 10/5/69 @ Newspaper Ad,[],,https://gdsets.com/68posters/1969_10_05a.jpg,,,,,,1969-10-05,1713480409619,true
gdsets_posters,gdsets_posters_1969_09_01b.jpg,,Poster - 9/1/69,[],,https://gdsets.com/68posters/1969_09_01b.jpg,,,,,,1969-09-01,1713480409620,false
gdsets_posters,gdsets_posters_1969_11_01a.jpg,,"Poster - 11/1,2/69",[],,https://gdsets.com/68posters/1969_11_01a.jpg,,,,,,1969-11-01,1713480409620,false
gdsets_posters,gdsets_posters_1969_11_01.jpg,,"Poster - 11/1,2/69 @ Newspaper Ad",[],,https://gdsets.com/68posters/1969_11_01.jpg,,,,,,1969-11-01,1713480409798,false
gdsets_posters,gdsets_posters_1969_10_24a.jpg,,Poster - 10/24-26/69 @ BG197 (OPC-A),[],,https://gdsets.com/68posters
gdsets_posters,gdsets_posters_1969_11_07a.jpg,,"Poster - 11/7,8/69",[],,https://gdsets.com/68posters/1969_11_07a.jpg,,,,,,1969-11-07,1713480409924,false
gdsets_posters,gdsets_posters_1969_11_07b.jpg,,"Poster - 11/7,8/69(reprint,likely fake)",[],,https://gdsets.com/68posters
gdsets_posters,gdsets_posters_1969_11_01b.jpg,,"Poster - 11/1,2/69 @ Newspaper Ad",[],,https://gdsets.com/68posters
gdsets_posters,gdsets_posters_1969_09_01d.jpg,,Poster - 9/1/69 @ Newspaper Ad,[],,https://gdsets.com/68posters/1969_09_01d.jpg,,,,,,1969-09-01,1713480410128,false
gdsets_posters,gdsets_posters_1969_10_24b.jpg,,Poster - 10/24-26/69 @ BG197/198(OPC-C),[],,https://gdsets.com/68posters
gdsets_posters,gdsets_posters_1969_11_10a.jpg,,Poster - Live Dead Concert ad blank,[],,https://gdsets.com/68posters
gdsets_posters,gdsets_posters_1969_11_18.jpg,,Poster - 11/18/69,[],,https://gdsets.com/68posters/1969_11_18.jpg,,,,,,1969-11-18,1713480410363,false
gdsets_posters,gdsets_posters_1969_11_18a.jpg,,"Poster - 11/18,19/69",[],,https://gdsets.com/68posters/1969_11_18a.jpg,,,,,,1969-11-18,1713480410365,false
gdsets_posters,gdsets_posters_1969_11_15.jpg,,Poster - 11/15/69,[],,https://gdsets.com/68posters/1969_11_15.jpg,,,,,,1969-11-15,1713480410446,false
gdsets_posters,gdsets_posters_1969_08_20d.jpg,,Poster - 8/20/69,[],,https://gdsets.com/68posters/1969_08_20d.jpg,,,,,,1969-08-20,1713480410458,true
gdsets_posters,gdsets_posters_1969_11_10.jpg,,Poster - Live Dead Newspaper Ad,[],,https://gdsets.com/68posters/1969_11_10.jpg,,,,,,1969-11-10,1713480410561,false
gdsets_posters,gdsets_posters_1969_11_21d.jpg,,Poster - 11/21/69 (OHB),[],,https://gdsets.com/68posters/1969_11_21d.jpg,,,,,,1969-11-21,1713480410680,true
gdsets_posters,gdsets_posters_1969_11_10e.jpg,,Poster - Live Dead Record store ad,[],,https://gdsets.com/68posters/1969_11_10e.jpg,,,,,,1969-11-10,1713480410686,false
gdsets_posters,gdsets_posters_1969_11_10d.jpg,,Poster - Live Dead Record store ad,[],,https://gdsets.com/68posters/1969_11_10d.jpg,,,,,,1969-11-10,1713480410689,false
gdsets_posters,gdsets_posters_1969_11_10f.jpg,,Poster - Live Dead Newspaper Ad,[],,https://gdsets.com/68posters/1969_11_10f.jpg,,,,,,1969-11-10,1713480410750,false
gdsets_posters,gdsets_posters_1969_11_21.jpg,,Poster - 11/21/69 (OP1),[],,https://gdsets.com/68posters/1969_11_21.jpg,,,,,,1969-11-21,1713480410776,false
gdsets_posters,gdsets_posters_1969_11_23.jpg,,Poster - 11/23/69(cancelled),[],,https://gdsets.com/68posters/1969_11_23.jpg,,,,,,1969-11-23,1713480410781,false
gdsets_posters,gdsets_posters_1969_11_10b.jpg,,Poster - Live Dead Record store ad,[],,https://gdsets.com/68posters/1969_11_10b.jpg,,,,,,1969-11-10,1713480410784,false
gdsets_posters,gdsets_posters_1969_11_21a.jpg,,Poster - 11/21/69 (OHB),[],,https://gdsets.com/68posters/1969_11_21a.jpg,,,,,,1969-11-21,1713480410869,false
gdsets_posters,gdsets_posters_1969_11_21b.jpg,,Poster - 11/21/69 (OHB),[],,https://gdsets.com/68posters/1969_11_21b.jpg,,,,,,1969-11-21,1713480410920,true
gdsets_posters,gdsets_posters_1969_11_21c.jpg,,Poster - 11/21/69 (OHB),[],,https://gdsets.com/68posters/1969_11_21c.jpg,,,,,,1969-11-21,1713480410957,true
gdsets_posters,gdsets_posters_1969_11_21e.jpg,,Poster - 11/21/69 (OHB),[],,https://gdsets.com/68posters/1969_11_21e.jpg,,,,,,1969-11-21,1713480411235,true
gdsets_posters,gdsets_posters_1969_12_10.jpg,,Poster - 12/10-12/69 @ Newspaper Ad,[],,https://gdsets.com/68posters/1969_12_10.jpg,,,,,,1969-12-10,1713480411249,false
gdsets_posters,gdsets_posters_1969_12_04a.jpg,,Poster - 12/4-7/69 @ BG205 (OPC-A),[],,https://gdsets.com/68posters/1969_12_04a.jpg,,,,,,1969-12-04,1713480411353,false
gdsets_posters,gdsets_posters_1969_12_10c.jpg,,Poster - 12/10-12/69 @ Newspaper Ad,[],,https://gdsets.com/68posters
gdsets_posters,gdsets_posters_1969_12_10b.jpg,,Poster - 12/10-12/69 @ Newspaper Ad,[],,https://gdsets.com/68posters
gdsets_posters,gdsets_posters_1969_12_10a.jpg,,Poster - 12/10-12/69 @ Newspaper Ad,[],,https://gdsets.com/68posters/1969_12_10a.jpg,,,,,,1969-12-10,1713480411382,true
gdsets_posters,gdsets_posters_1969_12_04c.jpg,,Poster - 12/4-7/69 @ BG205/206(OPC-C),[],,https://gdsets.com/68posters
gdsets_posters,gdsets_posters_1969_10_31.jpg,,Poster - 10/31/69,[],,https://gdsets.com/68posters/1969_10_31.jpg,,,,,,1969-10-31,1713480411489,false
gdsets_posters,gdsets_posters_1969_10_24.jpg,,Poster - 10/24-26/69 @ BG197 (OP1),[],,https://gdsets.com/68posters/1969_10_24.jpg,,,,,,1969-10-24,1713480411596,true
gdsets_posters,gdsets_posters_1969_12_04b.jpg,,Poster - 12/4-7/69 @ BG205/206(OPC-B),[],,https://gdsets.com/68posters
gdsets_posters,gdsets_posters_1969_12_04.jpg,,Poster - 12/4-7/69 @ BG205 (OP1),[],,https://gdsets.com/68posters/1969_12_04.jpg,,,,,,1969-12-04,1713480411912,false
gdsets_posters,gdsets_posters_1969_12_26a.jpg,,Poster - 12/26/69 @ Newspaper Ad,[],,https://gdsets.com/68posters/1969_12_26a.jpg,,,,,,1969-12-26,1713480411914,false
gdsets_posters,gdsets_posters_1969_12_28a.jpg,,Poster - 12/28/69 @ Program,[],,https://gdsets.com/68posters/1969_12_28a.jpg,,,,,,1969-12-28,1713480411914,false
gdsets_posters,gdsets_posters_1969_12_13.jpg,,Poster - 12/13/69,[],,https://gdsets.com/68posters/1969_12_13.jpg,,,,,,1969-12-13,1713480411984,false
gdsets_posters,gdsets_posters_1969_11_10c.jpg,,Poster - Live Dead Record store ad,[],,https://gdsets.com/68posters/1969_11_10c.jpg,,,,,,1969-11-10,1713480411994,false
gdsets_posters,gdsets_posters_1969_12_29.jpg,,Poster - 12/29-31/69 @ AOR 3.171,[],,https://gdsets.com/68posters/1969_12_29.jpg,,,,,,1969-12-29,1713480412072,false
gdsets_posters,gdsets_posters_1983_01_13.jpg,,"Poster - 1/13-15,22/83",[],,https://gdsets.com/83posters/1983_01_13.jpg,,,,,,1983-01-13,1713480412114,false
gdsets_posters,gdsets_posters_1983_01_22a.jpg,,Poster - 1/22/83,[],,https://gdsets.com/83posters/1983_01_22a.jpg,,,,,,1983-01-22,1713480412114,true
gdsets_posters,gdsets_posters_1983_01_01a.jpg,,Poster - 1983 Dead Art Catalog,[],,https://gdsets.com/83posters/1983_01_01a.jpg,,,,,,1983-01-01,1713480412213,false
gdsets_posters,gdsets_posters_1969_12_19.jpg,,Poster - 12/19-21/69(OHB)AOR 4.58,[],,https://gdsets.com/68posters/1969_12_19.jpg,,,,,,1969-12-19,1713480412217,false
gdsets_posters,gdsets_posters_1983_02_04.jpg,,Poster - 2/4/83,[],,https://gdsets.com/83posters/1983_02_04.jpg,,,,,,1983-02-04,1713480412218,true
gdsets_posters,gdsets_posters_1969_12_28.jpg,,Poster - 12/28/69 @ Newspaper Ad,[],,https://gdsets.com/68posters/1969_12_28.jpg,,,,,,1969-12-28,1713480412237,false
gdsets_posters,gdsets_posters_1983_01_22b.jpg,,"Poster - 1/22,2/18/83",[],,https://gdsets.com/83posters/1983_01_22b.jpg,,,,,,1983-01-22,1713480412316,false
gdsets_posters,gdsets_posters_1983_01_22.jpg,,Poster - 1/22/83,[],,https://gdsets.com/83posters/1983_01_22.jpg,,,,,,1983-01-22,1713480412395,false
gdsets_posters,gdsets_posters_1983_02_04a.jpg,,Poster - 2/4/83,[],,https://gdsets.com/83posters/1983_02_04a.jpg,,,,,,1983-02-04,1713480412486,false
gdsets_posters,gdsets_posters_1983_02_26a.jpg,,Poster - 2/26/83,[],,https://gdsets.com/83posters/1983_02_26a.jpg,,,,,,1983-02-26,1713480412592,false
gdsets_posters,gdsets_posters_1983_02_25.jpg,,Poster - 2/25/83,[],,https://gdsets.com/83posters/1983_02_25.jpg,,,,,,1983-02-25,1713480412594,false
gdsets_posters,gdsets_posters_1983_02_26.jpg,,Poster - 2/26-3/7/83,[],,https://gdsets.com/83posters/1983_02_26.jpg,,,,,,1983-02-26,1713480412693,false
gdsets_posters,gdsets_posters_1983_01_01b.jpg,,Poster - Lot Poster1983?,[],,https://gdsets.com/83posters/1983_01_01b.jpg,,,,,,1983-01-01,1713480412695,false
gdsets_posters,gdsets_posters_1983_02_28.jpg,,Poster - 2/28/83,[],,https://gdsets.com/83posters/1983_02_28.jpg,,,,,,1983-02-28,1713480412711,false
gdsets_posters,gdsets_posters_1983_03_10.jpg,,Poster - 3/10/83,[],,https://gdsets.com/83posters/1983_03_10.jpg,,,,,,1983-03-10,1713480412797,false
gdsets_posters,gdsets_posters_1983_03_08.jpg,,Poster - 3/8/83,[],,https://gdsets.com/83posters/1983_03_08.jpg,,,,,,1983-03-08,1713480412797,false
gdsets_posters,gdsets_posters_1983_02_22.jpg,,Poster - 2/22/83,[],,https://gdsets.com/83posters/1983_02_22.jpg,,,,,,1983-02-22,1713480412887,false
gdsets_posters,gdsets_posters_1983_03_10a.jpg,,Poster - 3/10/83,[],,https://gdsets.com/83posters/1983_03_10a.jpg,,,,,,1983-03-10,1713480412901,false
gdsets_posters,gdsets_posters_1983_03_11a.jpg,,Poster - 3/11/83,[],,https://gdsets.com/83posters/1983_03_11a.jpg,,,,,,1983-03-11,1713480412902,false
gdsets_posters,gdsets_posters_1983_03_12.jpg,,"Poster - 3/12,13/83",[],,https://gdsets.com/83posters/1983_03_12.jpg,,,,,,1983-03-12,1713480412913,false
gdsets_posters,gdsets_posters_1969_12_26.jpg,,Poster - 12/26/69,[],,https://gdsets.com/68posters/1969_12_26.jpg,,,,,,1969-12-26,1713480412915,false
gdsets_posters,gdsets_posters_1983_03_11.jpg,,Poster - 3/11/83,[],,https://gdsets.com/83posters/1983_03_11.jpg,,,,,,1983-03-11,1713480412993,false
gdsets_posters,gdsets_posters_1983_03_22a.jpg,,"Poster - 3/22,23/83",[],,https://gdsets.com/83posters/1983_03_22a.jpg,,,,,,1983-03-22,1713480413001,false
gdsets_posters,gdsets_posters_1983_03_22.jpg,,"Poster - 3/22,23/83",[],,https://gdsets.com/83posters/1983_03_22.jpg,,,,,,1983-03-22,1713480413049,false
gdsets_posters,gdsets_posters_1983_00_00.jpg,,Poster - 1983 Tour Book,[],,https://gdsets.com/83posters/1983_00_00.jpg,,,,,,1983-00-00,1713480413175,false
gdsets_posters,gdsets_posters_1983_03_11b.jpg,,Poster - 3/11/83,[],,https://gdsets.com/83posters/1983_03_11b.jpg,,,,,,1983-03-11,1713480413178,false
gdsets_posters,gdsets_posters_1983_03_26a.jpg,,"Poster - 3/26,27/83",[],,https://gdsets.com/83posters/1983_03_26a.jpg,,,,,,1983-03-26,1713480413267,false
gdsets_posters,gdsets_posters_1983_01_01.jpg,,Poster - 1983 Calendar,[],,https://gdsets.com/83posters/1983_01_01.jpg,,,,,,1983-01-01,1713480413273,false
gdsets_posters,gdsets_posters_1983_04_09.jpg,,Poster - Spring 1983,[],,https://gdsets.com/83posters/1983_04_09.jpg,,,,,,1983-04-09,1713480413362,false
gdsets_posters,gdsets_posters_1983_03_27a.jpg,,Poster - 3/27/83,[],,https://gdsets.com/83posters/1983_03_27a.jpg,,,,,,1983-03-27,1713480413362,false
gdsets_posters,gdsets_posters_1983_04_09a.jpg,,Poster - 4/9/83,[],,https://gdsets.com/83posters/1983_04_09a.jpg,,,,,,1983-04-09,1713480413362,false
gdsets_posters,gdsets_posters_1983_04_09k.jpg,,Poster - 4/9/83,[],,https://gdsets.com/83posters/1983_04_09k.jpg,,,,,,1983-04-09,1713480413454,false
gdsets_posters,gdsets_posters_1983_04_09l.jpg,,Poster - 4/9/83,[],,https://gdsets.com/83posters/1983_04_09l.jpg,,,,,,1983-04-09,1713480413462,false
gdsets_posters,gdsets_posters_1983_04_10.jpg,,Poster - 4/10/83,[],,https://gdsets.com/83posters/1983_04_10.jpg,,,,,,1983-04-10,1713480413532,false
gdsets_posters,gdsets_posters_1983_03_26.jpg,,Poster - 3/26/83,[],,https://gdsets.com/83posters/1983_03_26.jpg,,,,,,1983-03-26,1713480413556,false
gdsets_posters,gdsets_posters_1983_04_13a.jpg,,Poster - 4/13/83,[],,https://gdsets.com/83posters/1983_04_13a.jpg,,,,,,1983-04-13,1713480413564,false
gdsets_posters,gdsets_posters_1983_03_24.jpg,,"Poster - 3/24,25/83",[],,https://gdsets.com/83posters/1983_03_24.jpg,,,,,,1983-03-24,1713480413633,false
gdsets_posters,gdsets_posters_1983_04_25.jpg,,"Poster - 4/25,26/83",[],,https://gdsets.com/83posters/1983_04_25.jpg,,,,,,1983-04-25,1713480413634,true
gdsets_posters,gdsets_posters_1983_04_10a.jpg,,Poster - 4/10/83,[],,https://gdsets.com/83posters/1983_04_10a.jpg,,,,,,1983-04-10,1713480413634,false
gdsets_posters,gdsets_posters_1983_04_19.jpg,,Poster - 4/19/83,[],,https://gdsets.com/83posters/1983_04_19.jpg,,,,,,1983-04-19,1713480413640,false
gdsets_posters,gdsets_posters_1983_04_16a.jpg,,"Poster - 4/16,17/83",[],,https://gdsets.com/83posters/1983_04_16a.jpg,,,,,,1983-04-16,1713480413808,false
gdsets_posters,gdsets_posters_1983_05_11.jpg,,Poster - 5/11/83(cancelled),[],,https://gdsets.com/83posters/1983_05_11.jpg,,,,,,1983-05-11,1713480413825,false
gdsets_posters,gdsets_posters_1983_05_06.jpg,,"Poster - 5/6,7/83",[],,https://gdsets.com/83posters/1983_05_06.jpg,,,,,,1983-05-06,1713480413825,false
gdsets_posters,gdsets_posters_1983_04_25a.jpg,,"Poster - 4/25,26/83",[],,https://gdsets.com/83posters/1983_04_25a.jpg,,,,,,1983-04-25,1713480413826,false
gdsets_posters,gdsets_posters_1983_05_13a.jpg,,Poster - 5/13-15/83,[],,https://gdsets.com/83posters/1983_05_13a.jpg,,,,,,1983-05-13,1713480413911,false
gdsets_posters,gdsets_posters_1983_04_13.jpg,,Poster - 4/13/83,[],,https://gdsets.com/83posters/1983_04_13.jpg,,,,,,1983-04-13,1713480413914,false
gdsets_posters,gdsets_posters_1983_05_28.jpg,,Poster - 5/28/83,[],,https://gdsets.com/83posters/1983_05_28.jpg,,,,,,1983-05-28,1713480414087,false
gdsets_posters,gdsets_posters_1983_06_03.jpg,,"Poster - 6/3,11,14/83 @ Program",[],,https://gdsets.com/83posters/1983_06_03.jpg,,,,,,1983-06-03,1713480414090,false
gdsets_posters,gdsets_posters_1983_06_20.jpg,,"Poster - 6/20,21/83",[],,https://gdsets.com/83posters/1983_06_20.jpg,,,,,,1983-06-20,1713480414184,true
gdsets_posters,gdsets_posters_1983_07_16.jpg,,Poster - 7/16/83,[],,https://gdsets.com/83posters/1983_07_16.jpg,,,,,,1983-07-16,1713480414192,false
gdsets_posters,gdsets_posters_1983_06_05.jpg,,Poster - 6/5/83,[],,https://gdsets.com/83posters/1983_06_05.jpg,,,,,,1983-06-05,1713480414196,false
gdsets_posters,gdsets_posters_1983_06_20a.jpg,,"Poster - 6/20,21/83",[],,https://gdsets.com/83posters/1983_06_20a.jpg,,,,,,1983-06-20,1713480414306,false
gdsets_posters,gdsets_posters_1983_06_16.jpg,,Poster - 6/16/83,[],,https://gdsets.com/83posters/1983_06_16.jpg,,,,,,1983-06-16,1713480414405,false
gdsets_posters,gdsets_posters_1983_06_14.jpg,,Poster - 6/14/83,[],,https://gdsets.com/83posters/1983_06_14.jpg,,,,,,1983-06-14,1713480414407,false
gdsets_posters,gdsets_posters_1983_07_24a.jpg,,Poster - 7/24/83,[],,https://gdsets.com/83posters/1983_07_24a.jpg,,,,,,1983-07-24,1713480414524,false
gdsets_posters,gdsets_posters_1983_07_30a.jpg,,Poster - 7/30/83,[],,https://gdsets.com/83posters/1983_07_30a.jpg,,,,,,1983-07-30,1713480414525,true
gdsets_posters,gdsets_posters_1983_06_04a.jpg,,Poster - 6/4/83,[],,https://gdsets.com/83posters/1983_06_04a.jpg,,,,,,1983-06-04,1713480414526,false
gdsets_posters,gdsets_posters_1983_08_13.jpg,,Poster - 8/13/83(cancelled),[],,https://gdsets.com/83posters/1983_08_13.jpg,,,,,,1983-08-13,1713480414627,false
gdsets_posters,gdsets_posters_1983_05_22.jpg,,Poster - 5/22/83(cancelled),[],,https://gdsets.com/83posters/1983_05_22.jpg,,,,,,1983-05-22,1713480414729,false
gdsets_posters,gdsets_posters_1983_07_24.jpg,,Poster - 7/24/83,[],,https://gdsets.com/83posters/1983_07_24.jpg,,,,,,1983-07-24,1713480414736,false
gdsets_posters,gdsets_posters_1983_09_02a.jpg,,"Poster - 9/2,4/83",[],,https://gdsets.com/83posters/1983_09_02a.jpg,,,,,,1983-09-02,1713480414938,false
gdsets_posters,gdsets_posters_1983_08_20.jpg,,"Poster - 8/20,21/83",[],,https://gdsets.com/83posters/1983_08_20.jpg,,,,,,1983-08-20,1713480414951,false
gdsets_posters,gdsets_posters_1983_08_25.jpg,,Poster - 8/25/83,[],,https://gdsets.com/83posters/1983_08_25.jpg,,,,,,1983-08-25,1713480414953,false
gdsets_posters,gdsets_posters_1983_09_10a.jpg,,"Poster - 9/10,11/83",[],,https://gdsets.com/83posters/1983_09_10a.jpg,,,,,,1983-09-10,1713480415049,false
gdsets_posters,gdsets_posters_1983_07_14.jpg,,"Poster - 7/14,16/83",[],,https://gdsets.com/83posters/1983_07_14.jpg,,,,,,1983-07-14,1713480415159,false
gdsets_posters,gdsets_posters_1983_06_04.jpg,,"Poster - 6/4,8/83",[],,https://gdsets.com/83posters/1983_06_04.jpg,,,,,,1983-06-04,1713480415159,false
gdsets_posters,gdsets_posters_1983_08_23.jpg,,Poster - 8/23/83,[],,https://gdsets.com/83posters/1983_08_23.jpg,,,,,,1983-08-23,1713480415160,false
gdsets_posters,gdsets_posters_1983_07_30.jpg,,"Poster - 7/30,31/83",[],,https://gdsets.com/83posters/1983_07_30.jpg,,,,,,1983-07-30,1713480415165,false
gdsets_posters,gdsets_posters_1983_08_29a.jpg,,Poster - 8/29-31/83,[],,https://gdsets.com/83posters/1983_08_29a.jpg,,,,,,1983-08-29,1713480415171,false
gdsets_posters,gdsets_posters_1983_09_13c.jpg,,Poster - 9/13/83,[],,https://gdsets.com/83posters/1983_09_13c.jpg,,,,,,1983-09-13,1713480415265,false
gdsets_posters,gdsets_posters_1983_09_10b.jpg,,"Poster - 9/10,11/83",[],,https://gdsets.com/83posters/1983_09_10b.jpg,,,,,,1983-09-10,1713480415269,false
gdsets_posters,gdsets_posters_1983_09_13b.jpg,,Poster - 9/13/83,[],,https://gdsets.com/83posters/1983_09_13b.jpg,,,,,,1983-09-13,1713480415346,true
gdsets_posters,gdsets_posters_1983_09_13a.jpg,,Poster - 9/13/83,[],,https://gdsets.com/83posters/1983_09_13a.jpg,,,,,,1983-09-13,1713480415362,false
gdsets_posters,gdsets_posters_1983_07_30b.jpg,,Poster - 7/30/83,[],,https://gdsets.com/83posters/1983_07_30b.jpg,,,,,,1983-07-30,1713480415451,false
gdsets_posters,gdsets_posters_1983_09_18b.jpg,,Poster - 9/18/83,[],,https://gdsets.com/83posters/1983_09_18b.jpg,,,,,,1983-09-18,1713480415453,false
gdsets_posters,gdsets_posters_1983_09_18a.jpg,,"Poster - 9/18,24/83",[],,https://gdsets.com/83posters/1983_09_18a.jpg,,,,,,1983-09-18,1713480415454,false
gdsets_posters,gdsets_posters_1983_09_24.jpg,,Poster - 9/24/83,[],,https://gdsets.com/83posters/1983_09_24.jpg,,,,,,1983-09-24,1713480415551,true
gdsets_posters,gdsets_posters_1983_04_16.jpg,,"Poster - 4/16,17/83 @ Program",[],,https://gdsets.com/83posters/1983_04_16.jpg,,,,,,1983-04-16,1713480415653,false
gdsets_posters,gdsets_posters_1983_09_24b.jpg,,Poster - 9/24/83,[],,https://gdsets.com/83posters/1983_09_24b.jpg,,,,,,1983-09-24,1713480415747,true
gdsets_posters,gdsets_posters_1983_10_03a.jpg,,Poster - 10/3/83,[],,https://gdsets.com/83posters/1983_10_03a.jpg,,,,,,1983-10-03,1713480415839,false
gdsets_posters,gdsets_posters_1983_10_01.jpg,,Poster - 10/1/83,[],,https://gdsets.com/83posters/1983_10_01.jpg,,,,,,1983-10-01,1713480415840,false
gdsets_posters,gdsets_posters_1983_09_30a.jpg,,Poster - 9/30/83,[],,https://gdsets.com/83posters/1983_09_30a.jpg,,,,,,1983-09-30,1713480415842,false
gdsets_posters,gdsets_posters_1983_09_24d.jpg,,Poster - 9/24/83,[],,https://gdsets.com/83posters/1983_09_24d.jpg,,,,,,1983-09-24,1713480415944,false
gdsets_posters,gdsets_posters_1983_09_30b.jpg,,Poster - 9/30/83,[],,https://gdsets.com/83posters/1983_09_30b.jpg,,,,,,1983-09-30,1713480415947,false
gdsets_posters,gdsets_posters_1983_10_17a.jpg,,Poster - 10/17/83,[],,https://gdsets.com/83posters/1983_10_17a.jpg,,,,,,1983-10-17,1713480415953,false
gdsets_posters,gdsets_posters_1983_10_03.jpg,,Poster - 10/3/83,[],,https://gdsets.com/83posters/1983_10_03.jpg,,,,,,1983-10-03,1713480415958,false
gdsets_posters,gdsets_posters_1983_10_17.jpg,,Poster - 10/17/83,[],,https://gdsets.com/83posters/1983_10_17.jpg,,,,,,1983-10-17,1713480415963,true
gdsets_posters,gdsets_posters_1983_10_11a.jpg,,"Poster - 10/11,12/83",[],,https://gdsets.com/83posters/1983_10_11a.jpg,,,,,,1983-10-11,1713480415963,false
gdsets_posters,gdsets_posters_1983_09_18.jpg,,Poster - 9/18/83,[],,https://gdsets.com/83posters/1983_09_18.jpg,,,,,,1983-09-18,1713480416051,false
gdsets_posters,gdsets_posters_1983_10_22a.jpg,,Poster - 10/22/83,[],,https://gdsets.com/83posters/1983_10_22a.jpg,,,,,,1983-10-22,1713480416057,true
gdsets_posters,gdsets_posters_1983_09_24c.jpg,,Poster - 9/24/83,[],,https://gdsets.com/83posters/1983_09_24c.jpg,,,,,,1983-09-24,1713480416143,false
gdsets_posters,gdsets_posters_1983_09_10c.jpg,,"Poster - 9/10,11/83",[],,https://gdsets.com/83posters/1983_09_10c.jpg,,,,,,1983-09-10,1713480416243,false
gdsets_posters,gdsets_posters_1983_10_20b.jpg,,"Poster - 10/20,21/83",[],,https://gdsets.com/83posters/1983_10_20b.jpg,,,,,,1983-10-20,1713480416332,true
gdsets_posters,gdsets_posters_1983_10_20c.jpg,,"Poster - 10/20,21/83",[],,https://gdsets.com/83posters/1983_10_20c.jpg,,,,,,1983-10-20,1713480416341,true
gdsets_posters,gdsets_posters_1983_10_22c.jpg,,Poster - 10/22/83,[],,https://gdsets.com/83posters/1983_10_22c.jpg,,,,,,1983-10-22,1713480416343,false
gdsets_posters,gdsets_posters_1983_09_30.jpg,,Poster - 9/30/83,[],,https://gdsets.com/83posters/1983_09_30.jpg,,,,,,1983-09-30,1713480416344,false
gdsets_posters,gdsets_posters_1983_10_22d.jpg,,Poster - 10/22/83,[],,https://gdsets.com/83posters/1983_10_22d.jpg,,,,,,1983-10-22,1713480416431,false
gdsets_posters,gdsets_posters_1983_10_20a.jpg,,"Poster - 10/20,21/83",[],,https://gdsets.com/83posters/1983_10_20a.jpg,,,,,,1983-10-20,1713480416519,false
gdsets_posters,gdsets_posters_1983_10_22b.jpg,,Poster - 10/22/83,[],,https://gdsets.com/83posters/1983_10_22b.jpg,,,,,,1983-10-22,1713480416521,false
gdsets_posters,gdsets_posters_1983_10_23b.jpg,,Poster - 10/23/83,[],,https://gdsets.com/83posters/1983_10_23b.jpg,,,,,,1983-10-23,1713480416521,false
gdsets_posters,gdsets_posters_1983_10_30a.jpg,,"Poster - 10/30,31/83",[],,https://gdsets.com/83posters/1983_10_30a.jpg,,,,,,1983-10-30,1713480416617,false
gdsets_posters,gdsets_posters_1983_11_12.jpg,,Poster - 11/12-14/83,[],,https://gdsets.com/83posters/1983_11_12.jpg,,,,,,1983-11-12,1713480416619,false
gdsets_posters,gdsets_posters_1983_11_03.jpg,,Poster - 11/3/83,[],,https://gdsets.com/83posters/1983_11_03.jpg,,,,,,1983-11-03,1713480416632,false
gdsets_posters,gdsets_posters_1983_11_08.jpg,,Poster - 11/8-13/83,[],,https://gdsets.com/83posters/1983_11_08.jpg,,,,,,1983-11-08,1713480416706,false
gdsets_posters,gdsets_posters_1983_11_27.jpg,,Poster - 11/27/83,[],,https://gdsets.com/83posters/1983_11_27.jpg,,,,,,1983-11-27,1713480416706,false
gdsets_posters,gdsets_posters_1983_11_06.jpg,,Poster - 11/6/83,[],,https://gdsets.com/83posters/1983_11_06.jpg,,,,,,1983-11-06,1713480416793,false
gdsets_posters,gdsets_posters_1983_12_03a.jpg,,Poster - 12/3/83,[],,https://gdsets.com/83posters/1983_12_03a.jpg,,,,,,1983-12-03,1713480416892,false
gdsets_posters,gdsets_posters_1983_10_26.jpg,,Poster - 10/26/83,[],,https://gdsets.com/83posters/1983_10_26.jpg,,,,,,1983-10-26,1713480416893,false
gdsets_posters,gdsets_posters_1983_10_23a.jpg,,Poster - 10/23/83,[],,https://gdsets.com/83posters/1983_10_23a.jpg,,,,,,1983-10-23,1713480416989,false
gdsets_posters,gdsets_posters_1983_10_23.jpg,,Poster - 10/23/83,[],,https://gdsets.com/83posters/1983_10_23.jpg,,,,,,1983-10-23,1713480416990,false
gdsets_posters,gdsets_posters_1983_12_07a.jpg,,Poster - 12/7/83,[],,https://gdsets.com/83posters/1983_12_07a.jpg,,,,,,1983-12-07,1713480416994,true
gdsets_posters,gdsets_posters_1983_12_11.jpg,,Poster - 12/11/83,[],,https://gdsets.com/83posters/1983_12_11.jpg,,,,,,1983-12-11,1713480417070,false
gdsets_posters,gdsets_posters_1983_12_09.jpg,,Poster - 12/9/83,[],,https://gdsets.com/83posters/1983_12_09.jpg,,,,,,1983-12-09,1713480417070,false
gdsets_posters,gdsets_posters_1983_12_03.jpg,,Poster - 12/3/83,[],,https://gdsets.com/83posters/1983_12_03.jpg,,,,,,1983-12-03,1713480417085,false
gdsets_posters,gdsets_posters_1983_12_13.jpg,,Poster - 12/13/83,[],,https://gdsets.com/83posters/1983_12_13.jpg,,,,,,1983-12-13,1713480417172,false
gdsets_posters,gdsets_posters_1983_12_04.jpg,,Poster - 12/4/83,[],,https://gdsets.com/83posters/1983_12_04.jpg,,,,,,1983-12-04,1713480417173,false
gdsets_posters,gdsets_posters_1983_12_06.jpg,,Poster - 12/6/83,[],,https://gdsets.com/83posters/1983_12_06.jpg,,,,,,1983-12-06,1713480417173,false
gdsets_posters,gdsets_posters_1983_12_27a.jpg,,Poster - 12/27-30/83,[],,https://gdsets.com/83posters/1983_12_27a.jpg,,,,,,1983-12-27,1713480417180,false
gdsets_posters,gdsets_posters_1983_12_07.jpg,,Poster - 12/7/83,[],,https://gdsets.com/83posters/1983_12_07.jpg,,,,,,1983-12-07,1713480417180,false
gdsets_posters,gdsets_posters_1983_12_27c.jpg,,Poster - 12/27-31/83,[],,https://gdsets.com/83posters/1983_12_27c.jpg,,,,,,1983-12-27,1713480417261,false
gdsets_posters,gdsets_posters_1983_12_31.jpg,,Poster - 12/31/83,[],,https://gdsets.com/83posters/1983_12_31.jpg,,,,,,1983-12-31,1713480417264,false
gdsets_posters,gdsets_posters_1983_12_27b.jpg,,Poster - 12/27-31/83,[],,https://gdsets.com/83posters/1983_12_27b.jpg,,,,,,1983-12-27,1713480417346,false
gdsets_posters,gdsets_posters_1983_12_31a.jpg,,Poster - 12/31/83,[],,https://gdsets.com/83posters/1983_12_31a.jpg,,,,,,1983-12-31,1713480417356,false
gdsets_posters,gdsets_posters_1983_12_17.jpg,,Poster - 12/17/83,[],,https://gdsets.com/83posters/1983_12_17.jpg,,,,,,1983-12-17,1713480417428,false
gdsets_posters,gdsets_posters_1984_01_13.jpg,,Poster - 1/13-16/84,[],,https://gdsets.com/83posters/1984_01_13.jpg,,,,,,1984-01-13,1713480417531,false
gdsets_posters,gdsets_posters_1984_01_01a.jpg,,Poster - 1984 @ Dead Art Catalog,[],,https://gdsets.com/83posters/1984_01_01a.jpg,,,,,,1984-01-01,1713480417617,false
gdsets_posters,gdsets_posters_1984_01_13a.jpg,,Poster - 1/13/84,[],,https://gdsets.com/83posters/1984_01_13a.jpg,,,,,,1984-01-13,1713480417618,false
gdsets_posters,gdsets_posters_1984_01_08.jpg,,"Poster - 1/8,9/84",[],,https://gdsets.com/83posters/1984_01_08.jpg,,,,,,1984-01-08,1713480417627,false
gdsets_posters,gdsets_posters_1984_01_15a.jpg,,Poster - 1/15/84,[],,https://gdsets.com/83posters/1984_01_15a.jpg,,,,,,1984-01-15,1713480417695,false
gdsets_posters,gdsets_posters_1984_03_09.jpg,,Poster - 3/9/84,[],,https://gdsets.com/83posters/1984_03_09.jpg,,,,,,1984-03-09,1713480417696,false
gdsets_posters,gdsets_posters_1984_01_15.jpg,,Poster - 1/15/84,[],,https://gdsets.com/83posters/1984_01_15.jpg,,,,,,1984-01-15,1713480417712,false
gdsets_posters,gdsets_posters_1984_01_16f.jpg,,Poster - 1/16/84,[],,https://gdsets.com/83posters/1984_01_16f.jpg,,,,,,1984-01-16,1713480417713,false
gdsets_posters,gdsets_posters_1984_03_21.jpg,,Poster - 3/21/84,[],,https://gdsets.com/83posters/1984_03_21.jpg,,,,,,1984-03-21,1713480417793,false
gdsets_posters,gdsets_posters_1984_01_01.jpg,,Poster - 1984 Calendar,[],,https://gdsets.com/83posters/1984_01_01.jpg,,,,,,1984-01-01,1713480417866,false
gdsets_posters,gdsets_posters_1984_04_13.jpg,,Poster - 4/13-30/84,[],,https://gdsets.com/83posters/1984_04_13.jpg,,,,,,1984-04-13,1713480417880,false
gdsets_posters,gdsets_posters_1984_05_13.jpg,,Poster - 5/13/84,[],,https://gdsets.com/83posters/1984_05_13.jpg,,,,,,1984-05-13,1713480417887,false
gdsets_posters,gdsets_posters_1984_06_09a.jpg,,"Poster - 6/9,10/84",[],,https://gdsets.com/83posters/1984_06_09a.jpg,,,,,,1984-06-09,1713480417890,false
gdsets_posters,gdsets_posters_1984_05_20.jpg,,Poster - 5/20/84,[],,https://gdsets.com/83posters/1984_05_20.jpg,,,,,,1984-05-20,1713480417940,false
gdsets_posters,gdsets_posters_1984_05_18a.jpg,,Poster - 5/18/84,[],,https://gdsets.com/83posters/1984_05_18a.jpg,,,,,,1984-05-18,1713480417970,false
gdsets_posters,gdsets_posters_1984_06_20.jpg,,Poster -,[],,https://gdsets.com/83posters/1984_06_20.jpg,,,,,,1984-06-20,1713480418068,false
gdsets_posters,gdsets_posters_1984_06_09b.jpg,,"Poster - 6/9,10/84",[],,https://gdsets.com/83posters/1984_06_09b.jpg,,,,,,1984-06-09,1713480418157,false
gdsets_posters,gdsets_posters_1984_05_18.jpg,,Poster - 5/18/84,[],,https://gdsets.com/83posters/1984_05_18.jpg,,,,,,1984-05-18,1713480418245,false
gdsets_posters,gdsets_posters_1984_06_21a.jpg,,Poster - 6/21/84,[],,https://gdsets.com/83posters/1984_06_21a.jpg,,,,,,1984-06-21,1713480418246,false
gdsets_posters,gdsets_posters_1984_06_21d.jpg,,Poster - 6/21/84,[],,https://gdsets.com/83posters/1984_06_21d.jpg,,,,,,1984-06-21,1713480418249,true
gdsets_posters,gdsets_posters_1984_06_21e.jpg,,Poster - 6/21/84,[],,https://gdsets.com/83posters/1984_06_21e.jpg,,,,,,1984-06-21,1713480418252,false
gdsets_posters,gdsets_posters_1984_05_17.jpg,,Poster - 5/17/84,[],,https://gdsets.com/83posters/1984_05_17.jpg,,,,,,1984-05-17,1713480418343,false
gdsets_posters,gdsets_posters_1984_07_13a.jpg,,Poster - 7/13-15/84,[],,https://gdsets.com/83posters/1984_07_13a.jpg,,,,,,1984-07-13,1713480418343,false
gdsets_posters,gdsets_posters_1984_06_21b.jpg,,Poster - 6/21/84,[],,https://gdsets.com/83posters/1984_06_21b.jpg,,,,,,1984-06-21,1713480418344,false
gdsets_posters,gdsets_posters_1984_06_21f.jpg,,Poster - 6/21/84,[],,https://gdsets.com/83posters/1984_06_21f.jpg,,,,,,1984-06-21,1713480418359,false
gdsets_posters,gdsets_posters_1984_06_21g.jpg,,Poster - 6/21/84,[],,https://gdsets.com/83posters/1984_06_21g.jpg,,,,,,1984-06-21,1713480418426,false
gdsets_posters,gdsets_posters_1984_06_20a.jpg,,Poster - Summer 1984,[],,https://gdsets.com/83posters/1984_06_20a.jpg,,,,,,1984-06-20,1713480418430,false
gdsets_posters,gdsets_posters_1984_06_30a.jpg,,Poster - 6/30/84,[],,https://gdsets.com/83posters/1984_06_30a.jpg,,,,,,1984-06-30,1713480418431,false
gdsets_posters,gdsets_posters_1984_07_13m.jpg,,Poster - 7/13-15/84,[],,https://gdsets.com/83posters/1984_07_13m.jpg,,,,,,1984-07-13,1713480418506,false
gdsets_posters,gdsets_posters_1984_07_21c.jpg,,"Poster - 7/21,22/84",[],,https://gdsets.com/83posters/1984_07_21c.jpg,,,,,,1984-07-21,1713480418521,false
gdsets_posters,gdsets_posters_1984_07_18.jpg,,Poster - 7/18/84,[],,https://gdsets.com/83posters/1984_07_18.jpg,,,,,,1984-07-18,1713480418587,false
gdsets_posters,gdsets_posters_1984_07_21a.jpg,,"Poster - 7/21,22/84",[],,https://gdsets.com/83posters/1984_07_21a.jpg,,,,,,1984-07-21,1713480418707,false
gdsets_posters,gdsets_posters_1984_07_17.jpg,,Poster - 7/17/84,[],,https://gdsets.com/83posters/1984_07_17.jpg,,,,,,1984-07-17,1713480418709,false
gdsets_posters,gdsets_posters_1984_07_21d.jpg,,"Poster - 7/21,22/84",[],,https://gdsets.com/83posters/1984_07_21d.jpg,,,,,,1984-07-21,1713480418711,true
gdsets_posters,gdsets_posters_1984_07_21f.jpg,,"Poster - 7/21,22/84",[],,https://gdsets.com/83posters/1984_07_21f.jpg,,,,,,1984-07-21,1713480418797,false
gdsets_posters,gdsets_posters_1984_07_21e.jpg,,"Poster - 7/21,22/84",[],,https://gdsets.com/83posters/1984_07_21e.jpg,,,,,,1984-07-21,1713480418803,true
gdsets_posters,gdsets_posters_1984_08_08.jpg,,Poster - 8/8/84,[],,https://gdsets.com/83posters/1984_08_08.jpg,,,,,,1984-08-08,1713480418879,false
gdsets_posters,gdsets_posters_1984_07_28.jpg,,Poster - 7/28-8/1/84,[],,https://gdsets.com/83posters/1984_07_28.jpg,,,,,,1984-07-28,1713480418881,false
gdsets_posters,gdsets_posters_1984_08_07a.jpg,,Poster - 8/7/84,[],,https://gdsets.com/83posters/1984_08_07a.jpg,,,,,,1984-08-07,1713480418881,false
gdsets_posters,gdsets_posters_1984_07_21b.jpg,,"Poster - 7/21,22/84",[],,https://gdsets.com/83posters/1984_07_21b.jpg,,,,,,1984-07-21,1713480418886,false
gdsets_posters,gdsets_posters_1984_08_26.jpg,,"Poster - 8/26,27/84",[],,https://gdsets.com/83posters/1984_08_26.jpg,,,,,,1984-08-26,1713480418975,false
gdsets_posters,gdsets_posters_1984_08_28.jpg,,Poster - 8/28/84,[],,https://gdsets.com/83posters/1984_08_28.jpg,,,,,,1984-08-28,1713480419072,false
gdsets_posters,gdsets_posters_1984_08_14.jpg,,Poster - 8/14/84,[],,https://gdsets.com/83posters/1984_08_14.jpg,,,,,,1984-08-14,1713480419073,false
gdsets_posters,gdsets_posters_1984_08_17.jpg,,Poster - 8/17/84,[],,https://gdsets.com/83posters/1984_08_17.jpg,,,,,,1984-08-17,1713480419162,false
gdsets_posters,gdsets_posters_1984_08_28a.jpg,,Poster - 8/28/84,[],,https://gdsets.com/83posters/1984_08_28a.jpg,,,,,,1984-08-28,1713480419163,false
gdsets_posters,gdsets_posters_1984_09_15.jpg,,Poster - 9/15-19/84,[],,https://gdsets.com/83posters/1984_09_15.jpg,,,,,,1984-09-15,1713480419165,false
gdsets_posters,gdsets_posters_1984_09_28.jpg,,Poster - 9/28/84,[],,https://gdsets.com/83posters/1984_09_28.jpg,,,,,,1984-09-28,1713480419177,false
gdsets_posters,gdsets_posters_1984_08_30.jpg,,Poster - 8/30/84,[],,https://gdsets.com/83posters/1984_08_30.jpg,,,,,,1984-08-30,1713480419252,true
gdsets_posters,gdsets_posters_1984_08_07.jpg,,Poster - 8/7/84,[],,https://gdsets.com/83posters/1984_08_07.jpg,,,,,,1984-08-07,1713480419254,false
gdsets_posters,gdsets_posters_1984_08_30a.jpg,,Poster - 8/30/84,[],,https://gdsets.com/83posters/1984_08_30a.jpg,,,,,,1984-08-30,1713480419346,false
gdsets_posters,gdsets_posters_1984_10_24.jpg,,"Poster - 10/24,26/84",[],,https://gdsets.com/83posters/1984_10_24.jpg,,,,,,1984-10-24,1713480419443,false
gdsets_posters,gdsets_posters_1984_10_08a.jpg,,"Poster - 10/8,9/84",[],,https://gdsets.com/83posters/1984_10_08a.jpg,,,,,,1984-10-08,1713480419548,true
gdsets_posters,gdsets_posters_1984_11_17.jpg,,Poster - 11/17/84,[],,https://gdsets.com/83posters/1984_11_17.jpg,,,,,,1984-11-17,1713480419663,false
gdsets_posters,gdsets_posters_1984_10_27b.jpg,,Poster - 10/27-11/3/84,[],,https://gdsets.com/83posters/1984_10_27b.jpg,,,,,,1984-10-27,1713480419768,false
gdsets_posters,gdsets_posters_1984_11_16.jpg,,Poster - 11/16/84,[],,https://gdsets.com/83posters/1984_11_16.jpg,,,,,,1984-11-16,1713480419867,false
gdsets_posters,gdsets_posters_1984_12_02.jpg,,Poster - 12/2-10/84,[],,https://gdsets.com/83posters/1984_12_02.jpg,,,,,,1984-12-02,1713480419875,false
gdsets_posters,gdsets_posters_1984_11_26.jpg,,Poster - 11/26/84,[],,https://gdsets.com/83posters/1984_11_26.jpg,,,,,,1984-11-26,1713480419875,false
gdsets_posters,gdsets_posters_1984_11_16a.jpg,,Poster - 11/16/84,[],,https://gdsets.com/83posters/1984_11_16a.jpg,,,,,,1984-11-16,1713480419875,false
gdsets_posters,gdsets_posters_1984_10_20a.jpg,,Poster - 10/20/84,[],,https://gdsets.com/83posters/1984_10_20a.jpg,,,,,,1984-10-20,1713480419875,false
gdsets_posters,gdsets_posters_1984_11_18.jpg,,Poster - 11/18/84 @ Program,[],,https://gdsets.com/83posters/1984_11_18.jpg,,,,,,1984-11-18,1713480419875,false
gdsets_posters,gdsets_posters_1984_11_18a.jpg,,Poster - 11/18/84,[],,https://gdsets.com/83posters/1984_11_18a.jpg,,,,,,1984-11-18,1713480419881,false
gdsets_posters,gdsets_posters_1984_10_27c.jpg,,Poster - 10/27-11/3/84,[],,https://gdsets.com/83posters/1984_10_27c.jpg,,,,,,1984-10-27,1713480419882,false
gdsets_posters,gdsets_posters_1984_08_18.jpg,,Poster - 8/18/84,[],,https://gdsets.com/83posters/1984_08_18.jpg,,,,,,1984-08-18,1713480419974,false
gdsets_posters,gdsets_posters_1984_12_05c.jpg,,Poster - 12/5-8/84,[],,https://gdsets.com/83posters/1984_12_05c.jpg,,,,,,1984-12-05,1713480419978,true
gdsets_posters,gdsets_posters_1984_10_08b.jpg,,"Poster - 10/8,9/84",[],,https://gdsets.com/83posters/1984_10_08b.jpg,,,,,,1984-10-08,1713480419981,false
gdsets_posters,gdsets_posters_1984_12_22.jpg,,"Poster - 12/22,26/84",[],,https://gdsets.com/83posters/1984_12_22.jpg,,,,,,1984-12-22,1713480419981,false
gdsets_posters,gdsets_posters_1984_12_05a.jpg,,Poster - 12/5-8/84,[],,https://gdsets.com/83posters/1984_12_05a.jpg,,,,,,1984-12-05,1713480420049,false
gdsets_posters,gdsets_posters_1984_12_05.jpg,,Poster - 12/5-8/84,[],,https://gdsets.com/83posters/1984_12_05.jpg,,,,,,1984-12-05,1713480420049,true
gdsets_posters,gdsets_posters_1984_10_27d.jpg,,"Poster - 10/27,28/84",[],,https://gdsets.com/83posters/1984_10_27d.jpg,,,,,,1984-10-27,1713480420050,false
gdsets_posters,gdsets_posters_1984_12_26.jpg,,Poster - 12/26/84,[],,https://gdsets.com/83posters/1984_12_26.jpg,,,,,,1984-12-26,1713480420053,false
gdsets_posters,gdsets_posters_1984_12_28a.jpg,,Poster - 12/28-31/84,[],,https://gdsets.com/83posters/1984_12_28a.jpg,,,,,,1984-12-28,1713480420208,false
gdsets_posters,gdsets_posters_1985_01_26.jpg,,Poster - 1/26/85,[],,https://gdsets.com/83posters/1985_01_26.jpg,,,,,,1985-01-26,1713480420328,false
gdsets_posters,gdsets_posters_1985_03_27b.jpg,,Poster - 3/27-29/85,[],,https://gdsets.com/83posters/1985_03_27b.jpg,,,,,,1985-03-27,1713480420500,false
gdsets_posters,gdsets_posters_1985_03_27.jpg,,Poster - 3/27-29/85,[],,https://gdsets.com/83posters/1985_03_27.jpg,,,,,,1985-03-27,1713480420500,false
gdsets_posters,gdsets_posters_1985_03_27c.jpg,,Poster - 3/27-29/85,[],,https://gdsets.com/83posters/1985_03_27c.jpg,,,,,,1985-03-27,1713480420501,true
gdsets_posters,gdsets_posters_1985_03_27e.jpg,,Poster - 3/27-29/85,[],,https://gdsets.com/83posters/1985_03_27e.jpg,,,,,,1985-03-27,1713480420519,true
gdsets_posters,gdsets_posters_1985_05_31a.jpg,,Poster - 5/31/85,[],,https://gdsets.com/83posters/1985_05_31a.jpg,,,,,,1985-05-31,1713480420609,false
gdsets_posters,gdsets_posters_1985_03_27d.jpg,,Poster - 3/27-29/85,[],,https://gdsets.com/83posters/1985_03_27d.jpg,,,,,,1985-03-27,1713480420620,false
gdsets_posters,gdsets_posters_1985_04_03a.jpg,,"Poster - 4/3,4/85",[],,https://gdsets.com/83posters/1985_04_03a.jpg,,,,,,1985-04-03,1713480420624,false
gdsets_posters,gdsets_posters_1985_04_13a.jpg,,"Poster - 4/13,14/85",[],,https://gdsets.com/83posters/1985_04_13a.jpg,,,,,,1985-04-13,1713480420713,false
gdsets_posters,gdsets_posters_1985_05_31.jpg,,Poster - 5/31/85,[],,https://gdsets.com/83posters/1985_05_31.jpg,,,,,,1985-05-31,1713480420715,false
gdsets_posters,gdsets_posters_1985_04_13b.jpg,,"Poster - 4/13,14/85",[],,https://gdsets.com/83posters/1985_04_13b.jpg,,,,,,1985-04-13,1713480420715,false
gdsets_posters,gdsets_posters_1985_04_06.jpg,,Poster - 4/6-8/85,[],,https://gdsets.com/83posters/1985_04_06.jpg,,,,,,1985-04-06,1713480420728,false
gdsets_posters,gdsets_posters_1985_06_21a.jpg,,Poster - Summer 1985,[],,https://gdsets.com/83posters/1985_06_21a.jpg,,,,,,1985-06-21,1713480420821,false
gdsets_posters,gdsets_posters_1985_03_31a.jpg,,"Poster - 3/31,4/1/85",[],,https://gdsets.com/83posters/1985_03_31a.jpg,,,,,,1985-03-31,1713480420825,false
gdsets_posters,gdsets_posters_1985_06_01.jpg,,Poster - 6/1-3/85,[],,https://gdsets.com/83posters/1985_06_01.jpg,,,,,,1985-06-01,1713480420889,false
gdsets_posters,gdsets_posters_1985_07_02a.jpg,,Poster - 7/2/85,[],,https://gdsets.com/83posters/1985_07_02a.jpg,,,,,,1985-07-02,1713480420914,false
gdsets_posters,gdsets_posters_1985_07_02b.jpg,,Poster - 7/2/85,[],,https://gdsets.com/83posters/1985_07_02b.jpg,,,,,,1985-07-02,1713480421003,true
gdsets_posters,gdsets_posters_1985_06_27.jpg,,Poster - 6/27/85,[],,https://gdsets.com/83posters/1985_06_27.jpg,,,,,,1985-06-27,1713480421051,false
gdsets_posters,gdsets_posters_1985_07_13a.jpg,,"Poster - 7/13,14/85",[],,https://gdsets.com/83posters/1985_07_13a.jpg,,,,,,1985-07-13,1713480421186,false
gdsets_posters,gdsets_posters_1985_08_04.jpg,,Poster - 8/4-11/85,[],,https://gdsets.com/83posters/1985_08_04.jpg,,,,,,1985-08-04,1713480421285,false
gdsets_posters,gdsets_posters_1985_08_18.jpg,,Poster - 8/18/85,[],,https://gdsets.com/83posters/1985_08_18.jpg,,,,,,1985-08-18,1713480421286,false
gdsets_posters,gdsets_posters_1985_08_27.jpg,,Poster - 8/27/85,[],,https://gdsets.com/83posters/1985_08_27.jpg,,,,,,1985-08-27,1713480421290,false
gdsets_posters,gdsets_posters_1985_01_01.jpg,,Poster - 1985 Calendar(lot poster),[],,https://gdsets.com/83posters/1985_01_01.jpg,,,,,,1985-01-01,1713480421384,false
gdsets_posters,gdsets_posters_1985_07_13b.jpg,,"Poster - 7/13,14/85",[],,https://gdsets.com/83posters/1985_07_13b.jpg,,,,,,1985-07-13,1713480421393,false
gdsets_posters,gdsets_posters_1985_07_13c.jpg,,"Poster - 7/13,14/85",[],,https://gdsets.com/83posters/1985_07_13c.jpg,,,,,,1985-07-13,1713480421398,false
gdsets_posters,gdsets_posters_1985_08_10.jpg,,Poster - 8/10/85,[],,https://gdsets.com/83posters/1985_08_10.jpg,,,,,,1985-08-10,1713480421398,false
gdsets_posters,gdsets_posters_1985_08_31a.jpg,,Poster - 8/31/85,[],,https://gdsets.com/83posters/1985_08_31a.jpg,,,,,,1985-08-31,1713480421494,false
gdsets_posters,gdsets_posters_1985_09_02.jpg,,Poster - 9/2/85,[],,https://gdsets.com/83posters/1985_09_02.jpg,,,,,,1985-09-02,1713480421496,false
gdsets_posters,gdsets_posters_1985_08_24.jpg,,Poster - 8/24/85,[],,https://gdsets.com/83posters/1985_08_24.jpg,,,,,,1985-08-24,1713480421502,false
gdsets_posters,gdsets_posters_1985_09_02a.jpg,,Poster - 9/2/85,[],,https://gdsets.com/83posters/1985_09_02a.jpg,,,,,,1985-09-02,1713480421503,false
gdsets_posters,gdsets_posters_1985_09_15.jpg,,Poster - 9/15/85,[],,https://gdsets.com/83posters/1985_09_15.jpg,,,,,,1985-09-15,1713480421504,false
gdsets_posters,gdsets_posters_1985_08_24a.jpg,,Poster - 8/24/85,[],,https://gdsets.com/83posters/1985_08_24a.jpg,,,,,,1985-08-24,1713480421587,false
gdsets_posters,gdsets_posters_1985_03_27a.jpg,,Poster - 3/27-29/85,[],,https://gdsets.com/83posters/1985_03_27a.jpg,,,,,,1985-03-27,1713480421588,false
gdsets_posters,gdsets_posters_1985_09_15a.jpg,,Poster - 9/15/85,[],,https://gdsets.com/83posters/1985_09_15a.jpg,,,,,,1985-09-15,1713480421672,false
gdsets_posters,gdsets_posters_1985_08_31.jpg,,Poster - 8/31/85,[],,https://gdsets.com/83posters/1985_08_31.jpg,,,,,,1985-08-31,1713480421681,false
gdsets_posters,gdsets_posters_1985_10_07.jpg,,"Poster - 10/7,13/85",[],,https://gdsets.com/83posters/1985_10_07.jpg,,,,,,1985-10-07,1713480421764,false
gdsets_posters,gdsets_posters_1985_10_14.jpg,,Poster - 10/14/85,[],,https://gdsets.com/83posters/1985_10_14.jpg,,,,,,1985-10-14,1713480421845,false
gdsets_posters,gdsets_posters_1985_06_14c (OHB rev).jpg,,Poster - 6/14-16/85(OHB) Reverse,[],,https://gdsets.com/83posters/1985_06_14c (OHB
gdsets_posters,gdsets_posters_1985_10_14b.jpg,,Poster - 10/14/85 @ Program Outside,[],,https://gdsets.com/83posters
gdsets_posters,gdsets_posters_1985_10_31a.jpg,,Poster - 10/31/85,[],,https://gdsets.com/83posters/1985_10_31a.jpg,,,,,,1985-10-31,1713480422041,true
gdsets_posters,gdsets_posters_1985_10_28.jpg,,"Poster - 10/28,29/85",[],,https://gdsets.com/83posters/1985_10_28.jpg,,,,,,1985-10-28,1713480422042,false
gdsets_posters,gdsets_posters_1985_10_14c.jpg,,Poster - 10/14/85 @ Program Inside,[],,https://gdsets.com/83posters/1985_10_14c.jpg,,,,,,1985-10-14,1713480422100,false
gdsets_posters,gdsets_posters_1985_11_16.jpg,,"Poster - 11/16,17/85",[],,https://gdsets.com/83posters/1985_11_16.jpg,,,,,,1985-11-16,1713480422122,false
gdsets_posters,gdsets_posters_1985_10_31b.jpg,,Poster - 10/31/85,[],,https://gdsets.com/83posters/1985_10_31b.jpg,,,,,,1985-10-31,1713480422125,false
gdsets_posters,gdsets_posters_1985_11_16c.jpg,,"Poster - 11/16,17/85",[],,https://gdsets.com/83posters/1985_11_16c.jpg,,,,,,1985-11-16,1713480422213,false
gdsets_posters,gdsets_posters_1985_11_16b.jpg,,"Poster - 11/16,17/85",[],,https://gdsets.com/83posters/1985_11_16b.jpg,,,,,,1985-11-16,1713480422214,false
gdsets_posters,gdsets_posters_1985_11_20.jpg,,Poster - 11/20-22/85,[],,https://gdsets.com/83posters/1985_11_20.jpg,,,,,,1985-11-20,1713480422216,false
gdsets_posters,gdsets_posters_1985_12_15.jpg,,Poster - 12/15-22/85,[],,https://gdsets.com/83posters/1985_12_15.jpg,,,,,,1985-12-15,1713480422303,false
gdsets_posters,gdsets_posters_1985_10_31.jpg,,Poster - 10/31/85,[],,https://gdsets.com/83posters/1985_10_31.jpg,,,,,,1985-10-31,1713480422312,false
gdsets_posters,gdsets_posters_1985_12_31.jpg,,Poster - 12/31/85 @ Handout,[],,https://gdsets.com/83posters/1985_12_31.jpg,,,,,,1985-12-31,1713480422312,false
gdsets_posters,gdsets_posters_1985_12_31a.jpg,,Poster - 12/31/85 @ Broadcast Ad,[],,https://gdsets.com/83posters/1985_12_31a.jpg,,,,,,1985-12-31,1713480422399,false
gdsets_posters,gdsets_posters_1986_02_08.jpg,,Poster - 2/8-14/86,[],,https://gdsets.com/86posters/1986_02_08.jpg,,,,,,1986-02-08,1713480422437,false
gdsets_posters,gdsets_posters_1985_10_24a.jpg,,Poster - Fall 1985,[],,https://gdsets.com/83posters/1985_10_24a.jpg,,,,,,1985-10-24,1713480422437,false
gdsets_posters,gdsets_posters_1985_11_20a.jpg,,Poster - 11/20-22/85,[],,https://gdsets.com/83posters/1985_11_20a.jpg,,,,,,1985-11-20,1713480422495,false
gdsets_posters,gdsets_posters_1986_00_00.jpg,,Poster - 1986 merchandiseorder form,[],,https://gdsets.com/86posters/1986_00_00.jpg,,,,,,1986-00-00,1713480422607,false
gdsets_posters,gdsets_posters_1986_02_08k.jpg,,Poster - 2/8-14/86,[],,https://gdsets.com/86posters/1986_02_08k.jpg,,,,,,1986-02-08,1713480422702,false
gdsets_posters,gdsets_posters_1986_02_08a.jpg,,Poster - 2/8-14/86,[],,https://gdsets.com/86posters/1986_02_08a.jpg,,,,,,1986-02-08,1713480422703,false
gdsets_posters,gdsets_posters_1986_02_08m.jpg,,Poster - 2/8-14/86,[],,https://gdsets.com/86posters/1986_02_08m.jpg,,,,,,1986-02-08,1713480422704,false
gdsets_posters,gdsets_posters_1986_02_01.jpg,,Poster - 2/1/86,[],,https://gdsets.com/86posters/1986_02_01.jpg,,,,,,1986-02-01,1713480422783,false
gdsets_posters,gdsets_posters_1986_02_21.jpg,,Poster - 2/21/86,[],,https://gdsets.com/86posters/1986_02_21.jpg,,,,,,1986-02-21,1713480422886,false
gdsets_posters,gdsets_posters_1986_03_19a.jpg,,Poster - 3/19-21/86,[],,https://gdsets.com/86posters/1986_03_19a.jpg,,,,,,1986-03-19,1713480422908,false
gdsets_posters,gdsets_posters_1986_03_09.jpg,,"Poster - 3/9,10/86",[],,https://gdsets.com/86posters/1986_03_09.jpg,,,,,,1986-03-09,1713480422973,false
gdsets_posters,gdsets_posters_1986_02_22.jpg,,"Poster - 2/22,23/86",[],,https://gdsets.com/86posters/1986_02_22.jpg,,,,,,1986-02-22,1713480423008,false
gdsets_posters,gdsets_posters_1986_05_03.jpg,,"Poster - 5/3,4/86",[],,https://gdsets.com/86posters/1986_05_03.jpg,,,,,,1986-05-03,1713480423099,false
gdsets_posters,gdsets_posters_1986_04_12a.jpg,,"Poster - 4/12,13/86",[],,https://gdsets.com/86posters/1986_04_12a.jpg,,,,,,1986-04-12,1713480423111,false
gdsets_posters,gdsets_posters_1986_04_24.jpg,,Poster - 4/24/86,[],,https://gdsets.com/86posters/1986_04_24.jpg,,,,,,1986-04-24,1713480423112,false
gdsets_posters,gdsets_posters_1986_05_10.jpg,,"Poster - 5/10,11/86",[],,https://gdsets.com/86posters/1986_05_10.jpg,,,,,,1986-05-10,1713480423193,false
gdsets_posters,gdsets_posters_1985_11_04.jpg,,"Poster - 11/4,5/85",[],,https://gdsets.com/83posters/1985_11_04.jpg,,,,,,1985-11-04,1713480423203,false
gdsets_posters,gdsets_posters_1986_04_28.jpg,,Poster - 4/28/86,[],,https://gdsets.com/86posters/1986_04_28.jpg,,,,,,1986-04-28,1713480423204,false
gdsets_posters,gdsets_posters_1986_03_30.jpg,,"Poster - 3/30,31/86",[],,https://gdsets.com/86posters/1986_03_30.jpg,,,,,,1986-03-30,1713480423205,false
gdsets_posters,gdsets_posters_1985_10_24.jpg,,Poster - Fall 1985,[],,https://gdsets.com/83posters/1985_10_24.jpg,,,,,,1985-10-24,1713480423312,false
gdsets_posters,gdsets_posters_1986_05_15.jpg,,Poster - 5/15/86,[],,https://gdsets.com/86posters/1986_05_15.jpg,,,,,,1986-05-15,1713480423397,false
gdsets_posters,gdsets_posters_1986_05_15b.jpg,,Poster - 5/15/86,[],,https://gdsets.com/86posters/1986_05_15b.jpg,,,,,,1986-05-15,1713480423403,true
gdsets_posters,gdsets_posters_1986_05_18.jpg,,"Poster - 5/18,19/86",[],,https://gdsets.com/86posters/1986_05_18.jpg,,,,,,1986-05-18,1713480423403,false
gdsets_posters,gdsets_posters_1986_01_01.jpg,,Poster - 1986 Calendar,[],,https://gdsets.com/86posters/1986_01_01.jpg,,,,,,1986-01-01,1713480423488,false
gdsets_posters,gdsets_posters_1986_04_12.jpg,,"Poster - 4/12,13/86",[],,https://gdsets.com/86posters/1986_04_12.jpg,,,,,,1986-04-12,1713480423492,false
gdsets_posters,gdsets_posters_1986_05_23.jpg,,Poster - 5/23/86,[],,https://gdsets.com/86posters/1986_05_23.jpg,,,,,,1986-05-23,1713480423494,false
gdsets_posters,gdsets_posters_1986_05_24a.jpg,,Poster - 5/24/86,[],,https://gdsets.com/86posters/1986_05_24a.jpg,,,,,,1986-05-24,1713480423592,false
gdsets_posters,gdsets_posters_1986_05_23a.jpg,,Poster - 5/23/86,[],,https://gdsets.com/86posters/1986_05_23a.jpg,,,,,,1986-05-23,1713480423686,false
gdsets_posters,gdsets_posters_1986_02_28.jpg,,Poster - 2/28/86,[],,https://gdsets.com/86posters/1986_02_28.jpg,,,,,,1986-02-28,1713480423687,false
gdsets_posters,gdsets_posters_1986_05_29a.jpg,,Poster - 5/29/86,[],,https://gdsets.com/86posters/1986_05_29a.jpg,,,,,,1986-05-29,1713480423687,false
gdsets_posters,gdsets_posters_1986_06_26b.jpg,,Poster - Summer 1986,[],,https://gdsets.com/86posters/1986_06_26b.jpg,,,,,,1986-06-26,1713480423782,false
gdsets_posters,gdsets_posters_1986_05_30.jpg,,"Poster - 5/30,31/86",[],,https://gdsets.com/86posters/1986_05_30.jpg,,,,,,1986-05-30,1713480423812,false
gdsets_posters,gdsets_posters_1986_05_15c.jpg,,Poster - 5/15/86,[],,https://gdsets.com/86posters/1986_05_15c.jpg,,,,,,1986-05-15,1713480423867,false
gdsets_posters,gdsets_posters_1986_05_24.jpg,,Poster - 5/24/86,[],,https://gdsets.com/86posters/1986_05_24.jpg,,,,,,1986-05-24,1713480423964,false
gdsets_posters,gdsets_posters_1986_06_20d.jpg,,Poster - 6/20-22/86,[],,https://gdsets.com/86posters/1986_06_20d.jpg,,,,,,1986-06-20,1713480423974,false
gdsets_posters,gdsets_posters_1986_06_26c.jpg,,Poster - Summer 1986,[],,https://gdsets.com/86posters/1986_06_26c.jpg,,,,,,1986-06-26,1713480423974,false
gdsets_posters,gdsets_posters_1986_06_28c.jpg,,"Poster - 6/28,29/86",[],,https://gdsets.com/86posters/1986_06_28c.jpg,,,,,,1986-06-28,1713480424049,false
gdsets_posters,gdsets_posters_1986_06_26a.jpg,,Poster - Summer 1986,[],,https://gdsets.com/86posters/1986_06_26a.jpg,,,,,,1986-06-26,1713480424049,false
gdsets_posters,gdsets_posters_1986_06_28a.jpg,,"Poster - 6/28,29/86",[],,https://gdsets.com/86posters/1986_06_28a.jpg,,,,,,1986-06-28,1713480424055,false
gdsets_posters,gdsets_posters_1986_07_02.jpg,,Poster - 7/2/86,[],,https://gdsets.com/86posters/1986_07_02.jpg,,,,,,1986-07-02,1713480424140,true
gdsets_posters,gdsets_posters_1986_06_20e.jpg,,Poster - 6/20-22/86,[],,https://gdsets.com/86posters/1986_06_20e.jpg,,,,,,1986-06-20,1713480424144,true
gdsets_posters,gdsets_posters_1986_06_28b.jpg,,"Poster - 6/28,29/86",[],,https://gdsets.com/86posters/1986_06_28b.jpg,,,,,,1986-06-28,1713480424229,false
gdsets_posters,gdsets_posters_1986_06_20c.jpg,,Poster - 6/20-22/86,[],,https://gdsets.com/86posters/1986_06_20c.jpg,,,,,,1986-06-20,1713480424231,true
gdsets_posters,gdsets_posters_1986_07_04c.jpg,,Poster - 7/4-7/86,[],,https://gdsets.com/86posters/1986_07_04c.jpg,,,,,,1986-07-04,1713480424321,false
gdsets_posters,gdsets_posters_1986_07_04a.jpg,,Poster - 7/4/86,[],,https://gdsets.com/86posters/1986_07_04a.jpg,,,,,,1986-07-04,1713480424321,false
gdsets_posters,gdsets_posters_1986_07_02a.jpg,,Poster - 7/2/86,[],,https://gdsets.com/86posters/1986_07_02a.jpg,,,,,,1986-07-02,1713480424322,false
gdsets_posters,gdsets_posters_1986_07_06k.jpg,,"Poster - 7/6,7/86",[],,https://gdsets.com/86posters/1986_07_06k.jpg,,,,,,1986-07-06,1713480424327,false
gdsets_posters,gdsets_posters_1986_07_04b.jpg,,Poster - 7/4/86,[],,https://gdsets.com/86posters/1986_07_04b.jpg,,,,,,1986-07-04,1713480424411,false
gdsets_posters,gdsets_posters_1986_07_11.jpg,,"Poster - 7/12,13/86(cancelled)",[],,https://gdsets.com/86posters/1986_07_11.jpg,,,,,,1986-07-11,1713480424412,false
gdsets_posters,gdsets_posters_1986_07_06.jpg,,Poster - 7/6/86,[],,https://gdsets.com/86posters/1986_07_06.jpg,,,,,,1986-07-06,1713480424419,false
gdsets_posters,gdsets_posters_1986_07_07.jpg,,Poster - 7/7/86,[],,https://gdsets.com/86posters/1986_07_07.jpg,,,,,,1986-07-07,1713480424487,false
gdsets_posters,gdsets_posters_1986_07_11a.jpg,,"Poster - 7/12,13/86(cancelled)",[],,https://gdsets.com/86posters/1986_07_11a.jpg,,,,,,1986-07-11,1713480424491,false
gdsets_posters,gdsets_posters_1986_07_19b.jpg,,"Poster - 7/19,20/86(cancelled)",[],,https://gdsets.com/86posters/1986_07_19b.jpg,,,,,,1986-07-19,1713480424507,false
gdsets_posters,gdsets_posters_1986_08_17a.jpg,,Poster - 8/17/86(cancelled),[],,https://gdsets.com/86posters/1986_08_17a.jpg,,,,,,1986-08-17,1713480424772,false
gdsets_posters,gdsets_posters_1986_08_07.jpg,,Poster - 8/7/86,[],,https://gdsets.com/86posters/1986_08_07.jpg,,,,,,1986-08-07,1713480424774,false
gdsets_posters,gdsets_posters_1986_07_19a.jpg,,"Poster - 7/19,20/86(cancelled)",[],,https://gdsets.com/86posters/1986_07_19a.jpg,,,,,,1986-07-19,1713480424842,false
gdsets_posters,gdsets_posters_1986_09_07a.jpg,,Poster - 9/7/86,[],,https://gdsets.com/86posters/1986_09_07a.jpg,,,,,,1986-09-07,1713480424874,false
gdsets_posters,gdsets_posters_1986_10_04.jpg,,Poster - 10/4/86,[],,https://gdsets.com/86posters/1986_10_04.jpg,,,,,,1986-10-04,1713480424962,false
gdsets_posters,gdsets_posters_1986_11_30.jpg,,Poster - 11/30/86,[],,https://gdsets.com/86posters/1986_11_30.jpg,,,,,,1986-11-30,1713480425062,false
gdsets_posters,gdsets_posters_1986_08_27a.jpg,,Poster - 8/27/86,[],,https://gdsets.com/86posters/1986_08_27a.jpg,,,,,,1986-08-27,1713480425063,false
gdsets_posters,gdsets_posters_1986_08_27.jpg,,Poster - 8/27/86,[],,https://gdsets.com/86posters/1986_08_27.jpg,,,,,,1986-08-27,1713480425074,false
gdsets_posters,gdsets_posters_1986_10_01.jpg,,Poster - 10/1/86,[],,https://gdsets.com/86posters/1986_10_01.jpg,,,,,,1986-10-01,1713480425076,false
gdsets_posters,gdsets_posters_1986_12_08.jpg,,"Poster - 12/8,21/86",[],,https://gdsets.com/86posters/1986_12_08.jpg,,,,,,1986-12-08,1713480425162,false
gdsets_posters,gdsets_posters_1986_10_29.jpg,,Poster - 10/29/86,[],,https://gdsets.com/86posters/1986_10_29.jpg,,,,,,1986-10-29,1713480425163,false
gdsets_posters,gdsets_posters_1986_12_19.jpg,,Poster - 12/19/86,[],,https://gdsets.com/86posters/1986_12_19.jpg,,,,,,1986-12-19,1713480425164,false
gdsets_posters,gdsets_posters_1986_12_19a.jpg,,Poster - 12/19/86,[],,https://gdsets.com/86posters/1986_12_19a.jpg,,,,,,1986-12-19,1713480425165,false
gdsets_posters,gdsets_posters_1986_07_19.jpg,,"Poster - 7/19,20/86(cancelled)",[],,https://gdsets.com/86posters/1986_07_19.jpg,,,,,,1986-07-19,1713480425177,true
gdsets_posters,gdsets_posters_1986_09_25.jpg,,Poster - 9/25/86,[],,https://gdsets.com/86posters/1986_09_25.jpg,,,,,,1986-09-25,1713480425250,false
gdsets_posters,gdsets_posters_1986_07_29.jpg,,Poster - 7/29/86,[],,https://gdsets.com/86posters/1986_07_29.jpg,,,,,,1986-07-29,1713480425257,false
gdsets_posters,gdsets_posters_1986_09_07.jpg,,Poster - 9/7/86,[],,https://gdsets.com/86posters/1986_09_07.jpg,,,,,,1986-09-07,1713480425342,false
gdsets_posters,gdsets_posters_1986_10_17.jpg,,Poster - 10/17/86,[],,https://gdsets.com/86posters/1986_10_17.jpg,,,,,,1986-10-17,1713480425356,false
gdsets_posters,gdsets_posters_1986_08_17.jpg,,Poster - 8/17/86(cancelled),[],,https://gdsets.com/86posters/1986_08_17.jpg,,,,,,1986-08-17,1713480425516,false
gdsets_posters,gdsets_posters_1986_12_25a.jpg,,Poster - 1986 Holiday Card back,[],,https://gdsets.com/86posters/1986_12_25a.jpg,,,,,,1986-12-25,1713480425522,true
gdsets_posters,gdsets_posters_1986_12_25c.jpg,,Poster - 1986 Holiday Card proof back,[],,https://gdsets.com/86posters
gdsets_posters,gdsets_posters_1987_01_25a.jpg,,Poster - 1/25/87,[],,https://gdsets.com/86posters/1987_01_25a.jpg,,,,,,1987-01-25,1713480425713,false
gdsets_posters,gdsets_posters_1987_01_25.jpg,,"Poster - 1/25,2/9/87",[],,https://gdsets.com/86posters/1987_01_25.jpg,,,,,,1987-01-25,1713480425716,false
gdsets_posters,gdsets_posters_1987_02_05.jpg,,Poster - 2/5/87,[],,https://gdsets.com/86posters/1987_02_05.jpg,,,,,,1987-02-05,1713480425805,false
gdsets_posters,gdsets_posters_1987_02_05b.jpg,,"Poster - 2/5,12/87",[],,https://gdsets.com/86posters/1987_02_05b.jpg,,,,,,1987-02-05,1713480425811,false
gdsets_posters,gdsets_posters_1987_00_00.jpg,,Poster - GD Movie Video Release Promo Postcard,[],,https://gdsets.com/86posters
gdsets_posters,gdsets_posters_1987_01_25b.jpg,,Poster - 1/25/87,[],,https://gdsets.com/86posters/1987_01_25b.jpg,,,,,,1987-01-25,1713480425815,false
gdsets_posters,gdsets_posters_1987_02_20.jpg,,Poster - 2/20/87,[],,https://gdsets.com/86posters/1987_02_20.jpg,,,,,,1987-02-20,1713480425816,false
gdsets_posters,gdsets_posters_1987_02_05a.jpg,,Poster - 2/5/87,[],,https://gdsets.com/86posters/1987_02_05a.jpg,,,,,,1987-02-05,1713480425911,false
gdsets_posters,gdsets_posters_1987_02_15.jpg,,Poster - 2/15/87 @ Program,[],,https://gdsets.com/86posters/1987_02_15.jpg,,,,,,1987-02-15,1713480425913,false
gdsets_posters,gdsets_posters_1987_02_21k.jpg,,Poster - 2/21/87,[],,https://gdsets.com/86posters/1987_02_21k.jpg,,,,,,1987-02-21,1713480426014,false
gdsets_posters,gdsets_posters_1987_00_00a.jpg,,Poster - Warner Bros.CD promo,[],,https://gdsets.com/86posters/1987_00_00a.jpg,,,,,,1987-00-00,1713480426015,false
gdsets_posters,gdsets_posters_1987_02_21.jpg,,Poster - 2/21/87,[],,https://gdsets.com/86posters/1987_02_21.jpg,,,,,,1987-02-21,1713480426015,false
gdsets_posters,gdsets_posters_1986_12_25.jpg,,Poster - 1986 Holiday Card front,[],,https://gdsets.com/86posters/1986_12_25.jpg,,,,,,1986-12-25,1713480426015,false
gdsets_posters,gdsets_posters_1987_03_00a.jpg,,Poster - Spring 1987,[],,https://gdsets.com/86posters/1987_03_00a.jpg,,,,,,1987-03-00,1713480426201,false
gdsets_posters,gdsets_posters_1987_03_00.jpg,,Poster - Spring 1987,[],,https://gdsets.com/86posters/1987_03_00.jpg,,,,,,1987-03-00,1713480426297,false
gdsets_posters,gdsets_posters_1987_03_01a.jpg,,Poster - 3/1-3/87,[],,https://gdsets.com/86posters/1987_03_01a.jpg,,,,,,1987-03-01,1713480426392,false
gdsets_posters,gdsets_posters_1987_03_01.jpg,,Poster - 3/1-3/87,[],,https://gdsets.com/86posters/1987_03_01.jpg,,,,,,1987-03-01,1713480426397,false
gdsets_posters,gdsets_posters_1987_03_08.jpg,,Poster - 3/8-10/87,[],,https://gdsets.com/86posters/1987_03_08.jpg,,,,,,1987-03-08,1713480426401,false
gdsets_posters,gdsets_posters_1986_10_31.jpg,,Poster - 10/31/86,[],,https://gdsets.com/86posters/1986_10_31.jpg,,,,,,1986-10-31,1713480426406,false
gdsets_posters,gdsets_posters_1987_03_13.jpg,,"Poster - 3/13,14/87",[],,https://gdsets.com/86posters/1987_03_13.jpg,,,,,,1987-03-13,1713480426503,false
gdsets_posters,gdsets_posters_1987_01_28.jpg,,Poster - 1/28-30/87,[],,https://gdsets.com/86posters/1987_01_28.jpg,,,,,,1987-01-28,1713480426508,false
gdsets_posters,gdsets_posters_1987_03_13a.jpg,,"Poster - 3/13,14/87",[],,https://gdsets.com/86posters/1987_03_13a.jpg,,,,,,1987-03-13,1713480426610,false
gdsets_posters,gdsets_posters_1987_04_09a.jpg,,Poster - 4/9-11/87,[],,https://gdsets.com/86posters/1987_04_09a.jpg,,,,,,1987-04-09,1713480426714,false
gdsets_posters,gdsets_posters_1987_04_06.jpg,,"Poster - 4/6,7/87",[],,https://gdsets.com/86posters/1987_04_06.jpg,,,,,,1987-04-06,1713480426716,false
gdsets_posters,gdsets_posters_1987_03_18.jpg,,Poster - 3/18/87,[],,https://gdsets.com/86posters/1987_03_18.jpg,,,,,,1987-03-18,1713480426716,false
gdsets_posters,gdsets_posters_1987_02_24.jpg,,Poster - 2/24/87,[],,https://gdsets.com/86posters/1987_02_24.jpg,,,,,,1987-02-24,1713480426810,false
gdsets_posters,gdsets_posters_1987_04_17a.jpg,,Poster - 4/17-19/87,[],,https://gdsets.com/86posters/1987_04_17a.jpg,,,,,,1987-04-17,1713480426811,false
gdsets_posters,gdsets_posters_1987_04_17b.jpg,,Poster - 4/17-19/87,[],,https://gdsets.com/86posters/1987_04_17b.jpg,,,,,,1987-04-17,1713480426811,false
gdsets_posters,gdsets_posters_1987_03_18a.jpg,,Poster - 3/18/87,[],,https://gdsets.com/86posters/1987_03_18a.jpg,,,,,,1987-03-18,1713480426919,false
gdsets_posters,gdsets_posters_1987_03_22a.jpg,,Poster - Spring 1987,[],,https://gdsets.com/86posters/1987_03_22a.jpg,,,,,,1987-03-22,1713480427024,false
gdsets_posters,gdsets_posters_1987_05_09e.jpg,,"Poster - 5/9,10/87",[],,https://gdsets.com/86posters/1987_05_09e.jpg,,,,,,1987-05-09,1713480427107,false
gdsets_posters,gdsets_posters_1987_05_09b.jpg,,"Poster - 5/9,10/87",[],,https://gdsets.com/86posters/1987_05_09b.jpg,,,,,,1987-05-09,1713480427215,true
gdsets_posters,gdsets_posters_1987_05_29.jpg,,Poster - 5/29/87,[],,https://gdsets.com/86posters/1987_05_29.jpg,,,,,,1987-05-29,1713480427225,false
gdsets_posters,gdsets_posters_1987_05_09d.jpg,,"Poster - 5/9,10/87",[],,https://gdsets.com/86posters/1987_05_09d.jpg,,,,,,1987-05-09,1713480427333,true
gdsets_posters,gdsets_posters_1987_05_27.jpg,,Poster - 5/27/87,[],,https://gdsets.com/86posters/1987_05_27.jpg,,,,,,1987-05-27,1713480427338,false
gdsets_posters,gdsets_posters_1987_05_30.jpg,,Poster - 5/30/87,[],,https://gdsets.com/86posters/1987_05_30.jpg,,,,,,1987-05-30,1713480427338,false
gdsets_posters,gdsets_posters_1987_05_09c.jpg,,"Poster - 5/9,10/87",[],,https://gdsets.com/86posters/1987_05_09c.jpg,,,,,,1987-05-09,1713480427431,false
gdsets_posters,gdsets_posters_1987_06_26.jpg,,Poster - 6/26-28/87,[],,https://gdsets.com/86posters/1987_06_26.jpg,,,,,,1987-06-26,1713480427511,false
gdsets_posters,gdsets_posters_1987_06_12.jpg,,Poster - 6/12-14/87,[],,https://gdsets.com/86posters/1987_06_12.jpg,,,,,,1987-06-12,1713480427517,true
gdsets_posters,gdsets_posters_1987_05_09a.jpg,,"Poster - 5/9,10/87",[],,https://gdsets.com/86posters/1987_05_09a.jpg,,,,,,1987-05-09,1713480427539,false
gdsets_posters,gdsets_posters_1987_06_12a.jpg,,Poster - 6/12-14/87,[],,https://gdsets.com/86posters/1987_06_12a.jpg,,,,,,1987-06-12,1713480427544,false
gdsets_posters,gdsets_posters_1987_06_26a.jpg,,Poster - 6/26-28/87,[],,https://gdsets.com/86posters/1987_06_26a.jpg,,,,,,1987-06-26,1713480427590,false
gdsets_posters,gdsets_posters_1986_12_25b.jpg,,Poster - 1986 Holiday Card proof front,[],,https://gdsets.com/86posters
gdsets_posters,gdsets_posters_1987_06_19.jpg,,Poster - 6/19-21/87,[],,https://gdsets.com/86posters/1987_06_19.jpg,,,,,,1987-06-19,1713480427845,false
gdsets_posters,gdsets_posters_1987_07_06b.jpg,,Poster - In The Dark Promo,[],,https://gdsets.com/86posters/1987_07_06b.jpg,,,,,,1987-07-06,1713480427947,false
gdsets_posters,gdsets_posters_1987_07_12.jpg,,Poster - 7/12/87,[],,https://gdsets.com/86posters/1987_07_12.jpg,,,,,,1987-07-12,1713480427963,false
gdsets_posters,gdsets_posters_1987_07_19.jpg,,Poster - 7/19/87,[],,https://gdsets.com/86posters/1987_07_19.jpg,,,,,,1987-07-19,1713480428043,false
gdsets_posters,gdsets_posters_1987_05_09.jpg,,"Poster - 5/9,10/87",[],,https://gdsets.com/86posters/1987_05_09.jpg,,,,,,1987-05-09,1713480428064,false
gdsets_posters,gdsets_posters_1987_07_06c.jpg,,Poster - Dead Ringers Promo,[],,https://gdsets.com/86posters/1987_07_06c.jpg,,,,,,1987-07-06,1713480428068,false
gdsets_posters,gdsets_posters_1987_04_09.jpg,,Poster - 4/9-11/87,[],,https://gdsets.com/86posters/1987_04_09.jpg,,,,,,1987-04-09,1713480428146,false
gdsets_posters,gdsets_posters_1987_07_19a.jpg,,Poster - 7/19/87,[],,https://gdsets.com/86posters/1987_07_19a.jpg,,,,,,1987-07-19,1713480428165,false
gdsets_posters,gdsets_posters_1987_07_19b.jpg,,Poster - 7/19/87,[],,https://gdsets.com/86posters/1987_07_19b.jpg,,,,,,1987-07-19,1713480428170,false
gdsets_posters,gdsets_posters_1987_07_06.jpg,,Poster - In The Dark Promo,[],,https://gdsets.com/86posters/1987_07_06.jpg,,,,,,1987-07-06,1713480428276,false
gdsets_posters,gdsets_posters_1987_07_24a.jpg,,"Poster - 7/24,26/87",[],,https://gdsets.com/86posters/1987_07_24a.jpg,,,,,,1987-07-24,1713480428286,false
gdsets_posters,gdsets_posters_1987_07_07.jpg,,"Poster - 7/7,8/87",[],,https://gdsets.com/86posters/1987_07_07.jpg,,,,,,1987-07-07,1713480428363,false
gdsets_posters,gdsets_posters_1987_07_10.jpg,,Poster - 7/10/87,[],,https://gdsets.com/86posters/1987_07_10.jpg,,,,,,1987-07-10,1713480428382,false
gdsets_posters,gdsets_posters_1987_07_19c.jpg,,Poster - 7/19-26/87,[],,https://gdsets.com/86posters/1987_07_19c.jpg,,,,,,1987-07-19,1713480428480,false
gdsets_posters,gdsets_posters_1987_07_26.jpg,,Poster - 7/26/87,[],,https://gdsets.com/86posters/1987_07_26.jpg,,,,,,1987-07-26,1713480428554,false
gdsets_posters,gdsets_posters_1987_07_28.jpg,,Poster - 7/28/87,[],,https://gdsets.com/86posters/1987_07_28.jpg,,,,,,1987-07-28,1713480428672,false
gdsets_posters,gdsets_posters_1987_07_26b.jpg,,Poster - 7/26/87,[],,https://gdsets.com/86posters/1987_07_26b.jpg,,,,,,1987-07-26,1713480428673,false
gdsets_posters,gdsets_posters_1987_04_17.jpg,,Poster - 4/17-19/87,[],,https://gdsets.com/86posters/1987_04_17.jpg,,,,,,1987-04-17,1713480428682,false
gdsets_posters,gdsets_posters_1987_07_04a.jpg,,Poster - 7/4/87,[],,https://gdsets.com/86posters/1987_07_04a.jpg,,,,,,1987-07-04,1713480428771,false
gdsets_posters,gdsets_posters_1987_07_26a.jpg,,Poster - 7/26/87,[],,https://gdsets.com/86posters/1987_07_26a.jpg,,,,,,1987-07-26,1713480428889,true
gdsets_posters,gdsets_posters_1987_08_18.jpg,,Poster - 8/18/87,[],,https://gdsets.com/86posters/1987_08_18.jpg,,,,,,1987-08-18,1713480428898,false
gdsets_posters,gdsets_posters_1987_07_26c.jpg,,Poster - 7/26/87,[],,https://gdsets.com/86posters/1987_07_26c.jpg,,,,,,1987-07-26,1713480429004,false
gdsets_posters,gdsets_posters_1987_08_22b.jpg,,"Poster - 8/22,23/87",[],,https://gdsets.com/86posters/1987_08_22b.jpg,,,,,,1987-08-22,1713480429004,false
gdsets_posters,gdsets_posters_1987_08_22c.jpg,,"Poster - 8/22,23/87",[],,https://gdsets.com/86posters/1987_08_22c.jpg,,,,,,1987-08-22,1713480429091,false
gdsets_posters,gdsets_posters_1987_08_15.jpg,,"Poster - 8/15,16/87",[],,https://gdsets.com/86posters/1987_08_15.jpg,,,,,,1987-08-15,1713480429211,false
gdsets_posters,gdsets_posters_1987_08_22a.jpg,,"Poster - 8/22,23/87",[],,https://gdsets.com/86posters/1987_08_22a.jpg,,,,,,1987-08-22,1713480429211,false
gdsets_posters,gdsets_posters_1987_08_29aa.jpg,,Poster - 8/29/87,[],,https://gdsets.com/86posters/1987_08_29aa.jpg,,,,,,1987-08-29,1713480429293,true
gdsets_posters,gdsets_posters_1987_08_29.jpg,,Poster - 8/29/87,[],,https://gdsets.com/86posters/1987_08_29.jpg,,,,,,1987-08-29,1713480429317,false
gdsets_posters,gdsets_posters_1987_07_06a.jpg,,Poster - In The Dark Promo,[],,https://gdsets.com/86posters/1987_07_06a.jpg,,,,,,1987-07-06,1713480429320,false
gdsets_posters,gdsets_posters_1987_08_29a.jpg,,Poster - 8/29/87,[],,https://gdsets.com/86posters/1987_08_29a.jpg,,,,,,1987-08-29,1713480429322,true
gdsets_posters,gdsets_posters_1987_08_22d.jpg,,"Poster - 8/22,23/87",[],,https://gdsets.com/86posters/1987_08_22d.jpg,,,,,,1987-08-22,1713480429423,false
gdsets_posters,gdsets_posters_1987_10_02.jpg,,Poster - 10/2-4/87,[],,https://gdsets.com/86posters/1987_10_02.jpg,,,,,,1987-10-02,1713480429423,false
gdsets_posters,gdsets_posters_1987_07_24.jpg,,Poster - 7/24/87,[],,https://gdsets.com/86posters/1987_07_24.jpg,,,,,,1987-07-24,1713480429525,false
gdsets_posters,gdsets_posters_1987_09_22.jpg,,"Poster - 9/22,23/87",[],,https://gdsets.com/86posters/1987_09_22.jpg,,,,,,1987-09-22,1713480429528,false
gdsets_posters,gdsets_posters_1987_08_29c.jpg,,"Poster - 8/29,30/87",[],,https://gdsets.com/86posters/1987_08_29c.jpg,,,,,,1987-08-29,1713480429609,false
gdsets_posters,gdsets_posters_1987_10_15a.jpg,,Poster - 10/15-31/87 @ Handbill Front,[],,https://gdsets.com/86posters
gdsets_posters,gdsets_posters_1987_10_02a.jpg,,Poster - 10/2-4/87,[],,https://gdsets.com/86posters/1987_10_02a.jpg,,,,,,1987-10-02,1713480429710,false
gdsets_posters,gdsets_posters_1987_10_15b.jpg,,Poster - 10/15-31/87 @ Handbill Back,[],,https://gdsets.com/86posters
gdsets_posters,gdsets_posters_1987_08_22.jpg,,"Poster - 8/22,23/87",[],,https://gdsets.com/86posters/1987_08_22.jpg,,,,,,1987-08-22,1713480429722,false
gdsets_posters,gdsets_posters_1987_08_15a.jpg,,"Poster - 8/15,16/87",[],,https://gdsets.com/86posters/1987_08_15a.jpg,,,,,,1987-08-15,1713480429799,false
gdsets_posters,gdsets_posters_1987_08_29b.jpg,,Poster - 8/29/87,[],,https://gdsets.com/86posters/1987_08_29b.jpg,,,,,,1987-08-29,1713480429799,false
gdsets_posters,gdsets_posters_1987_11_13.jpg,,Poster - 11/13-15/87,[],,https://gdsets.com/86posters/1987_11_13.jpg,,,,,,1987-11-13,1713480429889,false
gdsets_posters,gdsets_posters_1987_11_06a.jpg,,Poster - 11/6-8/87,[],,https://gdsets.com/86posters/1987_11_06a.jpg,,,,,,1987-11-06,1713480429895,false
gdsets_posters,gdsets_posters_1987_11_28.jpg,,Poster - 11/28/87,[],,https://gdsets.com/86posters/1987_11_28.jpg,,,,,,1987-11-28,1713480429979,false
gdsets_posters,gdsets_posters_1987_11_15.jpg,,Poster - 11/15/87,[],,https://gdsets.com/86posters/1987_11_15.jpg,,,,,,1987-11-15,1713480429980,false
gdsets_posters,gdsets_posters_1987_11_06.jpg,,Poster - 11/6-8/87,[],,https://gdsets.com/86posters/1987_11_06.jpg,,,,,,1987-11-06,1713480429984,false
gdsets_posters,gdsets_posters_1987_11_29.jpg,,Poster - 11/29/87,[],,https://gdsets.com/86posters/1987_11_29.jpg,,,,,,1987-11-29,1713480430136,false
gdsets_posters,gdsets_posters_1987_11_13a.jpg,,Poster - 11/13-15/87,[],,https://gdsets.com/86posters/1987_11_13a.jpg,,,,,,1987-11-13,1713480430142,false
gdsets_posters,gdsets_posters_1987_12_02.jpg,,Poster - 12/2/87,[],,https://gdsets.com/86posters/1987_12_02.jpg,,,,,,1987-12-02,1713480430216,false
gdsets_posters,gdsets_posters_1987_10_15k.jpg,,Poster - 10/15-31/87,[],,https://gdsets.com/86posters/1987_10_15k.jpg,,,,,,1987-10-15,1713480430222,false
gdsets_posters,gdsets_posters_1987_12_03.jpg,,Poster - 12/3-5-87,[],,https://gdsets.com/86posters/1987_12_03.jpg,,,,,,1987-12-03,1713480430224,false
gdsets_posters,gdsets_posters_1987_12_06.jpg,,Poster - 12/3-6/87,[],,https://gdsets.com/86posters/1987_12_06.jpg,,,,,,1987-12-06,1713480430313,false
gdsets_posters,gdsets_posters_1987_12_27a.jpg,,"Poster - 12/27,28/87",[],,https://gdsets.com/86posters/1987_12_27a.jpg,,,,,,1987-12-27,1713480430314,false
gdsets_posters,gdsets_posters_1987_12_03a.jpg,,Poster - 12/3-5/87,[],,https://gdsets.com/86posters/1987_12_03a.jpg,,,,,,1987-12-03,1713480430321,false
gdsets_posters,gdsets_posters_1987_12_31a.jpg,,Poster - 12/31/87,[],,https://gdsets.com/86posters/1987_12_31a.jpg,,,,,,1987-12-31,1713480430398,true
gdsets_posters,gdsets_posters_1988_01_23a.jpg,,Poster - 1/23/88,[],,https://gdsets.com/86posters/1988_01_23a.jpg,,,,,,1988-01-23,1713480430594,false
gdsets_posters,gdsets_posters_1988_01_31.jpg,,Poster - 1/31/88,[],,https://gdsets.com/86posters/1988_01_31.jpg,,,,,,1988-01-31,1713480430595,false
gdsets_posters,gdsets_posters_1988_01_01.jpg,,Poster - 1988 Calendar Poster,[],,https://gdsets.com/86posters/1988_01_01.jpg,,,,,,1988-01-01,1713480430597,false
gdsets_posters,gdsets_posters_1988_01_23.jpg,,Poster - 1/23/88,[],,https://gdsets.com/86posters/1988_01_23.jpg,,,,,,1988-01-23,1713480430599,false
gdsets_posters,gdsets_posters_1988_02_06.jpg,,Poster - 2/6/88,[],,https://gdsets.com/86posters/1988_02_06.jpg,,,,,,1988-02-06,1713480430682,false
gdsets_posters,gdsets_posters_1988_02_07.jpg,,Poster - 2/7/88,[],,https://gdsets.com/86posters/1988_02_07.jpg,,,,,,1988-02-07,1713480430792,false
gdsets_posters,gdsets_posters_1988_02_05.jpg,,Poster - 2/5/88,[],,https://gdsets.com/86posters/1988_02_05.jpg,,,,,,1988-02-05,1713480430794,false
gdsets_posters,gdsets_posters_1987_12_31.jpg,,Poster - 12/31/87,[],,https://gdsets.com/86posters/1987_12_31.jpg,,,,,,1987-12-31,1713480430864,false
gdsets_posters,gdsets_posters_1987_11_13b.jpg,,Poster - 11/13-15/87,[],,https://gdsets.com/86posters/1987_11_13b.jpg,,,,,,1987-11-13,1713480430885,false
gdsets_posters,gdsets_posters_1988_03_05.jpg,,Poster - 3/5/88,[],,https://gdsets.com/86posters/1988_03_05.jpg,,,,,,1988-03-05,1713480430888,false
gdsets_posters,gdsets_posters_1988_03_16a.jpg,,Poster - 3/16-18/88,[],,https://gdsets.com/86posters/1988_03_16a.jpg,,,,,,1988-03-16,1713480430989,false
gdsets_posters,gdsets_posters_1988_02_06a.jpg,,Poster - 2/6/88,[],,https://gdsets.com/86posters/1988_02_06a.jpg,,,,,,1988-02-06,1713480430989,false
gdsets_posters,gdsets_posters_1988_03_16b.jpg,,Poster - 3/16-18/88,[],,https://gdsets.com/86posters/1988_03_16b.jpg,,,,,,1988-03-16,1713480430993,false
gdsets_posters,gdsets_posters_1988_03_16.jpg,,Poster - 3/16-18/88,[],,https://gdsets.com/86posters/1988_03_16.jpg,,,,,,1988-03-16,1713480430993,false
gdsets_posters,gdsets_posters_1988_02_21.jpg,,Poster - King Biscuit Promo,[],,https://gdsets.com/86posters/1988_02_21.jpg,,,,,,1988-02-21,1713480431080,false
gdsets_posters,gdsets_posters_1988_02_13.jpg,,Poster - 2/13-17/88,[],,https://gdsets.com/86posters/1988_02_13.jpg,,,,,,1988-02-13,1713480431167,false
gdsets_posters,gdsets_posters_1987_10_15.jpg,,Poster - 10/15-31/87 @ Poster,[],,https://gdsets.com/86posters/1987_10_15.jpg,,,,,,1987-10-15,1713480431187,true
gdsets_posters,gdsets_posters_1988_03_04.jpg,,"Poster - 3/4,5/88",[],,https://gdsets.com/86posters/1988_03_04.jpg,,,,,,1988-03-04,1713480431364,false
gdsets_posters,gdsets_posters_1987_12_27.jpg,,Poster - 12/27-31/87,[],,https://gdsets.com/86posters/1987_12_27.jpg,,,,,,1987-12-27,1713480431367,false
gdsets_posters,gdsets_posters_1988_03_24c.jpg,,Poster - Spring 1988(Peter Maxhand colored),[],,https://gdsets.com/86posters
gdsets_posters,gdsets_posters_1988_04_07a.jpg,,Poster - 4/7-9/88 @ proof,[],,https://gdsets.com/86posters/1988_04_07a.jpg,,,,,,1988-04-07,1713480431459,false
gdsets_posters,gdsets_posters_1988_03_24f.jpg,,Poster - Spring 1988,[],,https://gdsets.com/86posters/1988_03_24f.jpg,,,,,,1988-03-24,1713480431552,false
gdsets_posters,gdsets_posters_1988_04_11.jpg,,Poster - 4/11/88,[],,https://gdsets.com/86posters/1988_04_11.jpg,,,,,,1988-04-11,1713480431564,true
gdsets_posters,gdsets_posters_1988_04_26.jpg,,Poster - 4/26/88,[],,https://gdsets.com/86posters/1988_04_26.jpg,,,,,,1988-04-26,1713480431658,false
gdsets_posters,gdsets_posters_1988_04_07b.jpg,,Poster - 4/7-9/88 @ proof,[],,https://gdsets.com/86posters/1988_04_07b.jpg,,,,,,1988-04-07,1713480431668,false
gdsets_posters,gdsets_posters_1988_04_16.jpg,,Poster - 4/16/88,[],,https://gdsets.com/86posters/1988_04_16.jpg,,,,,,1988-04-16,1713480431762,false
gdsets_posters,gdsets_posters_1988_03_24.jpg,,Poster - Spring 1988,[],,https://gdsets.com/86posters/1988_03_24.jpg,,,,,,1988-03-24,1713480431871,false
gdsets_posters,gdsets_posters_1988_04_07c.jpg,,Poster - 4/7-9/88 @ proof,[],,https://gdsets.com/86posters/1988_04_07c.jpg,,,,,,1988-04-07,1713480431872,false
gdsets_posters,gdsets_posters_1988_05_06.jpg,,Poster - 5/6/88,[],,https://gdsets.com/86posters/1988_05_06.jpg,,,,,,1988-05-06,1713480431978,false
gdsets_posters,gdsets_posters_1988_03_24b.jpg,,Poster - Spring 1988(Peter Maxhand colored),[],,https://gdsets.com/86posters
gdsets_posters,gdsets_posters_1988_03_26.jpg,,Poster - 3/26-28/88,[],,https://gdsets.com/86posters/1988_03_26.jpg,,,,,,1988-03-26,1713480431980,false
gdsets_posters,gdsets_posters_1988_04_22.jpg,,Poster - 4/22-24/88,[],,https://gdsets.com/86posters/1988_04_22.jpg,,,,,,1988-04-22,1713480431980,false
gdsets_posters,gdsets_posters_1988_04_11a.jpg,,Poster - 4/11/88,[],,https://gdsets.com/86posters/1988_04_11a.jpg,,,,,,1988-04-11,1713480432038,false
gdsets_posters,gdsets_posters_1988_05_06b.jpg,,Poster - 5/6/88,[],,https://gdsets.com/86posters/1988_05_06b.jpg,,,,,,1988-05-06,1713480432084,false
gdsets_posters,gdsets_posters_1988_06_19a.jpg,,Poster - 6/19-23/88,[],,https://gdsets.com/86posters/1988_06_19a.jpg,,,,,,1988-06-19,1713480432179,false
gdsets_posters,gdsets_posters_1988_06_17.jpg,,Poster - 6/17/88,[],,https://gdsets.com/86posters/1988_06_17.jpg,,,,,,1988-06-17,1713480432275,true
gdsets_posters,gdsets_posters_1988_05_07a.jpg,,Poster - 5/7/88,[],,https://gdsets.com/86posters/1988_05_07a.jpg,,,,,,1988-05-07,1713480432277,true
gdsets_posters,gdsets_posters_1988_06_19b.jpg,,Poster - 6/19-23/88,[],,https://gdsets.com/86posters/1988_06_19b.jpg,,,,,,1988-06-19,1713480432484,false
gdsets_posters,gdsets_posters_1988_05_07.jpg,,Poster - 5/7/88,[],,https://gdsets.com/86posters/1988_05_07.jpg,,,,,,1988-05-07,1713480432496,false
gdsets_posters,gdsets_posters_1988_06_25.jpg,,Poster - 6/25/88,[],,https://gdsets.com/86posters/1988_06_25.jpg,,,,,,1988-06-25,1713480432584,false
gdsets_posters,gdsets_posters_1988_07_02.jpg,,"Poster - 7/2,3/88",[],,https://gdsets.com/86posters/1988_07_02.jpg,,,,,,1988-07-02,1713480432695,false
gdsets_posters,gdsets_posters_1988_05_06a.jpg,,Poster - 5/6/88,[],,https://gdsets.com/86posters/1988_05_06a.jpg,,,,,,1988-05-06,1713480432725,false
gdsets_posters,gdsets_posters_1988_06_26.jpg,,Poster - 6/26/88,[],,https://gdsets.com/86posters/1988_06_26.jpg,,,,,,1988-06-26,1713480432796,false
gdsets_posters,gdsets_posters_1988_06_17a.jpg,,Poster - 6/17/88,[],,https://gdsets.com/86posters/1988_06_17a.jpg,,,,,,1988-06-17,1713480432813,false
gdsets_posters,gdsets_posters_1988_07_09b.jpg,,Poster - 7/9/88,[],,https://gdsets.com/86posters/1988_07_09b.jpg,,,,,,1988-07-09,1713480432814,false
gdsets_posters,gdsets_posters_1988_06_19.jpg,,Poster - 6/19-23/88,[],,https://gdsets.com/86posters/1988_06_19.jpg,,,,,,1988-06-19,1713480432925,false
gdsets_posters,gdsets_posters_1988_04_07.jpg,,Poster - 4/7-9/88,[],,https://gdsets.com/86posters/1988_04_07.jpg,,,,,,1988-04-07,1713480432927,false
gdsets_posters,gdsets_posters_1988_07_07.jpg,,Poster - 7/7/88,[],,https://gdsets.com/86posters/1988_07_07.jpg,,,,,,1988-07-07,1713480433014,false
gdsets_posters,gdsets_posters_1988_06_19k.jpg,,Poster - 6/19-23/88,[],,https://gdsets.com/86posters/1988_06_19k.jpg,,,,,,1988-06-19,1713480433031,false
gdsets_posters,gdsets_posters_1988_07_16.jpg,,Poster - 7/16/88,[],,https://gdsets.com/86posters/1988_07_16.jpg,,,,,,1988-07-16,1713480433031,false
gdsets_posters,gdsets_posters_1988_03_24a.jpg,,Poster - Spring 1988,[],,https://gdsets.com/86posters/1988_03_24a.jpg,,,,,,1988-03-24,1713480433121,true
gdsets_posters,gdsets_posters_1988_08_05.jpg,,Poster - 8/5/88,[],,https://gdsets.com/86posters/1988_08_05.jpg,,,,,,1988-08-05,1713480433218,false
gdsets_posters,gdsets_posters_1988_07_29c.jpg,,Poster - 7/29-31/88,[],,https://gdsets.com/86posters/1988_07_29c.jpg,,,,,,1988-07-29,1713480433224,false
gdsets_posters,gdsets_posters_1988_07_29b.jpg,,Poster - 7/29-31/88,[],,https://gdsets.com/86posters/1988_07_29b.jpg,,,,,,1988-07-29,1713480433228,true
gdsets_posters,gdsets_posters_1988_07_29k.jpg,,Poster - 7/29-31/88,[],,https://gdsets.com/86posters/1988_07_29k.jpg,,,,,,1988-07-29,1713480433277,false
gdsets_posters,gdsets_posters_1988_07_10.jpg,,Poster - 7/10/88,[],,https://gdsets.com/86posters/1988_07_10.jpg,,,,,,1988-07-10,1713480433310,false
gdsets_posters,gdsets_posters_1988_08_26.jpg,,"Poster - 8/26,28/88",[],,https://gdsets.com/86posters/1988_08_26.jpg,,,,,,1988-08-26,1713480433311,false
gdsets_posters,gdsets_posters_1988_08_28k.jpg,,Poster - 8/28/88,[],,https://gdsets.com/86posters/1988_08_28k.jpg,,,,,,1988-08-28,1713480433497,false
gdsets_posters,gdsets_posters_1988_07_09.jpg,,Poster - 7/9/88,[],,https://gdsets.com/86posters/1988_07_09.jpg,,,,,,1988-07-09,1713480433498,false
gdsets_posters,gdsets_posters_1988_07_29.jpg,,Poster - 7/29-31/88,[],,https://gdsets.com/86posters/1988_07_29.jpg,,,,,,1988-07-29,1713480433514,false
gdsets_posters,gdsets_posters_1988_08_28.jpg,,Poster - 8/28/88,[],,https://gdsets.com/86posters/1988_08_28.jpg,,,,,,1988-08-28,1713480433596,false
gdsets_posters,gdsets_posters_1988_08_28a.jpg,,Poster - 8/28/88,[],,https://gdsets.com/86posters/1988_08_28a.jpg,,,,,,1988-08-28,1713480433598,true
gdsets_posters,gdsets_posters_1988_07_09a.jpg,,Poster - 7/9/88 @ Proof,[],,https://gdsets.com/86posters/1988_07_09a.jpg,,,,,,1988-07-09,1713480433599,true
gdsets_posters,gdsets_posters_1988_09_01.jpg,,Poster - Fall 1988,[],,https://gdsets.com/86posters/1988_09_01.jpg,,,,,,1988-09-01,1713480433602,false
gdsets_posters,gdsets_posters_1988_09_24a.jpg,,Poster - 9/24/88,[],,https://gdsets.com/86posters/1988_09_24a.jpg,,,,,,1988-09-24,1713480433688,false
gdsets_posters,gdsets_posters_1988_08_26a.jpg,,"Poster - 8/26,28/88",[],,https://gdsets.com/86posters/1988_08_26a.jpg,,,,,,1988-08-26,1713480433688,false
gdsets_posters,gdsets_posters_1988_09_14a.jpg,,Poster - 9/14-23/88 @ Original Art,[],,https://gdsets.com/86posters/1988_09_14a.jpg,,,,,,1988-09-14,1713480433688,false
gdsets_posters,gdsets_posters_1988_09_14.jpg,,Poster - 9/14-23/88,[],,https://gdsets.com/86posters/1988_09_14.jpg,,,,,,1988-09-14,1713480433696,false
gdsets_posters,gdsets_posters_1988_09_14m.jpg,,Poster - 9/14-24/88,[],,https://gdsets.com/86posters/1988_09_14m.jpg,,,,,,1988-09-14,1713480433773,false
gdsets_posters,gdsets_posters_1988_10_20.jpg,,Poster - 10/20/88,[],,https://gdsets.com/86posters/1988_10_20.jpg,,,,,,1988-10-20,1713480433975,false
gdsets_posters,gdsets_posters_1988_09_30a.jpg,,Poster - 9/30-10/2/88,[],,https://gdsets.com/86posters/1988_09_30a.jpg,,,,,,1988-09-30,1713480433978,true
gdsets_posters,gdsets_posters_1988_11_25.jpg,,Poster - 11/25-27/87,[],,https://gdsets.com/86posters/1988_11_25.jpg,,,,,,1988-11-25,1713480433979,false
gdsets_posters,gdsets_posters_1988_09_24b.jpg,,Poster - 9/24/88 @ Program,[],,https://gdsets.com/86posters/1988_09_24b.jpg,,,,,,1988-09-24,1713480434074,false
gdsets_posters,gdsets_posters_1988_10_31.jpg,,Poster - 10/31/88,[],,https://gdsets.com/86posters/1988_10_31.jpg,,,,,,1988-10-31,1713480434150,false
gdsets_posters,gdsets_posters_1988_12_02.jpg,,"Poster - 12/2,3/88",[],,https://gdsets.com/86posters/1988_12_02.jpg,,,,,,1988-12-02,1713480434175,false
gdsets_posters,gdsets_posters_1988_12_31b.jpg,,Poster - 12/31/88,[],,https://gdsets.com/86posters/1988_12_31b.jpg,,,,,,1988-12-31,1713480434260,false
gdsets_posters,gdsets_posters_1988_12_31c.jpg,,Poster - 12/31/88,[],,https://gdsets.com/86posters/1988_12_31c.jpg,,,,,,1988-12-31,1713480434261,false
gdsets_posters,gdsets_posters_1988_12_31a.jpg,,Poster - 12/31/88,[],,https://gdsets.com/86posters/1988_12_31a.jpg,,,,,,1988-12-31,1713480434274,false
gdsets_posters,gdsets_posters_1988_12_31d.jpg,,Poster - 12/31/88,[],,https://gdsets.com/86posters/1988_12_31d.jpg,,,,,,1988-12-31,1713480434385,false
gdsets_posters,gdsets_posters_1989_01_01.jpg,,Poster - 1989 Calendar,[],,https://gdsets.com/86posters/1989_01_01.jpg,,,,,,1989-01-01,1713480434586,false
gdsets_posters,gdsets_posters_1988_12_09.jpg,,Poster - 12/9-11/88,[],,https://gdsets.com/86posters/1988_12_09.jpg,,,,,,1988-12-09,1713480434602,false
gdsets_posters,gdsets_posters_1988_12_09a.jpg,,Poster - 12/9-11/88,[],,https://gdsets.com/86posters/1988_12_09a.jpg,,,,,,1988-12-09,1713480434604,false
gdsets_posters,gdsets_posters_1989_01_01a.jpg,,Poster - Lot Poster1989?,[],,https://gdsets.com/86posters/1989_01_01a.jpg,,,,,,1989-01-01,1713480434690,false
gdsets_posters,gdsets_posters_1989_02_05.jpg,,Poster - 2/5-7/89,[],,https://gdsets.com/86posters/1989_02_05.jpg,,,,,,1989-02-05,1713480434691,false
gdsets_posters,gdsets_posters_1989_02_00.jpg,,Poster - Dylan & The Dead Promo,[],,https://gdsets.com/86posters/1989_02_00.jpg,,,,,,1989-02-00,1713480434708,false
gdsets_posters,gdsets_posters_1989_03_27.jpg,,"Poster - 3/27,28/89",[],,https://gdsets.com/86posters/1989_03_27.jpg,,,,,,1989-03-27,1713480434924,false
gdsets_posters,gdsets_posters_1989_03_03.jpg,,"Poster - 3/3,4/89",[],,https://gdsets.com/86posters/1989_03_03.jpg,,,,,,1989-03-03,1713480435013,false
gdsets_posters,gdsets_posters_1989_03_30.jpg,,"Poster - 3/30,31/89",[],,https://gdsets.com/86posters/1989_03_30.jpg,,,,,,1989-03-30,1713480435017,false
gdsets_posters,gdsets_posters_1988_09_08.jpg,,Poster - 9/8-12/88,[],,https://gdsets.com/86posters/1988_09_08.jpg,,,,,,1988-09-08,1713480435031,false
gdsets_posters,gdsets_posters_1988_12_31.jpg,,Poster - 12/31/88,[],,https://gdsets.com/86posters/1988_12_31.jpg,,,,,,1988-12-31,1713480435034,false
gdsets_posters,gdsets_posters_1989_01_27.jpg,,"Poster - 1/27,28/89",[],,https://gdsets.com/86posters/1989_01_27.jpg,,,,,,1989-01-27,1713480435103,false
gdsets_posters,gdsets_posters_1988_09_30.jpg,,Poster - 9/30-10/2/88,[],,https://gdsets.com/86posters/1988_09_30.jpg,,,,,,1988-09-30,1713480435103,false
gdsets_posters,gdsets_posters_1989_04_02.jpg,,"Poster - 4/2,3/89",[],,https://gdsets.com/86posters/1989_04_02.jpg,,,,,,1989-04-02,1713480435133,false
gdsets_posters,gdsets_posters_1989_03_22.jpg,,Poster - 3/22/89,[],,https://gdsets.com/86posters/1989_03_22.jpg,,,,,,1989-03-22,1713480435223,false
gdsets_posters,gdsets_posters_1989_04_17.jpg,,Poster - 4/17/89,[],,https://gdsets.com/86posters/1989_04_17.jpg,,,,,,1989-04-17,1713480435406,false
gdsets_posters,gdsets_posters_1988_09_24.jpg,,Poster - 9/24/88,[],,https://gdsets.com/86posters/1988_09_24.jpg,,,,,,1988-09-24,1713480435407,false
gdsets_posters,gdsets_posters_1989_05_22.jpg,,Poster - 5/22/89,[],,https://gdsets.com/86posters/1989_05_22.jpg,,,,,,1989-05-22,1713480435420,false
gdsets_posters,gdsets_posters_1989_04_05.jpg,,"Poster - 4/5,6/89",[],,https://gdsets.com/86posters/1989_04_05.jpg,,,,,,1989-04-05,1713480435426,false
gdsets_posters,gdsets_posters_1989_05_22a.jpg,,Poster - 5/22/89,[],,https://gdsets.com/86posters/1989_05_22a.jpg,,,,,,1989-05-22,1713480435516,false
gdsets_posters,gdsets_posters_1989_05_19.jpg,,Poster - 5/19/89,[],,https://gdsets.com/86posters/1989_05_19.jpg,,,,,,1989-05-19,1713480435524,false
gdsets_posters,gdsets_posters_1989_05_27a.jpg,,Poster - 5/27/89,[],,https://gdsets.com/86posters/1989_05_27a.jpg,,,,,,1989-05-27,1713480435708,false
gdsets_posters,gdsets_posters_1989_05_27c.jpg,,Poster - 5/27/89,[],,https://gdsets.com/86posters/1989_05_27c.jpg,,,,,,1989-05-27,1713480435709,false
gdsets_posters,gdsets_posters_1989_02_10.jpg,,Poster - 2/10-12/89,[],,https://gdsets.com/86posters/1989_02_10.jpg,,,,,,1989-02-10,1713480435711,false
gdsets_posters,gdsets_posters_1989_04_09.jpg,,Poster - 4/9/89,[],,https://gdsets.com/86posters/1989_04_09.jpg,,,,,,1989-04-09,1713480435809,false
gdsets_posters,gdsets_posters_1989_04_28.jpg,,Poster - 4/28-30/89,[],,https://gdsets.com/86posters/1989_04_28.jpg,,,,,,1989-04-28,1713480435810,false
gdsets_posters,gdsets_posters_1989_05_27k.jpg,,Poster - 5/27/89,[],,https://gdsets.com/86posters/1989_05_27k.jpg,,,,,,1989-05-27,1713480435914,false
gdsets_posters,gdsets_posters_1989_03_22a.jpg,,Poster - 3/22/89,[],,https://gdsets.com/86posters/1989_03_22a.jpg,,,,,,1989-03-22,1713480435915,false
gdsets_posters,gdsets_posters_1989_06_26.jpg,,Poster - 6/26/89,[],,https://gdsets.com/86posters/1989_06_26.jpg,,,,,,1989-06-26,1713480435919,false
gdsets_posters,gdsets_posters_1989_05_27.jpg,,Poster - 5/27/896/10/896/18-21/89,[],,https://gdsets.com/86posters/1989_05_27.jpg,,,,,,1989-05-27,1713480435919,false
gdsets_posters,gdsets_posters_1989_06_10.jpg,,Poster - 6/10/89,[],,https://gdsets.com/86posters/1989_06_10.jpg,,,,,,1989-06-10,1713480436133,false
gdsets_posters,gdsets_posters_1989_07_04.jpg,,Poster - 7/4/89,[],,https://gdsets.com/86posters/1989_07_04.jpg,,,,,,1989-07-04,1713480436209,true
gdsets_posters,gdsets_posters_1989_06_10a.jpg,,Poster - 6/10/89,[],,https://gdsets.com/86posters/1989_06_10a.jpg,,,,,,1989-06-10,1713480436211,false
gdsets_posters,gdsets_posters_1989_06_21.jpg,,Poster - 6/21/89,[],,https://gdsets.com/86posters/1989_06_21.jpg,,,,,,1989-06-21,1713480436314,false
gdsets_posters,gdsets_posters_1989_03_22b.jpg,,Poster - 3/22/89,[],,https://gdsets.com/86posters/1989_03_22b.jpg,,,,,,1989-03-22,1713480436328,true
gdsets_posters,gdsets_posters_1989_07_07a.jpg,,Poster - 7/7/89,[],,https://gdsets.com/86posters/1989_07_07a.jpg,,,,,,1989-07-07,1713480436442,true
gdsets_posters,gdsets_posters_1989_07_12.jpg,,"Poster - 7/12,13/89",[],,https://gdsets.com/86posters/1989_07_12.jpg,,,,,,1989-07-12,1713480436530,false
gdsets_posters,gdsets_posters_1989_07_01.jpg,,Poster - Summer 1989,[],,https://gdsets.com/86posters/1989_07_01.jpg,,,,,,1989-07-01,1713480436533,false
gdsets_posters,gdsets_posters_1989_07_04a.jpg,,Poster - 7/4/89,[],,https://gdsets.com/86posters/1989_07_04a.jpg,,,,,,1989-07-04,1713480436537,false
gdsets_posters,gdsets_posters_1989_08_02.jpg,,Poster - 8/2/89,[],,https://gdsets.com/86posters/1989_08_02.jpg,,,,,,1989-08-02,1713480436640,false
gdsets_posters,gdsets_posters_1989_07_15.jpg,,Poster - 7/15/89,[],,https://gdsets.com/86posters/1989_07_15.jpg,,,,,,1989-07-15,1713480436735,false
gdsets_posters,gdsets_posters_1989_07_09.jpg,,"Poster - 7/9,10/89",[],,https://gdsets.com/86posters/1989_07_09.jpg,,,,,,1989-07-09,1713480436762,false
gdsets_posters,gdsets_posters_1989_06_26a.jpg,,Poster - 6/26/89,[],,https://gdsets.com/86posters/1989_06_26a.jpg,,,,,,1989-06-26,1713480436762,false
gdsets_posters,gdsets_posters_1989_07_17.jpg,,Poster - 7/17-19/89,[],,https://gdsets.com/86posters/1989_07_17.jpg,,,,,,1989-07-17,1713480436762,false
gdsets_posters,gdsets_posters_1989_07_17b.jpg,,Poster - 7/17-19/89,[],,https://gdsets.com/86posters/1989_07_17b.jpg,,,,,,1989-07-17,1713480436762,false
gdsets_posters,gdsets_posters_1989_07_17a.jpg,,Poster - 7/17-19/89,[],,https://gdsets.com/86posters/1989_07_17a.jpg,,,,,,1989-07-17,1713480436768,false
gdsets_posters,gdsets_posters_1989_07_07.jpg,,Poster - 7/7/89,[],,https://gdsets.com/86posters/1989_07_07.jpg,,,,,,1989-07-07,1713480436860,false
gdsets_posters,gdsets_posters_1989_08_17.jpg,,Poster - 8/17-19/89,[],,https://gdsets.com/86posters/1989_08_17.jpg,,,,,,1989-08-17,1713480436939,false
gdsets_posters,gdsets_posters_1989_06_21a.jpg,,Poster - 6/21/89,[],,https://gdsets.com/86posters/1989_06_21a.jpg,,,,,,1989-06-21,1713480436954,false
gdsets_posters,gdsets_posters_1989_09_01a.jpg,,Poster - 9/1-16/89,[],,https://gdsets.com/86posters/1989_09_01a.jpg,,,,,,1989-09-01,1713480437040,true
gdsets_posters,gdsets_posters_1989_09_06a.jpg,,"Poster - 9/6,7/89",[],,https://gdsets.com/86posters/1989_09_06a.jpg,,,,,,1989-09-06,1713480437132,false
gdsets_posters,gdsets_posters_1989_09_29.jpg,,Poster - 9/29-10/1/89,[],,https://gdsets.com/86posters/1989_09_29.jpg,,,,,,1989-09-29,1713480437245,false
gdsets_posters,gdsets_posters_1989_10_08a.jpg,,"Poster - 10/8,9/89",[],,https://gdsets.com/86posters/1989_10_08a.jpg,,,,,,1989-10-08,1713480437352,false
gdsets_posters,gdsets_posters_1989_12_31.jpg,,Poster - 12/31/89,[],,https://gdsets.com/86posters/1989_12_31.jpg,,,,,,1989-12-31,1713480437464,false
gdsets_posters,gdsets_posters_1989_09_29a.jpg,,Poster - 9/29-10/1/89,[],,https://gdsets.com/86posters/1989_09_29a.jpg,,,,,,1989-09-29,1713480437471,false
gdsets_posters,gdsets_posters_1989_09_11b.jpg,,Poster - 9/11/89,[],,https://gdsets.com/86posters/1989_09_11b.jpg,,,,,,1989-09-11,1713480437576,true
gdsets_posters,gdsets_posters_1989_07_02.jpg,,Poster - 7/2/89,[],,https://gdsets.com/86posters/1989_07_02.jpg,,,,,,1989-07-02,1713480437582,false
gdsets_posters,gdsets_posters_1989_10_31.jpg,,Poster - Built To Last Promo,[],,https://gdsets.com/86posters/1989_10_31.jpg,,,,,,1989-10-31,1713480437586,false
gdsets_posters,gdsets_posters_1976_01_16.jpg,,Poster - 1/16-19/76,[],,https://gdsets.com/76posters/1976_01_16.jpg,,,,,,1976-01-16,1713480437590,false
gdsets_posters,gdsets_posters_1976_01_26.jpg,,Poster - 1/26-28/76,[],,https://gdsets.com/76posters/1976_01_26.jpg,,,,,,1976-01-26,1713480437673,false
gdsets_posters,gdsets_posters_1976_01_01.jpg,,Poster - 1976 Songbook,[],,https://gdsets.com/76posters/1976_01_01.jpg,,,,,,1976-01-01,1713480437678,false
gdsets_posters,gdsets_posters_1989_07_17c.jpg,,Poster - 7/17-19/89,[],,https://gdsets.com/86posters/1989_07_17c.jpg,,,,,,1989-07-17,1713480437687,false
gdsets_posters,gdsets_posters_1976_01_21.jpg,,"Poster - 1/21,22/76",[],,https://gdsets.com/76posters/1976_01_21.jpg,,,,,,1976-01-21,1713480437794,false
gdsets_posters,gdsets_posters_1976_01_30.jpg,,"Poster - 1/30,31/76",[],,https://gdsets.com/76posters/1976_01_30.jpg,,,,,,1976-01-30,1713480437868,false
gdsets_posters,gdsets_posters_1976_02_14.jpg,,"Poster - 2/14,24,25/76",[],,https://gdsets.com/76posters/1976_02_14.jpg,,,,,,1976-02-14,1713480437873,false
gdsets_posters,gdsets_posters_1989_09_01.jpg,,Poster - 9/1-16/89,[],,https://gdsets.com/86posters/1989_09_01.jpg,,,,,,1989-09-01,1713480437876,false
gdsets_posters,gdsets_posters_1989_09_11a.jpg,,Poster - 9/11/89,[],,https://gdsets.com/86posters/1989_09_11a.jpg,,,,,,1989-09-11,1713480437878,true
gdsets_posters,gdsets_posters_1976_02_18.jpg,,Poster - 2/18-21/76,[],,https://gdsets.com/76posters/1976_02_18.jpg,,,,,,1976-02-18,1713480438048,false
gdsets_posters,gdsets_posters_1989_09_09.jpg,,"Poster - 9/9,10/89",[],,https://gdsets.com/86posters/1989_09_09.jpg,,,,,,1989-09-09,1713480438051,false
gdsets_posters,gdsets_posters_1989_12_08.jpg,,Poster - 12/8-10/89,[],,https://gdsets.com/86posters/1989_12_08.jpg,,,,,,1989-12-08,1713480438145,false
gdsets_posters,gdsets_posters_1989_10_31a.jpg,,Poster - Built To Last Promo,[],,https://gdsets.com/86posters/1989_10_31a.jpg,,,,,,1989-10-31,1713480438147,false
gdsets_posters,gdsets_posters_1976_02_26.jpg,,Poster - 2/26/76,[],,https://gdsets.com/76posters/1976_02_26.jpg,,,,,,1976-02-26,1713480438149,false
gdsets_posters,gdsets_posters_1976_02_21.jpg,,"Poster - 2/21,22/76",[],,https://gdsets.com/76posters/1976_02_21.jpg,,,,,,1976-02-21,1713480438235,true
gdsets_posters,gdsets_posters_1976_03_03.jpg,,Poster - 3/3/76,[],,https://gdsets.com/76posters/1976_03_03.jpg,,,,,,1976-03-03,1713480438240,false
gdsets_posters,gdsets_posters_1976_03_07.jpg,,"Poster - 3/7,8/76",[],,https://gdsets.com/76posters/1976_03_07.jpg,,,,,,1976-03-07,1713480438249,false
gdsets_posters,gdsets_posters_1976_03_10.jpg,,Poster - 3/10-13/76,[],,https://gdsets.com/76posters/1976_03_10.jpg,,,,,,1976-03-10,1713480438249,false
gdsets_posters,gdsets_posters_1976_03_13.jpg,,Poster - 3/13/76,[],,https://gdsets.com/76posters/1976_03_13.jpg,,,,,,1976-03-13,1713480438251,false
gdsets_posters,gdsets_posters_1976_03_14.jpg,,Poster - 3/14/76,[],,https://gdsets.com/76posters/1976_03_14.jpg,,,,,,1976-03-14,1713480438254,false
gdsets_posters,gdsets_posters_1976_03_14a.jpg,,Poster - Kingfish Album Promo Ad,[],,https://gdsets.com/76posters/1976_03_14a.jpg,,,,,,1976-03-14,1713480438402,false
gdsets_posters,gdsets_posters_1976_03_15.jpg,,"Poster - 3/15,16/76",[],,https://gdsets.com/76posters/1976_03_15.jpg,,,,,,1976-03-15,1713480438402,false
gdsets_posters,gdsets_posters_1989_09_11.jpg,,Poster - 9/11/89,[],,https://gdsets.com/86posters/1989_09_11.jpg,,,,,,1989-09-11,1713480438409,false
gdsets_posters,gdsets_posters_1976_03_30.jpg,,Poster - 3/30/76,[],,https://gdsets.com/76posters/1976_03_30.jpg,,,,,,1976-03-30,1713480438503,false
gdsets_posters,gdsets_posters_1976_03_27.jpg,,Poster - 3/27/76,[],,https://gdsets.com/76posters/1976_03_27.jpg,,,,,,1976-03-27,1713480438504,false
gdsets_posters,gdsets_posters_1976_03_18.jpg,,"Poster - 3/18,19/76(possible fake)",[],,https://gdsets.com/76posters/1976_03_18.jpg,,,,,,1976-03-18,1713480438505,false
gdsets_posters,gdsets_posters_1976_03_13a.jpg,,Poster - 3/13/76,[],,https://gdsets.com/76posters/1976_03_13a.jpg,,,,,,1976-03-13,1713480438587,false
gdsets_posters,gdsets_posters_1976_04_01.jpg,,Poster - 4/1/76,[],,https://gdsets.com/76posters/1976_04_01.jpg,,,,,,1976-04-01,1713480438675,false
gdsets_posters,gdsets_posters_1976_02_21a.jpg,,"Poster - 2/21,22/76",[],,https://gdsets.com/76posters/1976_02_21a.jpg,,,,,,1976-02-21,1713480438719,false
gdsets_posters,gdsets_posters_1976_04_01a.jpg,,Poster - 4/1/76,[],,https://gdsets.com/76posters/1976_04_01a.jpg,,,,,,1976-04-01,1713480438749,false
gdsets_posters,gdsets_posters_1976_05_20.jpg,,Poster - 5/20/76,[],,https://gdsets.com/76posters/1976_05_20.jpg,,,,,,1976-05-20,1713480438864,false
gdsets_posters,gdsets_posters_1976_04_04.jpg,,Poster - 4/4/76,[],,https://gdsets.com/76posters/1976_04_04.jpg,,,,,,1976-04-04,1713480438867,false
gdsets_posters,gdsets_posters_1976_05_17.jpg,,Poster - 5/17/76,[],,https://gdsets.com/76posters/1976_05_17.jpg,,,,,,1976-05-17,1713480438867,false
gdsets_posters,gdsets_posters_1976_05_21b.jpg,,Poster - 5/21/76,[],,https://gdsets.com/76posters/1976_05_21b.jpg,,,,,,1976-05-21,1713480438867,false
gdsets_posters,gdsets_posters_1976_04_04a.jpg,,Poster - 4/4/76,[],,https://gdsets.com/76posters/1976_04_04a.jpg,,,,,,1976-04-04,1713480438871,false
gdsets_posters,gdsets_posters_1976_05_16.jpg,,Poster - 5/16/76,[],,https://gdsets.com/76posters/1976_05_16.jpg,,,,,,1976-05-16,1713480438888,false
gdsets_posters,gdsets_posters_1976_04_06.jpg,,Poster - 4/6/76,[],,https://gdsets.com/76posters/1976_04_06.jpg,,,,,,1976-04-06,1713480438950,false
gdsets_posters,gdsets_posters_1976_05_21.jpg,,Poster - 5/21/76,[],,https://gdsets.com/76posters/1976_05_21.jpg,,,,,,1976-05-21,1713480439036,false
gdsets_posters,gdsets_posters_1976_06_07.jpg,,Poster - 6/7/76,[],,https://gdsets.com/76posters/1976_06_07.jpg,,,,,,1976-06-07,1713480439116,false
gdsets_posters,gdsets_posters_1976_05_26a.jpg,,Poster - 5/26/76,[],,https://gdsets.com/76posters/1976_05_26a.jpg,,,,,,1976-05-26,1713480439117,false
gdsets_posters,gdsets_posters_1976_05_26.jpg,,Poster - 5/26/76,[],,https://gdsets.com/76posters/1976_05_26.jpg,,,,,,1976-05-26,1713480439118,false
gdsets_posters,gdsets_posters_1976_03_20.jpg,,"Poster - 3/20,21/76",[],,https://gdsets.com/76posters/1976_03_20.jpg,,,,,,1976-03-20,1713480439157,false
gdsets_posters,gdsets_posters_1976_06_12.jpg,,Poster - 6/12/76,[],,https://gdsets.com/76posters/1976_06_12.jpg,,,,,,1976-06-12,1713480439198,true
gdsets_posters,gdsets_posters_1976_06_17.jpg,,Poster - 6/17-19/76,[],,https://gdsets.com/76posters/1976_06_17.jpg,,,,,,1976-06-17,1713480439408,false
gdsets_posters,gdsets_posters_1976_06_12a.jpg,,Poster - 6/12/76,[],,https://gdsets.com/76posters/1976_06_12a.jpg,,,,,,1976-06-12,1713480439476,false
gdsets_posters,gdsets_posters_1976_05_23.jpg,,Poster - 5/23/76,[],,https://gdsets.com/76posters/1976_05_23.jpg,,,,,,1976-05-23,1713480439479,false
gdsets_posters,gdsets_posters_1976_07_02a.jpg,,Poster - 7/2/76(rescheduledto 8/4),[],,https://gdsets.com/76posters/1976_07_02a.jpg,,,,,,1976-07-02,1713480439497,false
gdsets_posters,gdsets_posters_1976_07_08.jpg,,Poster - 7/8/76,[],,https://gdsets.com/76posters/1976_07_08.jpg,,,,,,1976-07-08,1713480439499,false
gdsets_posters,gdsets_posters_1976_06_19.jpg,,Poster - 6/19/76,[],,https://gdsets.com/76posters/1976_06_19.jpg,,,,,,1976-06-19,1713480439515,false
gdsets_posters,gdsets_posters_1976_07_20.jpg,,"Poster - 7/20,21/76",[],,https://gdsets.com/76posters/1976_07_20.jpg,,,,,,1976-07-20,1713480439583,false
gdsets_posters,gdsets_posters_1976_07_02.jpg,,Poster - 7/2/76(rescheduledto 8/4),[],,https://gdsets.com/76posters/1976_07_02.jpg,,,,,,1976-07-02,1713480439586,false
gdsets_posters,gdsets_posters_1976_05_22.jpg,,Poster - 5/22/76,[],,https://gdsets.com/76posters/1976_05_22.jpg,,,,,,1976-05-22,1713480439586,false
gdsets_posters,gdsets_posters_1976_08_16.jpg,,"Poster - 8/16,21/76",[],,https://gdsets.com/76posters/1976_08_16.jpg,,,,,,1976-08-16,1713480439760,false
gdsets_posters,gdsets_posters_1976_06_26.jpg,,Poster - Steal Your Face Promo,[],,https://gdsets.com/76posters/1976_06_26.jpg,,,,,,1976-06-26,1713480439763,false
gdsets_posters,gdsets_posters_1976_07_28.jpg,,Poster - 7/28/76,[],,https://gdsets.com/76posters/1976_07_28.jpg,,,,,,1976-07-28,1713480439765,false
gdsets_posters,gdsets_posters_1976_08_07.jpg,,Poster - 8/7/76(cancelled),[],,https://gdsets.com/76posters/1976_08_07.jpg,,,,,,1976-08-07,1713480439767,false
gdsets_posters,gdsets_posters_1976_08_15.jpg,,"Poster - 8/15/76(hoax, neverplanned)",[],,https://gdsets.com/76posters
gdsets_posters,gdsets_posters_1976_08_19a (OP1 black).jpg,,Poster - 8/19/76 (OP1)(Black Stars),[],,https://gdsets.com/76posters/1976_08_19a (OP1
gdsets_posters,gdsets_posters_1976_08_11.jpg,,"Poster - 8/11,12/76",[],,https://gdsets.com/76posters/1976_08_11.jpg,,,,,,1976-08-11,1713480439856,false
gdsets_posters,gdsets_posters_1976_07_12a.jpg,,Poster - 7/12-18/76,[],,https://gdsets.com/76posters/1976_07_12a.jpg,,,,,,1976-07-12,1713480439875,true
gdsets_posters,gdsets_posters_1976_05_21a.jpg,,Poster - 5/21/76,[],,https://gdsets.com/76posters/1976_05_21a.jpg,,,,,,1976-05-21,1713480439952,false
gdsets_posters,gdsets_posters_1976_05_28.jpg,,Poster - 5/28/76,[],,https://gdsets.com/76posters/1976_05_28.jpg,,,,,,1976-05-28,1713480440045,false
gdsets_posters,gdsets_posters_1976_09_10.jpg,,"Poster - 9/10,11/76",[],,https://gdsets.com/76posters/1976_09_10.jpg,,,,,,1976-09-10,1713480440101,false
gdsets_posters,gdsets_posters_1976_08_22.jpg,,Poster - 8/22/76,[],,https://gdsets.com/76posters/1976_08_22.jpg,,,,,,1976-08-22,1713480440101,false
gdsets_posters,gdsets_posters_1976_09_12.jpg,,Poster - 9/12/76,[],,https://gdsets.com/76posters/1976_09_12.jpg,,,,,,1976-09-12,1713480440112,false
gdsets_posters,gdsets_posters_1976_09_15.jpg,,Poster - 9/15/76 (OHB)AOR 4.218(Bo Diddley Signed),[],,https://gdsets.com/76posters
gdsets_posters,gdsets_posters_1976_09_15b (AOR 4.128 OHB).jpg,,Poster - 9/15/76 (OHB)AOR 4.218,[],,https://gdsets.com/76posters/1976_09_15b (AOR 4.128
gdsets_posters,gdsets_posters_1976_09_17.jpg,,Poster - 9/17/76,[],,https://gdsets.com/76posters/1976_09_17.jpg,,,,,,1976-09-17,1713480440298,false
gdsets_posters,gdsets_posters_1976_09_16.jpg,,Poster - 9/16/76,[],,https://gdsets.com/76posters/1976_09_16.jpg,,,,,,1976-09-16,1713480440298,true
gdsets_posters,gdsets_posters_1976_09_16a.jpg,,Poster - 9/16/76,[],,https://gdsets.com/76posters/1976_09_16a.jpg,,,,,,1976-09-16,1713480440389,false
gdsets_posters,gdsets_posters_1976_09_18.jpg,,Poster - 9/18/76,[],,https://gdsets.com/76posters/1976_09_18.jpg,,,,,,1976-09-18,1713480440393,true
gdsets_posters,gdsets_posters_1976_09_15c.jpg,,Poster - 9/15/76,[],,https://gdsets.com/76posters/1976_09_15c.jpg,,,,,,1976-09-15,1713480440393,true
gdsets_posters,gdsets_posters_1976_09_18a.jpg,,Poster - 9/18/76,[],,https://gdsets.com/76posters/1976_09_18a.jpg,,,,,,1976-09-18,1713480440393,false
gdsets_posters,gdsets_posters_1976_09_19.jpg,,Poster - 9/19/76,[],,https://gdsets.com/76posters/1976_09_19.jpg,,,,,,1976-09-19,1713480440468,false
gdsets_posters,gdsets_posters_1976_09_20.jpg,,Poster - 9/20/76,[],,https://gdsets.com/76posters/1976_09_20.jpg,,,,,,1976-09-20,1713480440469,false
gdsets_posters,gdsets_posters_1976_09_23.jpg,,Poster - 9/23/76,[],,https://gdsets.com/76posters/1976_09_23.jpg,,,,,,1976-09-23,1713480440473,false
gdsets_posters,gdsets_posters_1976_09_20a.jpg,,Poster - 9/20/76,[],,https://gdsets.com/76posters/1976_09_20a.jpg,,,,,,1976-09-20,1713480440474,false
gdsets_posters,gdsets_posters_1976_07_12.jpg,,Poster - 7/12-18/76,[],,https://gdsets.com/76posters/1976_07_12.jpg,,,,,,1976-07-12,1713480440521,false
gdsets_posters,gdsets_posters_1976_09_24.jpg,,Poster - 9/24/76,[],,https://gdsets.com/76posters/1976_09_24.jpg,,,,,,1976-09-24,1713480440552,false
gdsets_posters,gdsets_posters_1976_09_25.jpg,,Poster - 9/25/76,[],,https://gdsets.com/76posters/1976_09_25.jpg,,,,,,1976-09-25,1713480440653,false
gdsets_posters,gdsets_posters_1976_09_30.jpg,,Poster - 9/30/76,[],,https://gdsets.com/76posters/1976_09_30.jpg,,,,,,1976-09-30,1713480440710,false
gdsets_posters,gdsets_posters_1976_09_26.jpg,,Poster - 9/26/76 @ Silver(Brent),[],,https://gdsets.com/76posters/1976_09_26.jpg,,,,,,1976-09-26,1713480440710,false
gdsets_posters,gdsets_posters_1976_09_26a.jpg,,Poster - 9/26/76,[],,https://gdsets.com/76posters/1976_09_26a.jpg,,,,,,1976-09-26,1713480440771,false
gdsets_posters,gdsets_posters_1976_09_15d.jpg,,Poster - 9/15/76,[],,https://gdsets.com/76posters/1976_09_15d.jpg,,,,,,1976-09-15,1713480440879,false
gdsets_posters,gdsets_posters_1976_10_01.jpg,,Poster - 10/1/76,[],,https://gdsets.com/76posters/1976_10_01.jpg,,,,,,1976-10-01,1713480440893,true
gdsets_posters,gdsets_posters_1976_10_09c.jpg,,"Poster - 10/9,10/76",[],,https://gdsets.com/76posters/1976_10_09c.jpg,,,,,,1976-10-09,1713480440994,false
gdsets_posters,gdsets_posters_1976_10_03.jpg,,Poster - 10/3/76,[],,https://gdsets.com/76posters/1976_10_03.jpg,,,,,,1976-10-03,1713480441016,true
gdsets_posters,gdsets_posters_1976_10_03a.jpg,,Poster - 10/3/76,[],,https://gdsets.com/76posters/1976_10_03a.jpg,,,,,,1976-10-03,1713480441089,false
gdsets_posters,gdsets_posters_1976_10_09aa.jpg,,"Poster - 10/9,10/76",[],,https://gdsets.com/76posters/1976_10_09aa.jpg,,,,,,1976-10-09,1713480441099,true
gdsets_posters,gdsets_posters_1976_10_09a.jpg,,"Poster - 10/9,10/76",[],,https://gdsets.com/76posters/1976_10_09a.jpg,,,,,,1976-10-09,1713480441169,true
gdsets_posters,gdsets_posters_1976_10_09d.jpg,,"Poster - 10/9,10/76",[],,https://gdsets.com/76posters/1976_10_09d.jpg,,,,,,1976-10-09,1713480441170,false
gdsets_posters,gdsets_posters_1976_10_09m.jpg,,"Poster - 10/9,10/76",[],,https://gdsets.com/76posters/1976_10_09m.jpg,,,,,,1976-10-09,1713480441250,false
gdsets_posters,gdsets_posters_1976_10_14a.jpg,,"Poster - 10/14,15/76",[],,https://gdsets.com/76posters/1976_10_14a.jpg,,,,,,1976-10-14,1713480441265,false
gdsets_posters,gdsets_posters_1976_10_14.jpg,,"Poster - 10/14,15/76",[],,https://gdsets.com/76posters/1976_10_14.jpg,,,,,,1976-10-14,1713480441289,true
gdsets_posters,gdsets_posters_1976_10_01a.jpg,,Poster - 10/1/76,[],,https://gdsets.com/76posters/1976_10_01a.jpg,,,,,,1976-10-01,1713480441290,false
gdsets_posters,gdsets_posters_1976_10_22.jpg,,Poster - 10/22/76,[],,https://gdsets.com/76posters/1976_10_22.jpg,,,,,,1976-10-22,1713480441374,false
gdsets_posters,gdsets_posters_1976_10_10.jpg,,"Poster - 10/10,29-31/76",[],,https://gdsets.com/76posters/1976_10_10.jpg,,,,,,1976-10-10,1713480441375,false
gdsets_posters,gdsets_posters_1976_11_08.jpg,,Poster - 11/8/76,[],,https://gdsets.com/76posters/1976_11_08.jpg,,,,,,1976-11-08,1713480441377,false
gdsets_posters,gdsets_posters_1976_10_22a.jpg,,"Poster - 10/22,23/76",[],,https://gdsets.com/76posters/1976_10_22a.jpg,,,,,,1976-10-22,1713480441458,true
gdsets_posters,gdsets_posters_1976_11_12.jpg,,Poster - 11/12/76,[],,https://gdsets.com/76posters/1976_11_12.jpg,,,,,,1976-11-12,1713480441470,false
gdsets_posters,gdsets_posters_1976_10_09.jpg,,"Poster - 10/9,10/76 (OP1)AOR 4.43",[],,https://gdsets.com/76posters/1976_10_09.jpg,,,,,,1976-10-09,1713480441547,false
gdsets_posters,gdsets_posters_1976_11_07.jpg,,"Poster - 11/7,22/76",[],,https://gdsets.com/76posters/1976_11_07.jpg,,,,,,1976-11-07,1713480441579,false
gdsets_posters,gdsets_posters_1976_11_12b.jpg,,Poster - 11/12/76,[],,https://gdsets.com/76posters/1976_11_12b.jpg,,,,,,1976-11-12,1713480441647,false
gdsets_posters,gdsets_posters_1976_11_13a.jpg,,Poster - 11/13/76,[],,https://gdsets.com/76posters/1976_11_13a.jpg,,,,,,1976-11-13,1713480441731,false
gdsets_posters,gdsets_posters_1976_11_22.jpg,,Poster - 11/22-24/76,[],,https://gdsets.com/76posters/1976_11_22.jpg,,,,,,1976-11-22,1713480441764,false
gdsets_posters,gdsets_posters_1976_11_13.jpg,,Poster - 11/13/76,[],,https://gdsets.com/76posters/1976_11_13.jpg,,,,,,1976-11-13,1713480441822,false
gdsets_posters,gdsets_posters_1976_10_09b.jpg,,"Poster - 10/9,10/76 @ AOR pg. 324",[],,https://gdsets.com/76posters
gdsets_posters,gdsets_posters_1976_12_21.jpg,,Poster - 12/21-23/76,[],,https://gdsets.com/76posters/1976_12_21.jpg,,,,,,1976-12-21,1713480441931,false
gdsets_posters,gdsets_posters_1976_12_31.jpg,,Poster - 12/31/76,[],,https://gdsets.com/76posters/1976_12_31.jpg,,,,,,1976-12-31,1713480441933,false
gdsets_posters,gdsets_posters_1976_11_12a.jpg,,Poster - 11/12/76,[],,https://gdsets.com/76posters/1976_11_12a.jpg,,,,,,1976-11-12,1713480442026,false
gdsets_posters,gdsets_posters_1976_11_28.jpg,,Poster - 11/28/76 @ King Biscuit Promo Ad,[],,https://gdsets.com/76posters
gdsets_posters,gdsets_posters_1976_11_19a.jpg,,"Poster - 11/19,20/76",[],,https://gdsets.com/76posters/1976_11_19a.jpg,,,,,,1976-11-19,1713480442029,true
gdsets_posters,gdsets_posters_1977_01_23.jpg,,Poster - 1/23/77,[],,https://gdsets.com/76posters/1977_01_23.jpg,,,,,,1977-01-23,1713480442123,false
gdsets_posters,gdsets_posters_1977_01_23a.jpg,,"Poster - 1/23,28-30/77",[],,https://gdsets.com/76posters/1977_01_23a.jpg,,,,,,1977-01-23,1713480442124,false
gdsets_posters,gdsets_posters_1977_02_05a.jpg,,Poster - 2/5/77,[],,https://gdsets.com/76posters/1977_02_05a.jpg,,,,,,1977-02-05,1713480442128,false
gdsets_posters,gdsets_posters_1977_02_05.jpg,,Poster - 2/5/77,[],,https://gdsets.com/76posters/1977_02_05.jpg,,,,,,1977-02-05,1713480442331,false
gdsets_posters,gdsets_posters_1977_02_06.jpg,,Poster - 2/6/77,[],,https://gdsets.com/76posters/1977_02_06.jpg,,,,,,1977-02-06,1713480442342,false
gdsets_posters,gdsets_posters_1977_01_28.jpg,,Poster - 1/28-30/77,[],,https://gdsets.com/76posters/1977_01_28.jpg,,,,,,1977-01-28,1713480442342,false
gdsets_posters,gdsets_posters_1976_11_19.jpg,,"Poster - 11/19,20/76",[],,https://gdsets.com/76posters/1976_11_19.jpg,,,,,,1976-11-19,1713480442344,false
gdsets_posters,gdsets_posters_1977_02_26b.jpg,,Poster - 2/26/77,[],,https://gdsets.com/76posters/1977_02_26b.jpg,,,,,,1977-02-26,1713480442426,false
gdsets_posters,gdsets_posters_1977_02_26.jpg,,"Poster - 2/26,27/77",[],,https://gdsets.com/76posters/1977_02_26.jpg,,,,,,1977-02-26,1713480442430,false
gdsets_posters,gdsets_posters_1977_02_06a.jpg,,Poster - 2/6/77,[],,https://gdsets.com/76posters/1977_02_06a.jpg,,,,,,1977-02-06,1713480442432,false
gdsets_posters,gdsets_posters_1976_12_19.jpg,,Poster - 12/19-23/76,[],,https://gdsets.com/76posters/1976_12_19.jpg,,,,,,1976-12-19,1713480442445,false
gdsets_posters,gdsets_posters_1977_03_12.jpg,,Poster - 3/12/77 @ Silver,[],,https://gdsets.com/76posters/1977_03_12.jpg,,,,,,1977-03-12,1713480442516,false
gdsets_posters,gdsets_posters_1977_03_20.jpg,,Poster - 3/20/77,[],,https://gdsets.com/76posters/1977_03_20.jpg,,,,,,1977-03-20,1713480442556,false
gdsets_posters,gdsets_posters_1977_04_08a.jpg,,Poster - 4/8-10/77,[],,https://gdsets.com/76posters/1977_04_08a.jpg,,,,,,1977-04-08,1713480442607,true
gdsets_posters,gdsets_posters_1977_02_26a.jpg,,Poster - 2/26/77,[],,https://gdsets.com/76posters/1977_02_26a.jpg,,,,,,1977-02-26,1713480442614,false
gdsets_posters,gdsets_posters_1977_04_22a.jpg,,Poster - 4/22/77,[],,https://gdsets.com/76posters/1977_04_22a.jpg,,,,,,1977-04-22,1713480442641,false
gdsets_posters,gdsets_posters_1977_04_08.jpg,,"Poster - 4/8,9/77",[],,https://gdsets.com/76posters/1977_04_08.jpg,,,,,,1977-04-08,1713480442707,false
gdsets_posters,gdsets_posters_1977_04_16.jpg,,Poster - 4/16/77(rescheduled to5/22/77),[],,https://gdsets.com/76posters
gdsets_posters,gdsets_posters_1977_05_05.jpg,,Poster - 5/5/77,[],,https://gdsets.com/76posters/1977_05_05.jpg,,,,,,1977-05-05,1713480442806,false
gdsets_posters,gdsets_posters_1977_04_22b.jpg,,Poster - 4/22-5/5/77,[],,https://gdsets.com/76posters/1977_04_22b.jpg,,,,,,1977-04-22,1713480442903,false
gdsets_posters,gdsets_posters_1977_04_10.jpg,,Poster - 4/10/77,[],,https://gdsets.com/76posters/1977_04_10.jpg,,,,,,1977-04-10,1713480442905,false
gdsets_posters,gdsets_posters_1976_08_19b.jpg,,Poster - 8/19/76 (RP2)(Red Stars),[],,https://gdsets.com/76posters/1976_08_19b.jpg,,,,,,1976-08-19,1713480442909,false
gdsets_posters,gdsets_posters_1977_05_15.jpg,,Poster - 5/15/77,[],,https://gdsets.com/76posters/1977_05_15.jpg,,,,,,1977-05-15,1713480442996,false
gdsets_posters,gdsets_posters_1977_05_09.jpg,,Poster - 5/9/77,[],,https://gdsets.com/76posters/1977_05_09.jpg,,,,,,1977-05-09,1713480443098,false
gdsets_posters,gdsets_posters_1977_05_15a.jpg,,Poster - 5/15/77,[],,https://gdsets.com/76posters/1977_05_15a.jpg,,,,,,1977-05-15,1713480443202,false
gdsets_posters,gdsets_posters_1977_05_11.jpg,,Poster - 5/11/77,[],,https://gdsets.com/76posters/1977_05_11.jpg,,,,,,1977-05-11,1713480443204,false
gdsets_posters,gdsets_posters_1977_05_15b.jpg,,Poster - 5/15/77,[],,https://gdsets.com/76posters/1977_05_15b.jpg,,,,,,1977-05-15,1713480443204,false
gdsets_posters,gdsets_posters_1977_05_13.jpg,,Poster - 5/13/77,[],,https://gdsets.com/76posters/1977_05_13.jpg,,,,,,1977-05-13,1713480443207,false
gdsets_posters,gdsets_posters_1977_05_08x.jpg,,Poster - 5/8/77,[],,https://gdsets.com/76posters/1977_05_08x.jpg,,,,,,1977-05-08,1713480443303,true
gdsets_posters,gdsets_posters_1977_05_18.jpg,,"Poster - 5/18,19/77",[],,https://gdsets.com/76posters/1977_05_18.jpg,,,,,,1977-05-18,1713480443303,false
gdsets_posters,gdsets_posters_1977_05_26a.jpg,,Poster - 5/26/77,[],,https://gdsets.com/76posters/1977_05_26a.jpg,,,,,,1977-05-26,1713480443390,false
gdsets_posters,gdsets_posters_1977_05_11a.jpg,,Poster - 5/11/77,[],,https://gdsets.com/76posters/1977_05_11a.jpg,,,,,,1977-05-11,1713480443407,false
gdsets_posters,gdsets_posters_1977_05_22.jpg,,Poster - 5/22/77,[],,https://gdsets.com/76posters/1977_05_22.jpg,,,,,,1977-05-22,1713480443407,true
gdsets_posters,gdsets_posters_1977_05_07.jpg,,Poster - 5/7/77,[],,https://gdsets.com/76posters/1977_05_07.jpg,,,,,,1977-05-07,1713480443588,false
gdsets_posters,gdsets_posters_1977_06_04.jpg,,Poster - 6/4/77,[],,https://gdsets.com/76posters/1977_06_04.jpg,,,,,,1977-06-04,1713480443689,false
gdsets_posters,gdsets_posters_1977_05_08a.jpg,,Poster - 5/8/77,[],,https://gdsets.com/76posters/1977_05_08a.jpg,,,,,,1977-05-08,1713480443692,false
gdsets_posters,gdsets_posters_1977_05_26.jpg,,Poster - 5/26/77,[],,https://gdsets.com/76posters/1977_05_26.jpg,,,,,,1977-05-26,1713480443702,false
gdsets_posters,gdsets_posters_1977_06_09.jpg,,Poster - 6/9/77,[],,https://gdsets.com/76posters/1977_06_09.jpg,,,,,,1977-06-09,1713480443791,false
gdsets_posters,gdsets_posters_1977_06_02b.jpg,,Poster - GD Movie,[],,https://gdsets.com/76posters/1977_06_02b.jpg,,,,,,1977-06-02,1713480443808,false
gdsets_posters,gdsets_posters_1977_06_12.jpg,,"Poster - 6/12,13,15/77",[],,https://gdsets.com/76posters/1977_06_12.jpg,,,,,,1977-06-12,1713480443886,false
gdsets_posters,gdsets_posters_1977_05_17.jpg,,Poster - 5/17/77,[],,https://gdsets.com/76posters/1977_05_17.jpg,,,,,,1977-05-17,1713480443908,false
gdsets_posters,gdsets_posters_1977_06_02c.jpg,,Poster - GD Movie,[],,https://gdsets.com/76posters/1977_06_02c.jpg,,,,,,1977-06-02,1713480443913,false
gdsets_posters,gdsets_posters_1977_07_01c.jpg,,Poster - 7/1-3/77,[],,https://gdsets.com/76posters/1977_07_01c.jpg,,,,,,1977-07-01,1713480444000,false
gdsets_posters,gdsets_posters_1977_06_23.jpg,,Poster - 6/23/77,[],,https://gdsets.com/76posters/1977_06_23.jpg,,,,,,1977-06-23,1713480444007,false
gdsets_posters,gdsets_posters_1977_06_04a.jpg,,Poster - 6/4/77,[],,https://gdsets.com/76posters/1977_06_04a.jpg,,,,,,1977-06-04,1713480444092,false
gdsets_posters,gdsets_posters_1977_06_02.jpg,,Poster - GD Movie,[],,https://gdsets.com/76posters/1977_06_02.jpg,,,,,,1977-06-02,1713480444093,false
gdsets_posters,gdsets_posters_1977_06_02d.jpg,,Poster - GD Movie,[],,https://gdsets.com/76posters/1977_06_02d.jpg,,,,,,1977-06-02,1713480444095,false
gdsets_posters,gdsets_posters_1977_07_09.jpg,,Poster - 7/9/77,[],,https://gdsets.com/76posters/1977_07_09.jpg,,,,,,1977-07-09,1713480444189,false
gdsets_posters,gdsets_posters_1977_07_10a.jpg,,Poster - 7/10/77,[],,https://gdsets.com/76posters/1977_07_10a.jpg,,,,,,1977-07-10,1713480444258,false
gdsets_posters,gdsets_posters_1977_07_10.jpg,,Poster - 7/10/77,[],,https://gdsets.com/76posters/1977_07_10.jpg,,,,,,1977-07-10,1713480444279,false
gdsets_posters,gdsets_posters_1977_06_02a.jpg,,Poster - GD Movie,[],,https://gdsets.com/76posters/1977_06_02a.jpg,,,,,,1977-06-02,1713480444280,false
gdsets_posters,gdsets_posters_1977_07_10b.jpg,,Poster - 7/10/77,[],,https://gdsets.com/76posters/1977_07_10b.jpg,,,,,,1977-07-10,1713480444280,false
gdsets_posters,gdsets_posters_1977_07_01.jpg,,"Poster - 7/1,17/77",[],,https://gdsets.com/76posters/1977_07_01.jpg,,,,,,1977-07-01,1713480444369,false
gdsets_posters,gdsets_posters_1977_07_17.jpg,,"Poster - 7/17,23,24/77",[],,https://gdsets.com/76posters/1977_07_17.jpg,,,,,,1977-07-17,1713480444377,false
gdsets_posters,gdsets_posters_1977_07_27b.jpg,,Poster - Terrapin Station Promo,[],,https://gdsets.com/76posters/1977_07_27b.jpg,,,,,,1977-07-27,1713480444471,false
gdsets_posters,gdsets_posters_1977_07_27.jpg,,Poster - Terrapin Station Trade Paper Ad,[],,https://gdsets.com/76posters
gdsets_posters,gdsets_posters_1977_08_06a.jpg,,"Poster - 8/6,7/77",[],,https://gdsets.com/76posters/1977_08_06a.jpg,,,,,,1977-08-06,1713480444559,false
gdsets_posters,gdsets_posters_1977_07_29m.jpg,,"Poster - 7/29,30/77",[],,https://gdsets.com/76posters/1977_07_29m.jpg,,,,,,1977-07-29,1713480444564,true
gdsets_posters,gdsets_posters_1977_09_03.jpg,,Poster - 9/3/77,[],,https://gdsets.com/76posters/1977_09_03.jpg,,,,,,1977-09-03,1713480444650,true
gdsets_posters,gdsets_posters_1977_08_18.jpg,,Poster - WALSTIBPromo Proof,[],,https://gdsets.com/76posters/1977_08_18.jpg,,,,,,1977-08-18,1713480444736,false
gdsets_posters,gdsets_posters_1977_09_03a.jpg,,Poster - 9/3/77,[],,https://gdsets.com/76posters/1977_09_03a.jpg,,,,,,1977-09-03,1713480444741,true
gdsets_posters,gdsets_posters_1977_07_27a.jpg,,Poster - Terrapin Station Promo Hanger,[],,https://gdsets.com/76posters
gdsets_posters,gdsets_posters_1977_08_12.jpg,,Poster - 8/12/77,[],,https://gdsets.com/76posters/1977_08_12.jpg,,,,,,1977-08-12,1713480444743,false
gdsets_posters,gdsets_posters_1977_09_03b.jpg,,Poster - 9/3/77,[],,https://gdsets.com/76posters/1977_09_03b.jpg,,,,,,1977-09-03,1713480444835,false
gdsets_posters,gdsets_posters_1977_07_01b.jpg,,"Poster - 7/1,17/77",[],,https://gdsets.com/76posters/1977_07_01b.jpg,,,,,,1977-07-01,1713480444846,true
gdsets_posters,gdsets_posters_1977_10_14.jpg,,Poster - 10/14/77,[],,https://gdsets.com/76posters/1977_10_14.jpg,,,,,,1977-10-14,1713480444849,false
gdsets_posters,gdsets_posters_1977_10_20.jpg,,Poster - 10/20-22/77,[],,https://gdsets.com/76posters/1977_10_20.jpg,,,,,,1977-10-20,1713480445033,false
gdsets_posters,gdsets_posters_1977_09_03c.jpg,,Poster - 9/3/77,[],,https://gdsets.com/76posters/1977_09_03c.jpg,,,,,,1977-09-03,1713480445039,false
gdsets_posters,gdsets_posters_1977_08_06.jpg,,"Poster - 8/6,7/77",[],,https://gdsets.com/76posters/1977_08_06.jpg,,,,,,1977-08-06,1713480445075,false
gdsets_posters,gdsets_posters_1977_10_30a.jpg,,Poster - 10/30/77,[],,https://gdsets.com/76posters/1977_10_30a.jpg,,,,,,1977-10-30,1713480445133,false
gdsets_posters,gdsets_posters_1977_10_12a.jpg,,Poster - 10/12/77,[],,https://gdsets.com/76posters/1977_10_12a.jpg,,,,,,1977-10-12,1713480445135,true
gdsets_posters,gdsets_posters_1977_10_30.jpg,,Poster - 10/30/77,[],,https://gdsets.com/76posters/1977_10_30.jpg,,,,,,1977-10-30,1713480445135,false
gdsets_posters,gdsets_posters_1977_10_30b.jpg,,Poster - 10/30/77,[],,https://gdsets.com/76posters/1977_10_30b.jpg,,,,,,1977-10-30,1713480445214,false
gdsets_posters,gdsets_posters_1977_10_30c.jpg,,Poster - 10/30/77,[],,https://gdsets.com/76posters/1977_10_30c.jpg,,,,,,1977-10-30,1713480445240,false
gdsets_posters,gdsets_posters_1977_10_11.jpg,,Poster - 10/11/77,[],,https://gdsets.com/76posters/1977_10_11.jpg,,,,,,1977-10-11,1713480445313,false
gdsets_posters,gdsets_posters_1977_10_29.jpg,,Poster - 10/29/77,[],,https://gdsets.com/76posters/1977_10_29.jpg,,,,,,1977-10-29,1713480445336,false
gdsets_posters,gdsets_posters_1977_10_30d.jpg,,Poster - 10/30/77,[],,https://gdsets.com/76posters/1977_10_30d.jpg,,,,,,1977-10-30,1713480445336,false
gdsets_posters,gdsets_posters_1977_11_01.jpg,,Poster - 11/1/77,[],,https://gdsets.com/76posters/1977_11_01.jpg,,,,,,1977-11-01,1713480445343,false
gdsets_posters,gdsets_posters_1977_11_02a.jpg,,Poster - 11/2/77,[],,https://gdsets.com/76posters/1977_11_02a.jpg,,,,,,1977-11-02,1713480445343,false
gdsets_posters,gdsets_posters_1977_11_02.jpg,,Poster - 11/2/77,[],,https://gdsets.com/76posters/1977_11_02.jpg,,,,,,1977-11-02,1713480445415,false
gdsets_posters,gdsets_posters_1977_11_05.jpg,,Poster - 11/5/77,[],,https://gdsets.com/76posters/1977_11_05.jpg,,,,,,1977-11-05,1713480445426,false
gdsets_posters,gdsets_posters_1977_11_20.jpg,,Poster - 11/20/77,[],,https://gdsets.com/76posters/1977_11_20.jpg,,,,,,1977-11-20,1713480445515,false
gdsets_posters,gdsets_posters_1977_11_06.jpg,,Poster - 11/6/77,[],,https://gdsets.com/76posters/1977_11_06.jpg,,,,,,1977-11-06,1713480445604,false
gdsets_posters,gdsets_posters_1977_07_29.jpg,,"Poster - 7/29,30/77",[],,https://gdsets.com/76posters/1977_07_29.jpg,,,,,,1977-07-29,1713480445607,false
gdsets_posters,gdsets_posters_1977_11_27.jpg,,Poster - 11/27/77,[],,https://gdsets.com/76posters/1977_11_27.jpg,,,,,,1977-11-27,1713480445689,false
gdsets_posters,gdsets_posters_1977_11_26.jpg,,Poster - 11/26/77,[],,https://gdsets.com/76posters/1977_11_26.jpg,,,,,,1977-11-26,1713480445689,false
gdsets_posters,gdsets_posters_1977_10_12.jpg,,Poster - 10/12/77,[],,https://gdsets.com/76posters/1977_10_12.jpg,,,,,,1977-10-12,1713480445689,false
gdsets_posters,gdsets_posters_1977_11_20a.jpg,,Poster - 11/20/77,[],,https://gdsets.com/76posters/1977_11_20a.jpg,,,,,,1977-11-20,1713480445691,false
gdsets_posters,gdsets_posters_1977_12_09.jpg,,Poster - 12/9/77,[],,https://gdsets.com/76posters/1977_12_09.jpg,,,,,,1977-12-09,1713480445875,false
gdsets_posters,gdsets_posters_1977_11_29a.jpg,,Poster - 11/29/77,[],,https://gdsets.com/76posters/1977_11_29a.jpg,,,,,,1977-11-29,1713480445955,true
gdsets_posters,gdsets_posters_1977_11_29b.jpg,,Poster - 11/29/77 @ Program,[],,https://gdsets.com/76posters/1977_11_29b.jpg,,,,,,1977-11-29,1713480445964,false
gdsets_posters,gdsets_posters_1977_12_04.jpg,,Poster - 12/4/77,[],,https://gdsets.com/76posters/1977_12_04.jpg,,,,,,1977-12-04,1713480445966,false
gdsets_posters,gdsets_posters_1977_12_02.jpg,,Poster - 12/2/77,[],,https://gdsets.com/76posters/1977_12_02.jpg,,,,,,1977-12-02,1713480445973,false
gdsets_posters,gdsets_posters_1977_11_29.jpg,,Poster - 11/29/77,[],,https://gdsets.com/76posters/1977_11_29.jpg,,,,,,1977-11-29,1713480446000,false
gdsets_posters,gdsets_posters_1977_11_30.jpg,,Poster - 11/30/77,[],,https://gdsets.com/76posters/1977_11_30.jpg,,,,,,1977-11-30,1713480446062,false
gdsets_posters,gdsets_posters_1977_12_19.jpg,,"Poster - 12/19,20/77",[],,https://gdsets.com/76posters/1977_12_19.jpg,,,,,,1977-12-19,1713480446161,true
gdsets_posters,gdsets_posters_1977_12_06b.jpg,,Poster - 12/6/77,[],,https://gdsets.com/76posters/1977_12_06b.jpg,,,,,,1977-12-06,1713480446176,true
gdsets_posters,gdsets_posters_1977_12_03.jpg,,Poster - 12/3/77,[],,https://gdsets.com/76posters/1977_12_03.jpg,,,,,,1977-12-03,1713480446359,false
gdsets_posters,gdsets_posters_1977_12_22.jpg,,"Poster - 12/22,23/77",[],,https://gdsets.com/76posters/1977_12_22.jpg,,,,,,1977-12-22,1713480446369,false
gdsets_posters,gdsets_posters_1977_12_06a.jpg,,Poster - 12/6/77,[],,https://gdsets.com/76posters/1977_12_06a.jpg,,,,,,1977-12-06,1713480446462,false
gdsets_posters,gdsets_posters_1977_12_06.jpg,,Poster - 12/6/77,[],,https://gdsets.com/76posters/1977_12_06.jpg,,,,,,1977-12-06,1713480446560,true
gdsets_posters,gdsets_posters_1977_12_11.jpg,,Poster - 12/11/77,[],,https://gdsets.com/76posters/1977_12_11.jpg,,,,,,1977-12-11,1713480446564,false
gdsets_posters,gdsets_posters_1978_01_06.jpg,,Poster - 1/6-10/78,[],,https://gdsets.com/76posters/1978_01_06.jpg,,,,,,1978-01-06,1713480446667,false
gdsets_posters,gdsets_posters_1978_01_15b (OA).jpg,,Poster - 1/15/78(Orig. Art),[],,https://gdsets.com/76posters/1978_01_15b 
gdsets_posters,gdsets_posters_1978_02_18.jpg,,Poster - 2/18/78,[],,https://gdsets.com/76posters/1978_02_18.jpg,,,,,,1978-02-18,1713480446759,false
gdsets_posters,gdsets_posters_1978_01_13a.jpg,,Poster - 1/13/78 (OHB)AOR 4.112,[],,https://gdsets.com/76posters/1978_01_13a.jpg,,,,,,1978-01-13,1713480446772,false
gdsets_posters,gdsets_posters_1978_01_13b.jpg,,Poster - 1/13/78,[],,https://gdsets.com/76posters/1978_01_13b.jpg,,,,,,1978-01-13,1713480446785,false
gdsets_posters,gdsets_posters_1977_12_19a.jpg,,"Poster - 12/19,20/77",[],,https://gdsets.com/76posters/1977_12_19a.jpg,,,,,,1977-12-19,1713480446786,false
gdsets_posters,gdsets_posters_1977_12_29.jpg,,"Poster - 12/29-31/771/17,18/78",[],,https://gdsets.com/76posters/1977_12_29.jpg,,,,,,1977-12-29,1713480446870,false
gdsets_posters,gdsets_posters_1978_00_00.jpg,,Poster - 1978 @ On The Road,[],,https://gdsets.com/76posters/1978_00_00.jpg,,,,,,1978-00-00,1713480446874,false
gdsets_posters,gdsets_posters_1977_12_11a.jpg,,Poster - 12/11/77(cancelled),[],,https://gdsets.com/76posters/1977_12_11a.jpg,,,,,,1977-12-11,1713480446879,false
gdsets_posters,gdsets_posters_1978_02_28.jpg,,Poster - 2/28/78,[],,https://gdsets.com/76posters/1978_02_28.jpg,,,,,,1978-02-28,1713480446882,false
gdsets_posters,gdsets_posters_1978_02_25.jpg,,Poster - 2/25/78,[],,https://gdsets.com/76posters/1978_02_25.jpg,,,,,,1978-02-25,1713480446885,false
gdsets_posters,gdsets_posters_1978_01_10a.jpg,,Poster - 1/10/78,[],,https://gdsets.com/76posters/1978_01_10a.jpg,,,,,,1978-01-10,1713480446967,false
gdsets_posters,gdsets_posters_1978_03_03.jpg,,Poster - 3/3/78(rescheduled),[],,https://gdsets.com/76posters/1978_03_03.jpg,,,,,,1978-03-03,1713480447063,false
gdsets_posters,gdsets_posters_1978_00_01.jpg,,Poster - 1978 @ On The Road Proof,[],,https://gdsets.com/76posters/1978_00_01.jpg,,,,,,1978-00-01,1713480447068,false
gdsets_posters,gdsets_posters_1978_03_03a.jpg,,Poster - 3/3/78(rescheduled),[],,https://gdsets.com/76posters/1978_03_03a.jpg,,,,,,1978-03-03,1713480447148,false
gdsets_posters,gdsets_posters_1978_03_02.jpg,,Poster - 3/2/78,[],,https://gdsets.com/76posters/1978_03_02.jpg,,,,,,1978-03-02,1713480447149,false
gdsets_posters,gdsets_posters_1978_02_19.jpg,,Poster - 2/19/78,[],,https://gdsets.com/76posters/1978_02_19.jpg,,,,,,1978-02-19,1713480447150,false
gdsets_posters,gdsets_posters_1978_03_03b.jpg,,Poster - 3/3/78(rescheduled),[],,https://gdsets.com/76posters/1978_03_03b.jpg,,,,,,1978-03-03,1713480447235,false
gdsets_posters,gdsets_posters_1978_03_04.jpg,,Poster - 3/4/78,[],,https://gdsets.com/76posters/1978_03_04.jpg,,,,,,1978-03-04,1713480447310,false
gdsets_posters,gdsets_posters_1978_03_09a.jpg,,Poster - 3/9/78,[],,https://gdsets.com/76posters/1978_03_09a.jpg,,,,,,1978-03-09,1713480447325,false
gdsets_posters,gdsets_posters_1978_03_10.jpg,,Poster - 3/10/78,[],,https://gdsets.com/76posters/1978_03_10.jpg,,,,,,1978-03-10,1713480447337,false
gdsets_posters,gdsets_posters_1978_03_08.jpg,,Poster - 3/8/78,[],,https://gdsets.com/76posters/1978_03_08.jpg,,,,,,1978-03-08,1713480447341,false
gdsets_posters,gdsets_posters_1977_12_27.jpg,,Poster - 12/27-31/77,[],,https://gdsets.com/76posters/1977_12_27.jpg,,,,,,1977-12-27,1713480447394,false
gdsets_posters,gdsets_posters_1978_03_12.jpg,,Poster - 3/12/78,[],,https://gdsets.com/76posters/1978_03_12.jpg,,,,,,1978-03-12,1713480447416,false
gdsets_posters,gdsets_posters_1978_03_09.jpg,,Poster - 3/9/78,[],,https://gdsets.com/76posters/1978_03_09.jpg,,,,,,1978-03-09,1713480447422,false
gdsets_posters,gdsets_posters_1978_03_10a.jpg,,Poster - 3/10/78,[],,https://gdsets.com/76posters/1978_03_10a.jpg,,,,,,1978-03-10,1713480447486,false
gdsets_posters,gdsets_posters_1978_03_14.jpg,,Poster - 3/14/78(venue moved),[],,https://gdsets.com/76posters/1978_03_14.jpg,,,,,,1978-03-14,1713480447504,false
gdsets_posters,gdsets_posters_1978_03_10b.jpg,,"Poster - 3/10,11/78",[],,https://gdsets.com/76posters/1978_03_10b.jpg,,,,,,1978-03-10,1713480447512,false
gdsets_posters,gdsets_posters_1978_03_11.jpg,,"Poster - 3/11,17/78",[],,https://gdsets.com/76posters/1978_03_11.jpg,,,,,,1978-03-11,1713480447667,false
gdsets_posters,gdsets_posters_1978_03_14a.jpg,,Poster - 3/14/78,[],,https://gdsets.com/76posters/1978_03_14a.jpg,,,,,,1978-03-14,1713480447669,false
gdsets_posters,gdsets_posters_1978_03_17.jpg,,Poster - 3/17/78,[],,https://gdsets.com/76posters/1978_03_17.jpg,,,,,,1978-03-17,1713480447683,false
gdsets_posters,gdsets_posters_1978_03_14b.jpg,,Poster - 3/14/78,[],,https://gdsets.com/76posters/1978_03_14b.jpg,,,,,,1978-03-14,1713480447684,false
gdsets_posters,gdsets_posters_1978_03_05.jpg,,Poster - 3/5/78,[],,https://gdsets.com/76posters/1978_03_05.jpg,,,,,,1978-03-05,1713480447733,false
gdsets_posters,gdsets_posters_1978_03_19a.jpg,,Poster - 3/19/78,[],,https://gdsets.com/76posters/1978_03_19a.jpg,,,,,,1978-03-19,1713480447767,false
gdsets_posters,gdsets_posters_1978_03_20.jpg,,Poster - 3/20/78,[],,https://gdsets.com/76posters/1978_03_20.jpg,,,,,,1978-03-20,1713480447768,false
gdsets_posters,gdsets_posters_1978_03_11a.jpg,,Poster - 3/11/78 @ program,[],,https://gdsets.com/76posters/1978_03_11a.jpg,,,,,,1978-03-11,1713480447771,false
gdsets_posters,gdsets_posters_1978_03_19.jpg,,Poster - 3/19/78,[],,https://gdsets.com/76posters/1978_03_19.jpg,,,,,,1978-03-19,1713480447860,false
gdsets_posters,gdsets_posters_1978_03_22k.jpg,,Poster - 3/22/78,[],,https://gdsets.com/76posters/1978_03_22k.jpg,,,,,,1978-03-22,1713480447943,false
gdsets_posters,gdsets_posters_1978_03_22.jpg,,Poster - 3/22/78,[],,https://gdsets.com/76posters/1978_03_22.jpg,,,,,,1978-03-22,1713480448030,false
gdsets_posters,gdsets_posters_1978_03_22a.jpg,,Poster - 3/22/78,[],,https://gdsets.com/76posters/1978_03_22a.jpg,,,,,,1978-03-22,1713480448030,true
gdsets_posters,gdsets_posters_1978_04_04.jpg,,Poster - 4/7/78(originallyscheduledfor 4/4?),[],,https://gdsets.com/76posters
gdsets_posters,gdsets_posters_1978_04_12a.jpg,,Poster - 4/12/78,[],,https://gdsets.com/76posters/1978_04_12a.jpg,,,,,,1978-04-12,1713480448068,false
gdsets_posters,gdsets_posters_1978_03_25.jpg,,Poster - 3/25/78,[],,https://gdsets.com/76posters/1978_03_25.jpg,,,,,,1978-03-25,1713480448109,false
gdsets_posters,gdsets_posters_1978_03_22b.jpg,,Poster - 3/22/78,[],,https://gdsets.com/76posters/1978_03_22b.jpg,,,,,,1978-03-22,1713480448128,true
gdsets_posters,gdsets_posters_1978_04_15c.jpg,,Poster - Cats Under The Stars Lithograph,[],,https://gdsets.com/76posters
gdsets_posters,gdsets_posters_1978_04_15a.jpg,,Poster - 4/15/78,[],,https://gdsets.com/76posters/1978_04_15a.jpg,,,,,,1978-04-15,1713480448293,false
gdsets_posters,gdsets_posters_1978_04_24d.jpg,,Poster - 4/24/78,[],,https://gdsets.com/76posters/1978_04_24d.jpg,,,,,,1978-04-24,1713480448398,false
gdsets_posters,gdsets_posters_1978_04_24c.jpg,,Poster - 4/24/78,[],,https://gdsets.com/76posters/1978_04_24c.jpg,,,,,,1978-04-24,1713480448405,false
gdsets_posters,gdsets_posters_1978_04_27b.jpg,,Poster - 4/27/78,[],,https://gdsets.com/76posters/1978_04_27b.jpg,,,,,,1978-04-27,1713480448407,true
gdsets_posters,gdsets_posters_1978_04_24a.jpg,,Poster - 4/24/78,[],,https://gdsets.com/76posters/1978_04_24a.jpg,,,,,,1978-04-24,1713480448407,true
gdsets_posters,gdsets_posters_1978_04_24b.jpg,,Poster - 4/24/78,[],,https://gdsets.com/76posters/1978_04_24b.jpg,,,,,,1978-04-24,1713480448407,false
gdsets_posters,gdsets_posters_1978_04_24e.jpg,,Poster - 4/24/78,[],,https://gdsets.com/76posters/1978_04_24e.jpg,,,,,,1978-04-24,1713480448496,false
gdsets_posters,gdsets_posters_1978_04_27d.jpg,,Poster - 4/27/78,[],,https://gdsets.com/76posters/1978_04_27d.jpg,,,,,,1978-04-27,1713480448584,false
gdsets_posters,gdsets_posters_1978_05_19.jpg,,Poster - 5/19/78,[],,https://gdsets.com/76posters/1978_05_19.jpg,,,,,,1978-05-19,1713480448592,false
gdsets_posters,gdsets_posters_1978_04_30.jpg,,Poster - 4/30/78,[],,https://gdsets.com/76posters/1978_04_30.jpg,,,,,,1978-04-30,1713480448655,false
gdsets_posters,gdsets_posters_1978_05_26.jpg,,Poster - 5/26-28/78,[],,https://gdsets.com/76posters/1978_05_26.jpg,,,,,,1978-05-26,1713480448667,false
gdsets_posters,gdsets_posters_1978_04_27.jpg,,Poster - 4/27/78,[],,https://gdsets.com/76posters/1978_04_27.jpg,,,,,,1978-04-27,1713480448740,false
gdsets_posters,gdsets_posters_1978_03_23.jpg,,Poster - 3/23-25/78,[],,https://gdsets.com/76posters/1978_03_23.jpg,,,,,,1978-03-23,1713480448805,true
gdsets_posters,gdsets_posters_1978_06_04a.jpg,,Poster - 6/4/78,[],,https://gdsets.com/76posters/1978_06_04a.jpg,,,,,,1978-06-04,1713480448851,false
gdsets_posters,gdsets_posters_1978_06_04c.jpg,,Poster - 6/4/78,[],,https://gdsets.com/76posters/1978_06_04c.jpg,,,,,,1978-06-04,1713480448866,false
gdsets_posters,gdsets_posters_1978_04_15b.jpg,,Poster - Cats Under The Stars Promo,[],,https://gdsets.com/76posters
gdsets_posters,gdsets_posters_1978_04_27c.jpg,,Poster - 4/27/78,[],,https://gdsets.com/76posters/1978_04_27c.jpg,,,,,,1978-04-27,1713480448979,true
gdsets_posters,gdsets_posters_1978_06_04e.jpg,,Poster - 6/4/78,[],,https://gdsets.com/76posters/1978_06_04e.jpg,,,,,,1978-06-04,1713480449031,false
gdsets_posters,gdsets_posters_1978_06_04d.jpg,,Poster - 6/4/78,[],,https://gdsets.com/76posters/1978_06_04d.jpg,,,,,,1978-06-04,1713480449031,false
gdsets_posters,gdsets_posters_1978_07_01b.jpg,,Poster - 7/1/78,[],,https://gdsets.com/76posters/1978_07_01b.jpg,,,,,,1978-07-01,1713480449042,false
gdsets_posters,gdsets_posters_1978_06_04f.jpg,,Poster - 6/4/78,[],,https://gdsets.com/76posters/1978_06_04f.jpg,,,,,,1978-06-04,1713480449128,false
gdsets_posters,gdsets_posters_1978_06_11.jpg,,Poster - 6/11/78,[],,https://gdsets.com/76posters/1978_06_11.jpg,,,,,,1978-06-11,1713480449143,false
gdsets_posters,gdsets_posters_1978_07_19.jpg,,"Poster - 7/19,20/78",[],,https://gdsets.com/76posters/1978_07_19.jpg,,,,,,1978-07-19,1713480449170,false
gdsets_posters,gdsets_posters_1978_06_10.jpg,,Poster - 6/10-18/78,[],,https://gdsets.com/76posters/1978_06_10.jpg,,,,,,1978-06-10,1713480449218,false
gdsets_posters,gdsets_posters_1978_07_15.jpg,,Poster - 7/15/78,[],,https://gdsets.com/76posters/1978_07_15.jpg,,,,,,1978-07-15,1713480449229,false
gdsets_posters,gdsets_posters_1978_07_22.jpg,,Poster - 7/22/78,[],,https://gdsets.com/76posters/1978_07_22.jpg,,,,,,1978-07-22,1713480449322,false
gdsets_posters,gdsets_posters_1978_07_16.jpg,,Poster - 7/16/78,[],,https://gdsets.com/76posters/1978_07_16.jpg,,,,,,1978-07-16,1713480449324,false
gdsets_posters,gdsets_posters_1978_06_04b.jpg,,Poster - 6/4/78(Original Ad Art),[],,https://gdsets.com/76posters/1978_06_04b.jpg,,,,,,1978-06-04,1713480449414,false
gdsets_posters,gdsets_posters_1978_07_01a.jpg,,Poster - 7/1/78,[],,https://gdsets.com/76posters/1978_07_01a.jpg,,,,,,1978-07-01,1713480449435,false
gdsets_posters,gdsets_posters_1978_09_02a.jpg,,Poster - 9/2/78,[],,https://gdsets.com/76posters/1978_09_02a.jpg,,,,,,1978-09-02,1713480449442,true
gdsets_posters,gdsets_posters_1978_07_02.jpg,,Poster - 7/2/78(cancelleddue to rain),[],,https://gdsets.com/76posters
gdsets_posters,gdsets_posters_1978_09_02b.jpg,,Poster - 9/2/78,[],,https://gdsets.com/76posters/1978_09_02b.jpg,,,,,,1978-09-02,1713480449612,false
gdsets_posters,gdsets_posters_1978_09_04.jpg,,Poster - 9/4/78,[],,https://gdsets.com/76posters/1978_09_04.jpg,,,,,,1978-09-04,1713480449612,false
gdsets_posters,gdsets_posters_1978_03_23a.jpg,,Poster - 3/23-25/78,[],,https://gdsets.com/76posters/1978_03_23a.jpg,,,,,,1978-03-23,1713480449624,false
gdsets_posters,gdsets_posters_1978_09_22.jpg,,Poster - 9/22/78,[],,https://gdsets.com/76posters/1978_09_22.jpg,,,,,,1978-09-22,1713480449806,false
gdsets_posters,gdsets_posters_1978_09_14b (OA).jpg,,Poster - 9/14-16/78 @ AOR 4.239(Original Art),[],,https://gdsets.com/76posters/1978_09_14b 
gdsets_posters,gdsets_posters_1978_09_22a.jpg,,Poster - 9/22/78,[],,https://gdsets.com/76posters/1978_09_22a.jpg,,,,,,1978-09-22,1713480449825,true
gdsets_posters,gdsets_posters_1978_09_23.jpg,,Poster - 9/23/78,[],,https://gdsets.com/76posters/1978_09_23.jpg,,,,,,1978-09-23,1713480449891,false
gdsets_posters,gdsets_posters_1978_09_23a.jpg,,Poster - 9/23/78,[],,https://gdsets.com/76posters/1978_09_23a.jpg,,,,,,1978-09-23,1713480449918,false
gdsets_posters,gdsets_posters_1978_09_22b.jpg,,Poster - 9/22/78,[],,https://gdsets.com/76posters/1978_09_22b.jpg,,,,,,1978-09-22,1713480449918,false
gdsets_posters,gdsets_posters_1978_09_28.jpg,,Poster - 9/28-30/78(cancelled),[],,https://gdsets.com/76posters/1978_09_28.jpg,,,,,,1978-09-28,1713480450020,false
gdsets_posters,gdsets_posters_1978_10_07a.jpg,,Poster - 10/7/78,[],,https://gdsets.com/76posters/1978_10_07a.jpg,,,,,,1978-10-07,1713480450098,false
gdsets_posters,gdsets_posters_1978_09_14d.jpg,,Poster - 9/14-16/78,[],,https://gdsets.com/76posters/1978_09_14d.jpg,,,,,,1978-09-14,1713480450118,false
gdsets_posters,gdsets_posters_1978_10_13.jpg,,"Poster - 10/13,14/78",[],,https://gdsets.com/76posters/1978_10_13.jpg,,,,,,1978-10-13,1713480450199,false
gdsets_posters,gdsets_posters_1978_09_30.jpg,,Poster - 9/30/78,[],,https://gdsets.com/76posters/1978_09_30.jpg,,,,,,1978-09-30,1713480450199,false
gdsets_posters,gdsets_posters_1978_10_07.jpg,,Poster - 10/7-14/78,[],,https://gdsets.com/76posters/1978_10_07.jpg,,,,,,1978-10-07,1713480450201,false
gdsets_posters,gdsets_posters_1978_09_29.jpg,,Poster - 9/29/78,[],,https://gdsets.com/76posters/1978_09_29.jpg,,,,,,1978-09-29,1713480450214,false
gdsets_posters,gdsets_posters_1978_10_15a.jpg,,"Poster - 10/15,16/78",[],,https://gdsets.com/76posters/1978_10_15a.jpg,,,,,,1978-10-15,1713480450306,false
gdsets_posters,gdsets_posters_1978_10_15.jpg,,Poster - 10/15/78,[],,https://gdsets.com/76posters/1978_10_15.jpg,,,,,,1978-10-15,1713480450308,false
gdsets_posters,gdsets_posters_1978_09_30a.jpg,,Poster - 9/30/78,[],,https://gdsets.com/76posters/1978_09_30a.jpg,,,,,,1978-09-30,1713480450408,false
gdsets_posters,gdsets_posters_1978_10_17.jpg,,Poster - 10/17-22/78,[],,https://gdsets.com/76posters/1978_10_17.jpg,,,,,,1978-10-17,1713480450411,false
gdsets_posters,gdsets_posters_1978_09_14a.jpg,,Poster - 9/14-16/78 (OP1)AOR 4.239,[],,https://gdsets.com/76posters/1978_09_14a.jpg,,,,,,1978-09-14,1713480450512,false
gdsets_posters,gdsets_posters_1978_10_26.jpg,,Poster - 10/26/78,[],,https://gdsets.com/76posters/1978_10_26.jpg,,,,,,1978-10-26,1713480450512,false
gdsets_posters,gdsets_posters_1978_10_28.jpg,,Poster - 10/28/78,[],,https://gdsets.com/76posters/1978_10_28.jpg,,,,,,1978-10-28,1713480450514,false
gdsets_posters,gdsets_posters_1978_10_24.jpg,,Poster - 10/24-11/4/78,[],,https://gdsets.com/76posters/1978_10_24.jpg,,,,,,1978-10-24,1713480450596,false
gdsets_posters,gdsets_posters_1978_10_27a.jpg,,Poster - 10/27/78,[],,https://gdsets.com/76posters/1978_10_27a.jpg,,,,,,1978-10-27,1713480450596,false
gdsets_posters,gdsets_posters_1978_10_28a.jpg,,Poster - 10/28/78,[],,https://gdsets.com/76posters/1978_10_28a.jpg,,,,,,1978-10-28,1713480450684,true
gdsets_posters,gdsets_posters_1978_10_27.jpg,,Poster - 10/27/78,[],,https://gdsets.com/76posters/1978_10_27.jpg,,,,,,1978-10-27,1713480450687,false
gdsets_posters,gdsets_posters_1978_11_02a.jpg,,Poster - 11/2/78,[],,https://gdsets.com/76posters/1978_11_02a.jpg,,,,,,1978-11-02,1713480450778,true
gdsets_posters,gdsets_posters_1978_11_02.jpg,,Poster - 11/2/78,[],,https://gdsets.com/76posters/1978_11_02.jpg,,,,,,1978-11-02,1713480450778,true
gdsets_posters,gdsets_posters_1978_11_02c.jpg,,Poster - 11/2-4/78,[],,https://gdsets.com/76posters/1978_11_02c.jpg,,,,,,1978-11-02,1713480450981,false
gdsets_posters,gdsets_posters_1978_11_02b.jpg,,Poster - 11/2/78,[],,https://gdsets.com/76posters/1978_11_02b.jpg,,,,,,1978-11-02,1713480450983,false
gdsets_posters,gdsets_posters_1978_10_26cx.jpg,,Poster - 10/26/78(cancelled),[],,https://gdsets.com/76posters/1978_10_26cx.jpg,,,,,,1978-10-26,1713480450991,false
gdsets_posters,gdsets_posters_1978_09_14c.jpg,,Poster - 9/14-16/78 @ Program,[],,https://gdsets.com/76posters/1978_09_14c.jpg,,,,,,1978-09-14,1713480450998,false
gdsets_posters,gdsets_posters_1978_09_19.jpg,,Poster - 9/19/78(cancelled),[],,https://gdsets.com/76posters/1978_09_19.jpg,,,,,,1978-09-19,1713480451095,false
gdsets_posters,gdsets_posters_1978_11_25.jpg,,Poster - 11/25/78 @ Button,[],,https://gdsets.com/76posters/1978_11_25.jpg,,,,,,1978-11-25,1713480451095,false
gdsets_posters,gdsets_posters_1978_11_12.jpg,,Poster - 11/12/78,[],,https://gdsets.com/76posters/1978_11_12.jpg,,,,,,1978-11-12,1713480451159,false
gdsets_posters,gdsets_posters_1978_11_30.jpg,,"Poster - 11/30,12/1/78(rescheduled)",[],,https://gdsets.com/76posters
gdsets_posters,gdsets_posters_1978_11_27.jpg,,Poster - 11/27/78(rescheduled),[],,https://gdsets.com/76posters/1978_11_27.jpg,,,,,,1978-11-27,1713480451179,false
gdsets_posters,gdsets_posters_1978_11_13a.jpg,,Poster - 11/13/78,[],,https://gdsets.com/76posters/1978_11_13a.jpg,,,,,,1978-11-13,1713480451188,true
gdsets_posters,gdsets_posters_1978_11_13.jpg,,Poster - 11/13/78,[],,https://gdsets.com/76posters/1978_11_13.jpg,,,,,,1978-11-13,1713480451188,false
gdsets_posters,gdsets_posters_1978_11_27a.jpg,,Poster - 11/27-28/78(rescheduled),[],,https://gdsets.com/76posters/1978_11_27a.jpg,,,,,,1978-11-27,1713480451191,false
gdsets_posters,gdsets_posters_1978_11_13b.jpg,,Poster - 11/13/78,[],,https://gdsets.com/76posters/1978_11_13b.jpg,,,,,,1978-11-13,1713480451237,false
gdsets_posters,gdsets_posters_1978_12_07.jpg,,Poster - 12/7-9/78,[],,https://gdsets.com/76posters/1978_12_07.jpg,,,,,,1978-12-07,1713480451260,false
gdsets_posters,gdsets_posters_1978_11_15.jpg,,Poster - Shakedown Street Promo,[],,https://gdsets.com/76posters/1978_11_15.jpg,,,,,,1978-11-15,1713480451262,false
gdsets_posters,gdsets_posters_1978_11_30a.jpg,,"Poster - 11/30,12/1/78(rescheduled)",[],,https://gdsets.com/76posters
gdsets_posters,gdsets_posters_1978_12_12.jpg,,Poster - 12/12/78,[],,https://gdsets.com/76posters/1978_12_12.jpg,,,,,,1978-12-12,1713480451338,false
gdsets_posters,gdsets_posters_1978_12_19a.jpg,,Poster - 12/19/78,[],,https://gdsets.com/76posters/1978_12_19a.jpg,,,,,,1978-12-19,1713480451342,false
gdsets_posters,gdsets_posters_1978_12_22.jpg,,Poster - 12/22/78,[],,https://gdsets.com/76posters/1978_12_22.jpg,,,,,,1978-12-22,1713480451434,false
gdsets_posters,gdsets_posters_1978_12_27.jpg,,Poster - 12/27-30/78,[],,https://gdsets.com/76posters/1978_12_27.jpg,,,,,,1978-12-27,1713480451530,false
gdsets_posters,gdsets_posters_1979_01_21.jpg,,Poster - 1/21/79,[],,https://gdsets.com/76posters/1979_01_21.jpg,,,,,,1979-01-21,1713480451723,false
gdsets_posters,gdsets_posters_1979_02_02.jpg,,Poster - 2/2/79,[],,https://gdsets.com/76posters/1979_02_02.jpg,,,,,,1979-02-02,1713480451843,false
gdsets_posters,gdsets_posters_1978_12_31g.jpg,,Poster - 12/31/78,[],,https://gdsets.com/76posters/1978_12_31g.jpg,,,,,,1978-12-31,1713480451843,false
gdsets_posters,gdsets_posters_1978_12_31e.jpg,,Poster - 12/31/78,[],,https://gdsets.com/76posters/1978_12_31e.jpg,,,,,,1978-12-31,1713480451850,false
gdsets_posters,gdsets_posters_1979_02_03a.jpg,,Poster - 2/3/79,[],,https://gdsets.com/76posters/1979_02_03a.jpg,,,,,,1979-02-03,1713480451852,false
gdsets_posters,gdsets_posters_1979_02_06a.jpg,,Poster - 2/6/79,[],,https://gdsets.com/76posters/1979_02_06a.jpg,,,,,,1979-02-06,1713480451905,false
gdsets_posters,gdsets_posters_1979_01_01.jpg,,Poster - 1979 Songbook,[],,https://gdsets.com/76posters/1979_01_01.jpg,,,,,,1979-01-01,1713480451930,false
gdsets_posters,gdsets_posters_1979_02_06.jpg,,Poster - 2/6/79,[],,https://gdsets.com/76posters/1979_02_06.jpg,,,,,,1979-02-06,1713480451952,false
gdsets_posters,gdsets_posters_1979_02_17b.jpg,,Poster - 2/17/79,[],,https://gdsets.com/76posters/1979_02_17b.jpg,,,,,,1979-02-17,1713480452016,false
gdsets_posters,gdsets_posters_1978_12_31c.jpg,,Poster - 12/31/78,[],,https://gdsets.com/76posters/1978_12_31c.jpg,,,,,,1978-12-31,1713480452131,true
gdsets_posters,gdsets_posters_1979_02_27.jpg,,Poster - 2/27-3/4/79,[],,https://gdsets.com/76posters/1979_02_27.jpg,,,,,,1979-02-27,1713480452134,false
gdsets_posters,gdsets_posters_1979_01_20a.jpg,,Poster - 1/20/79 (RP2)AOR 4.230,[],,https://gdsets.com/76posters/1979_01_20a.jpg,,,,,,1979-01-20,1713480452140,true
gdsets_posters,gdsets_posters_1978_12_31a.jpg,,Poster - 12/31/78 (OHB)AOR 4.38,[],,https://gdsets.com/76posters/1978_12_31a.jpg,,,,,,1978-12-31,1713480452243,false
gdsets_posters,gdsets_posters_1979_01_20b.jpg,,Poster - 1/20/79 (RPC)AOR 4.230,[],,https://gdsets.com/76posters/1979_01_20b.jpg,,,,,,1979-01-20,1713480452256,true
gdsets_posters,gdsets_posters_1978_12_31d.jpg,,Poster - 12/31/78,[],,https://gdsets.com/76posters/1978_12_31d.jpg,,,,,,1978-12-31,1713480452259,false
gdsets_posters,gdsets_posters_1979_01_20c.jpg,,Poster - 1/20/79 (OP1)AOR 4.230,[],,https://gdsets.com/76posters/1979_01_20c.jpg,,,,,,1979-01-20,1713480452266,false
gdsets_posters,gdsets_posters_1979_03_04.jpg,,"Poster - 3/4,8/79",[],,https://gdsets.com/76posters/1979_03_04.jpg,,,,,,1979-03-04,1713480452349,false
gdsets_posters,gdsets_posters_1978_12_31b.jpg,,Poster - 12/31/78 @ AOR 4.38 (proof),[],,https://gdsets.com/76posters
gdsets_posters,gdsets_posters_1979_02_17a.jpg,,Poster - 2/17/79,[],,https://gdsets.com/76posters/1979_02_17a.jpg,,,,,,1979-02-17,1713480452355,false
gdsets_posters,gdsets_posters_1979_03_04a.jpg,,Poster - 3/4/79,[],,https://gdsets.com/76posters/1979_03_04a.jpg,,,,,,1979-03-04,1713480452442,false
gdsets_posters,gdsets_posters_1979_03_07.jpg,,Poster - 3/7/79,[],,https://gdsets.com/76posters/1979_03_07.jpg,,,,,,1979-03-07,1713480452522,false
gdsets_posters,gdsets_posters_1979_03_08.jpg,,Poster - 3/8/79,[],,https://gdsets.com/76posters/1979_03_08.jpg,,,,,,1979-03-08,1713480452524,false
gdsets_posters,gdsets_posters_1979_03_09.jpg,,Poster - 3/9/79,[],,https://gdsets.com/76posters/1979_03_09.jpg,,,,,,1979-03-09,1713480452524,false
gdsets_posters,gdsets_posters_1979_03_07a.jpg,,Poster - 3/7/79,[],,https://gdsets.com/76posters/1979_03_07a.jpg,,,,,,1979-03-07,1713480452613,false
gdsets_posters,gdsets_posters_1979_03_23.jpg,,Poster - 3/23/79,[],,https://gdsets.com/76posters/1979_03_23.jpg,,,,,,1979-03-23,1713480452613,false
gdsets_posters,gdsets_posters_1979_03_11.jpg,,Poster - 3/11/79,[],,https://gdsets.com/76posters/1979_03_11.jpg,,,,,,1979-03-11,1713480452615,false
gdsets_posters,gdsets_posters_1979_03_20.jpg,,"Poster - 3/20,21/79",[],,https://gdsets.com/76posters/1979_03_20.jpg,,,,,,1979-03-20,1713480452695,false
gdsets_posters,gdsets_posters_1979_04_06.jpg,,Poster - 4/6/79,[],,https://gdsets.com/76posters/1979_04_06.jpg,,,,,,1979-04-06,1713480452792,false
gdsets_posters,gdsets_posters_1979_03_29.jpg,,"Poster - 3/29,30/79",[],,https://gdsets.com/76posters/1979_03_29.jpg,,,,,,1979-03-29,1713480452793,false
gdsets_posters,gdsets_posters_1979_04_11.jpg,,"Poster - 4/11,12/79",[],,https://gdsets.com/76posters/1979_04_11.jpg,,,,,,1979-04-11,1713480452795,false
gdsets_posters,gdsets_posters_1979_03_31.jpg,,Poster - 3/31/79,[],,https://gdsets.com/76posters/1979_03_31.jpg,,,,,,1979-03-31,1713480452871,false
gdsets_posters,gdsets_posters_1979_04_17.jpg,,Poster - 4/17/79,[],,https://gdsets.com/76posters/1979_04_17.jpg,,,,,,1979-04-17,1713480452876,false
gdsets_posters,gdsets_posters_1979_04_14.jpg,,"Poster - 4/14,15/79",[],,https://gdsets.com/76posters/1979_04_14.jpg,,,,,,1979-04-14,1713480452971,false
gdsets_posters,gdsets_posters_1979_04_26.jpg,,"Poster - 4/26,28/79",[],,https://gdsets.com/76posters/1979_04_26.jpg,,,,,,1979-04-26,1713480452979,false
gdsets_posters,gdsets_posters_1979_04_23a.jpg,,Poster - 4/23/79,[],,https://gdsets.com/76posters/1979_04_23a.jpg,,,,,,1979-04-23,1713480452983,false
gdsets_posters,gdsets_posters_1979_04_27.jpg,,Poster - 4/27/79,[],,https://gdsets.com/76posters/1979_04_27.jpg,,,,,,1979-04-27,1713480452983,false
gdsets_posters,gdsets_posters_1979_04_27b.jpg,,Poster - 4/27/79,[],,https://gdsets.com/76posters/1979_04_27b.jpg,,,,,,1979-04-27,1713480453160,false
gdsets_posters,gdsets_posters_1979_05_03.jpg,,Poster - 5/3/79,[],,https://gdsets.com/76posters/1979_05_03.jpg,,,,,,1979-05-03,1713480453172,false
gdsets_posters,gdsets_posters_1979_04_28.jpg,,Poster - 4/28/79,[],,https://gdsets.com/76posters/1979_04_28.jpg,,,,,,1979-04-28,1713480453256,false
gdsets_posters,gdsets_posters_1979_05_04.jpg,,Poster - 5/4/79,[],,https://gdsets.com/76posters/1979_05_04.jpg,,,,,,1979-05-04,1713480453256,false
gdsets_posters,gdsets_posters_1979_04_27a.jpg,,Poster - 4/27/79,[],,https://gdsets.com/76posters/1979_04_27a.jpg,,,,,,1979-04-27,1713480453259,false
gdsets_posters,gdsets_posters_1978_12_31f.jpg,,Poster - 12/31/78,[],,https://gdsets.com/76posters/1978_12_31f.jpg,,,,,,1978-12-31,1713480453275,false
gdsets_posters,gdsets_posters_1979_05_03a.jpg,,Poster - 5/3/79,[],,https://gdsets.com/76posters/1979_05_03a.jpg,,,,,,1979-05-03,1713480453348,false
gdsets_posters,gdsets_posters_1979_05_05.jpg,,Poster - 5/5/79,[],,https://gdsets.com/76posters/1979_05_05.jpg,,,,,,1979-05-05,1713480453360,false
gdsets_posters,gdsets_posters_1979_05_06.jpg,,Poster - 5/6/79,[],,https://gdsets.com/76posters/1979_05_06.jpg,,,,,,1979-05-06,1713480453448,false
gdsets_posters,gdsets_posters_1979_05_05a.jpg,,Poster - 5/5/79,[],,https://gdsets.com/76posters/1979_05_05a.jpg,,,,,,1979-05-05,1713480453448,false
gdsets_posters,gdsets_posters_1979_05_11.jpg,,Poster - 5/11/79,[],,https://gdsets.com/76posters/1979_05_11.jpg,,,,,,1979-05-11,1713480453448,false
gdsets_posters,gdsets_posters_1979_05_07.jpg,,Poster - 5/7/79,[],,https://gdsets.com/76posters/1979_05_07.jpg,,,,,,1979-05-07,1713480453555,false
gdsets_posters,gdsets_posters_1979_05_12.jpg,,Poster - 5/12/79,[],,https://gdsets.com/76posters/1979_05_12.jpg,,,,,,1979-05-12,1713480453649,false
gdsets_posters,gdsets_posters_1979_05_30.jpg,,Poster - 5/30/79,[],,https://gdsets.com/76posters/1979_05_30.jpg,,,,,,1979-05-30,1713480453649,false
gdsets_posters,gdsets_posters_1979_05_18.jpg,,"Poster - 5/18,19/79",[],,https://gdsets.com/76posters/1979_05_18.jpg,,,,,,1979-05-18,1713480453649,false
gdsets_posters,gdsets_posters_1979_05_25.jpg,,Poster - 5/25/79,[],,https://gdsets.com/76posters/1979_05_25.jpg,,,,,,1979-05-25,1713480453746,false
gdsets_posters,gdsets_posters_1979_05_27.jpg,,Poster - 5/27/79,[],,https://gdsets.com/76posters/1979_05_27.jpg,,,,,,1979-05-27,1713480453858,false
gdsets_posters,gdsets_posters_1979_06_08.jpg,,Poster - 6/8/79,[],,https://gdsets.com/76posters/1979_06_08.jpg,,,,,,1979-06-08,1713480453859,false
gdsets_posters,gdsets_posters_1979_06_15.jpg,,Poster - 6/15-17/79,[],,https://gdsets.com/76posters/1979_06_15.jpg,,,,,,1979-06-15,1713480453861,false
gdsets_posters,gdsets_posters_1979_05_12a.jpg,,Poster - 5/12/79,[],,https://gdsets.com/76posters/1979_05_12a.jpg,,,,,,1979-05-12,1713480453949,false
gdsets_posters,gdsets_posters_1979_06_23.jpg,,Poster - 6/23/79,[],,https://gdsets.com/76posters/1979_06_23.jpg,,,,,,1979-06-23,1713480453962,false
gdsets_posters,gdsets_posters_1979_06_21.jpg,,Poster - 6/21/79,[],,https://gdsets.com/76posters/1979_06_21.jpg,,,,,,1979-06-21,1713480454062,false
gdsets_posters,gdsets_posters_1979_06_19.jpg,,Poster - 6/19/79,[],,https://gdsets.com/76posters/1979_06_19.jpg,,,,,,1979-06-19,1713480454072,false
gdsets_posters,gdsets_posters_1979_07_06.jpg,,"Poster - 7/6,7/79",[],,https://gdsets.com/76posters/1979_07_06.jpg,,,,,,1979-07-06,1713480454072,false
gdsets_posters,gdsets_posters_1979_07_01.jpg,,Poster - 7/1/79,[],,https://gdsets.com/76posters/1979_07_01.jpg,,,,,,1979-07-01,1713480454072,false
gdsets_posters,gdsets_posters_1979_07_20.jpg,,Poster - 7/20/79,[],,https://gdsets.com/76posters/1979_07_20.jpg,,,,,,1979-07-20,1713480454163,false
gdsets_posters,gdsets_posters_1979_07_06a.jpg,,Poster - 7/6-8/79,[],,https://gdsets.com/76posters/1979_07_06a.jpg,,,,,,1979-07-06,1713480454163,false
gdsets_posters,gdsets_posters_1979_07_20a.jpg,,Poster - 7/20/79,[],,https://gdsets.com/76posters/1979_07_20a.jpg,,,,,,1979-07-20,1713480454163,false
gdsets_posters,gdsets_posters_1979_07_22.jpg,,Poster - 7/22/79,[],,https://gdsets.com/76posters/1979_07_22.jpg,,,,,,1979-07-22,1713480454270,false
gdsets_posters,gdsets_posters_1979_06_30.jpg,,Poster - 6/30/79,[],,https://gdsets.com/76posters/1979_06_30.jpg,,,,,,1979-06-30,1713480454278,false
gdsets_posters,gdsets_posters_1979_08_04.jpg,,"Poster - 8/4,5/79",[],,https://gdsets.com/76posters/1979_08_04.jpg,,,,,,1979-08-04,1713480454357,false
gdsets_posters,gdsets_posters_1979_08_03.jpg,,"Poster - 8/3,4/79",[],,https://gdsets.com/76posters/1979_08_03.jpg,,,,,,1979-08-03,1713480454362,false
gdsets_posters,gdsets_posters_1979_08_10.jpg,,Poster - 8/10/79,[],,https://gdsets.com/76posters/1979_08_10.jpg,,,,,,1979-08-10,1713480454363,false
gdsets_posters,gdsets_posters_1979_04_22.jpg,,Poster - 4/22/79,[],,https://gdsets.com/76posters/1979_04_22.jpg,,,,,,1979-04-22,1713480454363,false
gdsets_posters,gdsets_posters_1979_08_10a.jpg,,Poster - 8/10/79,[],,https://gdsets.com/76posters/1979_08_10a.jpg,,,,,,1979-08-10,1713480454452,false
gdsets_posters,gdsets_posters_1979_04_23.jpg,,Poster - 4/23/79,[],,https://gdsets.com/76posters/1979_04_23.jpg,,,,,,1979-04-23,1713480454454,false
gdsets_posters,gdsets_posters_1979_08_12b.jpg,,"Poster - 8/12,16/79",[],,https://gdsets.com/76posters/1979_08_12b.jpg,,,,,,1979-08-12,1713480454541,false
gdsets_posters,gdsets_posters_1979_08_12.jpg,,Poster - 8/12-14/79 @ Program,[],,https://gdsets.com/76posters/1979_08_12.jpg,,,,,,1979-08-12,1713480454631,false
gdsets_posters,gdsets_posters_1979_09_04.jpg,,Poster - 9/4-6/79,[],,https://gdsets.com/76posters/1979_09_04.jpg,,,,,,1979-09-04,1713480454636,false
gdsets_posters,gdsets_posters_1979_09_01.jpg,,Poster - 9/1/79,[],,https://gdsets.com/76posters/1979_09_01.jpg,,,,,,1979-09-01,1713480454636,false
gdsets_posters,gdsets_posters_1979_09_05.jpg,,Poster - 9/5/79,[],,https://gdsets.com/76posters/1979_09_05.jpg,,,,,,1979-09-05,1713480454716,false
gdsets_posters,gdsets_posters_1979_09_06.jpg,,Poster - 9/6/79,[],,https://gdsets.com/76posters/1979_09_06.jpg,,,,,,1979-09-06,1713480454720,false
gdsets_posters,gdsets_posters_1979_10_07.jpg,,"Poster - 10/7,14,21/79",[],,https://gdsets.com/76posters/1979_10_07.jpg,,,,,,1979-10-07,1713480454809,false
gdsets_posters,gdsets_posters_1979_11_05.jpg,,Poster - 11/5/79,[],,https://gdsets.com/76posters/1979_11_05.jpg,,,,,,1979-11-05,1713480454809,false
gdsets_posters,gdsets_posters_1979_09_22.jpg,,Poster - 9/22/79,[],,https://gdsets.com/76posters/1979_09_22.jpg,,,,,,1979-09-22,1713480454809,false
gdsets_posters,gdsets_posters_1979_08_12a.jpg,,Poster - 8/12-14/79,[],,https://gdsets.com/76posters/1979_08_12a.jpg,,,,,,1979-08-12,1713480454809,false
gdsets_posters,gdsets_posters_1979_11_05a.jpg,,Poster - 11/5/79,[],,https://gdsets.com/76posters/1979_11_05a.jpg,,,,,,1979-11-05,1713480454809,false
gdsets_posters,gdsets_posters_1979_11_08.jpg,,Poster - 11/8/79,[],,https://gdsets.com/76posters/1979_11_08.jpg,,,,,,1979-11-08,1713480454883,false
gdsets_posters,gdsets_posters_1979_10_27.jpg,,"Poster - 10/27,28/79",[],,https://gdsets.com/76posters/1979_10_27.jpg,,,,,,1979-10-27,1713480454887,false
gdsets_posters,gdsets_posters_1979_11_09.jpg,,Poster - 11/9/79,[],,https://gdsets.com/76posters/1979_11_09.jpg,,,,,,1979-11-09,1713480454895,false
gdsets_posters,gdsets_posters_1979_11_18.jpg,,Poster - 11/18/79,[],,https://gdsets.com/76posters/1979_11_18.jpg,,,,,,1979-11-18,1713480454978,false
gdsets_posters,gdsets_posters_1979_11_25.jpg,,Poster - 11/25/79,[],,https://gdsets.com/76posters/1979_11_25.jpg,,,,,,1979-11-25,1713480455067,false
gdsets_posters,gdsets_posters_1979_11_10.jpg,,Poster - 11/10/79 (OP1)AOR 4.200,[],,https://gdsets.com/76posters/1979_11_10.jpg,,,,,,1979-11-10,1713480455072,false
gdsets_posters,gdsets_posters_1979_11_25a.jpg,,Poster - 11/25/79,[],,https://gdsets.com/76posters/1979_11_25a.jpg,,,,,,1979-11-25,1713480455075,false
gdsets_posters,gdsets_posters_1979_12_07a.jpg,,Poster - 12/7/79,[],,https://gdsets.com/76posters/1979_12_07a.jpg,,,,,,1979-12-07,1713480455255,false
gdsets_posters,gdsets_posters_1979_12_09.jpg,,Poster - 12/9/79,[],,https://gdsets.com/76posters/1979_12_09.jpg,,,,,,1979-12-09,1713480455261,false
gdsets_posters,gdsets_posters_1966_01_04a.jpg,,"Poster - 1/4,5/66",[],,https://gdsets.com/66posters/1966_01_04a.jpg,,,,,,1966-01-04,1713480455359,false
gdsets_posters,gdsets_posters_1979_12_07b.jpg,,Poster - 12/7/79,[],,https://gdsets.com/76posters/1979_12_07b.jpg,,,,,,1979-12-07,1713480455445,false
gdsets_posters,gdsets_posters_1979_12_26a.jpg,,Poster - 12/26-31/79,[],,https://gdsets.com/76posters/1979_12_26a.jpg,,,,,,1979-12-26,1713480455475,false
gdsets_posters,gdsets_posters_1966_01_08 AOR 2.4 (OP uncut).jpg,,Poster - 1/8/66 (OP1)AOR 2.4(uncut),[],,https://gdsets.com/66posters/1966_01_08 AOR 2.4 (OP
gdsets_posters,gdsets_posters_1979_11_23.jpg,,"Poster - 11/23,24/79",[],,https://gdsets.com/76posters/1979_11_23.jpg,,,,,,1979-11-23,1713480455584,false
gdsets_posters,gdsets_posters_1966_01_08d AOR 2.4 (RP).jpg,,Poster - 1/8/66 (RP)AOR 2.4,[],,https://gdsets.com/66posters/1966_01_08d AOR 2.4 
gdsets_posters,gdsets_posters_1979_12_07.jpg,,Poster - 12/7/79,[],,https://gdsets.com/76posters/1979_12_07.jpg,,,,,,1979-12-07,1713480455588,false
gdsets_posters,gdsets_posters_1966_01_08e AOR 2.4 (RP) JG colored.jpg,,Poster - 1/8/66 (RP)AOR 2.4(Jerry Garciahand colored),[],,https://gdsets.com/66posters
gdsets_posters,gdsets_posters_1966_01_08l AOR 2.7.jpg,,Poster - 1/8/66 (OHB)AOR 2.7,[],,https://gdsets.com/66posters/1966_01_08l AOR
gdsets_posters,gdsets_posters_1966_01_08a AOR 2.4(OP).jpg,,Poster - 1/8/66 (OP1)AOR 2.4,[],,https://gdsets.com/66posters/1966_01_08a AOR 2.4
gdsets_posters,gdsets_posters_1966_01_08c AOR 2.4 (RP Hand Colored).jpg,,Poster - 1/8/66 (RP)AOR 2.4(hand colored),[],,https://gdsets.com/66posters/1966_01_08c AOR
gdsets_posters,gdsets_posters_1966_01_08f.jpg,,Poster - 1/8/66 (RP)AOR 2.4,[],,https://gdsets.com/66posters/1966_01_08f.jpg,,,,,,1966-01-08,1713480455986,true
gdsets_posters,gdsets_posters_1966_01_08p.jpg,,Poster - 1/8/66(uncertainprovenance),[],,https://gdsets.com/66posters
gdsets_posters,gdsets_posters_1966_01_08a.jpg,,Poster - 1/8/66 (OP1)AOR 2.4,[],,https://gdsets.com/66posters/1966_01_08a.jpg,,,,,,1966-01-08,1713480455989,false
gdsets_posters,gdsets_posters_1966_01_08 AOR 2.4 (OP cut).jpg,,Poster - 1/8/66 (OP1)AOR 2.4(cut),[],,https://gdsets.com/66posters/1966_01_08 AOR 2.4 (OP
gdsets_posters,gdsets_posters_1966_01_08m.jpg,,Poster - 1/8/66 (OHB)AOR 2.7,[],,https://gdsets.com/66posters/1966_01_08m.jpg,,,,,,1966-01-08,1713480456208,true
gdsets_posters,gdsets_posters_1966_01_08q.jpg,,Poster - 1/8/66(uncertainprovenance),[],,https://gdsets.com/66posters
gdsets_posters,gdsets_posters_1966_01_08j.jpg,,Poster - 1/8/66 (OHB)AOR 2.7,[],,https://gdsets.com/66posters/1966_01_08j.jpg,,,,,,1966-01-08,1713480456428,false
gdsets_posters,gdsets_posters_1966_01_15.jpg,,"Poster - 1/15,16/66",[],,https://gdsets.com/66posters/1966_01_15.jpg,,,,,,1966-01-15,1713480456526,false
gdsets_posters,gdsets_posters_1966_01_08o AOR 2.7 (RP).jpg,,Poster - 1/8/66 (RP)AOR 2.7,[],,https://gdsets.com/66posters/1966_01_08o AOR 2.7 
gdsets_posters,gdsets_posters_1966_01_22.jpg,,Poster - 1/22/66 @ AOR 2.40,[],,https://gdsets.com/66posters/1966_01_22.jpg,,,,,,1966-01-22,1713480456624,false
gdsets_posters,gdsets_posters_1966_01_22d.jpg,,Poster - 1/22/66,[],,https://gdsets.com/66posters/1966_01_22d.jpg,,,,,,1966-01-22,1713480456739,false
gdsets_posters,gdsets_posters_1966_01_14.jpg,,Poster - 1/14/66 (OP1)AOR 2.39,[],,https://gdsets.com/66posters/1966_01_14.jpg,,,,,,1966-01-14,1713480456846,false
gdsets_posters,gdsets_posters_1966_01_28.jpg,,"Poster - 1/28,29/66 @ Newspaper Ad",[],,https://gdsets.com/66posters/1966_01_28.jpg,,,,,,1966-01-28,1713480456871,false
gdsets_posters,gdsets_posters_1966_01_14b.jpg,,Poster - 1/14/66 (OHB)AOR 2.38,[],,https://gdsets.com/66posters/1966_01_14b.jpg,,,,,,1966-01-14,1713480456873,true
gdsets_posters,gdsets_posters_1966_01_14c.jpg,,Poster - 1/14/66 (OHB)AOR 2.38,[],,https://gdsets.com/66posters/1966_01_14c.jpg,,,,,,1966-01-14,1713480456969,true
gdsets_posters,gdsets_posters_1966_01_13.jpg,,Poster - 1/13/66,[],,https://gdsets.com/66posters/1966_01_13.jpg,,,,,,1966-01-13,1713480456969,false
gdsets_posters,gdsets_posters_1966_01_22c.jpg,,Poster - 1/22/66,[],,https://gdsets.com/66posters/1966_01_22c.jpg,,,,,,1966-01-22,1713480456980,false
gdsets_posters,gdsets_posters_1979_12_26.jpg,,Poster - 12/26-31/79 @ Postcard,[],,https://gdsets.com/76posters/1979_12_26.jpg,,,,,,1979-12-26,1713480457115,false
gdsets_posters,gdsets_posters_1966_01_22a.jpg,,Poster - 1/22/66(OHB front)AOR 2.42,[],,https://gdsets.com/66posters
gdsets_posters,gdsets_posters_1966_01_14a.jpg,,Poster - 1/14/66 (OHB)AOR 2.38,[],,https://gdsets.com/66posters/1966_01_14a.jpg,,,,,,1966-01-14,1713480457205,false
gdsets_posters,gdsets_posters_1966_01_22e.jpg,,Poster - 1/22/66 @ Program,[],,https://gdsets.com/66posters/1966_01_22e.jpg,,,,,,1966-01-22,1713480457227,false
gdsets_posters,gdsets_posters_1966_01_22b.jpg,,Poster - 1/22/66(OHB back)AOR 2.42,[],,https://gdsets.com/66posters/1966_01_22b.jpg,,,,,,1966-01-22,1713480457325,false
gdsets_posters,gdsets_posters_1966_02_12.jpg,,Poster - 2/12/66(Fake Poster),[],,https://gdsets.com/66posters/1966_02_12.jpg,,,,,,1966-02-12,1713480457439,false
gdsets_posters,gdsets_posters_1966_02_25a.jpg,,Poster - 2/25/66 @ Full Page,[],,https://gdsets.com/66posters/1966_02_25a.jpg,,,,,,1966-02-25,1713480457656,false
gdsets_posters,gdsets_posters_1966_03_12c (OHB).jpg,,Poster - 3/12/66,[],,https://gdsets.com/66posters/1966_03_12c (OHB).jpg,,,,,,1966-03-12,1713480457669,true
gdsets_posters,gdsets_posters_1966_03_19c.jpg,,Poster - 3/19/66(uncertainprovenance),[],,https://gdsets.com/66posters
gdsets_posters,gdsets_posters_1966_03_12b (OHB).jpg,,Poster - 3/12/66,[],,https://gdsets.com/66posters/1966_03_12b (OHB).jpg,,,,,,1966-03-12,1713480457937,false
gdsets_posters,gdsets_posters_1966_02_12cx.jpg,,Poster - 2/12/66 @ AOR pg. 14(GD cancelled),[],,https://gdsets.com/66posters
gdsets_posters,gdsets_posters_1966_03_19d.jpg,,Poster - 3/19/66,[],,https://gdsets.com/66posters/1966_03_19d.jpg,,,,,,1966-03-19,1713480458042,false
gdsets_posters,gdsets_posters_1966_01_08k AOR 2.7.jpg,,Poster - 1/8/66 (OHB)AOR 2.7,[],,https://gdsets.com/66posters/1966_01_08k AOR
gdsets_posters,gdsets_posters_1966_03_03.jpg,,Poster - 3/3/66 @ Newspaper Ad,[],,https://gdsets.com/66posters/1966_03_03.jpg,,,,,,1966-03-03,1713480458060,false
gdsets_posters,gdsets_posters_1966_03_25.jpg,,Poster - 3/25/66,[],,https://gdsets.com/66posters/1966_03_25.jpg,,,,,,1966-03-25,1713480458164,false
gdsets_posters,gdsets_posters_1966_03_19e.jpg,,Poster - 3/19/66(uncertainprovenance),[],,https://gdsets.com/66posters
gdsets_posters,gdsets_posters_1966_03_12a.jpg,,Poster - 3/12/66 @ Full Page,[],,https://gdsets.com/66posters/1966_03_12a.jpg,,,,,,1966-03-12,1713480458259,false
gdsets_posters,gdsets_posters_1966_03_19a.jpg,,Poster - 3/19/66 @ Full Page,[],,https://gdsets.com/66posters/1966_03_19a.jpg,,,,,,1966-03-19,1713480458372,false
gdsets_posters,gdsets_posters_1966_03_12.jpg,,Poster - 3/12/66 @ Newspaper Ad,[],,https://gdsets.com/66posters/1966_03_12.jpg,,,,,,1966-03-12,1713480458387,true
gdsets_posters,gdsets_posters_1966_03_25b.jpg,,Poster - 3/25/66,[],,https://gdsets.com/66posters/1966_03_25b.jpg,,,,,,1966-03-25,1713480458492,true
gdsets_posters,gdsets_posters_1966_03_25a.jpg,,Poster - 3/25/66,[],,https://gdsets.com/66posters/1966_03_25a.jpg,,,,,,1966-03-25,1713480458811,true
gdsets_posters,gdsets_posters_1966_03_25cc.jpg,,Poster - 3/25/66 @ Full Page,[],,https://gdsets.com/66posters/1966_03_25cc.jpg,,,,,,1966-03-25,1713480458867,false
gdsets_posters,gdsets_posters_1966_04_22d.jpg,,Poster - 4/22-24/66(OHB back)AOR 2.187,[],,https://gdsets.com/66posters
gdsets_posters,gdsets_posters_1966_04_22c.jpg,,Poster - 4/22-24/66(OHB front)AOR 2.187,[],,https://gdsets.com/66posters
gdsets_posters,gdsets_posters_1966_04_22a (AOR 2.187).jpg,,Poster - 4/22-24/66 (OP1)AOR 2.187,[],,https://gdsets.com/66posters/1966_04_22a (AOR
gdsets_posters,gdsets_posters_1966_03_25e.jpg,,Poster - 3/25/66 @ Full Page,[],,https://gdsets.com/66posters/1966_03_25e.jpg,,,,,,1966-03-25,1713480459060,false
gdsets_posters,gdsets_posters_1966_05_07a.jpg,,Poster - 5/7/66 (OHB),[],,https://gdsets.com/66posters/1966_05_07a.jpg,,,,,,1966-05-07,1713480459173,true
gdsets_posters,gdsets_posters_1966_04_22.jpg,,Poster - 4/22-24/66 (OP1)AOR 2.187,[],,https://gdsets.com/66posters/1966_04_22.jpg,,,,,,1966-04-22,1713480459177,true
gdsets_posters,gdsets_posters_1966_03_19b.jpg,,Poster - 3/19/66 @ Newspaper Ad(venue moved),[],,https://gdsets.com/66posters
gdsets_posters,gdsets_posters_1966_01_08b.jpg,,Poster - 1/8/66 (OP1)AOR 2.4(hand colored),[],,https://gdsets.com/66posters
gdsets_posters,gdsets_posters_1966_05_07b.jpg,,Poster - 5/7/66 (OHB),[],,https://gdsets.com/66posters/1966_05_07b.jpg,,,,,,1966-05-07,1713480459329,false
gdsets_posters,gdsets_posters_1966_05_07c.jpg,,Poster - 5/7/66 (OHB),[],,https://gdsets.com/66posters/1966_05_07c.jpg,,,,,,1966-05-07,1713480459329,true
gdsets_posters,gdsets_posters_1966_05_07.jpg,,Poster - 5/7/66 (OP1),[],,https://gdsets.com/66posters/1966_05_07.jpg,,,,,,1966-05-07,1713480459694,false
gdsets_posters,gdsets_posters_1966_05_14.jpg,,Poster - 5/14/66 (OHB),[],,https://gdsets.com/66posters/1966_05_14.jpg,,,,,,1966-05-14,1713480459838,false
gdsets_posters,gdsets_posters_1966_05_14c.jpg,,Poster - 5/14/66 (OHB),[],,https://gdsets.com/66posters/1966_05_14c.jpg,,,,,,1966-05-14,1713480459963,true
gdsets_posters,gdsets_posters_1966_05_07h.jpg,,Poster - 5/7/66 @ Newspaper Ad,[],,https://gdsets.com/66posters/1966_05_07h.jpg,,,,,,1966-05-07,1713480459998,false
gdsets_posters,gdsets_posters_1966_05_14f.jpg,,Poster - 5/14/66 @ Newspaper Ad,[],,https://gdsets.com/66posters/1966_05_14f.jpg,,,,,,1966-05-14,1713480460058,false
gdsets_posters,gdsets_posters_1966_05_14g.jpg,,Poster - 5/14/66 @ Newspaper Ad,[],,https://gdsets.com/66posters/1966_05_14g.jpg,,,,,,1966-05-14,1713480460071,true
gdsets_posters,gdsets_posters_1966_05_07f.jpg,,Poster - 5/7/66 (OHB),[],,https://gdsets.com/66posters/1966_05_07f.jpg,,,,,,1966-05-07,1713480460198,false
gdsets_posters,gdsets_posters_1966_02_25.jpg,,Poster - 2/25/66 @ Newspaper Ad,[],,https://gdsets.com/66posters/1966_02_25.jpg,,,,,,1966-02-25,1713480460360,true
gdsets_posters,gdsets_posters_1966_05_22a.jpg,,Poster - 5/22/66,[],,https://gdsets.com/66posters/1966_05_22a.jpg,,,,,,1966-05-22,1713480460477,false
gdsets_posters,gdsets_posters_1966_03_25d.jpg,,Poster - 3/25/66 @ Newspaper Ad,[],,https://gdsets.com/66posters/1966_03_25d.jpg,,,,,,1966-03-25,1713480460504,true
gdsets_posters,gdsets_posters_1966_05_27c FD10 Art.jpg,,"Poster - 5/27,28/66 @ FD10 @ Original Art",[],,https://gdsets.com/66posters/1966_05_27c FD10
gdsets_posters,gdsets_posters_1966_05_29 (AOR 2.148 HB).jpg,,Poster - 5/29/66 (OHB)AOR 2.148,[],,https://gdsets.com/66posters/1966_05_29 (AOR 2.148
gdsets_posters,gdsets_posters_1966_05_19.jpg,,Poster - 5/19/66 (OP1)AOR 2.16,[],,https://gdsets.com/66posters/1966_05_19.jpg,,,,,,1966-05-19,1713480460871,false
gdsets_posters,gdsets_posters_1966_04_22f.jpg,,Poster - 4/22-24/66 @ Full Page,[],,https://gdsets.com/66posters/1966_04_22f.jpg,,,,,,1966-04-22,1713480460894,false
gdsets_posters,gdsets_posters_1966_04_22e.jpg,,Poster - 4/22-24/66 @ Newspaper Ad,[],,https://gdsets.com/66posters/1966_04_22e.jpg,,,,,,1966-04-22,1713480460917,false
gdsets_posters,gdsets_posters_1966_03_19.jpg,,Poster - 3/19/66 @ Newspaper Ad(venue moved),[],,https://gdsets.com/66posters
gdsets_posters,gdsets_posters_1966_05_27.jpg,,"Poster - 5/27,28/66 @ FD10 (OP1)",[],,https://gdsets.com/66posters/1966_05_27.jpg,,,,,,1966-05-27,1713480461067,false
gdsets_posters,gdsets_posters_1966_05_22b.jpg,,Poster - 5/22/66 (OHB),[],,https://gdsets.com/66posters/1966_05_22b.jpg,,,,,,1966-05-22,1713480461121,false
gdsets_posters,gdsets_posters_1966_05_07gg.jpg,,Poster - 5/7/66 @ Full Page,[],,https://gdsets.com/66posters/1966_05_07gg.jpg,,,,,,1966-05-07,1713480461185,false
gdsets_posters,gdsets_posters_1966_05_27b.jpg,,"Poster - 5/27,28/66 @ FD10 (OHB-A)",[],,https://gdsets.com/66posters
gdsets_posters,gdsets_posters_1966_05_19b.jpg,,Poster - 5/19/66 (OHB)AOR 2.16,[],,https://gdsets.com/66posters/1966_05_19b.jpg,,,,,,1966-05-19,1713480461370,true
gdsets_posters,gdsets_posters_1966_03_25c.jpg,,Poster - 3/25/66 @ Newspaper Ad,[],,https://gdsets.com/66posters/1966_03_25c.jpg,,,,,,1966-03-25,1713480461465,true
gdsets_posters,gdsets_posters_1966_03_19f.jpg,,Poster - 3/19/66 @ Full Page,[],,https://gdsets.com/66posters/1966_03_19f.jpg,,,,,,1966-03-19,1713480461755,true
gdsets_posters,gdsets_posters_1966_06_03b.jpg,,"Poster - 6/3,4/66 @ BG9 (OHB-A)",[],,https://gdsets.com/66posters/1966_06_03b.jpg,,,,,,1966-06-03,1713480461828,true
gdsets_posters,gdsets_posters_1966_06_03c.jpg,,"Poster - 6/3,4/66 @ BG9 (RPC-B)",[],,https://gdsets.com/66posters/1966_06_03c.jpg,,,,,,1966-06-03,1713480461876,true
gdsets_posters,gdsets_posters_1966_05_29c.jpg,,Poster - 5/29/66 (OHB)AOR 2.147,[],,https://gdsets.com/66posters/1966_05_29c.jpg,,,,,,1966-05-29,1713480461880,true
gdsets_posters,gdsets_posters_1966_05_19c.jpg,,Poster - 5/19/66 (OHB)AOR 2.15,[],,https://gdsets.com/66posters/1966_05_19c.jpg,,,,,,1966-05-19,1713480461881,false
gdsets_posters,gdsets_posters_1966_06_01.jpg,,Poster - Scorpio Records Promo Poster,[],,https://gdsets.com/66posters
gdsets_posters,gdsets_posters_1966_06_07.jpg,,Poster - 6/7-9/66,[],,https://gdsets.com/66posters/1966_06_07.jpg,,,,,,1966-06-07,1713480462015,false
gdsets_posters,gdsets_posters_1966_06_03.jpg,,"Poster - 6/3,4/66 @ BG9 (OP1)",[],,https://gdsets.com/66posters/1966_06_03.jpg,,,,,,1966-06-03,1713480462122,false
gdsets_posters,gdsets_posters_1966_06_07a.jpg,,Poster - 6/7-9/66,[],,https://gdsets.com/66posters/1966_06_07a.jpg,,,,,,1966-06-07,1713480462128,true
gdsets_posters,gdsets_posters_1966_06_03a.jpg,,"Poster - 6/3,4/66 @ BG9 (OP1)",[],,https://gdsets.com/66posters/1966_06_03a.jpg,,,,,,1966-06-03,1713480462223,true
gdsets_posters,gdsets_posters_1966_06_03d.jpg,,"Poster - 6/3,4/66 @ BG9 @ Newspaper Ad",[],,https://gdsets.com/66posters
gdsets_posters,gdsets_posters_1966_06_10cc.jpg,,"Poster - 6/10,11/66 @ FD12 (OHB-A)",[],,https://gdsets.com/66posters
gdsets_posters,gdsets_posters_1966_05_29a.jpg,,Poster - 5/29/66 (OHB)AOR 2.147,[],,https://gdsets.com/66posters/1966_05_29a.jpg,,,,,,1966-05-29,1713480462464,true
gdsets_posters,gdsets_posters_1966_06_10c (OP).jpg,,"Poster - 6/10,11/66 @ FD12 (OP1)(hand colored)",[],,https://gdsets.com/66posters/1966_06_10c 
gdsets_posters,gdsets_posters_1966_06_10d FD012 Art.jpg,,"Poster - 6/10,11/66 @ FD12 @ Original Art",[],,https://gdsets.com/66posters/1966_06_10d FD012
gdsets_posters,gdsets_posters_1966_05_07g.jpg,,Poster - 5/7/66 @ Newspaper Ad,[],,https://gdsets.com/66posters/1966_05_07g.jpg,,,,,,1966-05-07,1713480462516,false
gdsets_posters,gdsets_posters_1966_06_10a (FD012).jpg,,"Poster - 6/10,11/66 @ FD12 (OP1)(hand colored)",[],,https://gdsets.com/66posters/1966_06_10a 
gdsets_posters,gdsets_posters_1966_06_17b.jpg,,"Poster - 6/17,18/66 (OHB)AOR 2.338",[],,https://gdsets.com/66posters
gdsets_posters,gdsets_posters_1966_07_03a.jpg,,Poster - 7/3/66 @ BG14 (OHB-A),[],,https://gdsets.com/66posters/1966_07_03a.jpg,,,,,,1966-07-03,1713480462746,true
gdsets_posters,gdsets_posters_1966_05_07hh.jpg,,Poster - 5/7/66 @ Full Page,[],,https://gdsets.com/66posters/1966_05_07hh.jpg,,,,,,1966-05-07,1713480462900,false
gdsets_posters,gdsets_posters_1966_05_29.jpg,,Poster - 5/29/66 (OHB)AOR 2.147,[],,https://gdsets.com/66posters/1966_05_29.jpg,,,,,,1966-05-29,1713480462988,false
gdsets_posters,gdsets_posters_1966_07_15e.jpg,,Poster - 7/15-17/66 @ BG17 @ Original Art,[],,https://gdsets.com/66posters
gdsets_posters,gdsets_posters_1966_07_03.jpg,,Poster - 7/3/66 @ BG14 (OP1),[],,https://gdsets.com/66posters/1966_07_03.jpg,,,,,,1966-07-03,1713480463191,false
gdsets_posters,gdsets_posters_1966_06_17.jpg,,"Poster - 6/17,18/66 (OP1)AOR 2.338",[],,https://gdsets.com/66posters/1966_06_17.jpg,,,,,,1966-06-17,1713480463198,true
gdsets_posters,gdsets_posters_1966_06_17a AOR 2.338.jpg,,"Poster - 6/17,18/66 (OP1)AOR 2.338",[],,https://gdsets.com/66posters/1966_06_17a AOR
gdsets_posters,gdsets_posters_1966_07_14a (OHB).jpg,,Poster - 7/14/66 (OHB)AOR 2.182,[],,https://gdsets.com/66posters/1966_07_14a 
gdsets_posters,gdsets_posters_1966_07_15a.jpg,,Poster - 7/15-17/66 @ BG17 (OHB-A),[],,https://gdsets.com/66posters/1966_07_15a.jpg,,,,,,1966-07-15,1713480463337,true
gdsets_posters,gdsets_posters_1966_07_29d.jpg,,Poster - 7/29-31/66,[],,https://gdsets.com/66posters/1966_07_29d.jpg,,,,,,1966-07-29,1713480463692,false
gdsets_posters,gdsets_posters_1966_07_29a.jpg,,Poster - 7/29-31/66(OHB front)AOR pg. 250,[],,https://gdsets.com/66posters
gdsets_posters,gdsets_posters_1966_07_15b.jpg,,Poster - 7/15-17/66 @ BG17 (RP3),[],,https://gdsets.com/66posters/1966_07_15b.jpg,,,,,,1966-07-15,1713480463692,true
gdsets_posters,gdsets_posters_1966_07_14 (OP1).jpg,,Poster - 7/14/66 (OP1)AOR 2.182,[],,https://gdsets.com/66posters/1966_07_14 
gdsets_posters,gdsets_posters_1966_07_29b.jpg,,Poster - 7/29-31/66(OHB back)AOR pg. 250,[],,https://gdsets.com/66posters
gdsets_posters,gdsets_posters_1966_07_15c.jpg,,Poster - 7/15-17/66 @ BG17 (OP1),[],,https://gdsets.com/66posters/1966_07_15c.jpg,,,,,,1966-07-15,1713480463806,true
gdsets_posters,gdsets_posters_1966_07_29.jpg,,Poster - 7/29-31/66(OP1)AOR pg. 250,[],,https://gdsets.com/66posters/1966_07_29.jpg,,,,,,1966-07-29,1713480463826,true
gdsets_posters,gdsets_posters_1966_08_05a.jpg,,Poster - 8/5/66,[],,https://gdsets.com/66posters/1966_08_05a.jpg,,,,,,1966-08-05,1713480464011,false
gdsets_posters,gdsets_posters_1966_07_15d.jpg,,Poster - 7/15-17/66 @ BG17 (OP1),[],,https://gdsets.com/66posters/1966_07_15d.jpg,,,,,,1966-07-15,1713480464040,true
gdsets_posters,gdsets_posters_1966_07_15.jpg,,Poster - 7/15-17/66 @ BG17 (OP1),[],,https://gdsets.com/66posters/1966_07_15.jpg,,,,,,1966-07-15,1713480464284,false
gdsets_posters,gdsets_posters_1966_07_03c.jpg,,Poster - 7/3/66 @ Newspaper Ad,[],,https://gdsets.com/66posters/1966_07_03c.jpg,,,,,,1966-07-03,1713480464633,true
gdsets_posters,gdsets_posters_1966_08_07b.jpg,,Poster - 8/7/66 (OHB)AOR 2.68,[],,https://gdsets.com/66posters/1966_08_07b.jpg,,,,,,1966-08-07,1713480464667,true
gdsets_posters,gdsets_posters_1966_08_05.jpg,,Poster - 8/5/66,[],,https://gdsets.com/66posters/1966_08_05.jpg,,,,,,1966-08-05,1713480464945,false
gdsets_posters,gdsets_posters_1966_07_03cc.jpg,,Poster - 7/3/66 @ Full Page,[],,https://gdsets.com/66posters/1966_07_03cc.jpg,,,,,,1966-07-03,1713480465007,false
gdsets_posters,gdsets_posters_1966_08_07c (OHB).jpg,,Poster - 8/7/66 (OHB)AOR 2.68,[],,https://gdsets.com/66posters/1966_08_07c 
gdsets_posters,gdsets_posters_1966_08_12c.jpg,,"Poster - 8/12,13/66 @ BG23 (RPC-B)",[],,https://gdsets.com/66posters
gdsets_posters,gdsets_posters_1966_08_19c.jpg,,Poster - 8/19/66 @ FD22 @ Original Art,[],,https://gdsets.com/66posters
gdsets_posters,gdsets_posters_1966_08_26.jpg,,Poster - 8/26-28/66 (OHB)AOR 2.186,[],,https://gdsets.com/66posters/1966_08_26.jpg,,,,,,1966-08-26,1713480465053,true
gdsets_posters,gdsets_posters_1966_08_07d.jpg,,Poster - 8/7/66 (OHB)AOR 2.68 @ Red Variant,[],,https://gdsets.com/66posters
gdsets_posters,gdsets_posters_1966_08_07a.jpg,,Poster - 8/7/66 (OP1)AOR 2.68,[],,https://gdsets.com/66posters/1966_08_07a.jpg,,,,,,1966-08-07,1713480465151,false
gdsets_posters,gdsets_posters_1966_08_07e.jpg,,Poster - 8/7/66 (OHB)AOR 2.68,[],,https://gdsets.com/66posters/1966_08_07e.jpg,,,,,,1966-08-07,1713480465161,true
gdsets_posters,gdsets_posters_1966_06_03dd.jpg,,"Poster - 6/3,4/66 @ BG9 @ Full Page",[],,https://gdsets.com/66posters
gdsets_posters,gdsets_posters_1966_08_12d.jpg,,"Poster - 8/12,13/66 @ BG23 (OP1)",[],,https://gdsets.com/66posters/1966_08_12d.jpg,,,,,,1966-08-12,1713480465376,true
gdsets_posters,gdsets_posters_1966_08_19b.jpg,,Poster - 8/19/66 @ FD22 (OHB-A),[],,https://gdsets.com/66posters/1966_08_19b.jpg,,,,,,1966-08-19,1713480465474,true
gdsets_posters,gdsets_posters_1966_08_12a.jpg,,"Poster - 8/12,13/66 @ BG23 (RP2)",[],,https://gdsets.com/66posters/1966_08_12a.jpg,,,,,,1966-08-12,1713480465475,true
gdsets_posters,gdsets_posters_1966_08_26b.jpg,,Poster - 8/26-28/66 @ AOR 2.186 @ Program,[],,https://gdsets.com/66posters
gdsets_posters,gdsets_posters_1966_08_26a.jpg,,Poster - 8/26-28/66 (OHB)AOR 2.186,[],,https://gdsets.com/66posters/1966_08_26a.jpg,,,,,,1966-08-26,1713480465563,false
gdsets_posters,gdsets_posters_1966_08_12.jpg,,"Poster - 8/12,13/66 @ BG23 (OP1)",[],,https://gdsets.com/66posters/1966_08_12.jpg,,,,,,1966-08-12,1713480465770,false
gdsets_posters,gdsets_posters_1966_08_12b.jpg,,"Poster - 8/12,13/66 @ BG23 (OHB-A)",[],,https://gdsets.com/66posters
gdsets_posters,gdsets_posters_1966_06_10.jpg,,"Poster - 6/10,11/66 @ FD12 (OP1)",[],,https://gdsets.com/66posters/1966_06_10.jpg,,,,,,1966-06-10,1713480466036,true
gdsets_posters,gdsets_posters_1966_09_04a.jpg,,Poster - 9/4/66 @ BG26 (OHB),[],,https://gdsets.com/66posters/1966_09_04a.jpg,,,,,,1966-09-04,1713480466132,true
gdsets_posters,gdsets_posters_1966_08_19.jpg,,Poster - 8/19/66 @ FD22 (OP1),[],,https://gdsets.com/66posters/1966_08_19.jpg,,,,,,1966-08-19,1713480466136,false
gdsets_posters,gdsets_posters_1966_09_04.jpg,,Poster - 9/4/66 @ BG26 (OP1),[],,https://gdsets.com/66posters/1966_09_04.jpg,,,,,,1966-09-04,1713480466139,false
gdsets_posters,gdsets_posters_1966_09_16ff FD026 (RP2) blue.jpg,,"Poster - 9/16,17/66 @ FD26 (RP2)Blue Ink Pass",[],,https://gdsets.com/66posters/1966_09_16ff FD026 
gdsets_posters,gdsets_posters_1966_08_19a (FD022 OHB).jpg,,Poster - 8/19/66 @ FD22 (OHB-A),[],,https://gdsets.com/66posters/1966_08_19a (FD022
gdsets_posters,gdsets_posters_1966_09_16 (FD026 OP1).jpg,,"Poster - 9/16,17/66 @ FD26 (OP1)",[],,https://gdsets.com/66posters/1966_09_16 (FD026
gdsets_posters,gdsets_posters_1966_09_16c (FD026 RP2).jpg,,"Poster - 9/16,17/66 @ FD26 (RP2)",[],,https://gdsets.com/66posters/1966_09_16c (FD026
gdsets_posters,gdsets_posters_1966_09_16f FD026 (RP2) red.jpg,,"Poster - 9/16,17/66 @ FD26 (RP2)Red Ink Pass",[],,https://gdsets.com/66posters/1966_09_16f FD026 (RP2)
gdsets_posters,gdsets_posters_1966_09_04c.jpg,,Poster - 9/4/66 @ BG26 (RP4),[],,https://gdsets.com/66posters/1966_09_04c.jpg,,,,,,1966-09-04,1713480466668,true
gdsets_posters,gdsets_posters_1966_09_16aa (FD026 OP1).jpg,,"Poster - 9/16,17/66 @ FD26 (OP1)",[],,https://gdsets.com/66posters/1966_09_16aa (FD026
gdsets_posters,gdsets_posters_1966_09_04d.jpg,,Poster - 9/4/66 @ BG26 (OP2),[],,https://gdsets.com/66posters/1966_09_04d.jpg,,,,,,1966-09-04,1713480466807,true
gdsets_posters,gdsets_posters_1966_09_16a (FD026 OP1).jpg,,"Poster - 9/16,17/66 @ FD26 (OP1)",[],,https://gdsets.com/66posters/1966_09_16a (FD026
gdsets_posters,gdsets_posters_1966_09_04b.jpg,,Poster - 9/4/66 @ BG26 (RPC-D),[],,https://gdsets.com/66posters/1966_09_04b.jpg,,,,,,1966-09-04,1713480466952,true
gdsets_posters,gdsets_posters_1966_09_16 (FD026 OA).jpg,,"Poster - 9/16,17/66 @ FD26 Original Art",[],,https://gdsets.com/66posters/1966_09_16 (FD026
gdsets_posters,gdsets_posters_1966_09_11.jpg,,Poster - 9/11/66 (OHB)AOR 2.74,[],,https://gdsets.com/66posters/1966_09_11.jpg,,,,,,1966-09-11,1713480467167,false
gdsets_posters,gdsets_posters_1966_09_16b (FD026 OHB).jpg,,"Poster - 9/16,17/66 @ FD26 (OHB-A)",[],,https://gdsets.com/66posters/1966_09_16b (FD026
gdsets_posters,gdsets_posters_1966_09_16i FD026 (RP2) colored.jpg,,"Poster - 9/16,17/66 @ FD26 (RP2)Black Ink Pass(hand colored)",[],,https://gdsets.com/66posters
gdsets_posters,gdsets_posters_1966_09_23a.jpg,,"Poster - 9/23,24/66 (OP1)AOR 2.184",[],,https://gdsets.com/66posters
gdsets_posters,gdsets_posters_1966_09_23.jpg,,"Poster - 9/23,24/66 (OP1)Slipsheet AOR 2.184",[],,https://gdsets.com/66posters
gdsets_posters,gdsets_posters_1966_10_06.jpg,,Poster - 10/6/66,[],,https://gdsets.com/66posters/1966_10_06.jpg,,,,,,1966-10-06,1713480467780,false
gdsets_posters,gdsets_posters_1966_09_23b (OHB).jpg,,"Poster - 9/23,24/66 (OHB)AOR 2.184",[],,https://gdsets.com/66posters/1966_09_23b 
gdsets_posters,gdsets_posters_1966_10_08x.jpg,,Poster - 10/8/66 @ Original Art AOR 2.325,[],,https://gdsets.com/66posters
gdsets_posters,gdsets_posters_1966_10_01a AOR 2.188a.jpg,,Poster - 10/1/66 (OP1)AOR 2.188,[],,https://gdsets.com/66posters/1966_10_01a AOR
gdsets_posters,gdsets_posters_1966_09_16ff FD026 (RP2) black-blue.jpg,,"Poster - 9/16,17/66 @ FD26 (RP2)Black/Blue Ink Pass",[],,https://gdsets.com/66posters
gdsets_posters,gdsets_posters_1966_10_01.jpg,,Poster - 10/1/66 (OHB),[],,https://gdsets.com/66posters/1966_10_01.jpg,,,,,,1966-10-01,1713480468057,false
gdsets_posters,gdsets_posters_1966_10_07.jpg,,"Poster - 10/7""",[],,https://gdsets.com/66posters/1966_10_07.jpg,,,,,,1966-10-07,1713480468057,true
gdsets_posters,gdsets_posters_1966_10_07b.jpg,,"Poster - 10/7,8/66 @ BG30 (OHB-B)",[],,https://gdsets.com/66posters/1966_10_07b.jpg,,,,,,1966-10-07,1713480468239,true
gdsets_posters,gdsets_posters_1966_10_07a.jpg,,"Poster - 10/7,8/66 @ BG30 (OHB-A)",[],,https://gdsets.com/66posters/1966_10_07a.jpg,,,,,,1966-10-07,1713480468468,true
gdsets_posters,gdsets_posters_1966_10_08.jpg,,Poster - 10/8/66 (OP1)AOR 2.325,[],,https://gdsets.com/66posters/1966_10_08.jpg,,,,,,1966-10-08,1713480468490,false
gdsets_posters,gdsets_posters_1966_09_16x.jpg,,"Poster - 9/16,17/66 @ FD26 (RP2)Black/Red Ink Pass",[],,https://gdsets.com/66posters
gdsets_posters,gdsets_posters_1966_09_16m.jpg,,"Poster - 9/16,17/66 @ FD26 (Stanley Mousehand colored)",[],,https://gdsets.com/66posters
gdsets_posters,gdsets_posters_1966_09_16k (FD026 RP3).jpg,,"Poster - 9/16,17/66 @ FD26 (RP3)",[],,https://gdsets.com/66posters/1966_09_16k (FD026
gdsets_posters,gdsets_posters_1966_10_07c.jpg,,"Poster - 10/7,8/66 @ BG30 (RPC-C)",[],,https://gdsets.com/66posters/1966_10_07c.jpg,,,,,,1966-10-07,1713480468796,true
gdsets_posters,gdsets_posters_1966_10_08a.jpg,,Poster - 10/8/66 (OP1)AOR 2.327,[],,https://gdsets.com/66posters/1966_10_08a.jpg,,,,,,1966-10-08,1713480468807,true
gdsets_posters,gdsets_posters_1966_10_15a.jpg,,Poster - 10/15/66 @ Newspaper Ad,[],,https://gdsets.com/66posters/1966_10_15a.jpg,,,,,,1966-10-15,1713480468812,false
gdsets_posters,gdsets_posters_1966_10_08f.jpg,,Poster - 10/8/66 (RP2)AOR 2.325,[],,https://gdsets.com/66posters/1966_10_08f.jpg,,,,,,1966-10-08,1713480468901,true
gdsets_posters,gdsets_posters_1966_10_08e.jpg,,Poster - 10/8/66 (OHB)AOR 2.326,[],,https://gdsets.com/66posters/1966_10_08e.jpg,,,,,,1966-10-08,1713480469010,true
gdsets_posters,gdsets_posters_1966_10_14.jpg,,Poster - 10/14/66 @ Newspaper Ad,[],,https://gdsets.com/66posters/1966_10_14.jpg,,,,,,1966-10-14,1713480469117,false
gdsets_posters,gdsets_posters_1966_10_08b.jpg,,Poster - 10/8/66 (OHB)AOR 2.325,[],,https://gdsets.com/66posters/1966_10_08b.jpg,,,,,,1966-10-08,1713480469125,true
gdsets_posters,gdsets_posters_1966_10_16a.jpg,,Poster - 10/16/66,[],,https://gdsets.com/66posters/1966_10_16a.jpg,,,,,,1966-10-16,1713480469337,false
gdsets_posters,gdsets_posters_1966_10_15.jpg,,Poster - 10/15/66 (OP1),[],,https://gdsets.com/66posters/1966_10_15.jpg,,,,,,1966-10-15,1713480469390,true
gdsets_posters,gdsets_posters_1966_10_16.jpg,,Poster - 10/16/66 @ AOR 2.244,[],,https://gdsets.com/66posters/1966_10_16.jpg,,,,,,1966-10-16,1713480469442,false
gdsets_posters,gdsets_posters_1966_10_08d.jpg,,Poster - 10/8/66 (OHB)AOR 2.326,[],,https://gdsets.com/66posters/1966_10_08d.jpg,,,,,,1966-10-08,1713480469483,true
gdsets_posters,gdsets_posters_1966_10_08c.jpg,,Poster - 10/8/66 (OHB)AOR 2.325,[],,https://gdsets.com/66posters/1966_10_08c.jpg,,,,,,1966-10-08,1713480469488,true
gdsets_posters,gdsets_posters_1966_10_23.jpg,,Poster - 10/23/66,[],,https://gdsets.com/66posters/1966_10_23.jpg,,,,,,1966-10-23,1713480469523,false
gdsets_posters,gdsets_posters_1966_10_21c.jpg,,"Poster - 10/21,22/66 @ BG32 (RP5)",[],,https://gdsets.com/66posters/1966_10_21c.jpg,,,,,,1966-10-21,1713480469537,true
gdsets_posters,gdsets_posters_1966_10_08aa.jpg,,Poster - 10/8/66 (OP1)AOR 2.327,[],,https://gdsets.com/66posters/1966_10_08aa.jpg,,,,,,1966-10-08,1713480469573,true
gdsets_posters,gdsets_posters_1966_10_21d.jpg,,"Poster - 10/21,22/66 @ Newspaper Ad",[],,https://gdsets.com/66posters
gdsets_posters,gdsets_posters_1966_10_23c.jpg,,Poster - 10/23/66,[],,https://gdsets.com/66posters/1966_10_23c.jpg,,,,,,1966-10-23,1713480469717,false
gdsets_posters,gdsets_posters_1966_10_15b.jpg,,Poster - 10/15/66 (OP1),[],,https://gdsets.com/66posters/1966_10_15b.jpg,,,,,,1966-10-15,1713480469718,false
gdsets_posters,gdsets_posters_1966_10_31.jpg,,Poster - 10/31/66 (OP1)AOR 2.143,[],,https://gdsets.com/66posters/1966_10_31.jpg,,,,,,1966-10-31,1713480469820,false
gdsets_posters,gdsets_posters_1966_10_21.jpg,,"Poster - 10/21,22/66 @ BG32 (OP1)",[],,https://gdsets.com/66posters/1966_10_21.jpg,,,,,,1966-10-21,1713480469910,false
gdsets_posters,gdsets_posters_1966_10_21b.jpg,,"Poster - 10/21,22/66 @ BG32 (RPC-A)",[],,https://gdsets.com/66posters
gdsets_posters,gdsets_posters_1966_10_21a.jpg,,"Poster - 10/21,22/66 @ BG32 (OHB)",[],,https://gdsets.com/66posters/1966_10_21a.jpg,,,,,,1966-10-21,1713480470042,true
gdsets_posters,gdsets_posters_1966_10_31jg.jpg,,Poster - 10/31/66 @ Jerry Garcia Diploma,[],,https://gdsets.com/66posters
gdsets_posters,gdsets_posters_1966_10_08h.jpg,,Poster - 10/8/66 @ Full Page,[],,https://gdsets.com/66posters/1966_10_08h.jpg,,,,,,1966-10-08,1713480470393,false
gdsets_posters,gdsets_posters_1966_10_31mg.jpg,,Poster - 10/31/66 @ Mountain Girl Diploma,[],,https://gdsets.com/66posters
gdsets_posters,gdsets_posters_1966_11_04c.jpg,,"Poster - 11/4,5/66 @ Newspaper Ad",[],,https://gdsets.com/66posters
gdsets_posters,gdsets_posters_1966_10_31bb.jpg,,Poster - 10/31/66 @ Test Pressing,[],,https://gdsets.com/66posters/1966_10_31bb.jpg,,,,,,1966-10-31,1713480470606,true
gdsets_posters,gdsets_posters_1966_10_31lq.jpg,,Poster - 10/31/66 @ Lee Quanstrom Diploma,[],,https://gdsets.com/66posters
gdsets_posters,gdsets_posters_1966_11_12b.jpg,,Poster - 11/12/66 (OP1)AOR 2.247(possible GDappearance),[],,https://gdsets.com/66posters
gdsets_posters,gdsets_posters_1966_11_04a.jpg,,"Poster - 11/4,5/66 @ FD33 (OHB)",[],,https://gdsets.com/66posters/1966_11_04a.jpg,,,,,,1966-11-04,1713480471092,true
gdsets_posters,gdsets_posters_1966_11_12.jpg,,Poster - 11/12/66 (OP1)AOR 2.185,[],,https://gdsets.com/66posters/1966_11_12.jpg,,,,,,1966-11-12,1713480471092,true
gdsets_posters,gdsets_posters_1966_11_12a (OHB).jpg,,Poster - 11/12/66 (OHB)AOR 2.185,[],,https://gdsets.com/66posters/1966_11_12a 
gdsets_posters,gdsets_posters_1966_11_04b.jpg,,"Poster - 11/4,5/66 @ FD33 (OP3)",[],,https://gdsets.com/66posters/1966_11_04b.jpg,,,,,,1966-11-04,1713480471111,true
gdsets_posters,gdsets_posters_1966_11_13.jpg,,Poster - 11/13/66 (OP1)AOR 2.181,[],,https://gdsets.com/66posters/1966_11_13.jpg,,,,,,1966-11-13,1713480471188,true
gdsets_posters,gdsets_posters_1966_10_09.jpg,,Poster - 10/9/66 (OHB),[],,https://gdsets.com/66posters/1966_10_09.jpg,,,,,,1966-10-09,1713480471218,false
gdsets_posters,gdsets_posters_1966_10_31d.jpg,,Poster - 10/31/66,[],,https://gdsets.com/66posters/1966_10_31d.jpg,,,,,,1966-10-31,1713480471271,true
gdsets_posters,gdsets_posters_1966_11_04.jpg,,"Poster - 11/4,5/66 @ FD33 (OP1)",[],,https://gdsets.com/66posters/1966_11_04.jpg,,,,,,1966-11-04,1713480471314,false
gdsets_posters,gdsets_posters_1966_10_08g.jpg,,Poster - 10/8/66 @ Newspaper Ad,[],,https://gdsets.com/66posters/1966_10_08g.jpg,,,,,,1966-10-08,1713480471426,true
gdsets_posters,gdsets_posters_1966_11_18a.jpg,,"Poster - 11/18,19/66 @ BG38 (OHB-A)",[],,https://gdsets.com/66posters
gdsets_posters,gdsets_posters_1966_11_13b.jpg,,Poster - 11/13/66(OHB back)AOR 2.181,[],,https://gdsets.com/66posters
gdsets_posters,gdsets_posters_1966_11_13a.jpg,,Poster - 11/13/66(OHB front)AOR 2.181,[],,https://gdsets.com/66posters
gdsets_posters,gdsets_posters_1966_11_20a OHB.jpg,,Poster - 11/20/66 (OHB)AOR 2.70,[],,https://gdsets.com/66posters/1966_11_20a
gdsets_posters,gdsets_posters_1966_11_12b (AOR 2.185 RP2).jpg,,Poster - 11/12/66 (RP2)AOR 2.185,[],,https://gdsets.com/66posters/1966_11_12b (AOR 2.185
gdsets_posters,gdsets_posters_1966_11_20c (AOR 2.70 OHB).jpg,,Poster - 11/20/66 (OHB)AOR 2.70 @ Green Variant,[],,https://gdsets.com/66posters/1966_11_20c (AOR 2.70
gdsets_posters,gdsets_posters_1966_11_20b OHB red.jpg,,Poster - 11/20/66 (OHB)AOR 2.70 @ Brown Variant,[],,https://gdsets.com/66posters/1966_11_20b OHB
gdsets_posters,gdsets_posters_1966_11_20d.jpg,,Poster - 11/20/66 @ Newspaper Ad,[],,https://gdsets.com/66posters/1966_11_20d.jpg,,,,,,1966-11-20,1713480472289,true
gdsets_posters,gdsets_posters_1966_11_20a.jpg,,Poster - 11/20/66 (OP1)AOR 2.70,[],,https://gdsets.com/66posters/1966_11_20a.jpg,,,,,,1966-11-20,1713480472419,true
gdsets_posters,gdsets_posters_1966_12_02a.jpg,,Poster - 12/2/66 @ Red Only,[],,https://gdsets.com/66posters/1966_12_02a.jpg,,,,,,1966-12-02,1713480472445,false
gdsets_posters,gdsets_posters_1966_11_18.jpg,,"Poster - 11/18,19/66 @ BG38 (OP2)",[],,https://gdsets.com/66posters/1966_11_18.jpg,,,,,,1966-11-18,1713480472582,false
gdsets_posters,gdsets_posters_1966_10_31c.jpg,,Poster - 10/31/66,[],,https://gdsets.com/66posters/1966_10_31c.jpg,,,,,,1966-10-31,1713480472589,false
gdsets_posters,gdsets_posters_1966_11_18b.jpg,,"Poster - 11/18,19/66 @ BG38 (RPC-B)",[],,https://gdsets.com/66posters
gdsets_posters,gdsets_posters_1966_10_31a.jpg,,Poster - 10/31/66 (OHB)AOR 2.143,[],,https://gdsets.com/66posters/1966_10_31a.jpg,,,,,,1966-10-31,1713480472682,true
gdsets_posters,gdsets_posters_1966_12_02b.jpg,,Poster - 12/2/66,[],,https://gdsets.com/66posters/1966_12_02b.jpg,,,,,,1966-12-02,1713480472682,false
gdsets_posters,gdsets_posters_1966_11_20aa.jpg,,Poster - 11/20/66 (OHB)AOR 2.70,[],,https://gdsets.com/66posters/1966_11_20aa.jpg,,,,,,1966-11-20,1713480472691,false
gdsets_posters,gdsets_posters_1966_12_02.jpg,,Poster - 12/2/66,[],,https://gdsets.com/66posters/1966_12_02.jpg,,,,,,1966-12-02,1713480472812,false
gdsets_posters,gdsets_posters_1966_11_20.jpg,,Poster - 11/20/66 (OP1)AOR 2.70,[],,https://gdsets.com/66posters/1966_11_20.jpg,,,,,,1966-11-20,1713480473030,true
gdsets_posters,gdsets_posters_1966_11_28 (AOR 2.108).jpg,,Poster - 11/28-12/1/66 (OP1)AOR 2.108,[],,https://gdsets.com/66posters/1966_11_28 (AOR
gdsets_posters,gdsets_posters_1966_12_09a.jpg,,Poster - 12/9-11/66 @ BG41 (OHB-A),[],,https://gdsets.com/66posters/1966_12_09a.jpg,,,,,,1966-12-09,1713480473328,true
gdsets_posters,gdsets_posters_1966_12_21.jpg,,Poster - 12/21/66 (OHB),[],,https://gdsets.com/66posters/1966_12_21.jpg,,,,,,1966-12-21,1713480473396,false
gdsets_posters,gdsets_posters_1966_12_09.jpg,,Poster - 12/9-11/66 @ BG41 (OP1),[],,https://gdsets.com/66posters/1966_12_09.jpg,,,,,,1966-12-09,1713480473446,false
gdsets_posters,gdsets_posters_1966_12_20a.jpg,,Poster - 12/20/66 @ BG43 (OHB-A),[],,https://gdsets.com/66posters/1966_12_20a.jpg,,,,,,1966-12-20,1713480473556,false
gdsets_posters,gdsets_posters_1966_11_20 (OP1).jpg,,Poster - 11/20/66 (OP1)AOR 2.70,[],,https://gdsets.com/66posters/1966_11_20 
gdsets_posters,gdsets_posters_1966_12_02c.jpg,,Poster - 12/2/66 @ Newspaper Ad,[],,https://gdsets.com/66posters/1966_12_02c.jpg,,,,,,1966-12-02,1713480473677,false
gdsets_posters,gdsets_posters_1966_12_21a.jpg,,Poster - 12/21/66 (OP1),[],,https://gdsets.com/66posters/1966_12_21a.jpg,,,,,,1966-12-21,1713480473738,true
gdsets_posters,gdsets_posters_1966_12_21b.jpg,,Poster - 12/21/66(original art),[],,https://gdsets.com/66posters/1966_12_21b.jpg,,,,,,1966-12-21,1713480473855,false
gdsets_posters,gdsets_posters_1966_12_20d.jpg,,Poster - 12/20/66 @ Newspaper Ad,[],,https://gdsets.com/66posters/1966_12_20d.jpg,,,,,,1966-12-20,1713480473855,false
gdsets_posters,gdsets_posters_1966_12_09b.jpg,,Poster - 12/9-11/66 @ BG41 (RPC-D),[],,https://gdsets.com/66posters/1966_12_09b.jpg,,,,,,1966-12-09,1713480473974,true
gdsets_posters,gdsets_posters_1966_12_23d.jpg,,"Poster - 12/23,24/66 @ Newspaper Ad",[],,https://gdsets.com/66posters
gdsets_posters,gdsets_posters_1966_12_20aa.jpg,,Poster - 12/20/66 @ BG43 (OPC-C),[],,https://gdsets.com/66posters/1966_12_20aa.jpg,,,,,,1966-12-20,1713480474078,true
gdsets_posters,gdsets_posters_1966_12_23b.jpg,,"Poster - 12/23,24/66 @ Newspaper Ad",[],,https://gdsets.com/66posters
gdsets_posters,gdsets_posters_1966_12_09c.jpg,,Poster - 12/9-11/66 @ BG41 (OP1),[],,https://gdsets.com/66posters/1966_12_09c.jpg,,,,,,1966-12-09,1713480474241,true
gdsets_posters,gdsets_posters_1966_10_31b.jpg,,Poster - 10/31/66 @ Newspaper Ad,[],,https://gdsets.com/66posters/1966_10_31b.jpg,,,,,,1966-10-31,1713480474349,true
gdsets_posters,gdsets_posters_1966_12_23c.jpg,,"Poster - 12/23,24/66 @ Newspaper Ad",[],,https://gdsets.com/66posters
gdsets_posters,gdsets_posters_1966_12_20.jpg,,Poster - 12/20/66 @ BG43 (OP1),[],,https://gdsets.com/66posters/1966_12_20.jpg,,,,,,1966-12-20,1713480474488,true
gdsets_posters,gdsets_posters_1966_10_31bbb.jpg,,Poster - 10/31/66 @ Full Page,[],,https://gdsets.com/66posters/1966_10_31bbb.jpg,,,,,,1966-10-31,1713480474558,false
gdsets_posters,gdsets_posters_1966_12_23a.jpg,,"Poster - 12/23,24/66 @ FD40 (OHB)",[],,https://gdsets.com/66posters/1966_12_23a.jpg,,,,,,1966-12-23,1713480474650,true
gdsets_posters,gdsets_posters_1966_12_28a.jpg,,Poster - 12/28/66 (OP1)AOR 3.13,[],,https://gdsets.com/66posters/1966_12_28a.jpg,,,,,,1966-12-28,1713480474676,false
gdsets_posters,gdsets_posters_1966_12_28b.jpg,,Poster - 12/28/66 @ Newspaper Ad,[],,https://gdsets.com/66posters/1966_12_28b.jpg,,,,,,1966-12-28,1713480474816,false
gdsets_posters,gdsets_posters_1966_12_30a.jpg,,"Poster - 12/30,31/66 @ BG37 (OHB)",[],,https://gdsets.com/66posters/1966_12_30a.jpg,,,,,,1966-12-30,1713480474875,true
gdsets_posters,gdsets_posters_1966_12_29.jpg,,Poster - 12/29/66 (OHB),[],,https://gdsets.com/66posters/1966_12_29.jpg,,,,,,1966-12-29,1713480474900,false
gdsets_posters,gdsets_posters_1966_12_31d.jpg,,Poster - Trade Paper Ad,[],,https://gdsets.com/66posters/1966_12_31d.jpg,,,,,,1966-12-31,1713480474907,false
gdsets_posters,gdsets_posters_1966_12_31c.jpg,,Poster - Mnasidika Ad,[],,https://gdsets.com/66posters/1966_12_31c.jpg,,,,,,1966-12-31,1713480475080,false
gdsets_posters,gdsets_posters_1966_12_28.jpg,,Poster - 12/28/66 (OP1)AOR 3.14,[],,https://gdsets.com/66posters/1966_12_28.jpg,,,,,,1966-12-28,1713480475229,false
gdsets_posters,gdsets_posters_1967_01_13a (BG045 RP4).jpg,,"Poster - 1/13,14/67 @ BG45 (RP4)",[],,https://gdsets.com/66posters/1967_01_13a (BG045
gdsets_posters,gdsets_posters_1966_12_20b.jpg,,Poster - 12/20/66 (OHB)AOR 2.44,[],,https://gdsets.com/66posters/1966_12_20b.jpg,,,,,,1966-12-20,1713480475249,false
gdsets_posters,gdsets_posters_1966_12_30b.jpg,,"Poster - 12/30,31/66 @ BG37 (RPC-D)",[],,https://gdsets.com/66posters
gdsets_posters,gdsets_posters_1966_12_29a.jpg,,Poster - 12/29/66 (OP1)AOR 2.313,[],,https://gdsets.com/66posters/1966_12_29a.jpg,,,,,,1966-12-29,1713480475447,false
gdsets_posters,gdsets_posters_1967_01_13c.jpg,,"Poster - 1/13,14/67 @ BG45 (OHB-A)Variant",[],,https://gdsets.com/66posters
gdsets_posters,gdsets_posters_1966_12_30e.jpg,,"Poster - 12/30,31/66 @ BG37 (RP2)",[],,https://gdsets.com/66posters/1966_12_30e.jpg,,,,,,1966-12-30,1713480475638,true
gdsets_posters,gdsets_posters_1966_12_23.jpg,,"Poster - 12/23,24/66 @ FD40 (OP1)",[],,https://gdsets.com/66posters/1966_12_23.jpg,,,,,,1966-12-23,1713480475854,false
gdsets_posters,gdsets_posters_1966_12_30.jpg,,"Poster - 12/30,31/66 @ BG37 (OP1)",[],,https://gdsets.com/66posters/1966_12_30.jpg,,,,,,1966-12-30,1713480475887,false
gdsets_posters,gdsets_posters_1967_01_13b.jpg,,"Poster - 1/13,14/67 @ BG45 (OHB-A)",[],,https://gdsets.com/66posters
gdsets_posters,gdsets_posters_1967_01_13d.jpg,,"Poster - 1/13,14/67 @ BG45 (OPC-C)",[],,https://gdsets.com/66posters
gdsets_posters,gdsets_posters_1966_12_30c.jpg,,"Poster - 12/30,31/66 @ Newspaper Ad",[],,https://gdsets.com/66posters
gdsets_posters,gdsets_posters_1967_01_13 (BG045).jpg,,"Poster - 1/13,14/67 @ BG45 (OP2)",[],,https://gdsets.com/66posters/1967_01_13 
gdsets_posters,gdsets_posters_1967_01_14j (OHB).jpg,,Poster - 1/14/67 (OHB),[],,https://gdsets.com/66posters/1967_01_14j (OHB).jpg,,,,,,1967-01-14,1713480476305,false
gdsets_posters,gdsets_posters_1967_01_14e.jpg,,Poster - 1/14/67 (OHB)AOR 2.217,[],,https://gdsets.com/66posters/1967_01_14e.jpg,,,,,,1967-01-14,1713480476409,true
gdsets_posters,gdsets_posters_1967_01_14k.jpg,,Poster - 1/14/67 (OHB),[],,https://gdsets.com/66posters/1967_01_14k.jpg,,,,,,1967-01-14,1713480476672,true
gdsets_posters,gdsets_posters_1967_01_14n.jpg,,Poster - 1/14/67 (OHB)AOR 2.216,[],,https://gdsets.com/66posters/1967_01_14n.jpg,,,,,,1967-01-14,1713480476692,true
gdsets_posters,gdsets_posters_1967_01_14.jpg,,Poster - 1/14/67 (OP1)AOR 2.215,[],,https://gdsets.com/66posters/1967_01_14.jpg,,,,,,1967-01-14,1713480476696,true
gdsets_posters,gdsets_posters_1967_01_14b (AOR 2.215 RP2).jpg,,Poster - 1/14/67 (RP2)AOR 2.215,[],,https://gdsets.com/66posters/1967_01_14b (AOR 2.215
gdsets_posters,gdsets_posters_1967_01_14x.jpg,,Poster - 1/14/67 (OHB)AOR 2.216,[],,https://gdsets.com/66posters/1967_01_14x.jpg,,,,,,1967-01-14,1713480476799,false
gdsets_posters,gdsets_posters_1967_01_14c (AOR 2.215 RP3).jpg,,Poster - 1/14/67 (RP3)AOR 2.215,[],,https://gdsets.com/66posters/1967_01_14c (AOR 2.215
gdsets_posters,gdsets_posters_1967_01_14m.jpg,,Poster - 1/14/67 (OHB)AOR 2.216,[],,https://gdsets.com/66posters/1967_01_14m.jpg,,,,,,1967-01-14,1713480476962,true
gdsets_posters,gdsets_posters_1967_01_14o.jpg,,Poster - 1/14/67 (OHB)AOR 2.216(map variant),[],,https://gdsets.com/66posters
gdsets_posters,gdsets_posters_1967_01_14d (AOR 2.217 OP).jpg,,Poster - 1/14/67 (OP1)AOR 2.217,[],,https://gdsets.com/66posters/1967_01_14d (AOR 2.217
gdsets_posters,gdsets_posters_1967_01_27c.jpg,,"Poster - 1/27,28/67 @ FD45 Original Art",[],,https://gdsets.com/66posters
gdsets_posters,gdsets_posters_1967_01_14p.jpg,,Poster - 1/14/67 (OHB)AOR 2.216(map variant),[],,https://gdsets.com/66posters
gdsets_posters,gdsets_posters_1967_01_27.jpg,,"Poster - 1/27,28/67 @ FD45 (OP1)",[],,https://gdsets.com/66posters/1967_01_27.jpg,,,,,,1967-01-27,1713480477216,true
gdsets_posters,gdsets_posters_1967_01_06.jpg,,Poster - 1/6/67,[],,https://gdsets.com/66posters/1967_01_06.jpg,,,,,,1967-01-06,1713480477302,false
gdsets_posters,gdsets_posters_1967_01_27b.jpg,,"Poster - 1/27,28/67 @ FD45 (OPC-A)",[],,https://gdsets.com/66posters
gdsets_posters,gdsets_posters_1967_01_14kk.jpg,,Poster - 1/14/67 (OHB),[],,https://gdsets.com/66posters/1967_01_14kk.jpg,,,,,,1967-01-14,1713480477415,true
gdsets_posters,gdsets_posters_1967_01_27d.jpg,,"Poster - 1/27,28/67 @ Newspaper Ad",[],,https://gdsets.com/66posters
gdsets_posters,gdsets_posters_1967_01_14l.jpg,,Poster - 1/14/67 (OHB)AOR 2.216,[],,https://gdsets.com/66posters/1967_01_14l.jpg,,,,,,1967-01-14,1713480477714,false
gdsets_posters,gdsets_posters_1967_01_14dd.jpg,,Poster - 1/14/67 (OHB)AOR 2.217,[],,https://gdsets.com/66posters/1967_01_14dd.jpg,,,,,,1967-01-14,1713480477739,true
gdsets_posters,gdsets_posters_1967_02_10.jpg,,Poster - 2/10/67(GD replaced Sopwith Camel),[],,https://gdsets.com/66posters
gdsets_posters,gdsets_posters_1967_02_12.jpg,,Poster - 2/12/67 @ AOR 2.73,[],,https://gdsets.com/66posters/1967_02_12.jpg,,,,,,1967-02-12,1713480478077,false
gdsets_posters,gdsets_posters_1967_02_24c.jpg,,Poster - 2/24-26/67 @ BG51/52(OHB-B),[],,https://gdsets.com/66posters
gdsets_posters,gdsets_posters_1967_02_24d.jpg,,Poster - 2/24-26/67 @ BG51/52(OPC-D),[],,https://gdsets.com/66posters
gdsets_posters,gdsets_posters_1967_01_29a.jpg,,Poster - 1/29/67 (OHB),[],,https://gdsets.com/66posters/1967_01_29a.jpg,,,,,,1967-01-29,1713480478312,true
gdsets_posters,gdsets_posters_1967_03_03a (AOR 2.194 OHB).jpg,,Poster - 3/3/67 (OHB)AOR 2.194,[],,https://gdsets.com/66posters/1967_03_03a (AOR 2.194
gdsets_posters,gdsets_posters_1967_03_10a.jpg,,Poster - 3/10-16/67,[],,https://gdsets.com/66posters/1967_03_10a.jpg,,,,,,1967-03-10,1713480478428,true
gdsets_posters,gdsets_posters_1967_03_10b.jpg,,Poster - 3/10-16/67 @ Newspaper Ad,[],,https://gdsets.com/66posters/1967_03_10b.jpg,,,,,,1967-03-10,1713480478521,false
gdsets_posters,gdsets_posters_1967_03_14.jpg,,Poster - 3/10-16/67 @ Newspaper Ad,[],,https://gdsets.com/66posters/1967_03_14.jpg,,,,,,1967-03-14,1713480478527,false
gdsets_posters,gdsets_posters_1967_03_10c.jpg,,Poster - 3/10-16/67 @ Newspaper Ad,[],,https://gdsets.com/66posters/1967_03_10c.jpg,,,,,,1967-03-10,1713480478527,true
gdsets_posters,gdsets_posters_1967_01_14a.jpg,,Poster - 1/14/67 (OHB)AOR 2.215,[],,https://gdsets.com/66posters/1967_01_14a.jpg,,,,,,1967-01-14,1713480478533,true
gdsets_posters,gdsets_posters_1967_02_24b.jpg,,Poster - 2/24-26/67 @ BG51 (OPC-A),[],,https://gdsets.com/66posters/1967_02_24b.jpg,,,,,,1967-02-24,1713480478568,true
gdsets_posters,gdsets_posters_1967_03_05.jpg,,Poster - 3/5/67,[],,https://gdsets.com/66posters/1967_03_05.jpg,,,,,,1967-03-05,1713480478736,false
gdsets_posters,gdsets_posters_1967_03_03.jpg,,Poster - 3/3/67 (OP1)AOR 2.193,[],,https://gdsets.com/66posters/1967_03_03.jpg,,,,,,1967-03-03,1713480478736,false
gdsets_posters,gdsets_posters_1967_03_15.jpg,,Poster - 3/10-16/67 @ Newspaper Ad,[],,https://gdsets.com/66posters/1967_03_15.jpg,,,,,,1967-03-15,1713480478806,false
gdsets_posters,gdsets_posters_1967_01_27a.jpg,,"Poster - 1/27,28/67 @ FD45 (RP2)",[],,https://gdsets.com/66posters/1967_01_27a.jpg,,,,,,1967-01-27,1713480478809,false
gdsets_posters,gdsets_posters_1967_03_10.jpg,,Poster - 3/10-16/67,[],,https://gdsets.com/66posters/1967_03_10.jpg,,,,,,1967-03-10,1713480478926,false
gdsets_posters,gdsets_posters_1967_03_03b.jpg,,Poster - 3/3/67 @ Newspaper Ad,[],,https://gdsets.com/66posters/1967_03_03b.jpg,,,,,,1967-03-03,1713480479155,false
gdsets_posters,gdsets_posters_1967_03_17d.jpg,,"Poster - 3/17,18/67 @ Newspaper Ad",[],,https://gdsets.com/66posters
gdsets_posters,gdsets_posters_1967_03_17ii.jpg,,Poster - First Album Promo (proof),[],,https://gdsets.com/66posters
gdsets_posters,gdsets_posters_1967_02_24.jpg,,Poster - 2/24-26/67 @ BG51 (OP1),[],,https://gdsets.com/66posters/1967_02_24.jpg,,,,,,1967-02-24,1713480479270,false
gdsets_posters,gdsets_posters_1967_03_17k.jpg,,Poster - First Album Promo,[],,https://gdsets.com/66posters/1967_03_17k.jpg,,,,,,1967-03-17,1713480479385,true
gdsets_posters,gdsets_posters_1967_03_17c.jpg,,"Poster - 3/17,18/67 @ BG55 (OPC-C)",[],,https://gdsets.com/66posters
gdsets_posters,gdsets_posters_1967_03_17m.jpg,,Poster - First Album Promo Packet Flyer AOR 2.189,[],,https://gdsets.com/66posters
gdsets_posters,gdsets_posters_1967_03_17.jpg,,"Poster - 3/17,18/67 @ BG55 (OP1)",[],,https://gdsets.com/66posters/1967_03_17.jpg,,,,,,1967-03-17,1713480479804,false
gdsets_posters,gdsets_posters_1967_03_17j.jpg,,Poster - First Album Promo,[],,https://gdsets.com/66posters/1967_03_17j.jpg,,,,,,1967-03-17,1713480479924,true
gdsets_posters,gdsets_posters_1967_03_17l.jpg,,Poster - First Album Promo Packet Flyer AOR 2.189,[],,https://gdsets.com/66posters
gdsets_posters,gdsets_posters_1967_03_17r.jpg,,Poster - Olompali Sunday Times newsletter,[],,https://gdsets.com/66posters
gdsets_posters,gdsets_posters_1967_03_17b.jpg,,"Poster - 3/17,18/67 @ BG55 (OPC-B)",[],,https://gdsets.com/66posters
gdsets_posters,gdsets_posters_1967_03_17n.jpg,,Poster - Fan Club Poster (OP1)AOR 2.190,[],,https://gdsets.com/66posters
gdsets_posters,gdsets_posters_1967_03_17a.jpg,,"Poster - 3/17,18/67 @ BG55 (RPC-D)",[],,https://gdsets.com/66posters
gdsets_posters,gdsets_posters_1967_03_17e.jpg,,"Poster - 3/17,18/67 @ BG55 (OP1)",[],,https://gdsets.com/66posters/1967_03_17e.jpg,,,,,,1967-03-17,1713480480268,true
gdsets_posters,gdsets_posters_1967_03_17q.jpg,,Poster - Olompali Sunday Times newsletter,[],,https://gdsets.com/66posters
gdsets_posters,gdsets_posters_1967_03_17p.jpg,,Poster - Fan Club Promo,[],,https://gdsets.com/66posters/1967_03_17p.jpg,,,,,,1967-03-17,1713480480398,false
gdsets_posters,gdsets_posters_1967_03_17nn.jpg,,Poster - Fan Club Poster (OP1)AOR 2.190,[],,https://gdsets.com/66posters
gdsets_posters,gdsets_posters_1967_01_27e.jpg,,"Poster - 1/27,28/67 @ Newspaper Ad",[],,https://gdsets.com/66posters
gdsets_posters,gdsets_posters_1967_03_20a.jpg,,Poster - 3/20/67,[],,https://gdsets.com/66posters/1967_03_20a.jpg,,,,,,1967-03-20,1713480480724,true
gdsets_posters,gdsets_posters_1967_03_17o.jpg,,Poster - Fan Club Poster (OHB)AOR 2.190,[],,https://gdsets.com/66posters
gdsets_posters,gdsets_posters_1967_03_17s.jpg,,Poster - First Album Newspaper Ad,[],,https://gdsets.com/66posters/1967_03_17s.jpg,,,,,,1967-03-17,1713480480887,false
gdsets_posters,gdsets_posters_1967_01_29.jpg,,Poster - 1/29/67 (OP1),[],,https://gdsets.com/66posters/1967_01_29.jpg,,,,,,1967-01-29,1713480480919,false
gdsets_posters,gdsets_posters_1967_03_24b.jpg,,Poster - 3/24-26/67 @ FD54 (OPC-A),[],,https://gdsets.com/66posters/1967_03_24b.jpg,,,,,,1967-03-24,1713480480951,true
gdsets_posters,gdsets_posters_1967_03_28c (AOR 2.212).jpg,,Poster - 3/28-4/2/67 @ AOR 2.212,[],,https://gdsets.com/66posters/1967_03_28c (AOR
gdsets_posters,gdsets_posters_1967_03_28e.jpg,,Poster - 3/28-4/2/67 @ Newspaper Ad,[],,https://gdsets.com/66posters/1967_03_28e.jpg,,,,,,1967-03-28,1713480481331,true
gdsets_posters,gdsets_posters_1967_03_28d.jpg,,Poster - 3/28-4/2/67 @ AOR 2.212,[],,https://gdsets.com/66posters/1967_03_28d.jpg,,,,,,1967-03-28,1713480481339,true
gdsets_posters,gdsets_posters_1967_03_24.jpg,,Poster - 3/24-26/67 @ FD54 (OP1),[],,https://gdsets.com/66posters/1967_03_24.jpg,,,,,,1967-03-24,1713480481434,false
gdsets_posters,gdsets_posters_1967_03_28a (AOR 2.212).jpg,,Poster - 3/28-4/2/67 @ AOR 2.212,[],,https://gdsets.com/66posters/1967_03_28a (AOR
gdsets_posters,gdsets_posters_1967_03_28n.jpg,,Poster - 3/28-4/2/67 @ Newspaper Ad,[],,https://gdsets.com/66posters/1967_03_28n.jpg,,,,,,1967-03-28,1713480481724,true
gdsets_posters,gdsets_posters_1967_03_28m.jpg,,Poster - 3/28-4/2/67 @ Newspaper Ad,[],,https://gdsets.com/66posters
gdsets_posters,gdsets_posters_1967_03_24a.jpg,,Poster - 3/24-26/67 @ FD54 (RP2),[],,https://gdsets.com/66posters/1967_03_24a.jpg,,,,,,1967-03-24,1713480481729,true
gdsets_posters,gdsets_posters_1967_03_28i.jpg,,Poster - 3/28-4/2/67 @ Newspaper Ad,[],,https://gdsets.com/66posters/1967_03_28i.jpg,,,,,,1967-03-28,1713480481830,true
gdsets_posters,gdsets_posters_1967_04_09c AOR 2.193a.jpg,,Poster - 4/9/67 (OP1)AOR 2.193,[],,https://gdsets.com/66posters/1967_04_09c AOR
gdsets_posters,gdsets_posters_1967_03_17i.jpg,,Poster - First Album Promo,[],,https://gdsets.com/66posters/1967_03_17i.jpg,,,,,,1967-03-17,1713480482101,false
gdsets_posters,gdsets_posters_1967_03_20.jpg,,Poster - 3/20/67,[],,https://gdsets.com/66posters/1967_03_20.jpg,,,,,,1967-03-20,1713480482274,false
gdsets_posters,gdsets_posters_1967_04_09j.jpg,,Poster - 4/9/67 (OHB),[],,https://gdsets.com/66posters/1967_04_09j.jpg,,,,,,1967-04-09,1713480482518,true
gdsets_posters,gdsets_posters_1967_03_28k.jpg,,Poster - 3/28-4/2/67 @ Newspaper Ad,[],,https://gdsets.com/66posters/1967_03_28k.jpg,,,,,,1967-03-28,1713480482529,true
gdsets_posters,gdsets_posters_1967_04_12b (AOR 2.71 OP colored).jpg,,Poster - 4/12/67 (OP1)AOR 2.71 @ Hand Colored,[],,https://gdsets.com/66posters/1967_04_12b (AOR
gdsets_posters,gdsets_posters_1967_03_28h.jpg,,Poster - 3/28-4/2/67 @ Newspaper Ad,[],,https://gdsets.com/66posters
gdsets_posters,gdsets_posters_1967_04_09f.jpg,,Poster - 4/9/67(OHB front),[],,https://gdsets.com/66posters/1967_04_09f.jpg,,,,,,1967-04-09,1713480482852,false
gdsets_posters,gdsets_posters_1967_04_09g.jpg,,Poster - 4/9/67(OHB back),[],,https://gdsets.com/66posters/1967_04_09g.jpg,,,,,,1967-04-09,1713480482865,false
gdsets_posters,gdsets_posters_1967_04_09.jpg,,Poster - 4/9/67 (OP1)AOR 2.193(with sticker),[],,https://gdsets.com/66posters
gdsets_posters,gdsets_posters_1967_04_09a.jpg,,Poster - 4/9/67 (OP1)AOR 2.193(with sticker),[],,https://gdsets.com/66posters
gdsets_posters,gdsets_posters_1967_04_09k.jpg,,Poster - 4/9/67(afternoon),[],,https://gdsets.com/66posters/1967_04_09k.jpg,,,,,,1967-04-09,1713480483092,false
gdsets_posters,gdsets_posters_1967_04_12c.jpg,,Poster - 4/12/67 (OP1)AOR 2.71 @ Hand Colored,[],,https://gdsets.com/66posters
gdsets_posters,gdsets_posters_1967_03_28l.jpg,,Poster - 3/28-4/2/67 @ Full Page,[],,https://gdsets.com/66posters/1967_03_28l.jpg,,,,,,1967-03-28,1713480483333,true
gdsets_posters,gdsets_posters_1967_04_13.jpg,,Poster - The Great Blondino (film)(GD soundtrack),[],,https://gdsets.com/66posters
gdsets_posters,gdsets_posters_1967_04_12.jpg,,Poster - 4/12/67 (OP1)AOR 2.71,[],,https://gdsets.com/66posters/1967_04_12.jpg,,,,,,1967-04-12,1713480483569,false
gdsets_posters,gdsets_posters_1967_04_12d (AOR 2.71 RP).jpg,,Poster - 4/12/67 (RP2)AOR 2.71,[],,https://gdsets.com/66posters/1967_04_12d (AOR 2.71
gdsets_posters,gdsets_posters_1967_04_14.jpg,,Poster - 4/14/67 @ Newspaper Ad,[],,https://gdsets.com/66posters/1967_04_14.jpg,,,,,,1967-04-14,1713480483731,true
gdsets_posters,gdsets_posters_1967_04_14d.jpg,,Poster - 4/14/67 @ Newspaper Ad,[],,https://gdsets.com/66posters/1967_04_14d.jpg,,,,,,1967-04-14,1713480483974,true
gdsets_posters,gdsets_posters_1967_04_14c.jpg,,Poster - 4/14-16/67 @ Newspaper Ad,[],,https://gdsets.com/66posters/1967_04_14c.jpg,,,,,,1967-04-14,1713480484063,true
gdsets_posters,gdsets_posters_1967_04_14b.jpg,,Poster - 4/14-16/67 @ Newspaper Ad,[],,https://gdsets.com/66posters/1967_04_14b.jpg,,,,,,1967-04-14,1713480484066,true
gdsets_posters,gdsets_posters_1967_04_12d.jpg,,Poster - 4/12/67 (OP1)AOR 2.71 @ Hand Colored,[],,https://gdsets.com/66posters
gdsets_posters,gdsets_posters_1967_04_09h.jpg,,Poster - 4/9/67 (OHB),[],,https://gdsets.com/66posters/1967_04_09h.jpg,,,,,,1967-04-09,1713480484174,true
gdsets_posters,gdsets_posters_1967_04_30a.jpg,,Poster - 4/30/67 @ Newspaper Ad,[],,https://gdsets.com/66posters/1967_04_30a.jpg,,,,,,1967-04-30,1713480484456,false
gdsets_posters,gdsets_posters_1967_04_30.jpg,,Poster - 4/30/67,[],,https://gdsets.com/66posters/1967_04_30.jpg,,,,,,1967-04-30,1713480484585,false
gdsets_posters,gdsets_posters_1967_04_13a.jpg,,Poster - The Great Blondino(Postcard),[],,https://gdsets.com/66posters
gdsets_posters,gdsets_posters_1967_04_12dd.jpg,,Poster - 4/12/67 (RP2)AOR 2.71,[],,https://gdsets.com/66posters/1967_04_12dd.jpg,,,,,,1967-04-12,1713480484860,false
gdsets_posters,gdsets_posters_1967_04_26.jpg,,Poster - 4/26/67,[],,https://gdsets.com/66posters/1967_04_26.jpg,,,,,,1967-04-26,1713480484872,false
gdsets_posters,gdsets_posters_1967_03_28j.jpg,,Poster - 3/28-4/2/67 @ Newspaper Ad,[],,https://gdsets.com/66posters/1967_03_28j.jpg,,,,,,1967-03-28,1713480484975,true
gdsets_posters,gdsets_posters_1967_05_05d.jpg,,"Poster - 5/5,6/67 @ BG62 (OPC-A)",[],,https://gdsets.com/66posters/1967_05_05d.jpg,,,,,,1967-05-05,1713480484977,true
gdsets_posters,gdsets_posters_1967_04_12a.jpg,,Poster - 4/12/67 (OP1)AOR 2.71,[],,https://gdsets.com/66posters/1967_04_12a.jpg,,,,,,1967-04-12,1713480485014,true
gdsets_posters,gdsets_posters_1967_04_28.jpg,,Poster - 4/28/67,[],,https://gdsets.com/66posters/1967_04_28.jpg,,,,,,1967-04-28,1713480485112,false
gdsets_posters,gdsets_posters_1967_04_29.jpg,,Poster - 4/29/67 (OP1)AOR 3.46,[],,https://gdsets.com/66posters/1967_04_29.jpg,,,,,,1967-04-29,1713480485345,false
gdsets_posters,gdsets_posters_1967_03_28hh.jpg,,Poster - 3/28-4/2/67 @ Full Page,[],,https://gdsets.com/66posters/1967_03_28hh.jpg,,,,,,1967-03-28,1713480485356,false
gdsets_posters,gdsets_posters_1967_04_14a.jpg,,Poster - 4/14-16/67 (OP1)AOR 3.77,[],,https://gdsets.com/66posters/1967_04_14a.jpg,,,,,,1967-04-14,1713480485406,false
gdsets_posters,gdsets_posters_1967_01_27f.jpg,,"Poster - 1/27,28/67 @ Full Page",[],,https://gdsets.com/66posters/1967_01_27f.jpg,,,,,,1967-01-27,1713480485606,false
gdsets_posters,gdsets_posters_1967_05_01.jpg,,Poster - Translucent Promo Poster AOR 2.190,[],,https://gdsets.com/66posters
gdsets_posters,gdsets_posters_1967_05_05 (BG062 RP3).jpg,,"Poster - 5/5,6/67 @ BG62 (RP3)",[],,https://gdsets.com/66posters/1967_05_05 (BG062
gdsets_posters,gdsets_posters_1967_05_05c.jpg,,"Poster - 5/5,6/67 @ BG62 (RPC-K)",[],,https://gdsets.com/66posters/1967_05_05c.jpg,,,,,,1967-05-05,1713480485742,true
gdsets_posters,gdsets_posters_1967_05_12b.jpg,,Poster - 5/12/67 (OHB),[],,https://gdsets.com/66posters/1967_05_12b.jpg,,,,,,1967-05-12,1713480485868,true
gdsets_posters,gdsets_posters_1967_05_05a.jpg,,"Poster - 5/5,6/67 @ BG62 (OPC-B)",[],,https://gdsets.com/66posters/1967_05_05a.jpg,,,,,,1967-05-05,1713480485892,true
gdsets_posters,gdsets_posters_1967_05_12aa.jpg,,Poster - 5/12/67 (OHB),[],,https://gdsets.com/66posters/1967_05_12aa.jpg,,,,,,1967-05-12,1713480486081,false
gdsets_posters,gdsets_posters_1967_05_05b.jpg,,"Poster - 5/5,6/67 @ BG62 (OPC-E)",[],,https://gdsets.com/66posters/1967_05_05b.jpg,,,,,,1967-05-05,1713480486334,true
gdsets_posters,gdsets_posters_1967_05_12f.jpg,,Poster - 5/12/67 (OHB)AOR 2.189,[],,https://gdsets.com/66posters/1967_05_12f.jpg,,,,,,1967-05-12,1713480486336,true
gdsets_posters,gdsets_posters_1967_05_12g.jpg,,Poster - 5/12/67,[],,https://gdsets.com/66posters/1967_05_12g.jpg,,,,,,1967-05-12,1713480486336,false
gdsets_posters,gdsets_posters_1967_05_12bb.jpg,,Poster - 5/12/67 (OHB),[],,https://gdsets.com/66posters/1967_05_12bb.jpg,,,,,,1967-05-12,1713480486358,true
gdsets_posters,gdsets_posters_1967_05_12h.jpg,,Poster - 5/12/67,[],,https://gdsets.com/66posters/1967_05_12h.jpg,,,,,,1967-05-12,1713480486362,true
gdsets_posters,gdsets_posters_1967_05_18.jpg,,Poster - 5/18/67,[],,https://gdsets.com/66posters/1967_05_18.jpg,,,,,,1967-05-18,1713480486412,false
gdsets_posters,gdsets_posters_1967_05_05 (BG062 OP1).jpg,,"Poster - 5/5,6/67 @ BG62 (OP1)",[],,https://gdsets.com/66posters/1967_05_05 (BG062
gdsets_posters,gdsets_posters_1967_05_05 (BG062 proof).jpg,,"Poster - 5/5,6/67 @ BG62 (proof)",[],,https://gdsets.com/66posters/1967_05_05 (BG062
gdsets_posters,gdsets_posters_1967_05_12.jpg,,Poster - 5/12/67 (OHB),[],,https://gdsets.com/66posters/1967_05_12.jpg,,,,,,1967-05-12,1713480486650,true
gdsets_posters,gdsets_posters_1967_05_20b.jpg,,Poster - 5/20/67 (OHB)AOR 2.343,[],,https://gdsets.com/66posters/1967_05_20b.jpg,,,,,,1967-05-20,1713480486673,true
gdsets_posters,gdsets_posters_1967_05_12c.jpg,,Poster - 5/12/67 (OHB)AOR 2.189,[],,https://gdsets.com/66posters/1967_05_12c.jpg,,,,,,1967-05-12,1713480486675,true
gdsets_posters,gdsets_posters_1967_05_20 (AOR 2.343).jpg,,Poster - 5/20/67 (OP1)AOR 2.343,[],,https://gdsets.com/66posters/1967_05_20 (AOR
gdsets_posters,gdsets_posters_1967_06_01a.jpg,,Poster - 6/1/67 (OHB),[],,https://gdsets.com/66posters/1967_06_01a.jpg,,,,,,1967-06-01,1713480486953,false
gdsets_posters,gdsets_posters_1967_06_01b.jpg,,Poster - 6/1-11/67 @ Newspaper Ad,[],,https://gdsets.com/66posters/1967_06_01b.jpg,,,,,,1967-06-01,1713480486968,false
gdsets_posters,gdsets_posters_1967_06_01c.jpg,,Poster - 6/1-11/67 @ Newspaper Ad,[],,https://gdsets.com/66posters/1967_06_01c.jpg,,,,,,1967-06-01,1713480486988,false
gdsets_posters,gdsets_posters_1967_05_12d.jpg,,Poster - 5/12/67 (OHB)AOR 2.189,[],,https://gdsets.com/66posters/1967_05_12d.jpg,,,,,,1967-05-12,1713480486994,true
gdsets_posters,gdsets_posters_1967_05_20c.jpg,,Poster - 5/20/67 (OHB)AOR 2.343,[],,https://gdsets.com/66posters/1967_05_20c.jpg,,,,,,1967-05-20,1713480487061,false
gdsets_posters,gdsets_posters_1967_06_01d.jpg,,Poster - 6/1-11/67 @ Newspaper Ad,[],,https://gdsets.com/66posters/1967_06_01d.jpg,,,,,,1967-06-01,1713480487061,false
gdsets_posters,gdsets_posters_1967_03_28ii.jpg,,Poster - 3/28-4/2/67 @ Full Page,[],,https://gdsets.com/66posters/1967_03_28ii.jpg,,,,,,1967-03-28,1713480487077,false
gdsets_posters,gdsets_posters_1967_06_08a.jpg,,Poster - 6/8/67 (OHB),[],,https://gdsets.com/66posters/1967_06_08a.jpg,,,,,,1967-06-08,1713480487080,false
gdsets_posters,gdsets_posters_1967_06_08.jpg,,Poster - 6/8/67 (OHB),[],,https://gdsets.com/66posters/1967_06_08.jpg,,,,,,1967-06-08,1713480487087,false
gdsets_posters,gdsets_posters_1967_05_12a.jpg,,Poster - 5/12/67 (OHB),[],,https://gdsets.com/66posters/1967_05_12a.jpg,,,,,,1967-05-12,1713480487196,true
gdsets_posters,gdsets_posters_1967_05_30.jpg,,Poster - 5/30/67 (OP1)AOR 2.206,[],,https://gdsets.com/66posters/1967_05_30.jpg,,,,,,1967-05-30,1713480487382,true
gdsets_posters,gdsets_posters_1967_05_12e.jpg,,Poster - 5/12/67 (OHB)AOR 2.189,[],,https://gdsets.com/66posters/1967_05_12e.jpg,,,,,,1967-05-12,1713480487387,false
gdsets_posters,gdsets_posters_1967_06_18a.jpg,,Poster - 6/18/67 @ Order Form Outside,[],,https://gdsets.com/66posters
gdsets_posters,gdsets_posters_1967_05_29.jpg,,Poster - 5/29/67,[],,https://gdsets.com/66posters/1967_05_29.jpg,,,,,,1967-05-29,1713480487484,false
gdsets_posters,gdsets_posters_1967_06_18b.jpg,,Poster - 6/18/67 @ Order Form Inside,[],,https://gdsets.com/66posters
gdsets_posters,gdsets_posters_1967_06_18d.jpg,,Poster - 6/18/67,[],,https://gdsets.com/66posters/1967_06_18d.jpg,,,,,,1967-06-18,1713480487583,false
gdsets_posters,gdsets_posters_1967_05_30a.jpg,,Poster - 5/30/67 (OP1)AOR 2.206,[],,https://gdsets.com/66posters/1967_05_30a.jpg,,,,,,1967-05-30,1713480487673,false
gdsets_posters,gdsets_posters_1967_07_16a.jpg,,Poster - 7/16/67 @ AOR pg. 248,[],,https://gdsets.com/66posters/1967_07_16a.jpg,,,,,,1967-07-16,1713480487684,false
gdsets_posters,gdsets_posters_1967_06_18e.jpg,,Poster - 6/18/67,[],,https://gdsets.com/66posters/1967_06_18e.jpg,,,,,,1967-06-18,1713480487772,false
gdsets_posters,gdsets_posters_1967_07_16.jpg,,Poster - 7/16/67 @ AOR pg. 248,[],,https://gdsets.com/66posters/1967_07_16.jpg,,,,,,1967-07-16,1713480487787,true
gdsets_posters,gdsets_posters_1967_06_18c (prog).jpg,,Poster - 6/18/67 @ Program,[],,https://gdsets.com/66posters/1967_06_18c 
gdsets_posters,gdsets_posters_1967_07_14.jpg,,"Poster - 7/14,15/67 @ Newspaper Ad",[],,https://gdsets.com/66posters/1967_07_14.jpg,,,,,,1967-07-14,1713480487792,false
gdsets_posters,gdsets_posters_1967_06_20.jpg,,Poster - 6/20-24/67(cancelled),[],,https://gdsets.com/66posters/1967_06_20.jpg,,,,,,1967-06-20,1713480487984,false
gdsets_posters,gdsets_posters_1967_07_16c.jpg,,Poster - 7/16/67(OHB),[],,https://gdsets.com/66posters/1967_07_16c.jpg,,,,,,1967-07-16,1713480488093,false
gdsets_posters,gdsets_posters_1967_07_13b.jpg,,Poster - 7/13-15/67 (OPC)AOR 3.179,[],,https://gdsets.com/66posters/1967_07_13b.jpg,,,,,,1967-07-13,1713480488194,true
gdsets_posters,gdsets_posters_1967_06_18 AOR 3.5.jpg,,Poster - 6/18/67 (OP)AOR 3.5,[],,https://gdsets.com/66posters/1967_06_18 AOR
gdsets_posters,gdsets_posters_1967_06_28a (program).jpg,,Poster - 6/28/67 @ Program AOR 2.296,[],,https://gdsets.com/66posters/1967_06_28a 
gdsets_posters,gdsets_posters_1967_07_23a.jpg,,Poster - 7/23/67 (OHB),[],,https://gdsets.com/66posters/1967_07_23a.jpg,,,,,,1967-07-23,1713480488610,false
gdsets_posters,gdsets_posters_1967_07_18.jpg,,Poster - 7/18/67,[],,https://gdsets.com/66posters/1967_07_18.jpg,,,,,,1967-07-18,1713480488612,false
gdsets_posters,gdsets_posters_1967_07_21a.jpg,,Poster - 7/21-22/67,[],,https://gdsets.com/66posters/1967_07_21a.jpg,,,,,,1967-07-21,1713480488650,false
gdsets_posters,gdsets_posters_1967_06_12.jpg,,Poster - 6/12/67,[],,https://gdsets.com/66posters/1967_06_12.jpg,,,,,,1967-06-12,1713480488725,false
gdsets_posters,gdsets_posters_1967_06_28.jpg,,Poster - 6/28/67 (OP1)AOR 2.296,[],,https://gdsets.com/66posters/1967_06_28.jpg,,,,,,1967-06-28,1713480488742,false
gdsets_posters,gdsets_posters_1967_07_18a.jpg,,Poster - 7/18/67,[],,https://gdsets.com/66posters/1967_07_18a.jpg,,,,,,1967-07-18,1713480488883,false
gdsets_posters,gdsets_posters_1967_06_01.jpg,,Poster - 6/1-11/67 (OP1)AOR 3.163,[],,https://gdsets.com/66posters/1967_06_01.jpg,,,,,,1967-06-01,1713480488959,false
gdsets_posters,gdsets_posters_1967_07_21.jpg,,Poster - 7/21-22/67,[],,https://gdsets.com/66posters/1967_07_21.jpg,,,,,,1967-07-21,1713480489047,false
gdsets_posters,gdsets_posters_1967_07_31k (AOR 2.52 button).jpg,,Poster - 7/31-8/5/67 @ AOR 2.52 @ Button,[],,https://gdsets.com/66posters/1967_07_31k (AOR 2.52
gdsets_posters,gdsets_posters_1967_07_31e (BG74 orderfm outside).jpg,,Poster - 7/31-8/5/67 @ BG74 @ Order Form Outside,[],,https://gdsets.com/66posters/1967_07_31e 
gdsets_posters,gdsets_posters_1967_07_17 Joint Show AOR 2.350.jpg,,Poster - 7/17/67 @ AOR 2.350 @ Joint Show,[],,https://gdsets.com/66posters/1967_07_17 Joint Show
gdsets_posters,gdsets_posters_1967_07_31a BG74 (OHB).jpg,,Poster - 7/31-8/5/67 @ BG74(OHB-A front),[],,https://gdsets.com/66posters/1967_07_31a BG74 
gdsets_posters,gdsets_posters_1967_07_31b (BG74 OHB back).jpg,,Poster - 7/31-8/5/67 @ BG74(OHB-A back),[],,https://gdsets.com/66posters/1967_07_31b (BG74 OHB
gdsets_posters,gdsets_posters_1967_07_31d (BG74 orderfm inside).jpg,,Poster - 7/31-8/5/67 @ BG74 @ Order Form Inside,[],,https://gdsets.com/66posters/1967_07_31d 
gdsets_posters,gdsets_posters_1967_08_11a.jpg,,"Poster - 8/11,12/67",[],,https://gdsets.com/66posters/1967_08_11a.jpg,,,,,,1967-08-11,1713480489243,false
gdsets_posters,gdsets_posters_1967_07_28.jpg,,Poster - 7/28/67(rescheduled to8/19/67?),[],,https://gdsets.com/66posters
gdsets_posters,gdsets_posters_1967_08_11b.jpg,,"Poster - 8/11,12/67",[],,https://gdsets.com/66posters/1967_08_11b.jpg,,,,,,1967-08-11,1713480489365,false
gdsets_posters,gdsets_posters_1967_07_31l (AOR 2.100 sticker).jpg,,Poster - 7/31-8/5/67 @ AOR 2.56 @ Bumper Sticker,[],,https://gdsets.com/66posters/1967_07_31l (AOR
gdsets_posters,gdsets_posters_1967_08_25a.jpg,,"Poster - 8/25,26/67",[],,https://gdsets.com/66posters/1967_08_25a.jpg,,,,,,1967-08-25,1713480489463,false
gdsets_posters,gdsets_posters_1967_08_25b.jpg,,"Poster - 8/25,26/67",[],,https://gdsets.com/66posters/1967_08_25b.jpg,,,,,,1967-08-25,1713480489665,false
gdsets_posters,gdsets_posters_1967_09_08c.jpg,,"Poster - 9/8,9/67",[],,https://gdsets.com/66posters/1967_09_08c.jpg,,,,,,1967-09-08,1713480489935,true
gdsets_posters,gdsets_posters_1967_08_28.jpg,,Poster - 8/28/67(OHB front)AOR 2.251,[],,https://gdsets.com/66posters/1967_08_28.jpg,,,,,,1967-08-28,1713480490063,false
gdsets_posters,gdsets_posters_1967_07_13a (AOR 3.179).jpg,,Poster - 7/13-15/67 (OP1)AOR 3.179,[],,https://gdsets.com/66posters/1967_07_13a (AOR
gdsets_posters,gdsets_posters_1967_09_03a AOR 2.328a.jpg,,"Poster - 9/3,4/67 (OHB)AOR 2.328(hand colored)",[],,https://gdsets.com/66posters/1967_09_03a AOR
gdsets_posters,gdsets_posters_1967_08_28a (AOR 2.251 back).jpg,,Poster - 8/28/67(OHB back)AOR 2.251,[],,https://gdsets.com/66posters/1967_08_28a (AOR 2.251
gdsets_posters,gdsets_posters_1967_08_11.jpg,,"Poster - 8/11,12/67 @ G/G-670811 (OHB-A)",[],,https://gdsets.com/66posters
gdsets_posters,gdsets_posters_1967_07_31 (BG074 OP1).jpg,,Poster - 7/31-8/5/67 @ BG74 (OP1),[],,https://gdsets.com/66posters/1967_07_31 (BG074
gdsets_posters,gdsets_posters_1967_09_08b.jpg,,"Poster - 9/8,9/67",[],,https://gdsets.com/66posters/1967_09_08b.jpg,,,,,,1967-09-08,1713480490264,true
gdsets_posters,gdsets_posters_1967_09_02.jpg,,"Poster - 9/2,3/67 (OHB)AOR 3.32(cancelled)",[],,https://gdsets.com/66posters
gdsets_posters,gdsets_posters_1967_09_15a.jpg,,Poster - 9/15/67 @ BG81 (Program),[],,https://gdsets.com/66posters/1967_09_15a.jpg,,,,,,1967-09-15,1713480490309,false
gdsets_posters,gdsets_posters_1967_09_15 (BG081 RP2).jpg,,Poster - 9/15/67 @ BG81 (RP2),[],,https://gdsets.com/66posters/1967_09_15 (BG081
gdsets_posters,gdsets_posters_1967_09_08d.jpg,,"Poster - 9/8,9/67",[],,https://gdsets.com/66posters/1967_09_08d.jpg,,,,,,1967-09-08,1713480490719,false
gdsets_posters,gdsets_posters_1967_09_15b.jpg,,Poster - 9/15/67 @ Newspaper Ad,[],,https://gdsets.com/66posters/1967_09_15b.jpg,,,,,,1967-09-15,1713480490745,false
gdsets_posters,gdsets_posters_1967_09_24.jpg,,Poster - 9/24/67,[],,https://gdsets.com/66posters/1967_09_24.jpg,,,,,,1967-09-24,1713480490866,false
gdsets_posters,gdsets_posters_1967_09_24a.jpg,,Poster - 9/24/67,[],,https://gdsets.com/66posters/1967_09_24a.jpg,,,,,,1967-09-24,1713480490892,false
gdsets_posters,gdsets_posters_1967_09_22a.jpg,,"Poster - 9/22,23/67 @ FD82 (OPC-A)",[],,https://gdsets.com/66posters
gdsets_posters,gdsets_posters_1967_09_15c.jpg,,Poster - 9/15/67 @ Full Page,[],,https://gdsets.com/66posters/1967_09_15c.jpg,,,,,,1967-09-15,1713480490978,false
gdsets_posters,gdsets_posters_1967_09_29c.jpg,,"Poster - 9/29,30/67",[],,https://gdsets.com/66posters/1967_09_29c.jpg,,,,,,1967-09-29,1713480491100,false
gdsets_posters,gdsets_posters_1967_09_29e.jpg,,"Poster - 9/29,30/67",[],,https://gdsets.com/66posters/1967_09_29e.jpg,,,,,,1967-09-29,1713480491133,false
gdsets_posters,gdsets_posters_1967_09_29d.jpg,,"Poster - 9/29,30/67",[],,https://gdsets.com/66posters/1967_09_29d.jpg,,,,,,1967-09-29,1713480491137,false
gdsets_posters,gdsets_posters_1967_07_16e.jpg,,Poster - 7/16/67 @ Newspaper Ad,[],,https://gdsets.com/66posters/1967_07_16e.jpg,,,,,,1967-07-16,1713480491264,false
gdsets_posters,gdsets_posters_1967_07_23.jpg,,Poster - 7/23/67 (OP1)AOR 2.220,[],,https://gdsets.com/66posters/1967_07_23.jpg,,,,,,1967-07-23,1713480491265,false
gdsets_posters,gdsets_posters_1967_07_31c (BG074 program).jpg,,Poster - 7/31-8/5/67 @ BG74 @ Program,[],,https://gdsets.com/66posters/1967_07_31c (BG074
gdsets_posters,gdsets_posters_1967_09_29b.jpg,,"Poster - 9/29,30/67 (OHB)AOR 2.225",[],,https://gdsets.com/66posters
gdsets_posters,gdsets_posters_1967_09_22b.jpg,,"Poster - 9/22,23/67 @ FD82 (OP1)",[],,https://gdsets.com/66posters/1967_09_22b.jpg,,,,,,1967-09-22,1713480491617,false
gdsets_posters,gdsets_posters_1967_10_01a.jpg,,Poster - 10/1/67 @ Newspaper Ad,[],,https://gdsets.com/66posters/1967_10_01a.jpg,,,,,,1967-10-01,1713480491627,false
gdsets_posters,gdsets_posters_1967_10_01.jpg,,Poster - 10/1/67 (OP1)AOR 2.266,[],,https://gdsets.com/66posters/1967_10_01.jpg,,,,,,1967-10-01,1713480491698,false
gdsets_posters,gdsets_posters_1967_09_22.jpg,,"Poster - 9/22,23/67 @ FD82 (OP1)",[],,https://gdsets.com/66posters/1967_09_22.jpg,,,,,,1967-09-22,1713480491802,true
gdsets_posters,gdsets_posters_1967_09_29.jpg,,"Poster - 9/29,30/67 (OP1)AOR 2.224(First State)",[],,https://gdsets.com/66posters
gdsets_posters,gdsets_posters_1967_09_29a.jpg,,"Poster - 9/29,30/67 (OP1)AOR 2.224(Second State)",[],,https://gdsets.com/66posters
gdsets_posters,gdsets_posters_1967_09_08.jpg,,"Poster - 9/8,9/67 @ Newspaper Ad",[],,https://gdsets.com/66posters/1967_09_08.jpg,,,,,,1967-09-08,1713480492108,false
gdsets_posters,gdsets_posters_1967_10_22c AOR 2.205 Art.jpg,,Poster - 10/22/67 @ Original Art AOR 2.205,[],,https://gdsets.com/66posters/1967_10_22c AOR 2.205
gdsets_posters,gdsets_posters_1967_10_22b.jpg,,Poster - 10/22/67 (OP1)AOR 2.205,[],,https://gdsets.com/66posters/1967_10_22b.jpg,,,,,,1967-10-22,1713480492150,false
gdsets_posters,gdsets_posters_1967_11_10b.jpg,,"Poster - 11/10,11/67(OHB back)AOR 3.74",[],,https://gdsets.com/66posters
gdsets_posters,gdsets_posters_1967_11_10a.jpg,,"Poster - 11/10,11/67(OHB front)AOR 3.74",[],,https://gdsets.com/66posters
gdsets_posters,gdsets_posters_1967_10_31b.jpg,,Poster - 10/31/67 (OHB)AOR 2.183,[],,https://gdsets.com/66posters/1967_10_31b.jpg,,,,,,1967-10-31,1713480492478,true
gdsets_posters,gdsets_posters_1967_11_10 (AOR 3.74 OP).jpg,,"Poster - 11/10,11/67 (OP1)AOR 3.74",[],,https://gdsets.com/66posters/1967_11_10 (AOR 3.74
gdsets_posters,gdsets_posters_1967_12_22.jpg,,Poster - 12/22-24/67,[],,https://gdsets.com/66posters/1967_12_22.jpg,,,,,,1967-12-22,1713480492583,false
gdsets_posters,gdsets_posters_1967_12_08.jpg,,"Poster - 12/8,9/67",[],,https://gdsets.com/66posters/1967_12_08.jpg,,,,,,1967-12-08,1713480492583,false
gdsets_posters,gdsets_posters_1967_11_10e.jpg,,"Poster - 11/10,11/67 @ Newspaper Ad AOR 3.74",[],,https://gdsets.com/66posters
gdsets_posters,gdsets_posters_1967_09_03 (AOR 2.328).jpg,,"Poster - 9/3,4/67 (OHB)AOR 2.328",[],,https://gdsets.com/66posters/1967_09_03 (AOR
gdsets_posters,gdsets_posters_1967_12_09.jpg,,Poster - 12/9/67,[],,https://gdsets.com/66posters/1967_12_09.jpg,,,,,,1967-12-09,1713480492751,false
gdsets_posters,gdsets_posters_1967_12_22a.jpg,,Poster - 12/22-24/67 @ Newspaper Ad,[],,https://gdsets.com/66posters
gdsets_posters,gdsets_posters_1967_10_31a (AOR 2.183 OP proof).jpg,,Poster - 10/31/67 (Proof)AOR 2.183,[],,https://gdsets.com/66posters/1967_10_31a (AOR 2.183 OP
gdsets_posters,gdsets_posters_1967_11_10d.jpg,,"Poster - 11/10,11/67 @ Newspaper Ad AOR 3.74",[],,https://gdsets.com/66posters
gdsets_posters,gdsets_posters_1967_10_14.jpg,,Poster - 10/14/67 (OP1),[],,https://gdsets.com/66posters/1967_10_14.jpg,,,,,,1967-10-14,1713480493069,false
gdsets_posters,gdsets_posters_1967_10_22.jpg,,Poster - 10/22/67 (OP1)AOR 2.205,[],,https://gdsets.com/66posters/1967_10_22.jpg,,,,,,1967-10-22,1713480493072,true
gdsets_posters,gdsets_posters_1967_10_14a.jpg,,Poster - 10/14/67 @ Newspaper Ad,[],,https://gdsets.com/66posters/1967_10_14a.jpg,,,,,,1967-10-14,1713480493123,false
gdsets_posters,gdsets_posters_1973_01_23a.jpg,,Poster - 1/23-25/73,[],,https://gdsets.com/73posters/1973_01_23a.jpg,,,,,,1973-01-23,1713480493249,false
gdsets_posters,gdsets_posters_1973_01_23.jpg,,Poster - 1/23-25/73,[],,https://gdsets.com/73posters/1973_01_23.jpg,,,,,,1973-01-23,1713480493278,false
gdsets_posters,gdsets_posters_1973_01_01.jpg,,Poster - 1973 Songbook,[],,https://gdsets.com/73posters/1973_01_01.jpg,,,,,,1973-01-01,1713480493282,false
gdsets_posters,gdsets_posters_1967_12_26b.jpg,,Poster - 12/26-27/67 @ Newspaper Ad,[],,https://gdsets.com/66posters
gdsets_posters,gdsets_posters_1973_02_06a.jpg,,"Poster - 2/6,7/73",[],,https://gdsets.com/73posters/1973_02_06a.jpg,,,,,,1973-02-06,1713480493370,false
gdsets_posters,gdsets_posters_1973_02_06.jpg,,"Poster - 2/6,7/73",[],,https://gdsets.com/73posters/1973_02_06.jpg,,,,,,1973-02-06,1713480493470,false
gdsets_posters,gdsets_posters_1973_02_09.jpg,,Poster - 2/9/73,[],,https://gdsets.com/73posters/1973_02_09.jpg,,,,,,1973-02-09,1713480493487,false
gdsets_posters,gdsets_posters_1973_02_15.jpg,,Poster - 2/15/73,[],,https://gdsets.com/73posters/1973_02_15.jpg,,,,,,1973-02-15,1713480493489,true
gdsets_posters,gdsets_posters_1973_02_21.jpg,,"Poster - 2/21,22/73",[],,https://gdsets.com/73posters/1973_02_21.jpg,,,,,,1973-02-21,1713480493781,false
gdsets_posters,gdsets_posters_1973_02_15a.jpg,,Poster - 2/15/73,[],,https://gdsets.com/73posters/1973_02_15a.jpg,,,,,,1973-02-15,1713480493798,false
gdsets_posters,gdsets_posters_1973_02_15b.jpg,,Poster - February 1973,[],,https://gdsets.com/73posters/1973_02_15b.jpg,,,,,,1973-02-15,1713480493898,false
gdsets_posters,gdsets_posters_1973_02_21a.jpg,,"Poster - 2/21,22/73(OP1)",[],,https://gdsets.com/73posters/1973_02_21a.jpg,,,,,,1973-02-21,1713480494011,false
gdsets_posters,gdsets_posters_1973_02_28.jpg,,Poster - 2/28/73,[],,https://gdsets.com/73posters/1973_02_28.jpg,,,,,,1973-02-28,1713480494138,false
gdsets_posters,gdsets_posters_1973_02_26.jpg,,Poster - 2/26/73,[],,https://gdsets.com/73posters/1973_02_26.jpg,,,,,,1973-02-26,1713480494139,false
gdsets_posters,gdsets_posters_1967_12_26.jpg,,Poster - 12/26-27/67 @ OHB (front/back),[],,https://gdsets.com/66posters
gdsets_posters,gdsets_posters_1973_02_24.jpg,,Poster - 2/24/73 (OHB),[],,https://gdsets.com/73posters/1973_02_24.jpg,,,,,,1973-02-24,1713480494361,true
gdsets_posters,gdsets_posters_1973_02_24d.jpg,,Poster - 2/24/73(Original Art),[],,https://gdsets.com/73posters/1973_02_24d.jpg,,,,,,1973-02-24,1713480494426,true
gdsets_posters,gdsets_posters_1973_02_24e.jpg,,Poster - 2/24/73(Original Art),[],,https://gdsets.com/73posters/1973_02_24e.jpg,,,,,,1973-02-24,1713480494426,true
gdsets_posters,gdsets_posters_1973_03_06.jpg,,Poster - March 1973,[],,https://gdsets.com/73posters/1973_03_06.jpg,,,,,,1973-03-06,1713480494517,false
gdsets_posters,gdsets_posters_1973_03_05.jpg,,Poster - 3/5/73,[],,https://gdsets.com/73posters/1973_03_05.jpg,,,,,,1973-03-05,1713480494587,false
gdsets_posters,gdsets_posters_1973_03_24.jpg,,Poster - 3/24/73,[],,https://gdsets.com/73posters/1973_03_24.jpg,,,,,,1973-03-24,1713480494841,false
gdsets_posters,gdsets_posters_1973_03_15b (RP2).jpg,,"Poster - 3/15,16/73 @ BG288 (RP2)AOR 4.220",[],,https://gdsets.com/73posters/1973_03_15b 
gdsets_posters,gdsets_posters_1973_02_24b.jpg,,Poster - 2/24/73 (OP1),[],,https://gdsets.com/73posters/1973_02_24b.jpg,,,,,,1973-02-24,1713480494936,false
gdsets_posters,gdsets_posters_1973_03_15e (art).jpg,,"Poster - 3/15,16/73 @ BG288(Concept Art)",[],,https://gdsets.com/73posters/1973_03_15e 
gdsets_posters,gdsets_posters_1967_12_26a.jpg,,Poster - 12/26-27/67,[],,https://gdsets.com/66posters/1967_12_26a.jpg,,,,,,1967-12-26,1713480495019,false
gdsets_posters,gdsets_posters_1973_03_21.jpg,,"Poster - 3/21,22/73",[],,https://gdsets.com/73posters/1973_03_21.jpg,,,,,,1973-03-21,1713480495022,false
gdsets_posters,gdsets_posters_1973_03_26.jpg,,Poster - 3/26/73,[],,https://gdsets.com/73posters/1973_03_26.jpg,,,,,,1973-03-26,1713480495023,false
gdsets_posters,gdsets_posters_1973_03_30.jpg,,Poster - 3/30/73,[],,https://gdsets.com/73posters/1973_03_30.jpg,,,,,,1973-03-30,1713480495109,false
gdsets_posters,gdsets_posters_1973_02_24c.jpg,,Poster - 2/24/73,[],,https://gdsets.com/73posters/1973_02_24c.jpg,,,,,,1973-02-24,1713480495205,true
gdsets_posters,gdsets_posters_1967_11_10c.jpg,,"Poster - 11/10,11/67 @ Newspaper Ad AOR 3.74",[],,https://gdsets.com/66posters
gdsets_posters,gdsets_posters_1973_03_31b.jpg,,Poster - 3/31/73,[],,https://gdsets.com/73posters/1973_03_31b.jpg,,,,,,1973-03-31,1713480495249,true
gdsets_posters,gdsets_posters_1973_04_10.jpg,,"Poster - 4/10,11/73",[],,https://gdsets.com/73posters/1973_04_10.jpg,,,,,,1973-04-10,1713480495329,false
gdsets_posters,gdsets_posters_1973_03_15d (proof).jpg,,"Poster - 3/15,16/73 @ BG288 (Proof)AOR 4.220",[],,https://gdsets.com/73posters/1973_03_15d 
gdsets_posters,gdsets_posters_1967_10_31.jpg,,Poster - 10/31/67 (OP1)AOR 2.183,[],,https://gdsets.com/66posters/1967_10_31.jpg,,,,,,1967-10-31,1713480495364,false
gdsets_posters,gdsets_posters_1967_10_01b.jpg,,Poster - 10/1/67 @ Full Page,[],,https://gdsets.com/66posters/1967_10_01b.jpg,,,,,,1967-10-01,1713480495432,false
gdsets_posters,gdsets_posters_1973_03_31.jpg,,Poster - 3/31/73,[],,https://gdsets.com/73posters/1973_03_31.jpg,,,,,,1973-03-31,1713480495439,false
gdsets_posters,gdsets_posters_1973_03_15a.jpg,,"Poster - 3/15,16/73 @ BG288 (OP1)AOR 4.220",[],,https://gdsets.com/73posters
gdsets_posters,gdsets_posters_1973_04_13.jpg,,Poster - 4/13-16/73,[],,https://gdsets.com/73posters/1973_04_13.jpg,,,,,,1973-04-13,1713480495626,false
gdsets_posters,gdsets_posters_1973_04_13a.jpg,,Poster - 4/13-16/73,[],,https://gdsets.com/73posters/1973_04_13a.jpg,,,,,,1973-04-13,1713480495730,false
gdsets_posters,gdsets_posters_1973_04_23.jpg,,Poster - 4/23/73,[],,https://gdsets.com/73posters/1973_04_23.jpg,,,,,,1973-04-23,1713480495732,false
gdsets_posters,gdsets_posters_1973_04_12.jpg,,Poster - 4/12/73,[],,https://gdsets.com/73posters/1973_04_12.jpg,,,,,,1973-04-12,1713480495735,true
gdsets_posters,gdsets_posters_1973_03_15dd.jpg,,"Poster - 3/15,16/73 @ BG288 (Proof)AOR 4.220",[],,https://gdsets.com/73posters
gdsets_posters,gdsets_posters_1973_04_12a.jpg,,Poster - 4/12/73,[],,https://gdsets.com/73posters/1973_04_12a.jpg,,,,,,1973-04-12,1713480495925,false
gdsets_posters,gdsets_posters_1973_05_17.jpg,,Poster - 5/17/73,[],,https://gdsets.com/73posters/1973_05_17.jpg,,,,,,1973-05-17,1713480496055,false
gdsets_posters,gdsets_posters_1973_05_04.jpg,,"Poster - 5/4,5/73",[],,https://gdsets.com/73posters/1973_05_04.jpg,,,,,,1973-05-04,1713480496058,false
gdsets_posters,gdsets_posters_1973_05_08.jpg,,Poster - 5/8/73,[],,https://gdsets.com/73posters/1973_05_08.jpg,,,,,,1973-05-08,1713480496169,false
gdsets_posters,gdsets_posters_1973_05_05.jpg,,Poster - 5/5/73(rescheduledto 6/22),[],,https://gdsets.com/73posters/1973_05_05.jpg,,,,,,1973-05-05,1713480496296,false
gdsets_posters,gdsets_posters_1973_04_24.jpg,,Poster - 4/24/73,[],,https://gdsets.com/73posters/1973_04_24.jpg,,,,,,1973-04-24,1713480496305,false
gdsets_posters,gdsets_posters_1973_05_22.jpg,,"Poster - 5/22,23/73(moved to Kezar 5/26)",[],,https://gdsets.com/73posters
gdsets_posters,gdsets_posters_1973_05_20b.jpg,,Poster - 5/20/73,[],,https://gdsets.com/73posters/1973_05_20b.jpg,,,,,,1973-05-20,1713480496370,false
gdsets_posters,gdsets_posters_1973_05_20.jpg,,Poster - 5/20/73 (OP1)AOR 4.114,[],,https://gdsets.com/73posters/1973_05_20.jpg,,,,,,1973-05-20,1713480496386,false
gdsets_posters,gdsets_posters_1973_05_03.jpg,,Poster - 5/3/73(rescheduledto 6/24),[],,https://gdsets.com/73posters/1973_05_03.jpg,,,,,,1973-05-03,1713480496492,false
gdsets_posters,gdsets_posters_1973_05_25a.jpg,,Poster - 5/25/73,[],,https://gdsets.com/73posters/1973_05_25a.jpg,,,,,,1973-05-25,1713480496606,false
gdsets_posters,gdsets_posters_1973_05_26b.jpg,,Poster - 5/26/73,[],,https://gdsets.com/73posters/1973_05_26b.jpg,,,,,,1973-05-26,1713480496606,true
gdsets_posters,gdsets_posters_1973_05_07.jpg,,Poster - 5/7/73(rescheduledto 6/26),[],,https://gdsets.com/73posters/1973_05_07.jpg,,,,,,1973-05-07,1713480496606,false
gdsets_posters,gdsets_posters_1973_03_31a.jpg,,Poster - 3/31/73,[],,https://gdsets.com/73posters/1973_03_31a.jpg,,,,,,1973-03-31,1713480496612,true
gdsets_posters,gdsets_posters_1973_05_25.jpg,,Poster - 5/25/73,[],,https://gdsets.com/73posters/1973_05_25.jpg,,,,,,1973-05-25,1713480496703,false
gdsets_posters,gdsets_posters_1973_05_26a.jpg,,Poster - 5/26/73,[],,https://gdsets.com/73posters/1973_05_26a.jpg,,,,,,1973-05-26,1713480496798,true
gdsets_posters,gdsets_posters_1973_05_26c.jpg,,Poster - 5/26/73,[],,https://gdsets.com/73posters/1973_05_26c.jpg,,,,,,1973-05-26,1713480496916,false
gdsets_posters,gdsets_posters_1973_05_27.jpg,,Poster - 5/27/73(cancelled),[],,https://gdsets.com/73posters/1973_05_27.jpg,,,,,,1973-05-27,1713480497015,false
gdsets_posters,gdsets_posters_1973_06_02.jpg,,Poster - 6/2/73,[],,https://gdsets.com/73posters/1973_06_02.jpg,,,,,,1973-06-02,1713480497045,false
gdsets_posters,gdsets_posters_1973_06_02a.jpg,,Poster - 6/2/73,[],,https://gdsets.com/73posters/1973_06_02a.jpg,,,,,,1973-06-02,1713480497089,false
gdsets_posters,gdsets_posters_1973_05_26.jpg,,Poster - 5/26/73,[],,https://gdsets.com/73posters/1973_05_26.jpg,,,,,,1973-05-26,1713480497113,false
gdsets_posters,gdsets_posters_1973_06_06a.jpg,,Poster - 6/6/73,[],,https://gdsets.com/73posters/1973_06_06a.jpg,,,,,,1973-06-06,1713480497137,false
gdsets_posters,gdsets_posters_1973_06_05.jpg,,Poster - 6/5/73,[],,https://gdsets.com/73posters/1973_06_05.jpg,,,,,,1973-06-05,1713480497242,false
gdsets_posters,gdsets_posters_1973_06_06b.jpg,,Poster - 6/6/73,[],,https://gdsets.com/73posters/1973_06_06b.jpg,,,,,,1973-06-06,1713480497244,false
gdsets_posters,gdsets_posters_1973_05_18.jpg,,Poster - 5/18/73,[],,https://gdsets.com/73posters/1973_05_18.jpg,,,,,,1973-05-18,1713480497352,false
gdsets_posters,gdsets_posters_1973_06_06.jpg,,Poster - 6/6/73,[],,https://gdsets.com/73posters/1973_06_06.jpg,,,,,,1973-06-06,1713480497370,false
gdsets_posters,gdsets_posters_1973_03_15 BG288 AOR 4.220 (OP).jpg,,"Poster - 3/15,16/73 @ BG288 (OP1)AOR 4.220",[],,https://gdsets.com/73posters/1973_03_15 BG288 AOR
gdsets_posters,gdsets_posters_1973_05_20a.jpg,,Poster - 5/20/73,[],,https://gdsets.com/73posters/1973_05_20a.jpg,,,,,,1973-05-20,1713480497459,false
gdsets_posters,gdsets_posters_1973_06_08.jpg,,Poster - 6/8/73,[],,https://gdsets.com/73posters/1973_06_08.jpg,,,,,,1973-06-08,1713480497616,false
gdsets_posters,gdsets_posters_1973_06_09d.jpg,,"Poster - 6/9,10/73",[],,https://gdsets.com/73posters/1973_06_09d.jpg,,,,,,1973-06-09,1713480497697,true
gdsets_posters,gdsets_posters_1973_06_29.jpg,,Poster - 6/29-7/1/73,[],,https://gdsets.com/73posters/1973_06_29.jpg,,,,,,1973-06-29,1713480497741,false
gdsets_posters,gdsets_posters_1973_06_15.jpg,,Poster - 6/15/73(cancelled),[],,https://gdsets.com/73posters/1973_06_15.jpg,,,,,,1973-06-15,1713480497851,false
gdsets_posters,gdsets_posters_1973_06_24.jpg,,Poster - 6/24/73,[],,https://gdsets.com/73posters/1973_06_24.jpg,,,,,,1973-06-24,1713480497851,false
gdsets_posters,gdsets_posters_1973_06_26.jpg,,Poster - 6/26/73,[],,https://gdsets.com/73posters/1973_06_26.jpg,,,,,,1973-06-26,1713480497851,false
gdsets_posters,gdsets_posters_1973_06_09c.jpg,,"Poster - 6/9,10/73 @ Program",[],,https://gdsets.com/73posters/1973_06_09c.jpg,,,,,,1973-06-09,1713480497946,false
gdsets_posters,gdsets_posters_1973_06_22.jpg,,Poster - 6/22/73,[],,https://gdsets.com/73posters/1973_06_22.jpg,,,,,,1973-06-22,1713480497951,false
gdsets_posters,gdsets_posters_1973_06_11.jpg,,Poster - 6/11/73,[],,https://gdsets.com/73posters/1973_06_11.jpg,,,,,,1973-06-11,1713480498044,false
gdsets_posters,gdsets_posters_1973_06_09b.jpg,,"Poster - 6/9,10/73 @ Program",[],,https://gdsets.com/73posters/1973_06_09b.jpg,,,,,,1973-06-09,1713480498045,false
gdsets_posters,gdsets_posters_1973_07_19.jpg,,Poster - 7/19/73,[],,https://gdsets.com/73posters/1973_07_19.jpg,,,,,,1973-07-19,1713480498046,false
gdsets_posters,gdsets_posters_1973_07_19a.jpg,,Poster - 7/19/73,[],,https://gdsets.com/73posters/1973_07_19a.jpg,,,,,,1973-07-19,1713480498070,false
gdsets_posters,gdsets_posters_1973_07_19b.jpg,,Poster - 7/19/73,[],,https://gdsets.com/73posters/1973_07_19b.jpg,,,,,,1973-07-19,1713480498140,false
gdsets_posters,gdsets_posters_1973_06_09a.jpg,,"Poster - 6/9,10/73(OP1)",[],,https://gdsets.com/73posters/1973_06_09a.jpg,,,,,,1973-06-09,1713480498170,true
gdsets_posters,gdsets_posters_1973_07_22.jpg,,Poster - 7/22/73,[],,https://gdsets.com/73posters/1973_07_22.jpg,,,,,,1973-07-22,1713480498266,false
gdsets_posters,gdsets_posters_1973_05_27b.jpg,,Poster - 5/27/73,[],,https://gdsets.com/73posters/1973_05_27b.jpg,,,,,,1973-05-27,1713480498311,true
gdsets_posters,gdsets_posters_1973_06_29a.jpg,,Poster - 6/29-7/1/73,[],,https://gdsets.com/73posters/1973_06_29a.jpg,,,,,,1973-06-29,1713480498483,false
gdsets_posters,gdsets_posters_1973_07_07.jpg,,Poster - July 1973,[],,https://gdsets.com/73posters/1973_07_07.jpg,,,,,,1973-07-07,1713480498487,false
gdsets_posters,gdsets_posters_1973_07_20.jpg,,Poster - 7/20/73,[],,https://gdsets.com/73posters/1973_07_20.jpg,,,,,,1973-07-20,1713480498652,false
gdsets_posters,gdsets_posters_1973_07_31e.jpg,,"Poster - 7/31,8/1/73",[],,https://gdsets.com/73posters/1973_07_31e.jpg,,,,,,1973-07-31,1713480498909,false
gdsets_posters,gdsets_posters_1973_07_31a.jpg,,"Poster - 7/31,8/1/73",[],,https://gdsets.com/73posters/1973_07_31a.jpg,,,,,,1973-07-31,1713480498934,false
gdsets_posters,gdsets_posters_1973_09_05c.jpg,,Poster - 9/5/73,[],,https://gdsets.com/73posters/1973_09_05c.jpg,,,,,,1973-09-05,1713480499002,true
gdsets_posters,gdsets_posters_1973_09_05d.jpg,,Poster - 9/5/73,[],,https://gdsets.com/73posters/1973_09_05d.jpg,,,,,,1973-09-05,1713480499007,true
gdsets_posters,gdsets_posters_1973_09_05b.jpg,,Poster - 9/5/73,[],,https://gdsets.com/73posters/1973_09_05b.jpg,,,,,,1973-09-05,1713480499009,true
gdsets_posters,gdsets_posters_1973_07_28b.jpg,,Poster - 7/28/73 (OP1)AOR 4.231,[],,https://gdsets.com/73posters/1973_07_28b.jpg,,,,,,1973-07-28,1713480499009,true
gdsets_posters,gdsets_posters_1973_07_31b.jpg,,"Poster - 7/31,8/1/73 @ Postcard",[],,https://gdsets.com/73posters/1973_07_31b.jpg,,,,,,1973-07-31,1713480499009,true
gdsets_posters,gdsets_posters_1973_09_05.jpg,,Poster - 9/5/73,[],,https://gdsets.com/73posters/1973_09_05.jpg,,,,,,1973-09-05,1713480499024,false
gdsets_posters,gdsets_posters_1973_09_07.jpg,,Poster - September 1973,[],,https://gdsets.com/73posters/1973_09_07.jpg,,,,,,1973-09-07,1713480499127,false
gdsets_posters,gdsets_posters_1973_05_27a.jpg,,Poster - 5/27/73,[],,https://gdsets.com/73posters/1973_05_27a.jpg,,,,,,1973-05-27,1713480499138,false
gdsets_posters,gdsets_posters_1973_09_07a.jpg,,Poster - 9/7-9/73 @ Program,[],,https://gdsets.com/73posters/1973_09_07a.jpg,,,,,,1973-09-07,1713480499281,false
gdsets_posters,gdsets_posters_1973_09_07b.jpg,,Poster - 9/7-9/73,[],,https://gdsets.com/73posters/1973_09_07b.jpg,,,,,,1973-09-07,1713480499282,false
gdsets_posters,gdsets_posters_1973_07_31.jpg,,"Poster - 7/31,8/1/73 @ AOR pg. 319",[],,https://gdsets.com/73posters/1973_07_31.jpg,,,,,,1973-07-31,1713480499323,false
gdsets_posters,gdsets_posters_1973_07_31d.jpg,,"Poster - 7/31,8/1/73",[],,https://gdsets.com/73posters/1973_07_31d.jpg,,,,,,1973-07-31,1713480499405,false
gdsets_posters,gdsets_posters_1973_09_05e.jpg,,Poster - 9/5/73,[],,https://gdsets.com/73posters/1973_09_05e.jpg,,,,,,1973-09-05,1713480499415,false
gdsets_posters,gdsets_posters_1973_09_11.jpg,,Poster - 9/11/73,[],,https://gdsets.com/73posters/1973_09_11.jpg,,,,,,1973-09-11,1713480499416,false
gdsets_posters,gdsets_posters_1973_07_28.jpg,,Poster - 7/28/73 (OP1)AOR 4.231,[],,https://gdsets.com/73posters/1973_07_28.jpg,,,,,,1973-07-28,1713480499417,false
gdsets_posters,gdsets_posters_1973_09_20.jpg,,"Poster - 9/20,21/73",[],,https://gdsets.com/73posters/1973_09_20.jpg,,,,,,1973-09-20,1713480499620,false
gdsets_posters,gdsets_posters_1973_10_01.jpg,,"Poster - 10/1,8/73",[],,https://gdsets.com/73posters/1973_10_01.jpg,,,,,,1973-10-01,1713480499699,false
gdsets_posters,gdsets_posters_1973_09_20a.jpg,,"Poster - 9/20,21/73",[],,https://gdsets.com/73posters/1973_09_20a.jpg,,,,,,1973-09-20,1713480499716,false
gdsets_posters,gdsets_posters_1973_09_26b.jpg,,Poster - 9/26/73,[],,https://gdsets.com/73posters/1973_09_26b.jpg,,,,,,1973-09-26,1713480499821,false
gdsets_posters,gdsets_posters_1973_09_24.jpg,,Poster - 9/24/73,[],,https://gdsets.com/73posters/1973_09_24.jpg,,,,,,1973-09-24,1713480499918,false
gdsets_posters,gdsets_posters_1973_10_02c.jpg,,Poster - 10/2/73,[],,https://gdsets.com/73posters/1973_10_02c.jpg,,,,,,1973-10-02,1713480499944,false
gdsets_posters,gdsets_posters_1973_08_04.jpg,,Poster - August 1973,[],,https://gdsets.com/73posters/1973_08_04.jpg,,,,,,1973-08-04,1713480500043,false
gdsets_posters,gdsets_posters_1973_10_10.jpg,,Poster - 10/10/73,[],,https://gdsets.com/73posters/1973_10_10.jpg,,,,,,1973-10-10,1713480500045,false
gdsets_posters,gdsets_posters_1973_09_26a.jpg,,Poster - 9/26/73,[],,https://gdsets.com/73posters/1973_09_26a.jpg,,,,,,1973-09-26,1713480500050,false
gdsets_posters,gdsets_posters_1973_10_05.jpg,,Poster - 10/5/73,[],,https://gdsets.com/73posters/1973_10_05.jpg,,,,,,1973-10-05,1713480500190,false
gdsets_posters,gdsets_posters_1973_05_29.jpg,,"Poster - 5/29,30/73",[],,https://gdsets.com/73posters/1973_05_29.jpg,,,,,,1973-05-29,1713480500266,false
gdsets_posters,gdsets_posters_1973_10_02a.jpg,,Poster - 10/2/73,[],,https://gdsets.com/73posters/1973_10_02a.jpg,,,,,,1973-10-02,1713480500275,true
gdsets_posters,gdsets_posters_1973_10_02.jpg,,Poster - 10/2/73,[],,https://gdsets.com/73posters/1973_10_02.jpg,,,,,,1973-10-02,1713480500462,false
gdsets_posters,gdsets_posters_1973_10_07.jpg,,Poster - 10/7/73,[],,https://gdsets.com/73posters/1973_10_07.jpg,,,,,,1973-10-07,1713480500475,false
gdsets_posters,gdsets_posters_1973_07_31c.jpg,,"Poster - 7/31,8/1/73",[],,https://gdsets.com/73posters/1973_07_31c.jpg,,,,,,1973-07-31,1713480500574,false
gdsets_posters,gdsets_posters_1973_10_15e.jpg,,Poster - Wake Of The Flood Promo,[],,https://gdsets.com/73posters/1973_10_15e.jpg,,,,,,1973-10-15,1713480500676,false
gdsets_posters,gdsets_posters_1973_10_21.jpg,,Poster - 10/21/73,[],,https://gdsets.com/73posters/1973_10_21.jpg,,,,,,1973-10-21,1713480500679,false
gdsets_posters,gdsets_posters_1973_09_26.jpg,,Poster - 9/26/73,[],,https://gdsets.com/73posters/1973_09_26.jpg,,,,,,1973-09-26,1713480500782,false
gdsets_posters,gdsets_posters_1973_10_17.jpg,,Poster - 10/17/73(cancelled),[],,https://gdsets.com/73posters/1973_10_17.jpg,,,,,,1973-10-17,1713480500788,false
gdsets_posters,gdsets_posters_1973_10_15a.jpg,,Poster - Wake Of The Flood Promo,[],,https://gdsets.com/73posters/1973_10_15a.jpg,,,,,,1973-10-15,1713480500788,false
gdsets_posters,gdsets_posters_1973_10_19.jpg,,Poster - 10/19/73,[],,https://gdsets.com/73posters/1973_10_19.jpg,,,,,,1973-10-19,1713480500788,false
gdsets_posters,gdsets_posters_1973_10_02b.jpg,,Poster - 10/2/73,[],,https://gdsets.com/73posters/1973_10_02b.jpg,,,,,,1973-10-02,1713480500886,true
gdsets_posters,gdsets_posters_1973_10_23.jpg,,Poster - 10/23/73,[],,https://gdsets.com/73posters/1973_10_23.jpg,,,,,,1973-10-23,1713480500888,false
gdsets_posters,gdsets_posters_1973_10_25.jpg,,Poster - 10/25/73,[],,https://gdsets.com/73posters/1973_10_25.jpg,,,,,,1973-10-25,1713480501065,false
gdsets_posters,gdsets_posters_1973_10_15.jpg,,Poster - Wake Of The Flood (Orig. Art),[],,https://gdsets.com/73posters
gdsets_posters,gdsets_posters_1973_09_15.jpg,,Poster - 9/15/73,[],,https://gdsets.com/73posters/1973_09_15.jpg,,,,,,1973-09-15,1713480501161,false
gdsets_posters,gdsets_posters_1973_10_27.jpg,,Poster - 10/27/73,[],,https://gdsets.com/73posters/1973_10_27.jpg,,,,,,1973-10-27,1713480501179,false
gdsets_posters,gdsets_posters_1973_10_19a.jpg,,Poster - 10/19/73,[],,https://gdsets.com/73posters/1973_10_19a.jpg,,,,,,1973-10-19,1713480501247,false
gdsets_posters,gdsets_posters_1973_10_21a.jpg,,Poster - 10/21/73,[],,https://gdsets.com/73posters/1973_10_21a.jpg,,,,,,1973-10-21,1713480501252,false
gdsets_posters,gdsets_posters_1973_10_15c.jpg,,Poster - Wake Of The Flood Postcard,[],,https://gdsets.com/73posters/1973_10_15c.jpg,,,,,,1973-10-15,1713480501267,true
gdsets_posters,gdsets_posters_1973_10_29.jpg,,"Poster - 10/29,30/73",[],,https://gdsets.com/73posters/1973_10_29.jpg,,,,,,1973-10-29,1713480501275,false
gdsets_posters,gdsets_posters_1973_10_20cx.jpg,,Poster - 10/20/73(cancelled),[],,https://gdsets.com/73posters/1973_10_20cx.jpg,,,,,,1973-10-20,1713480501367,false
gdsets_posters,gdsets_posters_1973_10_15b.jpg,,Poster - Wake Of The Flood Promo,[],,https://gdsets.com/73posters/1973_10_15b.jpg,,,,,,1973-10-15,1713480501370,false
gdsets_posters,gdsets_posters_1973_11_01b.jpg,,Poster - 11/1/73,[],,https://gdsets.com/73posters/1973_11_01b.jpg,,,,,,1973-11-01,1713480501450,true
gdsets_posters,gdsets_posters_1973_11_01e.jpg,,Poster - 11/1/73,[],,https://gdsets.com/73posters/1973_11_01e.jpg,,,,,,1973-11-01,1713480501458,true
gdsets_posters,gdsets_posters_1973_11_01.jpg,,Poster - 11/1/73,[],,https://gdsets.com/73posters/1973_11_01.jpg,,,,,,1973-11-01,1713480501466,false
gdsets_posters,gdsets_posters_1973_11_01d.jpg,,Poster - 11/1/73,[],,https://gdsets.com/73posters/1973_11_01d.jpg,,,,,,1973-11-01,1713480501541,true
gdsets_posters,gdsets_posters_1973_11_01c.jpg,,Poster - 11/1/73,[],,https://gdsets.com/73posters/1973_11_01c.jpg,,,,,,1973-11-01,1713480501541,true
gdsets_posters,gdsets_posters_1973_11_04.jpg,,Poster - 11/4/73 (OP1)AOR 4.100,[],,https://gdsets.com/73posters/1973_11_04.jpg,,,,,,1973-11-04,1713480501554,false
gdsets_posters,gdsets_posters_1973_11_03.jpg,,Poster - 11/3/73,[],,https://gdsets.com/73posters/1973_11_03.jpg,,,,,,1973-11-03,1713480501629,false
gdsets_posters,gdsets_posters_1973_11_09.jpg,,Poster - 11/9-11/73,[],,https://gdsets.com/73posters/1973_11_09.jpg,,,,,,1973-11-09,1713480501736,false
gdsets_posters,gdsets_posters_1973_11_17.jpg,,Poster - 11/17/73,[],,https://gdsets.com/73posters/1973_11_17.jpg,,,,,,1973-11-17,1713480501737,false
gdsets_posters,gdsets_posters_1973_11_20.jpg,,"Poster - 11/20,21/73",[],,https://gdsets.com/73posters/1973_11_20.jpg,,,,,,1973-11-20,1713480501907,false
gdsets_posters,gdsets_posters_1973_11_28.jpg,,Poster - 11/28/73,[],,https://gdsets.com/73posters/1973_11_28.jpg,,,,,,1973-11-28,1713480501910,false
gdsets_posters,gdsets_posters_1973_10_25a.jpg,,Poster - 10/25/73,[],,https://gdsets.com/73posters/1973_10_25a.jpg,,,,,,1973-10-25,1713480502000,false
gdsets_posters,gdsets_posters_1973_12_06.jpg,,Poster - 12/6/73,[],,https://gdsets.com/73posters/1973_12_06.jpg,,,,,,1973-12-06,1713480502014,false
gdsets_posters,gdsets_posters_1973_11_30.jpg,,Poster - 11/30-12/19/73 @ GD Newsletter,[],,https://gdsets.com/73posters
gdsets_posters,gdsets_posters_1973_12_04.jpg,,Poster - 12/4/73,[],,https://gdsets.com/73posters/1973_12_04.jpg,,,,,,1973-12-04,1713480502017,false
gdsets_posters,gdsets_posters_1973_11_01a.jpg,,Poster - 11/1/73,[],,https://gdsets.com/73posters/1973_11_01a.jpg,,,,,,1973-11-01,1713480502100,true
gdsets_posters,gdsets_posters_1973_11_14a.jpg,,Poster - 11/14/73,[],,https://gdsets.com/73posters/1973_11_14a.jpg,,,,,,1973-11-14,1713480502113,true
gdsets_posters,gdsets_posters_1973_12_01.jpg,,"Poster - 12/1,2/73",[],,https://gdsets.com/73posters/1973_12_01.jpg,,,,,,1973-12-01,1713480502208,false
gdsets_posters,gdsets_posters_1973_12_12.jpg,,Poster - 12/12/73,[],,https://gdsets.com/73posters/1973_12_12.jpg,,,,,,1973-12-12,1713480502209,false
gdsets_posters,gdsets_posters_1973_12_08b.jpg,,Poster - 12/8/73,[],,https://gdsets.com/73posters/1973_12_08b.jpg,,,,,,1973-12-08,1713480502219,false
gdsets_posters,gdsets_posters_1973_12_18a.jpg,,"Poster - 12/18,19/73",[],,https://gdsets.com/73posters/1973_12_18a.jpg,,,,,,1973-12-18,1713480502408,false
gdsets_posters,gdsets_posters_1973_12_08a.jpg,,Poster - 12/8/73,[],,https://gdsets.com/73posters/1973_12_08a.jpg,,,,,,1973-12-08,1713480502411,true
gdsets_posters,gdsets_posters_1973_12_10.jpg,,Poster - 12/10/73,[],,https://gdsets.com/73posters/1973_12_10.jpg,,,,,,1973-12-10,1713480502499,false
gdsets_posters,gdsets_posters_1973_11_14.jpg,,Poster - 11/14/73,[],,https://gdsets.com/73posters/1973_11_14.jpg,,,,,,1973-11-14,1713480502500,false
gdsets_posters,gdsets_posters_1973_12_18b.jpg,,"Poster - 12/18,19/73",[],,https://gdsets.com/73posters/1973_12_18b.jpg,,,,,,1973-12-18,1713480502608,false
gdsets_posters,gdsets_posters_1973_11_01f.jpg,,Poster - 11/1/73,[],,https://gdsets.com/73posters/1973_11_01f.jpg,,,,,,1973-11-01,1713480502614,false
gdsets_posters,gdsets_posters_1974_02_05.jpg,,Poster - 2/5/74,[],,https://gdsets.com/73posters/1974_02_05.jpg,,,,,,1974-02-05,1713480502701,false
gdsets_posters,gdsets_posters_1974_01_17.jpg,,"Poster - 1/17,18/74",[],,https://gdsets.com/73posters/1974_01_17.jpg,,,,,,1974-01-17,1713480502706,false
gdsets_posters,gdsets_posters_1974_02_09.jpg,,Poster - 2/9/74,[],,https://gdsets.com/73posters/1974_02_09.jpg,,,,,,1974-02-09,1713480502709,false
gdsets_posters,gdsets_posters_1974_02_09a.jpg,,Poster - 2/9/74,[],,https://gdsets.com/73posters/1974_02_09a.jpg,,,,,,1974-02-09,1713480502710,false
gdsets_posters,gdsets_posters_1974_02_12.jpg,,Poster - 2/12/74,[],,https://gdsets.com/73posters/1974_02_12.jpg,,,,,,1974-02-12,1713480502802,false
gdsets_posters,gdsets_posters_1974_01_19.jpg,,Poster - 1/19/74,[],,https://gdsets.com/73posters/1974_01_19.jpg,,,,,,1974-01-19,1713480502802,false
gdsets_posters,gdsets_posters_1973_12_12b.jpg,,Poster - 12/12/73,[],,https://gdsets.com/73posters/1973_12_12b.jpg,,,,,,1973-12-12,1713480502806,false
gdsets_posters,gdsets_posters_1974_02_17.jpg,,Poster - 2/17/74,[],,https://gdsets.com/73posters/1974_02_17.jpg,,,,,,1974-02-17,1713480502892,false
gdsets_posters,gdsets_posters_1974_02_12a.jpg,,Poster - 2/12/74,[],,https://gdsets.com/73posters/1974_02_12a.jpg,,,,,,1974-02-12,1713480502892,false
gdsets_posters,gdsets_posters_1973_12_18.jpg,,"Poster - 12/18,19/73",[],,https://gdsets.com/73posters/1973_12_18.jpg,,,,,,1973-12-18,1713480502892,false
gdsets_posters,gdsets_posters_1974_02_22.jpg,,Poster - 2/22-24/74,[],,https://gdsets.com/73posters/1974_02_22.jpg,,,,,,1974-02-22,1713480502901,false
gdsets_posters,gdsets_posters_1974_01_11.jpg,,"Poster - 1/11,12/74",[],,https://gdsets.com/73posters/1974_01_11.jpg,,,,,,1974-01-11,1713480502901,false
gdsets_posters,gdsets_posters_1974_03_23.jpg,,Poster - 3/23/74,[],,https://gdsets.com/73posters/1974_03_23.jpg,,,,,,1974-03-23,1713480503059,false
gdsets_posters,gdsets_posters_1974_03_02.jpg,,Poster - 3/2/74,[],,https://gdsets.com/73posters/1974_03_02.jpg,,,,,,1974-03-02,1713480503061,false
gdsets_posters,gdsets_posters_1974_03_30.jpg,,Poster - 3/30/74,[],,https://gdsets.com/73posters/1974_03_30.jpg,,,,,,1974-03-30,1713480503154,false
gdsets_posters,gdsets_posters_1973_12_12a.jpg,,Poster - 12/12/73,[],,https://gdsets.com/73posters/1973_12_12a.jpg,,,,,,1973-12-12,1713480503327,false
gdsets_posters,gdsets_posters_1974_05_17a.jpg,,Poster - 5/17/74,[],,https://gdsets.com/73posters/1974_05_17a.jpg,,,,,,1974-05-17,1713480503327,true
gdsets_posters,gdsets_posters_1974_05_12.jpg,,Poster - 5/12/74,[],,https://gdsets.com/73posters/1974_05_12.jpg,,,,,,1974-05-12,1713480503327,false
gdsets_posters,gdsets_posters_1974_05_14.jpg,,Poster - 5/14/74,[],,https://gdsets.com/73posters/1974_05_14.jpg,,,,,,1974-05-14,1713480503349,false
gdsets_posters,gdsets_posters_1974_05_19a.jpg,,Poster - 5/19/74,[],,https://gdsets.com/73posters/1974_05_19a.jpg,,,,,,1974-05-19,1713480503410,true
gdsets_posters,gdsets_posters_1974_04_26.jpg,,"Poster - 4/26,28/74",[],,https://gdsets.com/73posters/1974_04_26.jpg,,,,,,1974-04-26,1713480503412,false
gdsets_posters,gdsets_posters_1974_05_30.jpg,,Poster - 5/30/74,[],,https://gdsets.com/73posters/1974_05_30.jpg,,,,,,1974-05-30,1713480503532,false
gdsets_posters,gdsets_posters_1974_05_17.jpg,,Poster - 5/17/74,[],,https://gdsets.com/73posters/1974_05_17.jpg,,,,,,1974-05-17,1713480503638,false
gdsets_posters,gdsets_posters_1973_12_08.jpg,,Poster - 12/8/73,[],,https://gdsets.com/73posters/1973_12_08.jpg,,,,,,1973-12-08,1713480503649,false
gdsets_posters,gdsets_posters_1974_05_25a.jpg,,Poster - 5/25/74 (OHB)AOR 4.115,[],,https://gdsets.com/73posters/1974_05_25a.jpg,,,,,,1974-05-25,1713480503743,true
gdsets_posters,gdsets_posters_1974_05_25c.jpg,,Poster - 5/25/74,[],,https://gdsets.com/73posters/1974_05_25c.jpg,,,,,,1974-05-25,1713480503835,false
gdsets_posters,gdsets_posters_1974_05_12a.jpg,,Poster - 5/12/74,[],,https://gdsets.com/73posters/1974_05_12a.jpg,,,,,,1974-05-12,1713480503861,false
gdsets_posters,gdsets_posters_1974_05_25 (AOR 4.115 OP).jpg,,Poster - 5/25/74 (OP1)AOR 4.115,[],,https://gdsets.com/73posters/1974_05_25 (AOR 4.115
gdsets_posters,gdsets_posters_1974_06_06a.jpg,,Poster - Compliments Of Garcia Promo,[],,https://gdsets.com/73posters
gdsets_posters,gdsets_posters_1974_05_25b.jpg,,Poster - 5/25/74,[],,https://gdsets.com/73posters/1974_05_25b.jpg,,,,,,1974-05-25,1713480503955,false
gdsets_posters,gdsets_posters_1974_06_08b.jpg,,Poster - 6/8/74,[],,https://gdsets.com/73posters/1974_06_08b.jpg,,,,,,1974-06-08,1713480504045,false
gdsets_posters,gdsets_posters_1974_06_06b.jpg,,Poster - 6/6/74,[],,https://gdsets.com/73posters/1974_06_06b.jpg,,,,,,1974-06-06,1713480504048,false
gdsets_posters,gdsets_posters_1974_06_01.jpg,,Poster - Compliments/Rum Runners Magazine Ad,[],,https://gdsets.com/73posters
gdsets_posters,gdsets_posters_1974_05_31.jpg,,"Poster - 5/31,6/1/74 @ front",[],,https://gdsets.com/73posters/1974_05_31.jpg,,,,,,1974-05-31,1713480504143,false
gdsets_posters,gdsets_posters_1974_06_06d.jpg,,Poster - June 1974,[],,https://gdsets.com/73posters/1974_06_06d.jpg,,,,,,1974-06-06,1713480504235,false
gdsets_posters,gdsets_posters_1974_06_11.jpg,,Poster - 6/11-14/74,[],,https://gdsets.com/73posters/1974_06_11.jpg,,,,,,1974-06-11,1713480504332,false
gdsets_posters,gdsets_posters_1974_06_08d.jpg,,Poster - 6/8/74,[],,https://gdsets.com/73posters/1974_06_08d.jpg,,,,,,1974-06-08,1713480504332,true
gdsets_posters,gdsets_posters_1974_05_31a.jpg,,"Poster - 5/31,6/1/74 @ back",[],,https://gdsets.com/73posters/1974_05_31a.jpg,,,,,,1974-05-31,1713480504348,false
gdsets_posters,gdsets_posters_1974_06_08c.jpg,,Poster - 6/8/74,[],,https://gdsets.com/73posters/1974_06_08c.jpg,,,,,,1974-06-08,1713480504407,true
gdsets_posters,gdsets_posters_1974_05_19.jpg,,Poster - 5/19/74,[],,https://gdsets.com/73posters/1974_05_19.jpg,,,,,,1974-05-19,1713480504417,false
gdsets_posters,gdsets_posters_1974_06_08a.jpg,,Poster - 6/8/74,[],,https://gdsets.com/73posters/1974_06_08a.jpg,,,,,,1974-06-08,1713480504418,true
gdsets_posters,gdsets_posters_1974_06_16b.jpg,,Poster - 6/16/74,[],,https://gdsets.com/73posters/1974_06_16b.jpg,,,,,,1974-06-16,1713480504438,true
gdsets_posters,gdsets_posters_1974_05_21.jpg,,Poster - 5/21/74,[],,https://gdsets.com/73posters/1974_05_21.jpg,,,,,,1974-05-21,1713480504519,false
gdsets_posters,gdsets_posters_1974_06_26.jpg,,Poster - 6/26/74,[],,https://gdsets.com/73posters/1974_06_26.jpg,,,,,,1974-06-26,1713480504530,false
gdsets_posters,gdsets_posters_1974_06_18a.jpg,,Poster - 6/18/74,[],,https://gdsets.com/73posters/1974_06_18a.jpg,,,,,,1974-06-18,1713480504613,true
gdsets_posters,gdsets_posters_1974_06_18.jpg,,Poster - 6/18/74,[],,https://gdsets.com/73posters/1974_06_18.jpg,,,,,,1974-06-18,1713480504624,false
gdsets_posters,gdsets_posters_1974_06_20.jpg,,Poster - 6/20/74,[],,https://gdsets.com/73posters/1974_06_20.jpg,,,,,,1974-06-20,1713480504704,false
gdsets_posters,gdsets_posters_1974_06_22.jpg,,"Poster - 6/22,23/74",[],,https://gdsets.com/73posters/1974_06_22.jpg,,,,,,1974-06-22,1713480504707,false
gdsets_posters,gdsets_posters_1974_06_16.jpg,,Poster - 6/16/74,[],,https://gdsets.com/73posters/1974_06_16.jpg,,,,,,1974-06-16,1713480504989,false
gdsets_posters,gdsets_posters_1974_06_08.jpg,,Poster - 6/8/74,[],,https://gdsets.com/73posters/1974_06_08.jpg,,,,,,1974-06-08,1713480505004,false
gdsets_posters,gdsets_posters_1974_06_20a.jpg,,Poster - 6/20/74,[],,https://gdsets.com/73posters/1974_06_20a.jpg,,,,,,1974-06-20,1713480505007,false
gdsets_posters,gdsets_posters_1974_07_04b.jpg,,Poster - 7/4/74(cancelled),[],,https://gdsets.com/73posters/1974_07_04b.jpg,,,,,,1974-07-04,1713480505088,false
gdsets_posters,gdsets_posters_1974_07_04a.jpg,,Poster - 7/4/74(cancelled),[],,https://gdsets.com/73posters/1974_07_04a.jpg,,,,,,1974-07-04,1713480505176,false
gdsets_posters,gdsets_posters_1974_07_04c.jpg,,Poster - 7/4/74(cancelled),[],,https://gdsets.com/73posters/1974_07_04c.jpg,,,,,,1974-07-04,1713480505211,false
gdsets_posters,gdsets_posters_1974_06_06.jpg,,Poster - Compliments Of Garcia Promo,[],,https://gdsets.com/73posters/1974_06_06.jpg,,,,,,1974-06-06,1713480505219,false
gdsets_posters,gdsets_posters_1974_06_27a.jpg,,Poster - Mars Hotel Promo,[],,https://gdsets.com/73posters/1974_06_27a.jpg,,,,,,1974-06-27,1713480505265,false
gdsets_posters,gdsets_posters_1974_07_04d.jpg,,Poster - 7/4/74(cancelled),[],,https://gdsets.com/73posters/1974_07_04d.jpg,,,,,,1974-07-04,1713480505302,false
gdsets_posters,gdsets_posters_1974_07_07.jpg,,Poster - 7/7/74(cancelled),[],,https://gdsets.com/73posters/1974_07_07.jpg,,,,,,1974-07-07,1713480505305,false
gdsets_posters,gdsets_posters_1974_07_12.jpg,,"Poster - 7/12,13/74",[],,https://gdsets.com/73posters/1974_07_12.jpg,,,,,,1974-07-12,1713480505305,false
gdsets_posters,gdsets_posters_1974_07_13.jpg,,Poster - 7/13/74,[],,https://gdsets.com/73posters/1974_07_13.jpg,,,,,,1974-07-13,1713480505308,false
gdsets_posters,gdsets_posters_1974_07_03.jpg,,Poster - 7/3/74(cancelled),[],,https://gdsets.com/73posters/1974_07_03.jpg,,,,,,1974-07-03,1713480505349,false
gdsets_posters,gdsets_posters_1974_07_14.jpg,,Poster - 7/14/74,[],,https://gdsets.com/73posters/1974_07_14.jpg,,,,,,1974-07-14,1713480505382,false
gdsets_posters,gdsets_posters_1974_06_27c.jpg,,Poster - Mars Hotel/COGNewspaper Ad,[],,https://gdsets.com/73posters
gdsets_posters,gdsets_posters_1974_07_29.jpg,,Poster - 7/29/74,[],,https://gdsets.com/73posters/1974_07_29.jpg,,,,,,1974-07-29,1713480505682,false
gdsets_posters,gdsets_posters_1974_08_04a.jpg,,Poster - 8/4/74,[],,https://gdsets.com/73posters/1974_08_04a.jpg,,,,,,1974-08-04,1713480505772,true
gdsets_posters,gdsets_posters_1974_08_23.jpg,,Poster - 8/23/74,[],,https://gdsets.com/73posters/1974_08_23.jpg,,,,,,1974-08-23,1713480505965,false
gdsets_posters,gdsets_posters_1974_08_11.jpg,,Poster - 8/11/74,[],,https://gdsets.com/73posters/1974_08_11.jpg,,,,,,1974-08-11,1713480505968,false
gdsets_posters,gdsets_posters_1974_08_05.jpg,,Poster - 8/5/74,[],,https://gdsets.com/73posters/1974_08_05.jpg,,,,,,1974-08-05,1713480505970,true
gdsets_posters,gdsets_posters_1974_08_07.jpg,,Poster - 8/7/74,[],,https://gdsets.com/73posters/1974_08_07.jpg,,,,,,1974-08-07,1713480505970,false
gdsets_posters,gdsets_posters_1974_06_27b.jpg,,Poster - U.S. Blues Single Trade Paper Ad,[],,https://gdsets.com/73posters
gdsets_posters,gdsets_posters_1974_08_05a.jpg,,"Poster - 8/4,5/74 @ Program",[],,https://gdsets.com/73posters/1974_08_05a.jpg,,,,,,1974-08-05,1713480505988,false
gdsets_posters,gdsets_posters_1974_07_04.jpg,,Poster - 7/4/74(cancelled),[],,https://gdsets.com/73posters/1974_07_04.jpg,,,,,,1974-07-04,1713480505988,false
gdsets_posters,gdsets_posters_1974_08_31.jpg,,"Poster - 8/31,9/1/74",[],,https://gdsets.com/73posters/1974_08_31.jpg,,,,,,1974-08-31,1713480506084,false
gdsets_posters,gdsets_posters_1974_08_06.jpg,,Poster - 8/6/74,[],,https://gdsets.com/73posters/1974_08_06.jpg,,,,,,1974-08-06,1713480506088,false
gdsets_posters,gdsets_posters_1974_07_25.jpg,,Poster - 7/25-8/5/74,[],,https://gdsets.com/73posters/1974_07_25.jpg,,,,,,1974-07-25,1713480506091,false
gdsets_posters,gdsets_posters_1974_08_23a.jpg,,Poster - 8/23/74,[],,https://gdsets.com/73posters/1974_08_23a.jpg,,,,,,1974-08-23,1713480506095,false
gdsets_posters,gdsets_posters_1974_07_19.jpg,,Poster - 7/19/74,[],,https://gdsets.com/73posters/1974_07_19.jpg,,,,,,1974-07-19,1713480506192,false
gdsets_posters,gdsets_posters_1974_06_27.jpg,,Poster - Mars Hotel Promo,[],,https://gdsets.com/73posters/1974_06_27.jpg,,,,,,1974-06-27,1713480506306,false
gdsets_posters,gdsets_posters_1974_06_28.jpg,,Poster - 6/28/74,[],,https://gdsets.com/73posters/1974_06_28.jpg,,,,,,1974-06-28,1713480506390,false
gdsets_posters,gdsets_posters_1974_09_09.jpg,,Poster - 9/9-11/74,[],,https://gdsets.com/73posters/1974_09_09.jpg,,,,,,1974-09-09,1713480506471,false
gdsets_posters,gdsets_posters_1974_09_02.jpg,,Poster - 9/2/74,[],,https://gdsets.com/73posters/1974_09_02.jpg,,,,,,1974-09-02,1713480506681,false
gdsets_posters,gdsets_posters_1974_10_16a.jpg,,Poster - 10/16-20/74,[],,https://gdsets.com/73posters/1974_10_16a.jpg,,,,,,1974-10-16,1713480506682,true
gdsets_posters,gdsets_posters_1974_10_04.jpg,,"Poster - 10/4,5/74",[],,https://gdsets.com/73posters/1974_10_04.jpg,,,,,,1974-10-04,1713480506684,false
gdsets_posters,gdsets_posters_1974_07_21.jpg,,Poster - 7/21/74,[],,https://gdsets.com/73posters/1974_07_21.jpg,,,,,,1974-07-21,1713480506687,false
gdsets_posters,gdsets_posters_1974_10_16.jpg,,Poster - 10/17-20/74(no 10/16 date),[],,https://gdsets.com/73posters/1974_10_16.jpg,,,,,,1974-10-16,1713480506688,false
gdsets_posters,gdsets_posters_1974_10_23.jpg,,"Poster - 10/23,24/74",[],,https://gdsets.com/73posters/1974_10_23.jpg,,,,,,1974-10-23,1713480506691,false
gdsets_posters,gdsets_posters_1974_10_16c.jpg,,Poster - 10/16/74(cancelled),[],,https://gdsets.com/73posters/1974_10_16c.jpg,,,,,,1974-10-16,1713480506692,true
gdsets_posters,gdsets_posters_1974_10_31a.jpg,,Poster - 10/31/74,[],,https://gdsets.com/73posters/1974_10_31a.jpg,,,,,,1974-10-31,1713480506782,false
gdsets_posters,gdsets_posters_1974_11_09.jpg,,Poster - 11/9/74,[],,https://gdsets.com/73posters/1974_11_09.jpg,,,,,,1974-11-09,1713480506782,false
gdsets_posters,gdsets_posters_1974_10_13.jpg,,Poster - 10/13/74,[],,https://gdsets.com/73posters/1974_10_13.jpg,,,,,,1974-10-13,1713480506885,true
gdsets_posters,gdsets_posters_1974_08_04b.jpg,,"Poster - 8/4,5/74",[],,https://gdsets.com/73posters/1974_08_04b.jpg,,,,,,1974-08-04,1713480506885,true
gdsets_posters,gdsets_posters_1974_10_25.jpg,,Poster - 10/25-27/74,[],,https://gdsets.com/73posters/1974_10_25.jpg,,,,,,1974-10-25,1713480506889,false
gdsets_posters,gdsets_posters_1974_10_11.jpg,,Poster - 10/11/74,[],,https://gdsets.com/73posters/1974_10_11.jpg,,,,,,1974-10-11,1713480506982,false
gdsets_posters,gdsets_posters_1974_11_12.jpg,,Poster - 11/12-14/74,[],,https://gdsets.com/73posters/1974_11_12.jpg,,,,,,1974-11-12,1713480507055,false
gdsets_posters,gdsets_posters_1974_11_27.jpg,,Poster - 11/27/74,[],,https://gdsets.com/73posters/1974_11_27.jpg,,,,,,1974-11-27,1713480507071,false
gdsets_posters,gdsets_posters_1974_10_31.jpg,,Poster - 10/31/74,[],,https://gdsets.com/73posters/1974_10_31.jpg,,,,,,1974-10-31,1713480507073,false
gdsets_posters,gdsets_posters_1974_11_29.jpg,,"Poster - 11/29,30/74",[],,https://gdsets.com/73posters/1974_11_29.jpg,,,,,,1974-11-29,1713480507172,false
gdsets_posters,gdsets_posters_1974_08_04 (OHB).jpg,,Poster - 8/4/74,[],,https://gdsets.com/73posters/1974_08_04 (OHB).jpg,,,,,,1974-08-04,1713480507174,false
gdsets_posters,gdsets_posters_1974_11_29a.jpg,,"Poster - 11/29,30/74",[],,https://gdsets.com/73posters/1974_11_29a.jpg,,,,,,1974-11-29,1713480507271,false
gdsets_posters,gdsets_posters_1974_10_13a.jpg,,Poster - 10/13/74,[],,https://gdsets.com/73posters/1974_10_13a.jpg,,,,,,1974-10-13,1713480507320,false
gdsets_posters,gdsets_posters_1974_10_16b.jpg,,Poster - 10/16-20/74,[],,https://gdsets.com/73posters/1974_10_16b.jpg,,,,,,1974-10-16,1713480507344,true
gdsets_posters,gdsets_posters_1974_12_13.jpg,,Poster - 12/13/74,[],,https://gdsets.com/73posters/1974_12_13.jpg,,,,,,1974-12-13,1713480507353,false
gdsets_posters,gdsets_posters_1974_12_15.jpg,,Poster - 12/15/74,[],,https://gdsets.com/73posters/1974_12_15.jpg,,,,,,1974-12-15,1713480507384,false
gdsets_posters,gdsets_posters_1974_12_06.jpg,,"Poster - 12/6,7/74",[],,https://gdsets.com/73posters/1974_12_06.jpg,,,,,,1974-12-06,1713480507385,false
gdsets_posters,gdsets_posters_1974_12_29.jpg,,"Poster - 12/29,31/74",[],,https://gdsets.com/73posters/1974_12_29.jpg,,,,,,1974-12-29,1713480507464,false
gdsets_posters,gdsets_posters_1974_12_31.jpg,,Poster - 12/31/74,[],,https://gdsets.com/73posters/1974_12_31.jpg,,,,,,1974-12-31,1713480507479,false
gdsets_posters,gdsets_posters_1974_09_14.jpg,,Poster - 9/14/74 (OP1)AOR 4.237,[],,https://gdsets.com/73posters/1974_09_14.jpg,,,,,,1974-09-14,1713480507526,false
gdsets_posters,gdsets_posters_1974_12_13a.jpg,,Poster - 12/13-27/74,[],,https://gdsets.com/73posters/1974_12_13a.jpg,,,,,,1974-12-13,1713480507609,false
gdsets_posters,gdsets_posters_1975_01_23.jpg,,Poster - 1/23/75,[],,https://gdsets.com/73posters/1975_01_23.jpg,,,,,,1975-01-23,1713480507621,false
gdsets_posters,gdsets_posters_1975_02_08.jpg,,Poster - 2/8/75,[],,https://gdsets.com/73posters/1975_02_08.jpg,,,,,,1975-02-08,1713480507704,false
gdsets_posters,gdsets_posters_1975_01_24.jpg,,"Poster - 1/24,25/75",[],,https://gdsets.com/73posters/1975_01_24.jpg,,,,,,1975-01-24,1713480507718,false
gdsets_posters,gdsets_posters_1975_02_14.jpg,,"Poster - 2/14,15/75",[],,https://gdsets.com/73posters/1975_02_14.jpg,,,,,,1975-02-14,1713480507719,false
gdsets_posters,gdsets_posters_1974_12_27.jpg,,Poster - 12/27-29/74,[],,https://gdsets.com/73posters/1974_12_27.jpg,,,,,,1974-12-27,1713480507783,false
gdsets_posters,gdsets_posters_1975_01_21a.jpg,,Poster - Jan/Feb. 1975,[],,https://gdsets.com/73posters/1975_01_21a.jpg,,,,,,1975-01-21,1713480507863,false
gdsets_posters,gdsets_posters_1975_02_28.jpg,,Poster - 2/28-3/2/75,[],,https://gdsets.com/73posters/1975_02_28.jpg,,,,,,1975-02-28,1713480507882,false
gdsets_posters,gdsets_posters_1975_02_27.jpg,,"Poster - 2/27,28/75",[],,https://gdsets.com/73posters/1975_02_27.jpg,,,,,,1975-02-27,1713480507882,false
gdsets_posters,gdsets_posters_1975_02_21.jpg,,Poster - 2/21-23/75,[],,https://gdsets.com/73posters/1975_02_21.jpg,,,,,,1975-02-21,1713480507896,false
gdsets_posters,gdsets_posters_1975_03_01.jpg,,"Poster - 3/1,2/75",[],,https://gdsets.com/73posters/1975_03_01.jpg,,,,,,1975-03-01,1713480507898,false
gdsets_posters,gdsets_posters_1975_03_16.jpg,,Poster - 3/16/75,[],,https://gdsets.com/73posters/1975_03_16.jpg,,,,,,1975-03-16,1713480507973,false
gdsets_posters,gdsets_posters_1975_03_07.jpg,,Poster - 3/7-9/75,[],,https://gdsets.com/73posters/1975_03_07.jpg,,,,,,1975-03-07,1713480507975,false
gdsets_posters,gdsets_posters_1975_03_15.jpg,,"Poster - 3/15,20,21/75",[],,https://gdsets.com/73posters/1975_03_15.jpg,,,,,,1975-03-15,1713480507976,false
gdsets_posters,gdsets_posters_1975_03_21.jpg,,Poster - 3/21-23/75,[],,https://gdsets.com/73posters/1975_03_21.jpg,,,,,,1975-03-21,1713480508074,false
gdsets_posters,gdsets_posters_1975_04_05.jpg,,Poster - 4/5/75,[],,https://gdsets.com/73posters/1975_04_05.jpg,,,,,,1975-04-05,1713480508148,false
gdsets_posters,gdsets_posters_1975_01_21.jpg,,Poster - Jan/Feb. 1975,[],,https://gdsets.com/73posters/1975_01_21.jpg,,,,,,1975-01-21,1713480508152,true
gdsets_posters,gdsets_posters_1975_03_23a.jpg,,Poster - 3/23/75 (OHB)AOR 4.49,[],,https://gdsets.com/73posters/1975_03_23a.jpg,,,,,,1975-03-23,1713480508235,true
gdsets_posters,gdsets_posters_1974_12_21.jpg,,"Poster - 12/21,22/74 (OP1)AOR 4.170",[],,https://gdsets.com/73posters
gdsets_posters,gdsets_posters_1975_04_05a.jpg,,Poster - 4/5/75,[],,https://gdsets.com/73posters/1975_04_05a.jpg,,,,,,1975-04-05,1713480508314,false
gdsets_posters,gdsets_posters_1975_04_05b.jpg,,Poster - 4/5/75,[],,https://gdsets.com/73posters/1975_04_05b.jpg,,,,,,1975-04-05,1713480508317,false
gdsets_posters,gdsets_posters_1975_04_07.jpg,,Poster - 4/7/75,[],,https://gdsets.com/73posters/1975_04_07.jpg,,,,,,1975-04-07,1713480508323,false
gdsets_posters,gdsets_posters_1975_04_11.jpg,,Poster - 4/11/75,[],,https://gdsets.com/73posters/1975_04_11.jpg,,,,,,1975-04-11,1713480508324,false
gdsets_posters,gdsets_posters_1975_04_12.jpg,,Poster - 4/12/75,[],,https://gdsets.com/73posters/1975_04_12.jpg,,,,,,1975-04-12,1713480508372,false
gdsets_posters,gdsets_posters_1975_04_14.jpg,,Poster - 4/14/75,[],,https://gdsets.com/73posters/1975_04_14.jpg,,,,,,1975-04-14,1713480508494,false
gdsets_posters,gdsets_posters_1975_04_13.jpg,,Poster - 4/13/75,[],,https://gdsets.com/73posters/1975_04_13.jpg,,,,,,1975-04-13,1713480508494,false
gdsets_posters,gdsets_posters_1975_04_12b.jpg,,Poster - 4/12/75,[],,https://gdsets.com/73posters/1975_04_12b.jpg,,,,,,1975-04-12,1713480508494,false
gdsets_posters,gdsets_posters_1975_04_06.jpg,,Poster - 4/6/75,[],,https://gdsets.com/73posters/1975_04_06.jpg,,,,,,1975-04-06,1713480508506,false
gdsets_posters,gdsets_posters_1975_04_19.jpg,,Poster - 4/19/75,[],,https://gdsets.com/73posters/1975_04_19.jpg,,,,,,1975-04-19,1713480508507,false
gdsets_posters,gdsets_posters_1975_04_19b.jpg,,Poster - 4/19/75,[],,https://gdsets.com/73posters/1975_04_19b.jpg,,,,,,1975-04-19,1713480508599,false
gdsets_posters,gdsets_posters_1975_04_12a.jpg,,Poster - 4/12/75,[],,https://gdsets.com/73posters/1975_04_12a.jpg,,,,,,1975-04-12,1713480508617,false
gdsets_posters,gdsets_posters_1975_04_20.jpg,,Poster - 4/20/75,[],,https://gdsets.com/73posters/1975_04_20.jpg,,,,,,1975-04-20,1713480508691,false
gdsets_posters,gdsets_posters_1975_04_20b.jpg,,Poster - 4/20/75,[],,https://gdsets.com/73posters/1975_04_20b.jpg,,,,,,1975-04-20,1713480508762,false
gdsets_posters,gdsets_posters_1975_04_19a.jpg,,Poster - 4/19/75,[],,https://gdsets.com/73posters/1975_04_19a.jpg,,,,,,1975-04-19,1713480508767,false
gdsets_posters,gdsets_posters_1975_04_20a.jpg,,Poster - 4/20/75,[],,https://gdsets.com/73posters/1975_04_20a.jpg,,,,,,1975-04-20,1713480508808,false
gdsets_posters,gdsets_posters_1975_04_20c.jpg,,Poster - 4/20/75,[],,https://gdsets.com/73posters/1975_04_20c.jpg,,,,,,1975-04-20,1713480508849,false
gdsets_posters,gdsets_posters_1975_05_03.jpg,,"Poster - 5/3,4/75",[],,https://gdsets.com/73posters/1975_05_03.jpg,,,,,,1975-05-03,1713480508850,false
gdsets_posters,gdsets_posters_1975_03_23.jpg,,Poster - 3/23/75 (OP1)AOR 4.49,[],,https://gdsets.com/73posters/1975_03_23.jpg,,,,,,1975-03-23,1713480508862,false
gdsets_posters,gdsets_posters_1975_05_16a.jpg,,Poster - 5/16-18/75,[],,https://gdsets.com/73posters/1975_05_16a.jpg,,,,,,1975-05-16,1713480508952,false
gdsets_posters,gdsets_posters_1975_05_12.jpg,,Poster - 5/12/75,[],,https://gdsets.com/73posters/1975_05_12.jpg,,,,,,1975-05-12,1713480509018,false
gdsets_posters,gdsets_posters_1975_05_11.jpg,,Poster - 5/11/75,[],,https://gdsets.com/73posters/1975_05_11.jpg,,,,,,1975-05-11,1713480509099,false
gdsets_posters,gdsets_posters_1975_05_25.jpg,,Poster - 5/25/75,[],,https://gdsets.com/73posters/1975_05_25.jpg,,,,,,1975-05-25,1713480509117,false
gdsets_posters,gdsets_posters_1975_05_21.jpg,,"Poster - 5/21,22/75",[],,https://gdsets.com/73posters/1975_05_21.jpg,,,,,,1975-05-21,1713480509119,false
gdsets_posters,gdsets_posters_1975_05_16b.jpg,,Poster - 5/16/75,[],,https://gdsets.com/73posters/1975_05_16b.jpg,,,,,,1975-05-16,1713480509121,false
gdsets_posters,gdsets_posters_1975_05_16.jpg,,Poster - 5/16-18/75,[],,https://gdsets.com/73posters/1975_05_16.jpg,,,,,,1975-05-16,1713480509180,false
gdsets_posters,gdsets_posters_1975_05_23.jpg,,Poster - K&D dates,[],,https://gdsets.com/73posters/1975_05_23.jpg,,,,,,1975-05-23,1713480509221,false
gdsets_posters,gdsets_posters_1975_05_30.jpg,,Poster - 5/30-6/1/75,[],,https://gdsets.com/73posters/1975_05_30.jpg,,,,,,1975-05-30,1713480509287,false
gdsets_posters,gdsets_posters_1975_05_26.jpg,,Poster - 5/26/75,[],,https://gdsets.com/73posters/1975_05_26.jpg,,,,,,1975-05-26,1713480509303,false
gdsets_posters,gdsets_posters_1975_06_03a.jpg,,Poster - 6/3-14/75,[],,https://gdsets.com/73posters/1975_06_03a.jpg,,,,,,1975-06-03,1713480509383,false
gdsets_posters,gdsets_posters_1975_05_26a.jpg,,Poster - 5/26/75,[],,https://gdsets.com/73posters/1975_05_26a.jpg,,,,,,1975-05-26,1713480509389,false
gdsets_posters,gdsets_posters_1975_05_17.jpg,,"Poster - 5/17,18/75",[],,https://gdsets.com/73posters/1975_05_17.jpg,,,,,,1975-05-17,1713480509455,false
gdsets_posters,gdsets_posters_1975_06_03.jpg,,Poster - June 1975,[],,https://gdsets.com/73posters/1975_06_03.jpg,,,,,,1975-06-03,1713480509456,false
gdsets_posters,gdsets_posters_1975_06_11.jpg,,Poster - 6/11-22/75,[],,https://gdsets.com/73posters/1975_06_11.jpg,,,,,,1975-06-11,1713480509481,false
gdsets_posters,gdsets_posters_1975_06_06.jpg,,Poster - 6/6/75,[],,https://gdsets.com/73posters/1975_06_06.jpg,,,,,,1975-06-06,1713480509481,true
gdsets_posters,gdsets_posters_1975_06_08.jpg,,Poster - 6/8/75,[],,https://gdsets.com/73posters/1975_06_08.jpg,,,,,,1975-06-08,1713480509744,false
gdsets_posters,gdsets_posters_1975_06_15.jpg,,Poster - 6/15/75,[],,https://gdsets.com/73posters/1975_06_15.jpg,,,,,,1975-06-15,1713480509750,false
gdsets_posters,gdsets_posters_1975_05_08.jpg,,Poster - 5/8/75 @ front,[],,https://gdsets.com/73posters/1975_05_08.jpg,,,,,,1975-05-08,1713480509750,false
gdsets_posters,gdsets_posters_1975_06_15a.jpg,,Poster - 6/15/75,[],,https://gdsets.com/73posters/1975_06_15a.jpg,,,,,,1975-06-15,1713480509788,false
gdsets_posters,gdsets_posters_1975_06_06a.jpg,,Poster - 6/6/75,[],,https://gdsets.com/73posters/1975_06_06a.jpg,,,,,,1975-06-06,1713480509808,false
gdsets_posters,gdsets_posters_1975_06_14.jpg,,Poster - 6/14/75,[],,https://gdsets.com/73posters/1975_06_14.jpg,,,,,,1975-06-14,1713480509834,false
gdsets_posters,gdsets_posters_1975_05_08a.jpg,,Poster - 5/8/75 @ back,[],,https://gdsets.com/73posters/1975_05_08a.jpg,,,,,,1975-05-08,1713480509867,false
gdsets_posters,gdsets_posters_1975_06_15b.jpg,,Poster - 6/15/75,[],,https://gdsets.com/73posters/1975_06_15b.jpg,,,,,,1975-06-15,1713480509867,false
gdsets_posters,gdsets_posters_1975_06_17c.jpg,,Poster - 6/17/75(OHB),[],,https://gdsets.com/73posters/1975_06_17c.jpg,,,,,,1975-06-17,1713480510006,true
gdsets_posters,gdsets_posters_1975_06_17b.jpg,,Poster - 6/17/75(OHB),[],,https://gdsets.com/73posters/1975_06_17b.jpg,,,,,,1975-06-17,1713480510024,true
gdsets_posters,gdsets_posters_1975_06_17a.jpg,,Poster - 6/17/75(OHB),[],,https://gdsets.com/73posters/1975_06_17a.jpg,,,,,,1975-06-17,1713480510024,true
gdsets_posters,gdsets_posters_1975_06_18.jpg,,Poster - 6/18/75,[],,https://gdsets.com/73posters/1975_06_18.jpg,,,,,,1975-06-18,1713480510025,false
gdsets_posters,gdsets_posters_1975_06_21.jpg,,"Poster - 6/21,22/75",[],,https://gdsets.com/73posters/1975_06_21.jpg,,,,,,1975-06-21,1713480510027,false
gdsets_posters,gdsets_posters_1975_06_23.jpg,,Poster - 6/23/75,[],,https://gdsets.com/73posters/1975_06_23.jpg,,,,,,1975-06-23,1713480510051,false
gdsets_posters,gdsets_posters_1975_07_04.jpg,,"Poster - 7/4,5/75",[],,https://gdsets.com/73posters/1975_07_04.jpg,,,,,,1975-07-04,1713480510112,false
gdsets_posters,gdsets_posters_1975_06_17d.jpg,,Poster - 6/17/75(OHB),[],,https://gdsets.com/73posters/1975_06_17d.jpg,,,,,,1975-06-17,1713480510195,true
gdsets_posters,gdsets_posters_1975_07_06.jpg,,Poster - July 1975,[],,https://gdsets.com/73posters/1975_07_06.jpg,,,,,,1975-07-06,1713480510288,false
gdsets_posters,gdsets_posters_1975_06_26.jpg,,Poster - 6/26/75,[],,https://gdsets.com/73posters/1975_06_26.jpg,,,,,,1975-06-26,1713480510382,false
gdsets_posters,gdsets_posters_1975_07_20.jpg,,Poster - 7/20/75,[],,https://gdsets.com/73posters/1975_07_20.jpg,,,,,,1975-07-20,1713480510386,false
gdsets_posters,gdsets_posters_1975_07_06a.jpg,,Poster - 7/6/75,[],,https://gdsets.com/73posters/1975_07_06a.jpg,,,,,,1975-07-06,1713480510386,false
gdsets_posters,gdsets_posters_1975_08_14.jpg,,Poster - 8/14/75,[],,https://gdsets.com/73posters/1975_08_14.jpg,,,,,,1975-08-14,1713480510396,false
gdsets_posters,gdsets_posters_1975_08_05.jpg,,Poster - 8/5/75,[],,https://gdsets.com/73posters/1975_08_05.jpg,,,,,,1975-08-05,1713480510407,false
gdsets_posters,gdsets_posters_1975_08_18a.jpg,,Poster - 8/18/75,[],,https://gdsets.com/73posters/1975_08_18a.jpg,,,,,,1975-08-18,1713480510493,false
gdsets_posters,gdsets_posters_1975_08_20.jpg,,"Poster - 8/20,21/75",[],,https://gdsets.com/73posters/1975_08_20.jpg,,,,,,1975-08-20,1713480510566,false
gdsets_posters,gdsets_posters_1975_09_19 AOR 4.24.jpg,,Poster - 9/19/75 @ AOR 4.24,[],,https://gdsets.com/73posters/1975_09_19 AOR
gdsets_posters,gdsets_posters_1975_08_24.jpg,,Poster - 8/24/75,[],,https://gdsets.com/73posters/1975_08_24.jpg,,,,,,1975-08-24,1713480510574,false
gdsets_posters,gdsets_posters_1975_06_17.jpg,,Poster - 6/17/75(OP1),[],,https://gdsets.com/73posters/1975_06_17.jpg,,,,,,1975-06-17,1713480510592,false
gdsets_posters,gdsets_posters_1975_09_19a.jpg,,Poster - 9/19/75,[],,https://gdsets.com/73posters/1975_09_19a.jpg,,,,,,1975-09-19,1713480510662,false
gdsets_posters,gdsets_posters_1975_08_29.jpg,,"Poster - 8/29,30/75",[],,https://gdsets.com/73posters/1975_08_29.jpg,,,,,,1975-08-29,1713480510662,false
gdsets_posters,gdsets_posters_1975_08_18.jpg,,Poster - August 1975,[],,https://gdsets.com/73posters/1975_08_18.jpg,,,,,,1975-08-18,1713480510664,false
gdsets_posters,gdsets_posters_1975_09_21.jpg,,Poster - 9/21/75,[],,https://gdsets.com/73posters/1975_09_21.jpg,,,,,,1975-09-21,1713480510677,false
gdsets_posters,gdsets_posters_1975_06_17e.jpg,,Poster - 6/17/75(proof),[],,https://gdsets.com/73posters/1975_06_17e.jpg,,,,,,1975-06-17,1713480510851,true
gdsets_posters,gdsets_posters_1975_10_17.jpg,,Poster - 10/17/75,[],,https://gdsets.com/73posters/1975_10_17.jpg,,,,,,1975-10-17,1713480511051,false
gdsets_posters,gdsets_posters_1975_09_28.jpg,,Poster - 9/28/75,[],,https://gdsets.com/73posters/1975_09_28.jpg,,,,,,1975-09-28,1713480511051,false
gdsets_posters,gdsets_posters_1975_10_17a.jpg,,Poster - 10/17/75,[],,https://gdsets.com/73posters/1975_10_17a.jpg,,,,,,1975-10-17,1713480511058,false
gdsets_posters,gdsets_posters_1975_10_26.jpg,,Poster - 10/26/75,[],,https://gdsets.com/73posters/1975_10_26.jpg,,,,,,1975-10-26,1713480511156,false
gdsets_posters,gdsets_posters_1975_10_24.jpg,,Poster - 10/24/75,[],,https://gdsets.com/73posters/1975_10_24.jpg,,,,,,1975-10-24,1713480511161,false
gdsets_posters,gdsets_posters_1975_07_11.jpg,,Poster - 7/11/75,[],,https://gdsets.com/73posters/1975_07_11.jpg,,,,,,1975-07-11,1713480511161,false
gdsets_posters,gdsets_posters_1975_10_11.jpg,,"Poster - 10/11,12/75",[],,https://gdsets.com/73posters/1975_10_11.jpg,,,,,,1975-10-11,1713480511206,false
gdsets_posters,gdsets_posters_1975_11_01.jpg,,Poster - 11/1/75,[],,https://gdsets.com/73posters/1975_11_01.jpg,,,,,,1975-11-01,1713480511249,false
gdsets_posters,gdsets_posters_1975_10_31.jpg,,Poster - 10/31/75,[],,https://gdsets.com/73posters/1975_10_31.jpg,,,,,,1975-10-31,1713480511249,false
gdsets_posters,gdsets_posters_1975_09_29.jpg,,Poster - 9/29/75,[],,https://gdsets.com/73posters/1975_09_29.jpg,,,,,,1975-09-29,1713480511251,false
gdsets_posters,gdsets_posters_1975_11_08.jpg,,Poster - 11/8/75,[],,https://gdsets.com/73posters/1975_11_08.jpg,,,,,,1975-11-08,1713480511341,false
gdsets_posters,gdsets_posters_1975_10_08.jpg,,Poster - 10/8/75,[],,https://gdsets.com/73posters/1975_10_08.jpg,,,,,,1975-10-08,1713480511351,false
gdsets_posters,gdsets_posters_1975_10_28.jpg,,Poster - 10/28-11/7/75,[],,https://gdsets.com/73posters/1975_10_28.jpg,,,,,,1975-10-28,1713480511365,false
gdsets_posters,gdsets_posters_1975_09_26.jpg,,Poster - 9/26/75,[],,https://gdsets.com/73posters/1975_09_26.jpg,,,,,,1975-09-26,1713480511454,false
gdsets_posters,gdsets_posters_1975_11_01c.jpg,,Poster - 11/1/75,[],,https://gdsets.com/73posters/1975_11_01c.jpg,,,,,,1975-11-01,1713480511454,false
gdsets_posters,gdsets_posters_1975_09_01.jpg,,Poster - Blues For Allah Promo,[],,https://gdsets.com/73posters/1975_09_01.jpg,,,,,,1975-09-01,1713480511457,false
gdsets_posters,gdsets_posters_1975_11_12.jpg,,Poster - 11/12/75,[],,https://gdsets.com/73posters/1975_11_12.jpg,,,,,,1975-11-12,1713480511529,false
gdsets_posters,gdsets_posters_1975_11_01b.jpg,,Poster - 11/1/75 @ Program,[],,https://gdsets.com/73posters/1975_11_01b.jpg,,,,,,1975-11-01,1713480511531,false
gdsets_posters,gdsets_posters_1975_11_01a.jpg,,Poster - 11/1/75 @ Program,[],,https://gdsets.com/73posters/1975_11_01a.jpg,,,,,,1975-11-01,1713480511686,false
gdsets_posters,gdsets_posters_1975_11_15.jpg,,Poster - 11/15/75,[],,https://gdsets.com/73posters/1975_11_15.jpg,,,,,,1975-11-15,1713480511716,false
gdsets_posters,gdsets_posters_1975_11_15 AOR 4.24.jpg,,Poster - 11/15/75 @ AOR 4.24,[],,https://gdsets.com/73posters/1975_11_15 AOR
gdsets_posters,gdsets_posters_1975_11_18.jpg,,Poster - 11/18/75,[],,https://gdsets.com/73posters/1975_11_18.jpg,,,,,,1975-11-18,1713480511798,false
gdsets_posters,gdsets_posters_1975_11_12a.jpg,,Poster - 11/12/75,[],,https://gdsets.com/73posters/1975_11_12a.jpg,,,,,,1975-11-12,1713480511877,false
gdsets_posters,gdsets_posters_1975_11_22c.jpg,,Poster - 11/22/75,[],,https://gdsets.com/73posters/1975_11_22c.jpg,,,,,,1975-11-22,1713480511885,false
gdsets_posters,gdsets_posters_1975_11_21.jpg,,Poster - 11/21/75,[],,https://gdsets.com/73posters/1975_11_21.jpg,,,,,,1975-11-21,1713480512044,false
gdsets_posters,gdsets_posters_1975_11_22.jpg,,Poster - 11/22/75,[],,https://gdsets.com/73posters/1975_11_22.jpg,,,,,,1975-11-22,1713480512044,false
gdsets_posters,gdsets_posters_1975_11_29a.jpg,,Poster - 11/29/75,[],,https://gdsets.com/73posters/1975_11_29a.jpg,,,,,,1975-11-29,1713480512156,false
gdsets_posters,gdsets_posters_1975_11_22a.jpg,,Poster - 11/22/75,[],,https://gdsets.com/73posters/1975_11_22a.jpg,,,,,,1975-11-22,1713480512159,false
gdsets_posters,gdsets_posters_1975_11_29.jpg,,Poster - 11/29/75,[],,https://gdsets.com/73posters/1975_11_29.jpg,,,,,,1975-11-29,1713480512175,false
gdsets_posters,gdsets_posters_1975_11_23a.jpg,,Poster - 11/23/75,[],,https://gdsets.com/73posters/1975_11_23a.jpg,,,,,,1975-11-23,1713480512178,true
gdsets_posters,gdsets_posters_1975_11_22b.jpg,,Poster - 11/22/75,[],,https://gdsets.com/73posters/1975_11_22b.jpg,,,,,,1975-11-22,1713480512178,false
gdsets_posters,gdsets_posters_1975_11_25.jpg,,Poster - 11/25/75,[],,https://gdsets.com/73posters/1975_11_25.jpg,,,,,,1975-11-25,1713480512272,false
gdsets_posters,gdsets_posters_1975_11_23.jpg,,Poster - 11/23/75,[],,https://gdsets.com/73posters/1975_11_23.jpg,,,,,,1975-11-23,1713480512281,false
gdsets_posters,gdsets_posters_1975_12_17.jpg,,Poster - 12/17/75,[],,https://gdsets.com/73posters/1975_12_17.jpg,,,,,,1975-12-17,1713480512282,false
gdsets_posters,gdsets_posters_1975_12_02.jpg,,Poster - 12/2/75,[],,https://gdsets.com/73posters/1975_12_02.jpg,,,,,,1975-12-02,1713480512393,false
gdsets_posters,gdsets_posters_1975_11_21b.jpg,,Poster - 11/21/75,[],,https://gdsets.com/73posters/1975_11_21b.jpg,,,,,,1975-11-21,1713480512432,false
gdsets_posters,gdsets_posters_1975_12_31.jpg,,Poster - 12/31/75,[],,https://gdsets.com/73posters/1975_12_31.jpg,,,,,,1975-12-31,1713480512514,false
gdsets_posters,gdsets_posters_1980_01_13.jpg,,Poster - 1/13/80,[],,https://gdsets.com/80posters/1980_01_13.jpg,,,,,,1980-01-13,1713480512597,false
gdsets_posters,gdsets_posters_1980_01_27.jpg,,Poster - 1/27/80,[],,https://gdsets.com/80posters/1980_01_27.jpg,,,,,,1980-01-27,1713480512599,true
gdsets_posters,gdsets_posters_1980_02_08.jpg,,Poster - 2/8-10/80(uncertain if theseshows happened),[],,https://gdsets.com/80posters
gdsets_posters,gdsets_posters_1980_02_01.jpg,,Poster - 2/1-3/80(rescheduled to2/8-10?),[],,https://gdsets.com/80posters
gdsets_posters,gdsets_posters_1980_02_16.jpg,,Poster - 2/16/80,[],,https://gdsets.com/80posters/1980_02_16.jpg,,,,,,1980-02-16,1713480512895,false
gdsets_posters,gdsets_posters_1980_02_17a.jpg,,Poster - 2/17/80,[],,https://gdsets.com/80posters/1980_02_17a.jpg,,,,,,1980-02-17,1713480512898,false
gdsets_posters,gdsets_posters_1980_02_17.jpg,,Poster - 2/17/80,[],,https://gdsets.com/80posters/1980_02_17.jpg,,,,,,1980-02-17,1713480513000,false
gdsets_posters,gdsets_posters_1980_02_15.jpg,,Poster - 2/15/80,[],,https://gdsets.com/80posters/1980_02_15.jpg,,,,,,1980-02-15,1713480513000,false
gdsets_posters,gdsets_posters_1980_01_27a.jpg,,"Poster - 1/27,2/1,2/80",[],,https://gdsets.com/80posters/1980_01_27a.jpg,,,,,,1980-01-27,1713480513001,false
gdsets_posters,gdsets_posters_1980_02_07.jpg,,Poster - 2/7/80,[],,https://gdsets.com/80posters/1980_02_07.jpg,,,,,,1980-02-07,1713480513001,false
gdsets_posters,gdsets_posters_1980_02_08a.jpg,,"Poster - 2/8,9/80",[],,https://gdsets.com/80posters/1980_02_08a.jpg,,,,,,1980-02-08,1713480513005,false
gdsets_posters,gdsets_posters_1975_12_19.jpg,,"Poster - 12/19,20/75",[],,https://gdsets.com/73posters/1975_12_19.jpg,,,,,,1975-12-19,1713480513005,false
gdsets_posters,gdsets_posters_1980_02_17b.jpg,,Poster - 2/17/80,[],,https://gdsets.com/80posters/1980_02_17b.jpg,,,,,,1980-02-17,1713480513012,false
gdsets_posters,gdsets_posters_1975_10_10.jpg,,Poster - 10/10/75,[],,https://gdsets.com/73posters/1975_10_10.jpg,,,,,,1975-10-10,1713480513015,false
gdsets_posters,gdsets_posters_1980_02_19a.jpg,,Poster - 2/19/80,[],,https://gdsets.com/80posters/1980_02_19a.jpg,,,,,,1980-02-19,1713480513180,false
gdsets_posters,gdsets_posters_1980_02_19.jpg,,Poster - 2/19/80,[],,https://gdsets.com/80posters/1980_02_19.jpg,,,,,,1980-02-19,1713480513181,false
gdsets_posters,gdsets_posters_1980_02_19d.jpg,,Poster - 2/19/80,[],,https://gdsets.com/80posters/1980_02_19d.jpg,,,,,,1980-02-19,1713480513269,false
gdsets_posters,gdsets_posters_1980_02_20a.jpg,,Poster - 2/20/80,[],,https://gdsets.com/80posters/1980_02_20a.jpg,,,,,,1980-02-20,1713480513270,false
gdsets_posters,gdsets_posters_1980_02_19c.jpg,,Poster - 2/19/80,[],,https://gdsets.com/80posters/1980_02_19c.jpg,,,,,,1980-02-19,1713480513272,true
gdsets_posters,gdsets_posters_1980_02_19b.jpg,,Poster - 2/19/80,[],,https://gdsets.com/80posters/1980_02_19b.jpg,,,,,,1980-02-19,1713480513272,false
gdsets_posters,gdsets_posters_1980_02_23.jpg,,Poster - 2/23/80,[],,https://gdsets.com/80posters/1980_02_23.jpg,,,,,,1980-02-23,1713480513449,false
gdsets_posters,gdsets_posters_1980_02_22.jpg,,Poster - 2/22/80,[],,https://gdsets.com/80posters/1980_02_22.jpg,,,,,,1980-02-22,1713480513453,false
gdsets_posters,gdsets_posters_1980_02_20.jpg,,Poster - 2/20/80,[],,https://gdsets.com/80posters/1980_02_20.jpg,,,,,,1980-02-20,1713480513611,false
gdsets_posters,gdsets_posters_1980_05_04.jpg,,Poster - 5/4/80,[],,https://gdsets.com/80posters/1980_05_04.jpg,,,,,,1980-05-04,1713480513636,false
gdsets_posters,gdsets_posters_1980_02_24.jpg,,Poster - 2/24/80,[],,https://gdsets.com/80posters/1980_02_24.jpg,,,,,,1980-02-24,1713480513646,true
gdsets_posters,gdsets_posters_1980_02_28.jpg,,Poster - 2/28/80 @ program,[],,https://gdsets.com/80posters/1980_02_28.jpg,,,,,,1980-02-28,1713480513648,false
gdsets_posters,gdsets_posters_1980_03_07.jpg,,"Poster - 3/7,8/80",[],,https://gdsets.com/80posters/1980_03_07.jpg,,,,,,1980-03-07,1713480513728,false
gdsets_posters,gdsets_posters_1980_04_28.jpg,,Poster - Go To Heaven Trade Ad,[],,https://gdsets.com/80posters/1980_04_28.jpg,,,,,,1980-04-28,1713480513732,false
gdsets_posters,gdsets_posters_1980_04_03.jpg,,Poster - 4/3/80,[],,https://gdsets.com/80posters/1980_04_03.jpg,,,,,,1980-04-03,1713480513816,false
gdsets_posters,gdsets_posters_1980_05_07.jpg,,Poster - 5/7/80,[],,https://gdsets.com/80posters/1980_05_07.jpg,,,,,,1980-05-07,1713480513839,false
gdsets_posters,gdsets_posters_1980_05_07a.jpg,,Poster - 5/7/80,[],,https://gdsets.com/80posters/1980_05_07a.jpg,,,,,,1980-05-07,1713480513918,false
gdsets_posters,gdsets_posters_1980_03_01.jpg,,Poster - 3/1/80 @ program,[],,https://gdsets.com/80posters/1980_03_01.jpg,,,,,,1980-03-01,1713480513927,false
gdsets_posters,gdsets_posters_1980_03_30.jpg,,Poster - 3/30-4/1/80 @ program,[],,https://gdsets.com/80posters/1980_03_30.jpg,,,,,,1980-03-30,1713480513927,false
gdsets_posters,gdsets_posters_1980_05_09.jpg,,Poster - 5/9/80,[],,https://gdsets.com/80posters/1980_05_09.jpg,,,,,,1980-05-09,1713480514010,false
gdsets_posters,gdsets_posters_1975_11_21a.jpg,,Poster - 11/21/75,[],,https://gdsets.com/73posters/1975_11_21a.jpg,,,,,,1975-11-21,1713480514034,false
gdsets_posters,gdsets_posters_1980_05_12b.jpg,,Poster - 5/12/80,[],,https://gdsets.com/80posters/1980_05_12b.jpg,,,,,,1980-05-12,1713480514205,true
gdsets_posters,gdsets_posters_1980_05_30.jpg,,Poster - 5/30/80,[],,https://gdsets.com/80posters/1980_05_30.jpg,,,,,,1980-05-30,1713480514217,false
gdsets_posters,gdsets_posters_1980_03_17.jpg,,Poster - 3/17/80,[],,https://gdsets.com/80posters/1980_03_17.jpg,,,,,,1980-03-17,1713480514306,false
gdsets_posters,gdsets_posters_1980_05_12c.jpg,,Poster - 5/12/80,[],,https://gdsets.com/80posters/1980_05_12c.jpg,,,,,,1980-05-12,1713480514393,false
gdsets_posters,gdsets_posters_1980_06_19a.jpg,,Poster - 6/19-21/80 (OP1)AOR 4.140 @ hand colored,[],,https://gdsets.com/80posters
gdsets_posters,gdsets_posters_1980_07_30.jpg,,"Poster - 7/30,31/80",[],,https://gdsets.com/80posters/1980_07_30.jpg,,,,,,1980-07-30,1713480514496,false
gdsets_posters,gdsets_posters_1980_06_07.jpg,,"Poster - 6/7,8/80",[],,https://gdsets.com/80posters/1980_06_07.jpg,,,,,,1980-06-07,1713480514496,false
gdsets_posters,gdsets_posters_1980_06_07a.jpg,,"Poster - 6/7,8/80",[],,https://gdsets.com/80posters/1980_06_07a.jpg,,,,,,1980-06-07,1713480514509,false
gdsets_posters,gdsets_posters_1980_06_29.jpg,,Poster - 6/29/80,[],,https://gdsets.com/80posters/1980_06_29.jpg,,,,,,1980-06-29,1713480514509,false
gdsets_posters,gdsets_posters_1980_02_24a.jpg,,Poster - 2/24/80,[],,https://gdsets.com/80posters/1980_02_24a.jpg,,,,,,1980-02-24,1713480514510,false
gdsets_posters,gdsets_posters_1980_06_05.jpg,,Poster - 6/5-8/80,[],,https://gdsets.com/80posters/1980_06_05.jpg,,,,,,1980-06-05,1713480514608,true
gdsets_posters,gdsets_posters_1980_06_29a.jpg,,Poster - 6/29/80,[],,https://gdsets.com/80posters/1980_06_29a.jpg,,,,,,1980-06-29,1713480514608,false
gdsets_posters,gdsets_posters_1980_06_05a.jpg,,Poster - 6/5-8/80,[],,https://gdsets.com/80posters/1980_06_05a.jpg,,,,,,1980-06-05,1713480514617,false
gdsets_posters,gdsets_posters_1980_07_30a.jpg,,"Poster - 7/30,31/80",[],,https://gdsets.com/80posters/1980_07_30a.jpg,,,,,,1980-07-30,1713480514617,false
gdsets_posters,gdsets_posters_1980_08_12.jpg,,Poster - 8/12/80,[],,https://gdsets.com/80posters/1980_08_12.jpg,,,,,,1980-08-12,1713480514617,false
gdsets_posters,gdsets_posters_1980_07_25.jpg,,Poster - 7/25/80,[],,https://gdsets.com/80posters/1980_07_25.jpg,,,,,,1980-07-25,1713480514682,false
gdsets_posters,gdsets_posters_1980_05_12a.jpg,,Poster - 5/12/80,[],,https://gdsets.com/80posters/1980_05_12a.jpg,,,,,,1980-05-12,1713480514688,true
gdsets_posters,gdsets_posters_1980_05_12d.jpg,,Poster - 5/12/80,[],,https://gdsets.com/80posters/1980_05_12d.jpg,,,,,,1980-05-12,1713480514876,false
gdsets_posters,gdsets_posters_1980_08_16b.jpg,,Poster - 8/16/80,[],,https://gdsets.com/80posters/1980_08_16b.jpg,,,,,,1980-08-16,1713480514879,false
gdsets_posters,gdsets_posters_1980_08_16.jpg,,Poster - 8/16/80 (OP1),[],,https://gdsets.com/80posters/1980_08_16.jpg,,,,,,1980-08-16,1713480515037,true
gdsets_posters,gdsets_posters_1980_08_23.jpg,,Poster - 8/23/80,[],,https://gdsets.com/80posters/1980_08_23.jpg,,,,,,1980-08-23,1713480515044,false
gdsets_posters,gdsets_posters_1980_08_27.jpg,,Poster - 8/27/80,[],,https://gdsets.com/80posters/1980_08_27.jpg,,,,,,1980-08-27,1713480515141,false
gdsets_posters,gdsets_posters_1980_08_29.jpg,,"Poster - 8/29,30/80",[],,https://gdsets.com/80posters/1980_08_29.jpg,,,,,,1980-08-29,1713480515152,false
gdsets_posters,gdsets_posters_1980_08_26.jpg,,Poster - 8/26/80,[],,https://gdsets.com/80posters/1980_08_26.jpg,,,,,,1980-08-26,1713480515252,false
gdsets_posters,gdsets_posters_1980_09_06a.jpg,,Poster - 9/6/80,[],,https://gdsets.com/80posters/1980_09_06a.jpg,,,,,,1980-09-06,1713480515347,false
gdsets_posters,gdsets_posters_1980_09_02.jpg,,Poster - 9/2/80,[],,https://gdsets.com/80posters/1980_09_02.jpg,,,,,,1980-09-02,1713480515353,false
gdsets_posters,gdsets_posters_1980_08_24.jpg,,Poster - 8/24/80,[],,https://gdsets.com/80posters/1980_08_24.jpg,,,,,,1980-08-24,1713480515353,false
gdsets_posters,gdsets_posters_1980_09_19.jpg,,"Poster - 9/19,20/80",[],,https://gdsets.com/80posters/1980_09_19.jpg,,,,,,1980-09-19,1713480515353,false
gdsets_posters,gdsets_posters_1980_09_06.jpg,,Poster - 9/6/80,[],,https://gdsets.com/80posters/1980_09_06.jpg,,,,,,1980-09-06,1713480515374,true
gdsets_posters,gdsets_posters_1980_05_12.jpg,,Poster - 5/12/80,[],,https://gdsets.com/80posters/1980_05_12.jpg,,,,,,1980-05-12,1713480515557,false
gdsets_posters,gdsets_posters_1980_09_25g.jpg,,Poster - 9/25-10/10/80,[],,https://gdsets.com/80posters/1980_09_25g.jpg,,,,,,1980-09-25,1713480515561,false
gdsets_posters,gdsets_posters_1980_09_25c.jpg,,Poster - 9/25-10/14/80 @ AOR 4.45 (proof),[],,https://gdsets.com/80posters
gdsets_posters,gdsets_posters_1980_09_25d.jpg,,Poster - 9/25-10/14/80 @ AOR 4.45 (proof),[],,https://gdsets.com/80posters
gdsets_posters,gdsets_posters_1980_09_25.jpg,,Poster - 9/25-10/14/80 @ AOR 4.45(original art),[],,https://gdsets.com/80posters
gdsets_posters,gdsets_posters_1980_10_13.jpg,,Poster - 10/13/80,[],,https://gdsets.com/80posters/1980_10_13.jpg,,,,,,1980-10-13,1713480515671,true
gdsets_posters,gdsets_posters_1980_09_25e.jpg,,Poster - 9/25-10/14/80 @ AOR 4.45 (proof),[],,https://gdsets.com/80posters
gdsets_posters,gdsets_posters_1980_09_25h.jpg,,Poster - 9/25-10/14/80,[],,https://gdsets.com/80posters/1980_09_25h.jpg,,,,,,1980-09-25,1713480515773,false
gdsets_posters,gdsets_posters_1980_09_25f.jpg,,Poster - 9/25-10/14/80 @ AOR 4.45 (proof),[],,https://gdsets.com/80posters
gdsets_posters,gdsets_posters_1980_10_18.jpg,,"Poster - 10/18,19/80",[],,https://gdsets.com/80posters/1980_10_18.jpg,,,,,,1980-10-18,1713480515850,false
gdsets_posters,gdsets_posters_1980_09_25b.jpg,,Poster - 9/25-10/14/80 @ AOR 4.45 (OHB),[],,https://gdsets.com/80posters
gdsets_posters,gdsets_posters_1980_10_22c.jpg,,Poster - 10/25-31/80,[],,https://gdsets.com/80posters/1980_10_22c.jpg,,,,,,1980-10-22,1713480515955,false
gdsets_posters,gdsets_posters_1980_10_13a.jpg,,Poster - 10/13/80,[],,https://gdsets.com/80posters/1980_10_13a.jpg,,,,,,1980-10-13,1713480516051,false
gdsets_posters,gdsets_posters_1980_10_22b.jpg,,Poster - 10/25-31/80,[],,https://gdsets.com/80posters/1980_10_22b.jpg,,,,,,1980-10-22,1713480516139,true
gdsets_posters,gdsets_posters_1980_10_22a.jpg,,Poster - 10/22-31/80(OPC),[],,https://gdsets.com/80posters/1980_10_22a.jpg,,,,,,1980-10-22,1713480516141,true
gdsets_posters,gdsets_posters_1980_10_30.jpg,,Poster - 10/22-31/80 @ program,[],,https://gdsets.com/80posters/1980_10_30.jpg,,,,,,1980-10-30,1713480516143,false
gdsets_posters,gdsets_posters_1980_09_25a.jpg,,Poster - 9/25-10/14/80 @ AOR 4.45 (OP1),[],,https://gdsets.com/80posters
gdsets_posters,gdsets_posters_1980_10_31.jpg,,"Poster - 10/31,11/1/80",[],,https://gdsets.com/80posters/1980_10_31.jpg,,,,,,1980-10-31,1713480516223,false
gdsets_posters,gdsets_posters_1980_10_27.jpg,,Poster - 10/27/80,[],,https://gdsets.com/80posters/1980_10_27.jpg,,,,,,1980-10-27,1713480516235,false
gdsets_posters,gdsets_posters_1980_10_31b.jpg,,Poster - 10/31/80,[],,https://gdsets.com/80posters/1980_10_31b.jpg,,,,,,1980-10-31,1713480516355,false
gdsets_posters,gdsets_posters_1980_10_31a.jpg,,Poster - 10/31/80,[],,https://gdsets.com/80posters/1980_10_31a.jpg,,,,,,1980-10-31,1713480516440,false
gdsets_posters,gdsets_posters_1980_11_29.jpg,,Poster - 11/29/80,[],,https://gdsets.com/80posters/1980_11_29.jpg,,,,,,1980-11-29,1713480516455,false
gdsets_posters,gdsets_posters_1980_11_04a.jpg,,Poster - 11/4/80,[],,https://gdsets.com/80posters/1980_11_04a.jpg,,,,,,1980-11-04,1713480516455,false
gdsets_posters,gdsets_posters_1980_11_29a.jpg,,Poster - 11/29/80,[],,https://gdsets.com/80posters/1980_11_29a.jpg,,,,,,1980-11-29,1713480516541,false
gdsets_posters,gdsets_posters_1980_11_18.jpg,,Poster - 11/18/80,[],,https://gdsets.com/80posters/1980_11_18.jpg,,,,,,1980-11-18,1713480516541,false
gdsets_posters,gdsets_posters_1980_11_04.jpg,,Poster - 11/4/80,[],,https://gdsets.com/80posters/1980_11_04.jpg,,,,,,1980-11-04,1713480516544,false
gdsets_posters,gdsets_posters_1980_12_12a.jpg,,Poster - 12/12-14/80,[],,https://gdsets.com/80posters/1980_12_12a.jpg,,,,,,1980-12-12,1713480516544,false
gdsets_posters,gdsets_posters_1980_11_29b.jpg,,Poster - 11/29/80,[],,https://gdsets.com/80posters/1980_11_29b.jpg,,,,,,1980-11-29,1713480516646,false
gdsets_posters,gdsets_posters_1980_12_25.jpg,,Poster - 12/26-31/80,[],,https://gdsets.com/80posters/1980_12_25.jpg,,,,,,1980-12-25,1713480516646,false
gdsets_posters,gdsets_posters_1980_12_12b.jpg,,Poster - 12/12-14/80,[],,https://gdsets.com/80posters/1980_12_12b.jpg,,,,,,1980-12-12,1713480516746,false
gdsets_posters,gdsets_posters_1980_12_26b.jpg,,Poster - 12/26-31/80,[],,https://gdsets.com/80posters/1980_12_26b.jpg,,,,,,1980-12-26,1713480516837,false
gdsets_posters,gdsets_posters_1980_12_12.jpg,,Poster - 12/12/80,[],,https://gdsets.com/80posters/1980_12_12.jpg,,,,,,1980-12-12,1713480516957,false
gdsets_posters,gdsets_posters_1980_12_26c.jpg,,Poster - 12/26-31/80,[],,https://gdsets.com/80posters/1980_12_26c.jpg,,,,,,1980-12-26,1713480516957,true
gdsets_posters,gdsets_posters_1980_12_26a.jpg,,Poster - 12/26-31/80,[],,https://gdsets.com/80posters/1980_12_26a.jpg,,,,,,1980-12-26,1713480516960,true
gdsets_posters,gdsets_posters_1981_01_27.jpg,,Poster - 1/27/81,[],,https://gdsets.com/80posters/1981_01_27.jpg,,,,,,1981-01-27,1713480516969,false
gdsets_posters,gdsets_posters_1981_01_29.jpg,,"Poster - 1/29,30/81",[],,https://gdsets.com/80posters/1981_01_29.jpg,,,,,,1981-01-29,1713480516975,false
gdsets_posters,gdsets_posters_1981_01_29a.jpg,,"Poster - 1/29,30/81",[],,https://gdsets.com/80posters/1981_01_29a.jpg,,,,,,1981-01-29,1713480517074,false
gdsets_posters,gdsets_posters_1980_08_16 (OP).jpg,,Poster - 8/16/80 (OP1),[],,https://gdsets.com/80posters/1980_08_16 (OP).jpg,,,,,,1980-08-16,1713480517203,false
gdsets_posters,gdsets_posters_1980_12_26.jpg,,Poster - 12/26-31/80,[],,https://gdsets.com/80posters/1980_12_26.jpg,,,,,,1980-12-26,1713480517205,false
gdsets_posters,gdsets_posters_1981_02_07.jpg,,Poster - 2/7/81,[],,https://gdsets.com/80posters/1981_02_07.jpg,,,,,,1981-02-07,1713480517219,false
gdsets_posters,gdsets_posters_1981_02_15.jpg,,Poster - 2/15/81,[],,https://gdsets.com/80posters/1981_02_15.jpg,,,,,,1981-02-15,1713480517260,false
gdsets_posters,gdsets_posters_1981_02_22.jpg,,"Poster - 2/22,23/81",[],,https://gdsets.com/80posters/1981_02_22.jpg,,,,,,1981-02-22,1713480517262,false
gdsets_posters,gdsets_posters_1981_02_13b.jpg,,"Poster - 2/13,14/81",[],,https://gdsets.com/80posters/1981_02_13b.jpg,,,,,,1981-02-13,1713480517363,true
gdsets_posters,gdsets_posters_1981_02_13c.jpg,,"Poster - 2/13,14/81",[],,https://gdsets.com/80posters/1981_02_13c.jpg,,,,,,1981-02-13,1713480517366,true
gdsets_posters,gdsets_posters_1981_02_13a.jpg,,"Poster - 2/13,14/81",[],,https://gdsets.com/80posters/1981_02_13a.jpg,,,,,,1981-02-13,1713480517457,false
gdsets_posters,gdsets_posters_1981_03_09.jpg,,"Poster - 3/9,10/81",[],,https://gdsets.com/80posters/1981_03_09.jpg,,,,,,1981-03-09,1713480517466,false
gdsets_posters,gdsets_posters_1981_03_12c.jpg,,Poster - 3/12/81,[],,https://gdsets.com/80posters/1981_03_12c.jpg,,,,,,1981-03-12,1713480517666,false
gdsets_posters,gdsets_posters_1981_03_28.jpg,,Poster - 3/28/81,[],,https://gdsets.com/80posters/1981_03_28.jpg,,,,,,1981-03-28,1713480517686,false
gdsets_posters,gdsets_posters_1981_03_12a.jpg,,Poster - 3/12/81,[],,https://gdsets.com/80posters/1981_03_12a.jpg,,,,,,1981-03-12,1713480517760,true
gdsets_posters,gdsets_posters_1981_03_12b.jpg,,Poster - 3/12/81,[],,https://gdsets.com/80posters/1981_03_12b.jpg,,,,,,1981-03-12,1713480517850,true
gdsets_posters,gdsets_posters_1981_04_18.jpg,,Poster - 4/18/81,[],,https://gdsets.com/80posters/1981_04_18.jpg,,,,,,1981-04-18,1713480517877,false
gdsets_posters,gdsets_posters_1981_04_01a.jpg,,Poster - Reckoningprint,[],,https://gdsets.com/80posters/1981_04_01a.jpg,,,,,,1981-04-01,1713480517942,false
gdsets_posters,gdsets_posters_1981_04_30.jpg,,Poster - 4/30/81,[],,https://gdsets.com/80posters/1981_04_30.jpg,,,,,,1981-04-30,1713480517987,false
gdsets_posters,gdsets_posters_1981_04_23.jpg,,Poster - 4/23-25/81,[],,https://gdsets.com/80posters/1981_04_23.jpg,,,,,,1981-04-23,1713480517987,false
gdsets_posters,gdsets_posters_1981_02_13.jpg,,Poster - 2/13/81 @ program,[],,https://gdsets.com/80posters/1981_02_13.jpg,,,,,,1981-02-13,1713480517992,false
gdsets_posters,gdsets_posters_1980_10_22.jpg,,Poster - 10/22-31/80(OP1),[],,https://gdsets.com/80posters/1980_10_22.jpg,,,,,,1980-10-22,1713480518041,false
gdsets_posters,gdsets_posters_1981_04_25a.jpg,,Poster - 4/25/81,[],,https://gdsets.com/80posters/1981_04_25a.jpg,,,,,,1981-04-25,1713480518127,false
gdsets_posters,gdsets_posters_1981_04_25.jpg,,Poster - 4/25/81,[],,https://gdsets.com/80posters/1981_04_25.jpg,,,,,,1981-04-25,1713480518139,false
gdsets_posters,gdsets_posters_1981_02_26.jpg,,Poster - 2/26-28/81,[],,https://gdsets.com/80posters/1981_02_26.jpg,,,,,,1981-02-26,1713480518144,false
gdsets_posters,gdsets_posters_1981_05_06a.jpg,,Poster - 5/6-9/81,[],,https://gdsets.com/80posters/1981_05_06a.jpg,,,,,,1981-05-06,1713480518313,false
gdsets_posters,gdsets_posters_1981_05_06.jpg,,Poster - 5/6-9/81,[],,https://gdsets.com/80posters/1981_05_06.jpg,,,,,,1981-05-06,1713480518323,false
gdsets_posters,gdsets_posters_1981_05_06c.jpg,,Poster - 5/6/81,[],,https://gdsets.com/80posters/1981_05_06c.jpg,,,,,,1981-05-06,1713480518340,false
gdsets_posters,gdsets_posters_1981_05_06b.jpg,,Poster - 5/6-9/81,[],,https://gdsets.com/80posters/1981_05_06b.jpg,,,,,,1981-05-06,1713480518423,false
gdsets_posters,gdsets_posters_1981_05_11.jpg,,"Poster - 5/11,12/81",[],,https://gdsets.com/80posters/1981_05_11.jpg,,,,,,1981-05-11,1713480518427,false
gdsets_posters,gdsets_posters_1981_05_23.jpg,,Poster - 5/23-6/1/81,[],,https://gdsets.com/80posters/1981_05_23.jpg,,,,,,1981-05-23,1713480518534,false
gdsets_posters,gdsets_posters_1981_05_22.jpg,,Poster - 5/22/81,[],,https://gdsets.com/80posters/1981_05_22.jpg,,,,,,1981-05-22,1713480518629,false
gdsets_posters,gdsets_posters_1981_07_04a.jpg,,Poster - 7/4/81,[],,https://gdsets.com/80posters/1981_07_04a.jpg,,,,,,1981-07-04,1713480518724,false
gdsets_posters,gdsets_posters_1981_07_19.jpg,,Poster - 7/19/81,[],,https://gdsets.com/80posters/1981_07_19.jpg,,,,,,1981-07-19,1713480518730,false
gdsets_posters,gdsets_posters_1981_04_01b.jpg,,Poster - Reckoningprint,[],,https://gdsets.com/80posters/1981_04_01b.jpg,,,,,,1981-04-01,1713480518732,true
gdsets_posters,gdsets_posters_1981_04_01.jpg,,Poster - Reckoningconcept art,[],,https://gdsets.com/80posters/1981_04_01.jpg,,,,,,1981-04-01,1713480518736,true
gdsets_posters,gdsets_posters_1981_03_12.jpg,,Poster - 3/12/81,[],,https://gdsets.com/80posters/1981_03_12.jpg,,,,,,1981-03-12,1713480518736,false
gdsets_posters,gdsets_posters_1981_05_28.jpg,,Poster - 5/28/81,[],,https://gdsets.com/80posters/1981_05_28.jpg,,,,,,1981-05-28,1713480518736,false
gdsets_posters,gdsets_posters_1981_06_25.jpg,,Poster - 6/25/81,[],,https://gdsets.com/80posters/1981_06_25.jpg,,,,,,1981-06-25,1713480518823,false
gdsets_posters,gdsets_posters_1981_07_28.jpg,,Poster - 7/28-8/8/81,[],,https://gdsets.com/80posters/1981_07_28.jpg,,,,,,1981-07-28,1713480518824,false
gdsets_posters,gdsets_posters_1981_06_14.jpg,,Poster - 6/14/81,[],,https://gdsets.com/80posters/1981_06_14.jpg,,,,,,1981-06-14,1713480518831,false
gdsets_posters,gdsets_posters_1981_08_06.jpg,,Poster - 8/6-8/81,[],,https://gdsets.com/80posters/1981_08_06.jpg,,,,,,1981-08-06,1713480518933,false
gdsets_posters,gdsets_posters_1981_08_06b.jpg,,Poster - 8/6-8/81,[],,https://gdsets.com/80posters/1981_08_06b.jpg,,,,,,1981-08-06,1713480519013,false
gdsets_posters,gdsets_posters_1981_08_09.jpg,,Poster - 8/9/81,[],,https://gdsets.com/80posters/1981_08_09.jpg,,,,,,1981-08-09,1713480519029,false
gdsets_posters,gdsets_posters_1981_08_06a.jpg,,Poster - 8/6-8/81,[],,https://gdsets.com/80posters/1981_08_06a.jpg,,,,,,1981-08-06,1713480519099,false
gdsets_posters,gdsets_posters_1981_07_04.jpg,,Poster - 7/4/81,[],,https://gdsets.com/80posters/1981_07_04.jpg,,,,,,1981-07-04,1713480519110,false
gdsets_posters,gdsets_posters_1981_08_06c.jpg,,Poster - 8/6-8/81,[],,https://gdsets.com/80posters/1981_08_06c.jpg,,,,,,1981-08-06,1713480519191,false
gdsets_posters,gdsets_posters_1981_08_07.jpg,,Poster - 8/7/81,[],,https://gdsets.com/80posters/1981_08_07.jpg,,,,,,1981-08-07,1713480519191,false
gdsets_posters,gdsets_posters_1981_08_20.jpg,,Poster - 8/20-23/81,[],,https://gdsets.com/80posters/1981_08_20.jpg,,,,,,1981-08-20,1713480519192,false
gdsets_posters,gdsets_posters_1981_08_16.jpg,,Poster - 8/16/81,[],,https://gdsets.com/80posters/1981_08_16.jpg,,,,,,1981-08-16,1713480519283,false
gdsets_posters,gdsets_posters_1981_08_27a.jpg,,"Poster - 8/27,28/81",[],,https://gdsets.com/80posters/1981_08_27a.jpg,,,,,,1981-08-27,1713480519373,false
gdsets_posters,gdsets_posters_1981_08_27b.jpg,,"Poster - 8/27,28/81",[],,https://gdsets.com/80posters/1981_08_27b.jpg,,,,,,1981-08-27,1713480519376,false
gdsets_posters,gdsets_posters_1981_08_30.jpg,,Poster - 8/30/81,[],,https://gdsets.com/80posters/1981_08_30.jpg,,,,,,1981-08-30,1713480519397,false
gdsets_posters,gdsets_posters_1981_08_31.jpg,,Poster - 8/31/81 @ button,[],,https://gdsets.com/80posters/1981_08_31.jpg,,,,,,1981-08-31,1713480519465,false
gdsets_posters,gdsets_posters_1981_09_07.jpg,,Poster - 9/7/81,[],,https://gdsets.com/80posters/1981_09_07.jpg,,,,,,1981-09-07,1713480519481,false
gdsets_posters,gdsets_posters_1981_08_27c.jpg,,"Poster - 8/27,28/81",[],,https://gdsets.com/80posters/1981_08_27c.jpg,,,,,,1981-08-27,1713480519553,false
gdsets_posters,gdsets_posters_1981_08_27.jpg,,"Poster - 8/27,28/81",[],,https://gdsets.com/80posters/1981_08_27.jpg,,,,,,1981-08-27,1713480519575,false
gdsets_posters,gdsets_posters_1981_09_18.jpg,,Poster - 9/18-20/81,[],,https://gdsets.com/80posters/1981_09_18.jpg,,,,,,1981-09-18,1713480519579,false
gdsets_posters,gdsets_posters_1981_09_11a.jpg,,Poster - 9/11-13/81,[],,https://gdsets.com/80posters/1981_09_11a.jpg,,,,,,1981-09-11,1713480519580,false
gdsets_posters,gdsets_posters_1981_09_26.jpg,,Poster - 9/26/81,[],,https://gdsets.com/80posters/1981_09_26.jpg,,,,,,1981-09-26,1713480519755,false
gdsets_posters,gdsets_posters_1981_09_30b.jpg,,Poster - 9/30/81,[],,https://gdsets.com/80posters/1981_09_30b.jpg,,,,,,1981-09-30,1713480519766,false
gdsets_posters,gdsets_posters_1981_10_02.jpg,,Poster - 10/2-6/81,[],,https://gdsets.com/80posters/1981_10_02.jpg,,,,,,1981-10-02,1713480519858,true
gdsets_posters,gdsets_posters_1981_09_30a.jpg,,Poster - 9/30-10/6/81,[],,https://gdsets.com/80posters/1981_09_30a.jpg,,,,,,1981-09-30,1713480519862,false
gdsets_posters,gdsets_posters_1981_10_02b.jpg,,Poster - 10/2-6/81,[],,https://gdsets.com/80posters/1981_10_02b.jpg,,,,,,1981-10-02,1713480519959,false
gdsets_posters,gdsets_posters_1981_09_30.jpg,,Poster - 9/30-10/19/81,[],,https://gdsets.com/80posters/1981_09_30.jpg,,,,,,1981-09-30,1713480519962,false
gdsets_posters,gdsets_posters_1981_08_26.jpg,,Poster - Dead Setpromo,[],,https://gdsets.com/80posters/1981_08_26.jpg,,,,,,1981-08-26,1713480519975,false
gdsets_posters,gdsets_posters_1981_10_09.jpg,,"Poster - 10/9,10/81",[],,https://gdsets.com/80posters/1981_10_09.jpg,,,,,,1981-10-09,1713480520041,false
gdsets_posters,gdsets_posters_1981_10_02a.jpg,,Poster - 10/2-6/81,[],,https://gdsets.com/80posters/1981_10_02a.jpg,,,,,,1981-10-02,1713480520073,false
gdsets_posters,gdsets_posters_1981_10_10.jpg,,Poster - 10/10-13/81,[],,https://gdsets.com/80posters/1981_10_10.jpg,,,,,,1981-10-10,1713480520175,false
gdsets_posters,gdsets_posters_1981_10_17.jpg,,Poster - 10/17/81,[],,https://gdsets.com/80posters/1981_10_17.jpg,,,,,,1981-10-17,1713480520176,false
gdsets_posters,gdsets_posters_1981_10_10a.jpg,,Poster - 10/10-13/81 (OP1)AOR 4.240,[],,https://gdsets.com/80posters
gdsets_posters,gdsets_posters_1981_10_15.jpg,,"Poster - 10/15,16/81",[],,https://gdsets.com/80posters/1981_10_15.jpg,,,,,,1981-10-15,1713480520265,false
gdsets_posters,gdsets_posters_1981_10_12.jpg,,Poster - 10/12/81,[],,https://gdsets.com/80posters/1981_10_12.jpg,,,,,,1981-10-12,1713480520267,false
gdsets_posters,gdsets_posters_1981_10_25.jpg,,"Poster - 10/25,27/81",[],,https://gdsets.com/80posters/1981_10_25.jpg,,,,,,1981-10-25,1713480520275,false
gdsets_posters,gdsets_posters_1981_10_19a.jpg,,Poster - 10/19/81(handbill)AOR 4.238,[],,https://gdsets.com/80posters
gdsets_posters,gdsets_posters_1981_11_01.jpg,,Poster - 11/1/81,[],,https://gdsets.com/80posters/1981_11_01.jpg,,,,,,1981-11-01,1713480520444,false
gdsets_posters,gdsets_posters_1981_05_15.jpg,,Poster - 5/15/81 @ program,[],,https://gdsets.com/80posters/1981_05_15.jpg,,,,,,1981-05-15,1713480520535,false
gdsets_posters,gdsets_posters_1981_11_06.jpg,,Poster - 11/6/81 @ program,[],,https://gdsets.com/80posters/1981_11_06.jpg,,,,,,1981-11-06,1713480520544,false
gdsets_posters,gdsets_posters_1981_11_14.jpg,,Poster - 11/14/81,[],,https://gdsets.com/80posters/1981_11_14.jpg,,,,,,1981-11-14,1713480520631,false
gdsets_posters,gdsets_posters_1981_11_08.jpg,,Poster - 11/8/81,[],,https://gdsets.com/80posters/1981_11_08.jpg,,,,,,1981-11-08,1713480520634,false
gdsets_posters,gdsets_posters_1981_11_17.jpg,,Poster - 11/17/81,[],,https://gdsets.com/80posters/1981_11_17.jpg,,,,,,1981-11-17,1713480520720,false
gdsets_posters,gdsets_posters_1981_11_13.jpg,,Poster - 11/13/81,[],,https://gdsets.com/80posters/1981_11_13.jpg,,,,,,1981-11-13,1713480520722,false
gdsets_posters,gdsets_posters_1981_11_17a.jpg,,Poster - 11/17/81,[],,https://gdsets.com/80posters/1981_11_17a.jpg,,,,,,1981-11-17,1713480520734,false
gdsets_posters,gdsets_posters_1981_11_18.jpg,,Poster - 11/18/81,[],,https://gdsets.com/80posters/1981_11_18.jpg,,,,,,1981-11-18,1713480520830,false
gdsets_posters,gdsets_posters_1981_12_03.jpg,,Poster - 12/3/81,[],,https://gdsets.com/80posters/1981_12_03.jpg,,,,,,1981-12-03,1713480520927,false
gdsets_posters,gdsets_posters_1981_11_27.jpg,,Poster - 11/27/81(cancelled),[],,https://gdsets.com/80posters/1981_11_27.jpg,,,,,,1981-11-27,1713480520934,true
gdsets_posters,gdsets_posters_1981_09_11.jpg,,Poster - 9/11-13/81,[],,https://gdsets.com/80posters/1981_09_11.jpg,,,,,,1981-09-11,1713480520936,false
gdsets_posters,gdsets_posters_1981_12_17.jpg,,Poster - 12/17-20/81,[],,https://gdsets.com/80posters/1981_12_17.jpg,,,,,,1981-12-17,1713480520944,false
gdsets_posters,gdsets_posters_1981_11_27b.jpg,,Poster - 11/27/81(cancelled),[],,https://gdsets.com/80posters/1981_11_27b.jpg,,,,,,1981-11-27,1713480521044,true
gdsets_posters,gdsets_posters_1981_12_26a.jpg,,Poster - 12/26-31/81,[],,https://gdsets.com/80posters/1981_12_26a.jpg,,,,,,1981-12-26,1713480521143,false
gdsets_posters,gdsets_posters_1981_10_19.jpg,,Poster - 10/19/81 (OP1)AOR 4.238,[],,https://gdsets.com/80posters/1981_10_19.jpg,,,,,,1981-10-19,1713480521143,false
gdsets_posters,gdsets_posters_1981_11_27a.jpg,,Poster - 11/27/81(cancelled),[],,https://gdsets.com/80posters/1981_11_27a.jpg,,,,,,1981-11-27,1713480521152,false
gdsets_posters,gdsets_posters_1981_12_26.jpg,,Poster - 12/26-31/81,[],,https://gdsets.com/80posters/1981_12_26.jpg,,,,,,1981-12-26,1713480521156,false
gdsets_posters,gdsets_posters_1981_11_04.jpg,,Poster - 11/4/81,[],,https://gdsets.com/80posters/1981_11_04.jpg,,,,,,1981-11-04,1713480521242,false
gdsets_posters,gdsets_posters_1981_12_31.jpg,,Poster - 12/31/81,[],,https://gdsets.com/80posters/1981_12_31.jpg,,,,,,1981-12-31,1713480521244,false
gdsets_posters,gdsets_posters_1982_01_11.jpg,,"Poster - 1/11,13/82",[],,https://gdsets.com/80posters/1982_01_11.jpg,,,,,,1982-01-11,1713480521427,false
gdsets_posters,gdsets_posters_1982_01_12b.jpg,,Poster - 1/12/82,[],,https://gdsets.com/80posters/1982_01_12b.jpg,,,,,,1982-01-12,1713480521449,false
gdsets_posters,gdsets_posters_1982_01_12a.jpg,,Poster - 1/12/82,[],,https://gdsets.com/80posters/1982_01_12a.jpg,,,,,,1982-01-12,1713480521453,false
gdsets_posters,gdsets_posters_1981_12_26b.jpg,,Poster - 12/26-31/81,[],,https://gdsets.com/80posters/1981_12_26b.jpg,,,,,,1981-12-26,1713480521456,false
gdsets_posters,gdsets_posters_1981_10_13.jpg,,Poster - 10/13/81,[],,https://gdsets.com/80posters/1981_10_13.jpg,,,,,,1981-10-13,1713480521542,false
gdsets_posters,gdsets_posters_1982_01_14.jpg,,Poster - 1/14/82,[],,https://gdsets.com/80posters/1982_01_14.jpg,,,,,,1982-01-14,1713480521542,false
gdsets_posters,gdsets_posters_1982_02_26.jpg,,Poster - 2/26-28/82,[],,https://gdsets.com/80posters/1982_02_26.jpg,,,,,,1982-02-26,1713480521636,false
gdsets_posters,gdsets_posters_1982_02_19.jpg,,Poster - 2/19-21/82,[],,https://gdsets.com/80posters/1982_02_19.jpg,,,,,,1982-02-19,1713480521735,false
gdsets_posters,gdsets_posters_1981_10_31.jpg,,Poster - 10/31/81,[],,https://gdsets.com/80posters/1981_10_31.jpg,,,,,,1981-10-31,1713480521741,false
gdsets_posters,gdsets_posters_1982_02_06.jpg,,Poster - 2/6/82,[],,https://gdsets.com/80posters/1982_02_06.jpg,,,,,,1982-02-06,1713480521835,false
gdsets_posters,gdsets_posters_1982_03_14b.jpg,,Poster - 3/14/82 (OHB)AOR 4.109,[],,https://gdsets.com/80posters/1982_03_14b.jpg,,,,,,1982-03-14,1713480521835,true
gdsets_posters,gdsets_posters_1982_03_03a.jpg,,Poster - 3/3/82,[],,https://gdsets.com/80posters/1982_03_03a.jpg,,,,,,1982-03-03,1713480521836,false
gdsets_posters,gdsets_posters_1982_01_29.jpg,,Poster - 1/29/82,[],,https://gdsets.com/80posters/1982_01_29.jpg,,,,,,1982-01-29,1713480521845,false
gdsets_posters,gdsets_posters_1982_03_17.jpg,,Poster - 3/17/82,[],,https://gdsets.com/80posters/1982_03_17.jpg,,,,,,1982-03-17,1713480521929,false
gdsets_posters,gdsets_posters_1982_04_02.jpg,,Poster - Spring 1982,[],,https://gdsets.com/80posters/1982_04_02.jpg,,,,,,1982-04-02,1713480522141,false
gdsets_posters,gdsets_posters_1982_03_20.jpg,,Poster - 3/20/82,[],,https://gdsets.com/80posters/1982_03_20.jpg,,,,,,1982-03-20,1713480522146,false
gdsets_posters,gdsets_posters_1982_03_20a.jpg,,Poster - 3/20/82,[],,https://gdsets.com/80posters/1982_03_20a.jpg,,,,,,1982-03-20,1713480522146,false
gdsets_posters,gdsets_posters_1982_03_18a.jpg,,Poster - 3/18/82,[],,https://gdsets.com/80posters/1982_03_18a.jpg,,,,,,1982-03-18,1713480522155,false
gdsets_posters,gdsets_posters_1982_03_17a.jpg,,Poster - 3/17/82,[],,https://gdsets.com/80posters/1982_03_17a.jpg,,,,,,1982-03-17,1713480522155,false
gdsets_posters,gdsets_posters_1982_03_03.jpg,,Poster - 3/3/82,[],,https://gdsets.com/80posters/1982_03_03.jpg,,,,,,1982-03-03,1713480522155,false
gdsets_posters,gdsets_posters_1982_04_02a.jpg,,Poster - 4/2/82,[],,https://gdsets.com/80posters/1982_04_02a.jpg,,,,,,1982-04-02,1713480522252,false
gdsets_posters,gdsets_posters_1982_04_10.jpg,,Poster - 4/10/82,[],,https://gdsets.com/80posters/1982_04_10.jpg,,,,,,1982-04-10,1713480522518,false
gdsets_posters,gdsets_posters_1982_01_27.jpg,,Poster - 1/27/82,[],,https://gdsets.com/80posters/1982_01_27.jpg,,,,,,1982-01-27,1713480522629,false
gdsets_posters,gdsets_posters_1982_01_01.jpg,,Poster - 1982 calendar,[],,https://gdsets.com/80posters/1982_01_01.jpg,,,,,,1982-01-01,1713480522629,false
gdsets_posters,gdsets_posters_1982_05_01.jpg,,"Poster - 5/1,8,14,15/82",[],,https://gdsets.com/80posters/1982_05_01.jpg,,,,,,1982-05-01,1713480522714,false
gdsets_posters,gdsets_posters_1982_04_25.jpg,,"Poster - 4/25,26/82",[],,https://gdsets.com/80posters/1982_04_25.jpg,,,,,,1982-04-25,1713480522716,false
gdsets_posters,gdsets_posters_1982_05_21a.jpg,,Poster - 5/21-23/82,[],,https://gdsets.com/80posters/1982_05_21a.jpg,,,,,,1982-05-21,1713480522737,false
gdsets_posters,gdsets_posters_1982_05_12.jpg,,Poster - 5/12/82,[],,https://gdsets.com/80posters/1982_05_12.jpg,,,,,,1982-05-12,1713480522749,false
gdsets_posters,gdsets_posters_1982_04_02b.jpg,,Poster - 4/2/82,[],,https://gdsets.com/80posters/1982_04_02b.jpg,,,,,,1982-04-02,1713480522749,false
gdsets_posters,gdsets_posters_1982_04_21.jpg,,Poster - 4/21/82 @ program,[],,https://gdsets.com/80posters/1982_04_21.jpg,,,,,,1982-04-21,1713480522752,false
gdsets_posters,gdsets_posters_1982_05_28a.jpg,,Poster - 5/28/82,[],,https://gdsets.com/80posters/1982_05_28a.jpg,,,,,,1982-05-28,1713480522829,false
gdsets_posters,gdsets_posters_1982_06_04.jpg,,Poster - 6/4/82 @ program,[],,https://gdsets.com/80posters/1982_06_04.jpg,,,,,,1982-06-04,1713480522947,false
gdsets_posters,gdsets_posters_1982_03_14.jpg,,Poster - 3/14/82 (OP1)AOR 4.109,[],,https://gdsets.com/80posters/1982_03_14.jpg,,,,,,1982-03-14,1713480522958,false
gdsets_posters,gdsets_posters_1982_05_31.jpg,,Poster - 5/31/82,[],,https://gdsets.com/80posters/1982_05_31.jpg,,,,,,1982-05-31,1713480523043,false
gdsets_posters,gdsets_posters_1982_06_05.jpg,,"Poster - 6/5,6/82",[],,https://gdsets.com/80posters/1982_06_05.jpg,,,,,,1982-06-05,1713480523149,false
gdsets_posters,gdsets_posters_1982_03_18.jpg,,"Poster - 3/18,19/82",[],,https://gdsets.com/80posters/1982_03_18.jpg,,,,,,1982-03-18,1713480523268,false
gdsets_posters,gdsets_posters_1982_06_10a.jpg,,Poster - 6/10-12/82,[],,https://gdsets.com/80posters/1982_06_10a.jpg,,,,,,1982-06-10,1713480523354,false
gdsets_posters,gdsets_posters_1982_04_10a.jpg,,Poster - 4/10/82 @ program,[],,https://gdsets.com/80posters/1982_04_10a.jpg,,,,,,1982-04-10,1713480523363,false
gdsets_posters,gdsets_posters_1982_05_28b.jpg,,Poster - 5/28/82,[],,https://gdsets.com/80posters/1982_05_28b.jpg,,,,,,1982-05-28,1713480523366,false
gdsets_posters,gdsets_posters_1982_06_10.jpg,,"Poster - 6/10,12/82 @ program",[],,https://gdsets.com/80posters/1982_06_10.jpg,,,,,,1982-06-10,1713480523367,false
gdsets_posters,gdsets_posters_1982_06_12.jpg,,Poster - 6/12/82,[],,https://gdsets.com/80posters/1982_06_12.jpg,,,,,,1982-06-12,1713480523367,true
gdsets_posters,gdsets_posters_1982_06_18.jpg,,Poster - 6/18/82,[],,https://gdsets.com/80posters/1982_06_18.jpg,,,,,,1982-06-18,1713480523369,false
gdsets_posters,gdsets_posters_1982_06_12b.jpg,,Poster - 6/12/82,[],,https://gdsets.com/80posters/1982_06_12b.jpg,,,,,,1982-06-12,1713480523443,false
gdsets_posters,gdsets_posters_1982_06_30.jpg,,Poster - 6/30/82,[],,https://gdsets.com/80posters/1982_06_30.jpg,,,,,,1982-06-30,1713480523444,false
gdsets_posters,gdsets_posters_1982_06_27.jpg,,Poster - 6/27/82,[],,https://gdsets.com/80posters/1982_06_27.jpg,,,,,,1982-06-27,1713480523549,false
gdsets_posters,gdsets_posters_1982_05_21.jpg,,Poster - 5/21-23/82,[],,https://gdsets.com/80posters/1982_05_21.jpg,,,,,,1982-05-21,1713480523554,false
gdsets_posters,gdsets_posters_1982_06_25.jpg,,Poster - 6/25/82,[],,https://gdsets.com/80posters/1982_06_25.jpg,,,,,,1982-06-25,1713480523557,false
gdsets_posters,gdsets_posters_1982_05_28.jpg,,Poster - 5/28/82,[],,https://gdsets.com/80posters/1982_05_28.jpg,,,,,,1982-05-28,1713480523557,false
gdsets_posters,gdsets_posters_1982_06_12a.jpg,,Poster - 6/12/82,[],,https://gdsets.com/80posters/1982_06_12a.jpg,,,,,,1982-06-12,1713480523641,false
gdsets_posters,gdsets_posters_1982_07_02.jpg,,Poster - 7/2/82,[],,https://gdsets.com/80posters/1982_07_02.jpg,,,,,,1982-07-02,1713480523727,false
gdsets_posters,gdsets_posters_1982_06_30a.jpg,,Poster - 6/30/82,[],,https://gdsets.com/80posters/1982_06_30a.jpg,,,,,,1982-06-30,1713480523730,false
gdsets_posters,gdsets_posters_1982_07_27a.jpg,,Poster - 7/27-29/82,[],,https://gdsets.com/80posters/1982_07_27a.jpg,,,,,,1982-07-27,1713480523815,false
gdsets_posters,gdsets_posters_1982_07_17a.jpg,,Poster - 7/17-18/82,[],,https://gdsets.com/80posters/1982_07_17a.jpg,,,,,,1982-07-17,1713480523815,false
gdsets_posters,gdsets_posters_1982_07_27.jpg,,Poster - 7/27-29/82,[],,https://gdsets.com/80posters/1982_07_27.jpg,,,,,,1982-07-27,1713480523899,false
gdsets_posters,gdsets_posters_1982_08_10.jpg,,Poster - 8/10/82,[],,https://gdsets.com/80posters/1982_08_10.jpg,,,,,,1982-08-10,1713480524016,false
gdsets_posters,gdsets_posters_1982_08_04a.jpg,,Poster - 8/4/82,[],,https://gdsets.com/80posters/1982_08_04a.jpg,,,,,,1982-08-04,1713480524018,false
gdsets_posters,gdsets_posters_1982_08_07.jpg,,Poster - 8/7/82,[],,https://gdsets.com/80posters/1982_08_07.jpg,,,,,,1982-08-07,1713480524022,false
gdsets_posters,gdsets_posters_1982_08_10a.jpg,,Poster - 8/10/82,[],,https://gdsets.com/80posters/1982_08_10a.jpg,,,,,,1982-08-10,1713480524113,true
gdsets_posters,gdsets_posters_1982_08_10b.jpg,,Poster - 8/10/82,[],,https://gdsets.com/80posters/1982_08_10b.jpg,,,,,,1982-08-10,1713480524215,false
gdsets_posters,gdsets_posters_1982_08_07a.jpg,,"Poster - 8/7,8/82",[],,https://gdsets.com/80posters/1982_08_07a.jpg,,,,,,1982-08-07,1713480524302,false
gdsets_posters,gdsets_posters_1982_09_05.jpg,,Poster - 9/5/82,[],,https://gdsets.com/80posters/1982_09_05.jpg,,,,,,1982-09-05,1713480524304,false
gdsets_posters,gdsets_posters_1982_08_01.jpg,,Poster - 8/1/82,[],,https://gdsets.com/80posters/1982_08_01.jpg,,,,,,1982-08-01,1713480524317,false
gdsets_posters,gdsets_posters_1982_09_06.jpg,,"Poster - 9/6,7/82",[],,https://gdsets.com/80posters/1982_09_06.jpg,,,,,,1982-09-06,1713480524418,false
gdsets_posters,gdsets_posters_1982_07_31a (AOR 4.159 OHB).jpg,,Poster - 7/31/82 (OHB)AOR 4.159,[],,https://gdsets.com/80posters/1982_07_31a (AOR 4.159
gdsets_posters,gdsets_posters_1982_09_05a.jpg,,Poster - 9/5/82,[],,https://gdsets.com/80posters/1982_09_05a.jpg,,,,,,1982-09-05,1713480524514,false
gdsets_posters,gdsets_posters_1982_08_07b.jpg,,"Poster - 8/7,8/82",[],,https://gdsets.com/80posters/1982_08_07b.jpg,,,,,,1982-08-07,1713480524520,false
gdsets_posters,gdsets_posters_1982_09_16.jpg,,Poster - 9/16/82,[],,https://gdsets.com/80posters/1982_09_16.jpg,,,,,,1982-09-16,1713480524606,false
gdsets_posters,gdsets_posters_1982_09_14a.jpg,,Poster - 9/14/82,[],,https://gdsets.com/80posters/1982_09_14a.jpg,,,,,,1982-09-14,1713480524701,false
gdsets_posters,gdsets_posters_1982_08_28a.jpg,,Poster - 8/28/82,[],,https://gdsets.com/80posters/1982_08_28a.jpg,,,,,,1982-08-28,1713480524726,false
gdsets_posters,gdsets_posters_1982_09_18a.jpg,,Poster - 9/18/82,[],,https://gdsets.com/80posters/1982_09_18a.jpg,,,,,,1982-09-18,1713480524925,true
gdsets_posters,gdsets_posters_1982_09_05b.jpg,,Poster - 9/5/82 (OP1)AOR 4.130,[],,https://gdsets.com/80posters/1982_09_05b.jpg,,,,,,1982-09-05,1713480524929,false
gdsets_posters,gdsets_posters_1982_08_13.jpg,,Poster - 8/13/82,[],,https://gdsets.com/80posters/1982_08_13.jpg,,,,,,1982-08-13,1713480524929,false
gdsets_posters,gdsets_posters_1982_09_18c.jpg,,Poster - 9/18/82,[],,https://gdsets.com/80posters/1982_09_18c.jpg,,,,,,1982-09-18,1713480524935,true
gdsets_posters,gdsets_posters_1982_09_17.jpg,,Poster - 9/17/82,[],,https://gdsets.com/80posters/1982_09_17.jpg,,,,,,1982-09-17,1713480524935,false
gdsets_posters,gdsets_posters_1982_09_20.jpg,,"Poster - 9/20,21/82 @ program",[],,https://gdsets.com/80posters/1982_09_20.jpg,,,,,,1982-09-20,1713480525016,false
gdsets_posters,gdsets_posters_1982_09_14.jpg,,Poster - 9/14/82,[],,https://gdsets.com/80posters/1982_09_14.jpg,,,,,,1982-09-14,1713480525034,false
gdsets_posters,gdsets_posters_1982_09_17a.jpg,,"Poster - 9/17,18/82",[],,https://gdsets.com/80posters/1982_09_17a.jpg,,,,,,1982-09-17,1713480525123,false
gdsets_posters,gdsets_posters_1982_10_09a.jpg,,"Poster - 10/9,10/82",[],,https://gdsets.com/80posters/1982_10_09a.jpg,,,,,,1982-10-09,1713480525123,false
gdsets_posters,gdsets_posters_1982_09_18d.jpg,,Poster - 9/18/82,[],,https://gdsets.com/80posters/1982_09_18d.jpg,,,,,,1982-09-18,1713480525131,true
gdsets_posters,gdsets_posters_1982_09_18b.jpg,,Poster - 9/18/82,[],,https://gdsets.com/80posters/1982_09_18b.jpg,,,,,,1982-09-18,1713480525317,true
gdsets_posters,gdsets_posters_1982_10_21.jpg,,"Poster - 10/21-23,29/82",[],,https://gdsets.com/80posters/1982_10_21.jpg,,,,,,1982-10-21,1713480525429,false
gdsets_posters,gdsets_posters_1982_10_18.jpg,,Poster - 10/18/82,[],,https://gdsets.com/80posters/1982_10_18.jpg,,,,,,1982-10-18,1713480525432,false
gdsets_posters,gdsets_posters_1982_10_24.jpg,,Poster - 10/24/82,[],,https://gdsets.com/80posters/1982_10_24.jpg,,,,,,1982-10-24,1713480525435,false
gdsets_posters,gdsets_posters_1982_10_25.jpg,,Poster - 10/25/82,[],,https://gdsets.com/80posters/1982_10_25.jpg,,,,,,1982-10-25,1713480525538,false
gdsets_posters,gdsets_posters_1982_10_17.jpg,,Poster - 10/17/82 (OP1)AOR 4.153,[],,https://gdsets.com/80posters/1982_10_17.jpg,,,,,,1982-10-17,1713480525545,false
gdsets_posters,gdsets_posters_1982_10_17a.jpg,,Poster - 10/17/82 (OP2)AOR 4.153,[],,https://gdsets.com/80posters/1982_10_17a.jpg,,,,,,1982-10-17,1713480525547,true
gdsets_posters,gdsets_posters_1982_10_30a.jpg,,Poster - 10/30/82,[],,https://gdsets.com/80posters/1982_10_30a.jpg,,,,,,1982-10-30,1713480525654,false
gdsets_posters,gdsets_posters_1982_10_27.jpg,,"Poster - 10/27,28/82",[],,https://gdsets.com/80posters/1982_10_27.jpg,,,,,,1982-10-27,1713480525661,false
gdsets_posters,gdsets_posters_1982_10_30.jpg,,Poster - 10/30/82,[],,https://gdsets.com/80posters/1982_10_30.jpg,,,,,,1982-10-30,1713480525752,false
gdsets_posters,gdsets_posters_1982_11_01.jpg,,Poster - 11/1/82,[],,https://gdsets.com/80posters/1982_11_01.jpg,,,,,,1982-11-01,1713480525756,false
gdsets_posters,gdsets_posters_1982_11_01a.jpg,,Poster - Run For The Rosesconcept art,[],,https://gdsets.com/80posters
gdsets_posters,gdsets_posters_1982_11_07.jpg,,Poster - 11/7/82,[],,https://gdsets.com/80posters/1982_11_07.jpg,,,,,,1982-11-07,1713480525852,false
gdsets_posters,gdsets_posters_1982_11_04.jpg,,Poster - 11/4/82,[],,https://gdsets.com/80posters/1982_11_04.jpg,,,,,,1982-11-04,1713480525859,false
gdsets_posters,gdsets_posters_1982_10_09.jpg,,"Poster - 10/9,10/82",[],,https://gdsets.com/80posters/1982_10_09.jpg,,,,,,1982-10-09,1713480525948,false
gdsets_posters,gdsets_posters_1982_09_18.jpg,,Poster - 9/18/82,[],,https://gdsets.com/80posters/1982_09_18.jpg,,,,,,1982-09-18,1713480525950,false
gdsets_posters,gdsets_posters_1982_10_28a.jpg,,Poster - 10/28/82,[],,https://gdsets.com/80posters/1982_10_28a.jpg,,,,,,1982-10-28,1713480526042,false
gdsets_posters,gdsets_posters_1982_11_06.jpg,,Poster - 11/6/82,[],,https://gdsets.com/80posters/1982_11_06.jpg,,,,,,1982-11-06,1713480526048,false
gdsets_posters,gdsets_posters_1982_11_12.jpg,,Poster - 11/12/82,[],,https://gdsets.com/80posters/1982_11_12.jpg,,,,,,1982-11-12,1713480526275,false
gdsets_posters,gdsets_posters_1982_11_11.jpg,,Poster - 11/11/82 @ program,[],,https://gdsets.com/80posters/1982_11_11.jpg,,,,,,1982-11-11,1713480526280,false
gdsets_posters,gdsets_posters_1982_11_09.jpg,,Poster - 11/9/82,[],,https://gdsets.com/80posters/1982_11_09.jpg,,,,,,1982-11-09,1713480526280,false
gdsets_posters,gdsets_posters_1982_11_15.jpg,,Poster - 11/15/82,[],,https://gdsets.com/80posters/1982_11_15.jpg,,,,,,1982-11-15,1713480526379,false
gdsets_posters,gdsets_posters_1982_10_28.jpg,,Poster - 10/28/82,[],,https://gdsets.com/80posters/1982_10_28.jpg,,,,,,1982-10-28,1713480526385,false
gdsets_posters,gdsets_posters_1982_11_22.jpg,,Poster - 11/22/82,[],,https://gdsets.com/80posters/1982_11_22.jpg,,,,,,1982-11-22,1713480526475,false
gdsets_posters,gdsets_posters_1982_11_26c.jpg,,Poster - 11/26/82 @ travel flyer,[],,https://gdsets.com/80posters/1982_11_26c.jpg,,,,,,1982-11-26,1713480526583,false
gdsets_posters,gdsets_posters_1982_11_26b.jpg,,Poster - 11/26/82,[],,https://gdsets.com/80posters/1982_11_26b.jpg,,,,,,1982-11-26,1713480526594,false
gdsets_posters,gdsets_posters_1982_12_10a.jpg,,Poster - 12/10/82,[],,https://gdsets.com/80posters/1982_12_10a.jpg,,,,,,1982-12-10,1713480526598,false
gdsets_posters,gdsets_posters_1982_12_26.jpg,,Poster - 12/26-31/82,[],,https://gdsets.com/80posters/1982_12_26.jpg,,,,,,1982-12-26,1713480526717,false
gdsets_posters,gdsets_posters_1982_12_31.jpg,,Poster - 12/31/82,[],,https://gdsets.com/80posters/1982_12_31.jpg,,,,,,1982-12-31,1713480526835,false
gdsets_posters,gdsets_posters_1982_11_26.jpg,,Poster - 11/26/82 (OP1)AOR 4.241,[],,https://gdsets.com/80posters/1982_11_26.jpg,,,,,,1982-11-26,1713480527055,true
gdsets_posters,gdsets_posters_1982_11_21.jpg,,Poster - 11/21/82,[],,https://gdsets.com/80posters/1982_11_21.jpg,,,,,,1982-11-21,1713480527056,false
gdsets_posters,gdsets_posters_1982_12_26a.jpg,,Poster - 12/26-31/82,[],,https://gdsets.com/80posters/1982_12_26a.jpg,,,,,,1982-12-26,1713480527059,false
gdsets_posters,gdsets_posters_1990_01_01b.jpg,,Poster - 1990 Trade Ad,[],,https://gdsets.com/90posters/1990_01_01b.jpg,,,,,,1990-01-01,1713480527064,false
gdsets_posters,gdsets_posters_1990_01_01.jpg,,Poster - 1990 @ Calendar,[],,https://gdsets.com/90posters/1990_01_01.jpg,,,,,,1990-01-01,1713480527169,false
gdsets_posters,gdsets_posters_1990_02_25.jpg,,Poster - 2/25-27/90,[],,https://gdsets.com/90posters/1990_02_25.jpg,,,,,,1990-02-25,1713480527171,false
gdsets_posters,gdsets_posters_1982_12_17a.jpg,,Poster - 12/17/82,[],,https://gdsets.com/80posters/1982_12_17a.jpg,,,,,,1982-12-17,1713480527188,false
gdsets_posters,gdsets_posters_1982_07_31.jpg,,Poster - 7/31/82 (OP1)AOR 4.159,[],,https://gdsets.com/80posters/1982_07_31.jpg,,,,,,1982-07-31,1713480527330,false
gdsets_posters,gdsets_posters_1982_11_26aa.jpg,,Poster - 11/26/82,[],,https://gdsets.com/80posters/1982_11_26aa.jpg,,,,,,1982-11-26,1713480527360,false
gdsets_posters,gdsets_posters_1990_01_06.jpg,,"Poster - 1/6,7,12/90",[],,https://gdsets.com/90posters/1990_01_06.jpg,,,,,,1990-01-06,1713480527361,false
gdsets_posters,gdsets_posters_1982_12_17.jpg,,Poster - 12/17/82,[],,https://gdsets.com/80posters/1982_12_17.jpg,,,,,,1982-12-17,1713480527401,false
gdsets_posters,gdsets_posters_1990_03_05.jpg,,Poster - 3/5/90,[],,https://gdsets.com/90posters/1990_03_05.jpg,,,,,,1990-03-05,1713480527412,false
gdsets_posters,gdsets_posters_1990_03_14.jpg,,Poster - 3/14-16/90,[],,https://gdsets.com/90posters/1990_03_14.jpg,,,,,,1990-03-14,1713480527419,false
gdsets_posters,gdsets_posters_1982_12_10.jpg,,Poster - 12/10/82,[],,https://gdsets.com/80posters/1982_12_10.jpg,,,,,,1982-12-10,1713480527419,false
gdsets_posters,gdsets_posters_1990_03_21a.jpg,,"Poster - 3/21,22/90 @ Original Art",[],,https://gdsets.com/90posters
gdsets_posters,gdsets_posters_1990_03_24.jpg,,Poster - 3/24-30/90,[],,https://gdsets.com/90posters/1990_03_24.jpg,,,,,,1990-03-24,1713480527579,false
gdsets_posters,gdsets_posters_1990_03_21b.jpg,,"Poster - 3/21,22/90",[],,https://gdsets.com/90posters/1990_03_21b.jpg,,,,,,1990-03-21,1713480527581,false
gdsets_posters,gdsets_posters_1982_11_26a.jpg,,Poster - 11/26/82,[],,https://gdsets.com/80posters/1982_11_26a.jpg,,,,,,1982-11-26,1713480527715,false
gdsets_posters,gdsets_posters_1990_05_15.jpg,,Poster - 5/15/90,[],,https://gdsets.com/90posters/1990_05_15.jpg,,,,,,1990-05-15,1713480527798,false
gdsets_posters,gdsets_posters_1990_05_19.jpg,,Poster - 5/19/90,[],,https://gdsets.com/90posters/1990_05_19.jpg,,,,,,1990-05-19,1713480527830,false
gdsets_posters,gdsets_posters_1990_01_01a.jpg,,Poster - 1990 Promo Poster,[],,https://gdsets.com/90posters/1990_01_01a.jpg,,,,,,1990-01-01,1713480527863,false
gdsets_posters,gdsets_posters_1990_05_20.jpg,,Poster - 5/20/90,[],,https://gdsets.com/90posters/1990_05_20.jpg,,,,,,1990-05-20,1713480527863,false
gdsets_posters,gdsets_posters_1990_03_24a.jpg,,Poster - 3/24-26/90,[],,https://gdsets.com/90posters/1990_03_24a.jpg,,,,,,1990-03-24,1713480527869,false
gdsets_posters,gdsets_posters_1990_03_21.jpg,,"Poster - 3/21,22/90",[],,https://gdsets.com/90posters/1990_03_21.jpg,,,,,,1990-03-21,1713480527902,false
gdsets_posters,gdsets_posters_1990_03_24b.jpg,,Poster - 3/24-26/90,[],,https://gdsets.com/90posters/1990_03_24b.jpg,,,,,,1990-03-24,1713480527956,false
gdsets_posters,gdsets_posters_1990_05_16.jpg,,Poster - 5/16/90,[],,https://gdsets.com/90posters/1990_05_16.jpg,,,,,,1990-05-16,1713480527959,false
gdsets_posters,gdsets_posters_1990_06_12.jpg,,"Poster - 6/12,13/90",[],,https://gdsets.com/90posters/1990_06_12.jpg,,,,,,1990-06-12,1713480527963,false
gdsets_posters,gdsets_posters_1990_06_23a.jpg,,"Poster - 6/23,24/90",[],,https://gdsets.com/90posters/1990_06_23a.jpg,,,,,,1990-06-23,1713480528152,false
gdsets_posters,gdsets_posters_1990_05_05.jpg,,"Poster - 5/5,6/90",[],,https://gdsets.com/90posters/1990_05_05.jpg,,,,,,1990-05-05,1713480528154,false
gdsets_posters,gdsets_posters_1990_06_30.jpg,,Poster - 6/30/90,[],,https://gdsets.com/90posters/1990_06_30.jpg,,,,,,1990-06-30,1713480528252,false
gdsets_posters,gdsets_posters_1990_05_20a.jpg,,Poster - 5/20/90,[],,https://gdsets.com/90posters/1990_05_20a.jpg,,,,,,1990-05-20,1713480528268,false
gdsets_posters,gdsets_posters_1990_06_23.jpg,,"Poster - 6/23,24/90",[],,https://gdsets.com/90posters/1990_06_23.jpg,,,,,,1990-06-23,1713480528363,false
gdsets_posters,gdsets_posters_1990_06_23b.jpg,,"Poster - 6/23,24/90",[],,https://gdsets.com/90posters/1990_06_23b.jpg,,,,,,1990-06-23,1713480528469,false
gdsets_posters,gdsets_posters_1990_07_14.jpg,,Poster - 7/14/90,[],,https://gdsets.com/90posters/1990_07_14.jpg,,,,,,1990-07-14,1713480528586,true
gdsets_posters,gdsets_posters_1990_06_15b.jpg,,Poster - 6/15-17/90,[],,https://gdsets.com/90posters/1990_06_15b.jpg,,,,,,1990-06-15,1713480528591,false
gdsets_posters,gdsets_posters_1990_07_16.jpg,,Poster - 7/16/90,[],,https://gdsets.com/90posters/1990_07_16.jpg,,,,,,1990-07-16,1713480528667,false
gdsets_posters,gdsets_posters_1990_07_08.jpg,,Poster - 7/8/90,[],,https://gdsets.com/90posters/1990_07_08.jpg,,,,,,1990-07-08,1713480528669,false
gdsets_posters,gdsets_posters_1990_07_08b.jpg,,Poster - 7/8/90,[],,https://gdsets.com/90posters/1990_07_08b.jpg,,,,,,1990-07-08,1713480528676,true
gdsets_posters,gdsets_posters_1990_07_10.jpg,,Poster - 7/10/90,[],,https://gdsets.com/90posters/1990_07_10.jpg,,,,,,1990-07-10,1713480528778,true
gdsets_posters,gdsets_posters_1990_07_14a.jpg,,Poster - 7/14/90,[],,https://gdsets.com/90posters/1990_07_14a.jpg,,,,,,1990-07-14,1713480528779,false
gdsets_posters,gdsets_posters_1990_07_21.jpg,,Poster - 7/21-23/90,[],,https://gdsets.com/90posters/1990_07_21.jpg,,,,,,1990-07-21,1713480528781,false
gdsets_posters,gdsets_posters_1990_08_05.jpg,,Poster - 8/5/90,[],,https://gdsets.com/90posters/1990_08_05.jpg,,,,,,1990-08-05,1713480528834,false
gdsets_posters,gdsets_posters_1990_06_08.jpg,,Poster - 6/8-10/90,[],,https://gdsets.com/90posters/1990_06_08.jpg,,,,,,1990-06-08,1713480528870,false
gdsets_posters,gdsets_posters_1990_07_10b.jpg,,Poster - 7/10/90,[],,https://gdsets.com/90posters/1990_07_10b.jpg,,,,,,1990-07-10,1713480528880,false
gdsets_posters,gdsets_posters_1990_07_06.jpg,,Poster - 7/6/90,[],,https://gdsets.com/90posters/1990_07_06.jpg,,,,,,1990-07-06,1713480528967,false
gdsets_posters,gdsets_posters_1990_07_18.jpg,,"Poster - 7/18,19/90",[],,https://gdsets.com/90posters/1990_07_18.jpg,,,,,,1990-07-18,1713480528983,false
gdsets_posters,gdsets_posters_1990_09_01.jpg,,Poster - 9/1/90,[],,https://gdsets.com/90posters/1990_09_01.jpg,,,,,,1990-09-01,1713480528985,true
gdsets_posters,gdsets_posters_1990_09_01a.jpg,,Poster - 9/1/90,[],,https://gdsets.com/90posters/1990_09_01a.jpg,,,,,,1990-09-01,1713480529060,true
gdsets_posters,gdsets_posters_1990_09_01b.jpg,,Poster - 9/1/90,[],,https://gdsets.com/90posters/1990_09_01b.jpg,,,,,,1990-09-01,1713480529069,false
gdsets_posters,gdsets_posters_1990_09_25.jpg,,Poster - Without A Net Promo,[],,https://gdsets.com/90posters/1990_09_25.jpg,,,,,,1990-09-25,1713480529156,true
gdsets_posters,gdsets_posters_1990_09_14.jpg,,Poster - 9/14-20/90,[],,https://gdsets.com/90posters/1990_09_14.jpg,,,,,,1990-09-14,1713480529157,false
gdsets_posters,gdsets_posters_1990_10_00a.jpg,,Poster - Europe 1990,[],,https://gdsets.com/90posters/1990_10_00a.jpg,,,,,,1990-10-00,1713480529324,false
gdsets_posters,gdsets_posters_1990_09_25b.jpg,,Poster - Without A Net Ad,[],,https://gdsets.com/90posters/1990_09_25b.jpg,,,,,,1990-09-25,1713480529325,false
gdsets_posters,gdsets_posters_1990_10_17.jpg,,Poster - 10/17-22/90,[],,https://gdsets.com/90posters/1990_10_17.jpg,,,,,,1990-10-17,1713480529440,false
gdsets_posters,gdsets_posters_1990_10_13a.jpg,,Poster - 10/13-31/90,[],,https://gdsets.com/90posters/1990_10_13a.jpg,,,,,,1990-10-13,1713480529441,true
gdsets_posters,gdsets_posters_1990_10_17a.jpg,,Poster - 10/17/90,[],,https://gdsets.com/90posters/1990_10_17a.jpg,,,,,,1990-10-17,1713480529555,false
gdsets_posters,gdsets_posters_1990_08_23.jpg,,Poster - 8/23/90,[],,https://gdsets.com/90posters/1990_08_23.jpg,,,,,,1990-08-23,1713480529555,false
gdsets_posters,gdsets_posters_1990_10_00b.jpg,,Poster - Europe 1990,[],,https://gdsets.com/90posters/1990_10_00b.jpg,,,,,,1990-10-00,1713480529658,false
gdsets_posters,gdsets_posters_1990_10_19.jpg,,Poster - 10/19/90,[],,https://gdsets.com/90posters/1990_10_19.jpg,,,,,,1990-10-19,1713480529665,false
gdsets_posters,gdsets_posters_1990_10_17b.jpg,,Poster - 10/17/90,[],,https://gdsets.com/90posters/1990_10_17b.jpg,,,,,,1990-10-17,1713480529672,false
gdsets_posters,gdsets_posters_1990_10_00.jpg,,Poster - Europe 1990 @ Concept Art,[],,https://gdsets.com/90posters/1990_10_00.jpg,,,,,,1990-10-00,1713480529754,false
gdsets_posters,gdsets_posters_1990_10_19c.jpg,,Poster - 10/19/90,[],,https://gdsets.com/90posters/1990_10_19c.jpg,,,,,,1990-10-19,1713480529939,false
gdsets_posters,gdsets_posters_1990_10_31.jpg,,Poster - 10/31/90,[],,https://gdsets.com/90posters/1990_10_31.jpg,,,,,,1990-10-31,1713480529939,false
gdsets_posters,gdsets_posters_1990_10_31a.jpg,,Poster - 10/31/90,[],,https://gdsets.com/90posters/1990_10_31a.jpg,,,,,,1990-10-31,1713480529951,false
gdsets_posters,gdsets_posters_1990_11_09.jpg,,Poster - 11/9/90,[],,https://gdsets.com/90posters/1990_11_09.jpg,,,,,,1990-11-09,1713480530129,false
gdsets_posters,gdsets_posters_1990_10_19b.jpg,,Poster - 10/19/90,[],,https://gdsets.com/90posters/1990_10_19b.jpg,,,,,,1990-10-19,1713480530131,false
gdsets_posters,gdsets_posters_1990_11_09a.jpg,,Poster - 11/9/90,[],,https://gdsets.com/90posters/1990_11_09a.jpg,,,,,,1990-11-09,1713480530138,false
gdsets_posters,gdsets_posters_1990_10_19a.jpg,,"Poster - 10/19,20/90",[],,https://gdsets.com/90posters/1990_10_19a.jpg,,,,,,1990-10-19,1713480530145,false
gdsets_posters,gdsets_posters_1990_11_20.jpg,,"Poster - 11/20,21/90",[],,https://gdsets.com/90posters/1990_11_20.jpg,,,,,,1990-11-20,1713480530253,false
gdsets_posters,gdsets_posters_1990_11_17.jpg,,Poster - 11/17/90,[],,https://gdsets.com/90posters/1990_11_17.jpg,,,,,,1990-11-17,1713480530259,false
gdsets_posters,gdsets_posters_1990_11_10.jpg,,Poster - 11/10/90,[],,https://gdsets.com/90posters/1990_11_10.jpg,,,,,,1990-11-10,1713480530332,false
gdsets_posters,gdsets_posters_1990_11_10a.jpg,,Poster - 11/10/90,[],,https://gdsets.com/90posters/1990_11_10a.jpg,,,,,,1990-11-10,1713480530334,false
gdsets_posters,gdsets_posters_1990_11_24.jpg,,Poster - 11/24/90,[],,https://gdsets.com/90posters/1990_11_24.jpg,,,,,,1990-11-24,1713480530353,false
gdsets_posters,gdsets_posters_1990_11_27.jpg,,Poster - 11/27/90,[],,https://gdsets.com/90posters/1990_11_27.jpg,,,,,,1990-11-27,1713480530356,false
gdsets_posters,gdsets_posters_1990_10_22.jpg,,Poster - 10/22/90,[],,https://gdsets.com/90posters/1990_10_22.jpg,,,,,,1990-10-22,1713480530435,false
gdsets_posters,gdsets_posters_1990_11_28.jpg,,Poster - 11/28/90,[],,https://gdsets.com/90posters/1990_11_28.jpg,,,,,,1990-11-28,1713480530558,false
gdsets_posters,gdsets_posters_1990_10_13.jpg,,Poster - 10/13/90,[],,https://gdsets.com/90posters/1990_10_13.jpg,,,,,,1990-10-13,1713480530560,false
gdsets_posters,gdsets_posters_1990_12_03.jpg,,"Poster - 12/3,4/90",[],,https://gdsets.com/90posters/1990_12_03.jpg,,,,,,1990-12-03,1713480530654,false
gdsets_posters,gdsets_posters_1990_11_30.jpg,,Poster - 11/30/90,[],,https://gdsets.com/90posters/1990_11_30.jpg,,,,,,1990-11-30,1713480530774,false
gdsets_posters,gdsets_posters_1990_12_08.jpg,,"Poster - 12/8,9/90",[],,https://gdsets.com/90posters/1990_12_08.jpg,,,,,,1990-12-08,1713480530890,false
gdsets_posters,gdsets_posters_1990_12_03a.jpg,,"Poster - 12/3,4/90",[],,https://gdsets.com/90posters/1990_12_03a.jpg,,,,,,1990-12-03,1713480530898,true
gdsets_posters,gdsets_posters_1990_10_30.jpg,,Poster - 10/30-11/1/90,[],,https://gdsets.com/90posters/1990_10_30.jpg,,,,,,1990-10-30,1713480530903,false
gdsets_posters,gdsets_posters_1990_09_25a.jpg,,Poster - Without A Net Promo,[],,https://gdsets.com/90posters/1990_09_25a.jpg,,,,,,1990-09-25,1713480530903,false
gdsets_posters,gdsets_posters_1990_11_28a.jpg,,Poster - 11/28/90,[],,https://gdsets.com/90posters/1990_11_28a.jpg,,,,,,1990-11-28,1713480530998,false
gdsets_posters,gdsets_posters_1990_12_12.jpg,,Poster - 12/12-14/90,[],,https://gdsets.com/90posters/1990_12_12.jpg,,,,,,1990-12-12,1713480531085,false
gdsets_posters,gdsets_posters_1991_01_21.jpg,,"Poster - 1/21,22/91",[],,https://gdsets.com/90posters/1991_01_21.jpg,,,,,,1991-01-21,1713480531089,false
gdsets_posters,gdsets_posters_1991_01_29.jpg,,Poster - 1/29-31/91,[],,https://gdsets.com/90posters/1991_01_29.jpg,,,,,,1991-01-29,1713480531091,false
gdsets_posters,gdsets_posters_1991_01_26.jpg,,Poster - 1/26/91,[],,https://gdsets.com/90posters/1991_01_26.jpg,,,,,,1991-01-26,1713480531091,false
gdsets_posters,gdsets_posters_1990_10_22a.jpg,,Poster - 10/22/90,[],,https://gdsets.com/90posters/1990_10_22a.jpg,,,,,,1990-10-22,1713480531185,true
gdsets_posters,gdsets_posters_1991_02_01.jpg,,Poster - 2/1/91,[],,https://gdsets.com/90posters/1991_02_01.jpg,,,,,,1991-02-01,1713480531188,false
gdsets_posters,gdsets_posters_1990_12_31a.jpg,,Poster - 12/31/90 @ Button,[],,https://gdsets.com/90posters/1990_12_31a.jpg,,,,,,1990-12-31,1713480531196,false
gdsets_posters,gdsets_posters_1990_12_31.jpg,,Poster - 12/31/90,[],,https://gdsets.com/90posters/1990_12_31.jpg,,,,,,1990-12-31,1713480531296,false
gdsets_posters,gdsets_posters_1991_02_28.jpg,,Poster - 2/28-3/2/91,[],,https://gdsets.com/90posters/1991_02_28.jpg,,,,,,1991-02-28,1713480531296,false
gdsets_posters,gdsets_posters_1991_02_28a.jpg,,Poster - 2/28-3/2/91,[],,https://gdsets.com/90posters/1991_02_28a.jpg,,,,,,1991-02-28,1713480531376,false
gdsets_posters,gdsets_posters_1991_02_19.jpg,,Poster - 2/19-21/91,[],,https://gdsets.com/90posters/1991_02_19.jpg,,,,,,1991-02-19,1713480531381,false
gdsets_posters,gdsets_posters_1991_04_15.jpg,,Poster - One From The Vault Trade Ad,[],,https://gdsets.com/90posters/1991_04_15.jpg,,,,,,1991-04-15,1713480531471,false
gdsets_posters,gdsets_posters_1991_03_17.jpg,,Poster - 3/17-21/91,[],,https://gdsets.com/90posters/1991_03_17.jpg,,,,,,1991-03-17,1713480531478,false
gdsets_posters,gdsets_posters_1991_04_19.jpg,,Poster - 4/19-21/91,[],,https://gdsets.com/90posters/1991_04_19.jpg,,,,,,1991-04-19,1713480531566,false
gdsets_posters,gdsets_posters_1991_04_27b.jpg,,"Poster - 4/27,28/91(OP1) back",[],,https://gdsets.com/90posters/1991_04_27b.jpg,,,,,,1991-04-27,1713480531578,false
gdsets_posters,gdsets_posters_1991_05_22.jpg,,"Poster - 5/22,23/91",[],,https://gdsets.com/90posters/1991_05_22.jpg,,,,,,1991-05-22,1713480531774,true
gdsets_posters,gdsets_posters_1991_05_22a.jpg,,"Poster - 5/22,23/91",[],,https://gdsets.com/90posters/1991_05_22a.jpg,,,,,,1991-05-22,1713480531784,true
gdsets_posters,gdsets_posters_1991_05_10.jpg,,Poster - 5/10-12/91,[],,https://gdsets.com/90posters/1991_05_10.jpg,,,,,,1991-05-10,1713480531786,false
gdsets_posters,gdsets_posters_1991_04_27d.jpg,,"Poster - 4/27,28/91",[],,https://gdsets.com/90posters/1991_04_27d.jpg,,,,,,1991-04-27,1713480531869,false
gdsets_posters,gdsets_posters_1991_05_22b.jpg,,Poster - 5/22/91,[],,https://gdsets.com/90posters/1991_05_22b.jpg,,,,,,1991-05-22,1713480531880,false
gdsets_posters,gdsets_posters_1991_01_29a.jpg,,"Poster - 1/29-31/912/2,3/91",[],,https://gdsets.com/90posters/1991_01_29a.jpg,,,,,,1991-01-29,1713480531884,false
gdsets_posters,gdsets_posters_1991_04_27c.jpg,,"Poster - 4/27,28/91",[],,https://gdsets.com/90posters/1991_04_27c.jpg,,,,,,1991-04-27,1713480531970,false
gdsets_posters,gdsets_posters_1991_06_28.jpg,,Poster - 6/28/91,[],,https://gdsets.com/90posters/1991_06_28.jpg,,,,,,1991-06-28,1713480531971,true
gdsets_posters,gdsets_posters_1991_06_16.jpg,,"Poster - 6/16,17/91",[],,https://gdsets.com/90posters/1991_06_16.jpg,,,,,,1991-06-16,1713480531977,false
gdsets_posters,gdsets_posters_1990_11_01.jpg,,Poster - 11/1/90,[],,https://gdsets.com/90posters/1990_11_01.jpg,,,,,,1990-11-01,1713480531990,false
gdsets_posters,gdsets_posters_1991_06_19.jpg,,"Poster - 6/19,20/91",[],,https://gdsets.com/90posters/1991_06_19.jpg,,,,,,1991-06-19,1713480531991,false
gdsets_posters,gdsets_posters_1991_05_19.jpg,,Poster - 5/19-21/91,[],,https://gdsets.com/90posters/1991_05_19.jpg,,,,,,1991-05-19,1713480532069,false
gdsets_posters,gdsets_posters_1991_07_14.jpg,,Poster - 7/14/91(cancelled),[],,https://gdsets.com/90posters/1991_07_14.jpg,,,,,,1991-07-14,1713480532169,false
gdsets_posters,gdsets_posters_1991_07_13a.jpg,,Poster - 7/13/91 (OHB)(rescheduled),[],,https://gdsets.com/90posters
gdsets_posters,gdsets_posters_1991_08_24b.jpg,,"Poster - 8/24,25/91",[],,https://gdsets.com/90posters/1991_08_24b.jpg,,,,,,1991-08-24,1713480532261,false
gdsets_posters,gdsets_posters_1991_04_27a.jpg,,"Poster - 4/27,28/91(OP1) front",[],,https://gdsets.com/90posters/1991_04_27a.jpg,,,,,,1991-04-27,1713480532265,false
gdsets_posters,gdsets_posters_1991_06_01.jpg,,Poster - 6/1/91,[],,https://gdsets.com/90posters/1991_06_01.jpg,,,,,,1991-06-01,1713480532354,false
gdsets_posters,gdsets_posters_1991_07_19.jpg,,Poster - 7/19/91,[],,https://gdsets.com/90posters/1991_07_19.jpg,,,,,,1991-07-19,1713480532441,false
gdsets_posters,gdsets_posters_1991_07_13.jpg,,Poster - 7/13/91 (OP1)(rescheduled),[],,https://gdsets.com/90posters/1991_07_13.jpg,,,,,,1991-07-13,1713480532441,false
gdsets_posters,gdsets_posters_1991_06_28a.jpg,,Poster - 6/28/91,[],,https://gdsets.com/90posters/1991_06_28a.jpg,,,,,,1991-06-28,1713480532442,false
gdsets_posters,gdsets_posters_1991_08_24x.jpg,,"Poster - 8/24,25/91 @ Button",[],,https://gdsets.com/90posters/1991_08_24x.jpg,,,,,,1991-08-24,1713480532447,false
gdsets_posters,gdsets_posters_1991_09_08c.jpg,,Poster - 9/8-18/91,[],,https://gdsets.com/90posters/1991_09_08c.jpg,,,,,,1991-09-08,1713480532626,false
gdsets_posters,gdsets_posters_1991_11_12.jpg,,"Poster - 11/12,13/91",[],,https://gdsets.com/90posters/1991_11_12.jpg,,,,,,1991-11-12,1713480532629,false
gdsets_posters,gdsets_posters_1991_08_31a.jpg,,Poster - 8/31/91,[],,https://gdsets.com/90posters/1991_08_31a.jpg,,,,,,1991-08-31,1713480532630,false
gdsets_posters,gdsets_posters_1991_11_15.jpg,,Poster - 11/15/91,[],,https://gdsets.com/90posters/1991_11_15.jpg,,,,,,1991-11-15,1713480532639,false
gdsets_posters,gdsets_posters_1991_11_10.jpg,,Poster - 11/10/91,[],,https://gdsets.com/90posters/1991_11_10.jpg,,,,,,1991-11-10,1713480532650,false
gdsets_posters,gdsets_posters_1991_11_16.jpg,,Poster - 11/16/91,[],,https://gdsets.com/90posters/1991_11_16.jpg,,,,,,1991-11-16,1713480532723,false
gdsets_posters,gdsets_posters_1991_12_07.jpg,,Poster - 12/7-9/91,[],,https://gdsets.com/90posters/1991_12_07.jpg,,,,,,1991-12-07,1713480532731,false
gdsets_posters,gdsets_posters_1991_09_08b.jpg,,Poster - 9/8-18/91,[],,https://gdsets.com/90posters/1991_09_08b.jpg,,,,,,1991-09-08,1713480532820,false
gdsets_posters,gdsets_posters_1991_11_13.jpg,,Poster - 11/13/91,[],,https://gdsets.com/90posters/1991_11_13.jpg,,,,,,1991-11-13,1713480532920,false
gdsets_posters,gdsets_posters_1991_08_24c.jpg,,"Poster - 8/24,25/91",[],,https://gdsets.com/90posters/1991_08_24c.jpg,,,,,,1991-08-24,1713480532926,false
gdsets_posters,gdsets_posters_1992_03_23.jpg,,"Poster - 3/23,24/92",[],,https://gdsets.com/90posters/1992_03_23.jpg,,,,,,1992-03-23,1713480533021,false
gdsets_posters,gdsets_posters_1991_12_31.jpg,,Poster - 12/31/91,[],,https://gdsets.com/90posters/1991_12_31.jpg,,,,,,1991-12-31,1713480533109,false
gdsets_posters,gdsets_posters_1992_05_01.jpg,,Poster - Two From The Vault Trade Ad,[],,https://gdsets.com/90posters/1992_05_01.jpg,,,,,,1992-05-01,1713480533120,false
gdsets_posters,gdsets_posters_1992_04_25.jpg,,Poster - 4/25/92,[],,https://gdsets.com/90posters/1992_04_25.jpg,,,,,,1992-04-25,1713480533211,false
gdsets_posters,gdsets_posters_1991_09_20.jpg,,Poster - 9/20-26/91,[],,https://gdsets.com/90posters/1991_09_20.jpg,,,,,,1991-09-20,1713480533211,false
gdsets_posters,gdsets_posters_1991_11_03.jpg,,Poster - 11/3/91,[],,https://gdsets.com/90posters/1991_11_03.jpg,,,,,,1991-11-03,1713480533216,false
gdsets_posters,gdsets_posters_1992_01_01.jpg,,Poster - 1992 Calendar,[],,https://gdsets.com/90posters/1992_01_01.jpg,,,,,,1992-01-01,1713480533305,false
gdsets_posters,gdsets_posters_1992_05_07a.jpg,,Poster - 5/7-11/92,[],,https://gdsets.com/90posters/1992_05_07a.jpg,,,,,,1992-05-07,1713480533306,true
gdsets_posters,gdsets_posters_1992_05_23.jpg,,Poster - 5/23-25/92,[],,https://gdsets.com/90posters/1992_05_23.jpg,,,,,,1992-05-23,1713480533409,false
gdsets_posters,gdsets_posters_1992_05_29a.jpg,,Poster - 5/29-31/92,[],,https://gdsets.com/90posters/1992_05_29a.jpg,,,,,,1992-05-29,1713480533409,false
gdsets_posters,gdsets_posters_1992_05_19a.jpg,,Poster - 5/19-21/92,[],,https://gdsets.com/90posters/1992_05_19a.jpg,,,,,,1992-05-19,1713480533414,false
gdsets_posters,gdsets_posters_1992_05_07.jpg,,Poster - 5/7-11/92,[],,https://gdsets.com/90posters/1992_05_07.jpg,,,,,,1992-05-07,1713480533418,false
gdsets_posters,gdsets_posters_1992_06_08.jpg,,"Poster - 6/8,9/92",[],,https://gdsets.com/90posters/1992_06_08.jpg,,,,,,1992-06-08,1713480533494,false
gdsets_posters,gdsets_posters_1992_06_02.jpg,,"Poster - 6/2,3/92",[],,https://gdsets.com/90posters/1992_06_02.jpg,,,,,,1992-06-02,1713480533508,false
gdsets_posters,gdsets_posters_1992_06_06.jpg,,Poster - 6/6/92,[],,https://gdsets.com/90posters/1992_06_06.jpg,,,,,,1992-06-06,1713480533514,false
gdsets_posters,gdsets_posters_1992_06_25b.jpg,,"Poster - 6/25,26/92",[],,https://gdsets.com/90posters/1992_06_25b.jpg,,,,,,1992-06-25,1713480533517,true
gdsets_posters,gdsets_posters_1992_05_29.jpg,,Poster - 5/29-31/92,[],,https://gdsets.com/90posters/1992_05_29.jpg,,,,,,1992-05-29,1713480533685,false
gdsets_posters,gdsets_posters_1992_07_09.jpg,,Poster - 7/9/92,[],,https://gdsets.com/90posters/1992_07_09.jpg,,,,,,1992-07-09,1713480533878,false
gdsets_posters,gdsets_posters_1992_07_24a.jpg,,Poster - 7/24/92,[],,https://gdsets.com/90posters/1992_07_24a.jpg,,,,,,1992-07-24,1713480533895,true
gdsets_posters,gdsets_posters_1992_07_24.jpg,,Poster - 7/24/92,[],,https://gdsets.com/90posters/1992_07_24.jpg,,,,,,1992-07-24,1713480533895,true
gdsets_posters,gdsets_posters_1992_07_12.jpg,,Poster - 7/12/92,[],,https://gdsets.com/90posters/1992_07_12.jpg,,,,,,1992-07-12,1713480534009,false
gdsets_posters,gdsets_posters_1992_07_24b.jpg,,Poster - 7/24/92,[],,https://gdsets.com/90posters/1992_07_24b.jpg,,,,,,1992-07-24,1713480534011,true
gdsets_posters,gdsets_posters_1992_06_25a.jpg,,"Poster - 6/25,26/92",[],,https://gdsets.com/90posters/1992_06_25a.jpg,,,,,,1992-06-25,1713480534018,false
gdsets_posters,gdsets_posters_1992_07_31.jpg,,Poster - 7/31/92,[],,https://gdsets.com/90posters/1992_07_31.jpg,,,,,,1992-07-31,1713480534109,true
gdsets_posters,gdsets_posters_1992_07_31a.jpg,,Poster - 7/31/92,[],,https://gdsets.com/90posters/1992_07_31a.jpg,,,,,,1992-07-31,1713480534122,false
gdsets_posters,gdsets_posters_1992_08_02.jpg,,Poster - 8/2/92,[],,https://gdsets.com/90posters/1992_08_02.jpg,,,,,,1992-08-02,1713480534210,false
gdsets_posters,gdsets_posters_1992_07_16.jpg,,Poster - 7/16/92,[],,https://gdsets.com/90posters/1992_07_16.jpg,,,,,,1992-07-16,1713480534214,false
gdsets_posters,gdsets_posters_1992_07_31d.jpg,,"Poster - 7/31,8/1/92",[],,https://gdsets.com/90posters/1992_07_31d.jpg,,,,,,1992-07-31,1713480534217,true
gdsets_posters,gdsets_posters_1992_08_01.jpg,,Poster - 8/1/92,[],,https://gdsets.com/90posters/1992_08_01.jpg,,,,,,1992-08-01,1713480534313,false
gdsets_posters,gdsets_posters_1992_07_31c.jpg,,"Poster - 7/31,8/1/92",[],,https://gdsets.com/90posters/1992_07_31c.jpg,,,,,,1992-07-31,1713480534323,true
gdsets_posters,gdsets_posters_1992_08_06.jpg,,Poster - 8/6-9/92(cancelled),[],,https://gdsets.com/90posters/1992_08_06.jpg,,,,,,1992-08-06,1713480534540,false
gdsets_posters,gdsets_posters_1992_06_28.jpg,,"Poster - 6/28,29/92",[],,https://gdsets.com/90posters/1992_06_28.jpg,,,,,,1992-06-28,1713480534555,false
gdsets_posters,gdsets_posters_1992_10_31.jpg,,Poster - 10/31/92,[],,https://gdsets.com/90posters/1992_10_31.jpg,,,,,,1992-10-31,1713480534557,false
gdsets_posters,gdsets_posters_1992_06_25.jpg,,"Poster - 6/25,26/92",[],,https://gdsets.com/90posters/1992_06_25.jpg,,,,,,1992-06-25,1713480534653,false
gdsets_posters,gdsets_posters_1992_10_16.jpg,,Poster - Backstage Pass Trade Ad,[],,https://gdsets.com/90posters/1992_10_16.jpg,,,,,,1992-10-16,1713480534656,false
gdsets_posters,gdsets_posters_1991_12_31a.jpg,,Poster - 12/31/91,[],,https://gdsets.com/90posters/1991_12_31a.jpg,,,,,,1991-12-31,1713480534658,false
gdsets_posters,gdsets_posters_1992_08_02a.jpg,,Poster - 8/2/92,[],,https://gdsets.com/90posters/1992_08_02a.jpg,,,,,,1992-08-02,1713480534686,false
gdsets_posters,gdsets_posters_1992_07_24c.jpg,,Poster - 7/24/92,[],,https://gdsets.com/90posters/1992_07_24c.jpg,,,,,,1992-07-24,1713480534739,false
gdsets_posters,gdsets_posters_1992_10_16a.jpg,,Poster - Backstage Pass Trade Ad,[],,https://gdsets.com/90posters/1992_10_16a.jpg,,,,,,1992-10-16,1713480534822,false
gdsets_posters,gdsets_posters_1992_12_11.jpg,,Poster - 12/11-17/92,[],,https://gdsets.com/90posters/1992_12_11.jpg,,,,,,1992-12-11,1713480534840,false
gdsets_posters,gdsets_posters_1992_12_05.jpg,,"Poster - 12/5,6/92",[],,https://gdsets.com/90posters/1992_12_05.jpg,,,,,,1992-12-05,1713480534923,false
gdsets_posters,gdsets_posters_1992_07_31b.jpg,,"Poster - 7/31,8/1/92",[],,https://gdsets.com/90posters/1992_07_31b.jpg,,,,,,1992-07-31,1713480534924,false
gdsets_posters,gdsets_posters_1992_12_19a.jpg,,"Poster - 12/19,21/92",[],,https://gdsets.com/90posters/1992_12_19a.jpg,,,,,,1992-12-19,1713480535116,true
gdsets_posters,gdsets_posters_1992_12_19.jpg,,"Poster - 12/19,21/92",[],,https://gdsets.com/90posters/1992_12_19.jpg,,,,,,1992-12-19,1713480535148,true
gdsets_posters,gdsets_posters_1993_02_21.jpg,,Poster - 2/21-23/93,[],,https://gdsets.com/90posters/1993_02_21.jpg,,,,,,1993-02-21,1713480535148,false
gdsets_posters,gdsets_posters_1992_08_22a.jpg,,"Poster - 8/22,23/92(cancelled)",[],,https://gdsets.com/90posters/1992_08_22a.jpg,,,,,,1992-08-22,1713480535197,false
gdsets_posters,gdsets_posters_1993_02_25.jpg,,"Poster - 2/25,26/93",[],,https://gdsets.com/90posters/1993_02_25.jpg,,,,,,1993-02-25,1713480535233,false
gdsets_posters,gdsets_posters_1992_12_19b.jpg,,"Poster - 12/19,21/92",[],,https://gdsets.com/90posters/1992_12_19b.jpg,,,,,,1992-12-19,1713480535233,true
gdsets_posters,gdsets_posters_1992_12_19c.jpg,,"Poster - 12/19,21/92",[],,https://gdsets.com/90posters/1992_12_19c.jpg,,,,,,1992-12-19,1713480535307,false
gdsets_posters,gdsets_posters_1993_04_16.jpg,,"Poster - 4/16,17/93",[],,https://gdsets.com/90posters/1993_04_16.jpg,,,,,,1993-04-16,1713480535319,false
gdsets_posters,gdsets_posters_1992_08_22.jpg,,"Poster - 8/22,23/92(cancelled)",[],,https://gdsets.com/90posters/1992_08_22.jpg,,,,,,1992-08-22,1713480535415,false
gdsets_posters,gdsets_posters_1993_02_23a.jpg,,Poster - 2/23/93 @ Proof,[],,https://gdsets.com/90posters/1993_02_23a.jpg,,,,,,1993-02-23,1713480535417,true
gdsets_posters,gdsets_posters_1993_03_09.jpg,,Poster - Spring 1993,[],,https://gdsets.com/90posters/1993_03_09.jpg,,,,,,1993-03-09,1713480535417,false
gdsets_posters,gdsets_posters_1993_03_09a.jpg,,Poster - Spring 1993,[],,https://gdsets.com/90posters/1993_03_09a.jpg,,,,,,1993-03-09,1713480535418,false
gdsets_posters,gdsets_posters_1993_04_18.jpg,,Poster - 4/18/93,[],,https://gdsets.com/90posters/1993_04_18.jpg,,,,,,1993-04-18,1713480535419,false
gdsets_posters,gdsets_posters_1993_03_20.jpg,,Poster - 3/20-22/93,[],,https://gdsets.com/90posters/1993_03_20.jpg,,,,,,1993-03-20,1713480535515,false
gdsets_posters,gdsets_posters_1993_04_23.jpg,,Poster - 4/23-25/93,[],,https://gdsets.com/90posters/1993_04_23.jpg,,,,,,1993-04-23,1713480535603,false
gdsets_posters,gdsets_posters_1993_02_23.jpg,,Poster - 2/23/93,[],,https://gdsets.com/90posters/1993_02_23.jpg,,,,,,1993-02-23,1713480535693,false
gdsets_posters,gdsets_posters_1993_04_16a.jpg,,"Poster - 4/16,17/93",[],,https://gdsets.com/90posters/1993_04_16a.jpg,,,,,,1993-04-16,1713480535693,false
gdsets_posters,gdsets_posters_1992_12_11a.jpg,,Poster - 12/11-17/92,[],,https://gdsets.com/90posters/1992_12_11a.jpg,,,,,,1992-12-11,1713480535701,false
gdsets_posters,gdsets_posters_1993_05_05.jpg,,Poster - 5/5/93,[],,https://gdsets.com/90posters/1993_05_05.jpg,,,,,,1993-05-05,1713480535777,false
gdsets_posters,gdsets_posters_1993_04_18a.jpg,,Poster - 4/18/93,[],,https://gdsets.com/90posters/1993_04_18a.jpg,,,,,,1993-04-18,1713480535865,false
gdsets_posters,gdsets_posters_1993_06_08.jpg,,"Poster - 6/8,9/93",[],,https://gdsets.com/90posters/1993_06_08.jpg,,,,,,1993-06-08,1713480535982,false
gdsets_posters,gdsets_posters_1993_05_14c.jpg,,Poster - 5/14-16/93,[],,https://gdsets.com/90posters/1993_05_14c.jpg,,,,,,1993-05-14,1713480535987,false
gdsets_posters,gdsets_posters_1993_05_08.jpg,,Poster - 5/8/93,[],,https://gdsets.com/90posters/1993_05_08.jpg,,,,,,1993-05-08,1713480535990,false
gdsets_posters,gdsets_posters_1993_06_05.jpg,,"Poster - 6/5,6/93",[],,https://gdsets.com/90posters/1993_06_05.jpg,,,,,,1993-06-05,1713480536071,false
gdsets_posters,gdsets_posters_1993_05_25.jpg,,Poster - 5/25-27/93,[],,https://gdsets.com/90posters/1993_05_25.jpg,,,,,,1993-05-25,1713480536166,false
gdsets_posters,gdsets_posters_1993_05_21a.jpg,,Poster - 5/21-23/93,[],,https://gdsets.com/90posters/1993_05_21a.jpg,,,,,,1993-05-21,1713480536171,false
gdsets_posters,gdsets_posters_1993_06_08a.jpg,,"Poster - 6/8,9/93",[],,https://gdsets.com/90posters/1993_06_08a.jpg,,,,,,1993-06-08,1713480536171,true
gdsets_posters,gdsets_posters_1993_05_25a.jpg,,Poster - 5/25-27/93,[],,https://gdsets.com/90posters/1993_05_25a.jpg,,,,,,1993-05-25,1713480536171,false
gdsets_posters,gdsets_posters_1993_06_08b.jpg,,"Poster - 6/8,9/93",[],,https://gdsets.com/90posters/1993_06_08b.jpg,,,,,,1993-06-08,1713480536258,false
gdsets_posters,gdsets_posters_1993_05_21.jpg,,Poster - 5/21-23/93,[],,https://gdsets.com/90posters/1993_05_21.jpg,,,,,,1993-05-21,1713480536264,true
gdsets_posters,gdsets_posters_1993_05_14e.jpg,,Poster - 5/14-16/93,[],,https://gdsets.com/90posters/1993_05_14e.jpg,,,,,,1993-05-14,1713480536264,false
gdsets_posters,gdsets_posters_1993_05_14a.jpg,,Poster - 5/14-16/93 @ Proof,[],,https://gdsets.com/90posters/1993_05_14a.jpg,,,,,,1993-05-14,1713480536340,true
gdsets_posters,gdsets_posters_1993_06_15.jpg,,"Poster - 6/15,16/93",[],,https://gdsets.com/90posters/1993_06_15.jpg,,,,,,1993-06-15,1713480536376,false
gdsets_posters,gdsets_posters_1993_06_13.jpg,,Poster - 6/13/93,[],,https://gdsets.com/90posters/1993_06_13.jpg,,,,,,1993-06-13,1713480536469,false
gdsets_posters,gdsets_posters_1993_06_18.jpg,,"Poster - 6/18,19/93",[],,https://gdsets.com/90posters/1993_06_18.jpg,,,,,,1993-06-18,1713480536552,false
gdsets_posters,gdsets_posters_1993_08_21b.jpg,,"Poster - 8/21,22/93",[],,https://gdsets.com/90posters/1993_08_21b.jpg,,,,,,1993-08-21,1713480536635,false
gdsets_posters,gdsets_posters_1993_09_12.jpg,,Poster - 9/12-14/93,[],,https://gdsets.com/90posters/1993_09_12.jpg,,,,,,1993-09-12,1713480536648,true
gdsets_posters,gdsets_posters_1993_06_21.jpg,,Poster - 6/21-23/93 @ Trade Ad,[],,https://gdsets.com/90posters/1993_06_21.jpg,,,,,,1993-06-21,1713480536741,false
gdsets_posters,gdsets_posters_1993_05_14b.jpg,,Poster - 5/14-16/93 @ Proof,[],,https://gdsets.com/90posters/1993_05_14b.jpg,,,,,,1993-05-14,1713480536854,true
gdsets_posters,gdsets_posters_1993_05_14.jpg,,Poster - 5/14-16/93(OP1),[],,https://gdsets.com/90posters/1993_05_14.jpg,,,,,,1993-05-14,1713480536861,false
gdsets_posters,gdsets_posters_1993_10_31.jpg,,"Poster - 10/31,11/1/9311/12/93",[],,https://gdsets.com/90posters/1993_10_31.jpg,,,,,,1993-10-31,1713480536864,false
gdsets_posters,gdsets_posters_1993_08_21.jpg,,"Poster - 8/21,22/93",[],,https://gdsets.com/90posters/1993_08_21.jpg,,,,,,1993-08-21,1713480536941,true
gdsets_posters,gdsets_posters_1993_11_09.jpg,,"Poster - 11/9,15/93",[],,https://gdsets.com/90posters/1993_11_09.jpg,,,,,,1993-11-09,1713480536954,false
gdsets_posters,gdsets_posters_1993_12_08.jpg,,Poster - 12/8-19/93,[],,https://gdsets.com/90posters/1993_12_08.jpg,,,,,,1993-12-08,1713480536958,false
gdsets_posters,gdsets_posters_1993_05_14d.jpg,,Poster - 5/14-16/93,[],,https://gdsets.com/90posters/1993_05_14d.jpg,,,,,,1993-05-14,1713480536966,false
gdsets_posters,gdsets_posters_1993_09_12a.jpg,,Poster - 9/12-14/93,[],,https://gdsets.com/90posters/1993_09_12a.jpg,,,,,,1993-09-12,1713480536968,false
gdsets_posters,gdsets_posters_1993_11_16.jpg,,Poster - 11/16/93,[],,https://gdsets.com/90posters/1993_11_16.jpg,,,,,,1993-11-16,1713480537060,false
gdsets_posters,gdsets_posters_1994_01_01.jpg,,Poster - 1994 @ Calendar,[],,https://gdsets.com/90posters/1994_01_01.jpg,,,,,,1994-01-01,1713480537070,false
gdsets_posters,gdsets_posters_1993_11_11.jpg,,"Poster - 11/11,15/93",[],,https://gdsets.com/90posters/1993_11_11.jpg,,,,,,1993-11-11,1713480537152,false
gdsets_posters,gdsets_posters_1993_12_08a.jpg,,Poster - 12/8-10/93,[],,https://gdsets.com/90posters/1993_12_08a.jpg,,,,,,1993-12-08,1713480537343,false
gdsets_posters,gdsets_posters_1994_03_04a.jpg,,Poster - 3/4-6/94,[],,https://gdsets.com/90posters/1994_03_04a.jpg,,,,,,1994-03-04,1713480537455,false
gdsets_posters,gdsets_posters_1993_08_21c.jpg,,"Poster - 8/21,22/93",[],,https://gdsets.com/90posters/1993_08_21c.jpg,,,,,,1993-08-21,1713480537458,false
gdsets_posters,gdsets_posters_1994_02_25.jpg,,Poster - 2/25-27/94,[],,https://gdsets.com/90posters/1994_02_25.jpg,,,,,,1994-02-25,1713480537460,false
gdsets_posters,gdsets_posters_1994_03_09.jpg,,Poster - 3/9/94,[],,https://gdsets.com/90posters/1994_03_09.jpg,,,,,,1994-03-09,1713480537460,false
gdsets_posters,gdsets_posters_1994_04_18.jpg,,Poster - 4/18-27/94,[],,https://gdsets.com/90posters/1994_04_18.jpg,,,,,,1994-04-18,1713480537547,false
gdsets_posters,gdsets_posters_1994_06_13.jpg,,"Poster - 6/13,14/94",[],,https://gdsets.com/90posters/1994_06_13.jpg,,,,,,1994-06-13,1713480537647,false
gdsets_posters,gdsets_posters_1993_12_31.jpg,,"Poster - ""12/31/93""BGP spoof",[],,https://gdsets.com/90posters/1993_12_31.jpg,,,,,,1993-12-31,1713480537738,false
gdsets_posters,gdsets_posters_1994_06_13a.jpg,,Poster - 6/13-19/94 @ Original Art,[],,https://gdsets.com/90posters/1994_06_13a.jpg,,,,,,1994-06-13,1713480537750,false
gdsets_posters,gdsets_posters_1994_06_08.jpg,,Poster - Summer 1994,[],,https://gdsets.com/90posters/1994_06_08.jpg,,,,,,1994-06-08,1713480537751,false
gdsets_posters,gdsets_posters_1994_06_17c.jpg,,Poster - 6/17-19/94,[],,https://gdsets.com/90posters/1994_06_17c.jpg,,,,,,1994-06-17,1713480537752,true
gdsets_posters,gdsets_posters_1993_08_21a.jpg,,"Poster - 8/21,22/93",[],,https://gdsets.com/90posters/1993_08_21a.jpg,,,,,,1993-08-21,1713480537762,false
gdsets_posters,gdsets_posters_1994_05_17.jpg,,"Poster - 5/17,18/94",[],,https://gdsets.com/90posters/1994_05_17.jpg,,,,,,1994-05-17,1713480537765,false
gdsets_posters,gdsets_posters_1994_06_08a.jpg,,Poster - 6/8-10/94,[],,https://gdsets.com/90posters/1994_06_08a.jpg,,,,,,1994-06-08,1713480537766,false
gdsets_posters,gdsets_posters_1994_03_04b.jpg,,Poster - Spring 1994,[],,https://gdsets.com/90posters/1994_03_04b.jpg,,,,,,1994-03-04,1713480537845,false
gdsets_posters,gdsets_posters_1994_03_04.jpg,,Poster - 3/4-6/94,[],,https://gdsets.com/90posters/1994_03_04.jpg,,,,,,1994-03-04,1713480537846,false
gdsets_posters,gdsets_posters_1994_07_24.jpg,,Poster - 7/24/94,[],,https://gdsets.com/90posters/1994_07_24.jpg,,,,,,1994-07-24,1713480538123,true
gdsets_posters,gdsets_posters_1994_06_17a.jpg,,Poster - 6/17-19/94,[],,https://gdsets.com/90posters/1994_06_17a.jpg,,,,,,1994-06-17,1713480538212,true
gdsets_posters,gdsets_posters_1994_06_17b.jpg,,Poster - 6/17-19/94,[],,https://gdsets.com/90posters/1994_06_17b.jpg,,,,,,1994-06-17,1713480538226,false
gdsets_posters,gdsets_posters_1994_07_23.jpg,,"Poster - 7/23,24/94",[],,https://gdsets.com/90posters/1994_07_23.jpg,,,,,,1994-07-23,1713480538230,false
gdsets_posters,gdsets_posters_1994_08_01.jpg,,Poster - 8/1/94,[],,https://gdsets.com/90posters/1994_08_01.jpg,,,,,,1994-08-01,1713480538328,false
gdsets_posters,gdsets_posters_1994_09_16.jpg,,Poster - 9/16-18/94,[],,https://gdsets.com/90posters/1994_09_16.jpg,,,,,,1994-09-16,1713480538423,false
gdsets_posters,gdsets_posters_1994_06_24a.jpg,,Poster - 6/24-26/94,[],,https://gdsets.com/90posters/1994_06_24a.jpg,,,,,,1994-06-24,1713480538423,false
gdsets_posters,gdsets_posters_1994_06_17.jpg,,Poster - 6/17-19/94,[],,https://gdsets.com/90posters/1994_06_17.jpg,,,,,,1994-06-17,1713480538424,false
gdsets_posters,gdsets_posters_1994_09_24.jpg,,Poster - 9/24/94,[],,https://gdsets.com/90posters/1994_09_24.jpg,,,,,,1994-09-24,1713480538432,false
gdsets_posters,gdsets_posters_1994_07_26.jpg,,"Poster - 7/26,27/94",[],,https://gdsets.com/90posters/1994_07_26.jpg,,,,,,1994-07-26,1713480538432,false
gdsets_posters,gdsets_posters_1994_08_03.jpg,,"Poster - 8/3,4/94",[],,https://gdsets.com/90posters/1994_08_03.jpg,,,,,,1994-08-03,1713480538521,false
gdsets_posters,gdsets_posters_1994_09_10.jpg,,Poster - 9/10/94,[],,https://gdsets.com/90posters/1994_09_10.jpg,,,,,,1994-09-10,1713480538526,false
gdsets_posters,gdsets_posters_1994_09_01a.jpg,,"Poster - 9/1,2/94",[],,https://gdsets.com/90posters/1994_09_01a.jpg,,,,,,1994-09-01,1713480538533,true
gdsets_posters,gdsets_posters_1994_07_24a.jpg,,Poster - 7/24/94,[],,https://gdsets.com/90posters/1994_07_24a.jpg,,,,,,1994-07-24,1713480538533,false
gdsets_posters,gdsets_posters_1994_10_13.jpg,,Poster - 10/13-19/94,[],,https://gdsets.com/90posters/1994_10_13.jpg,,,,,,1994-10-13,1713480538533,false
gdsets_posters,gdsets_posters_1994_11_11.jpg,,Poster - 11/11/94,[],,https://gdsets.com/90posters/1994_11_11.jpg,,,,,,1994-11-11,1713480538535,true
gdsets_posters,gdsets_posters_1994_06_24b.jpg,,Poster - 6/24-26/94,[],,https://gdsets.com/90posters/1994_06_24b.jpg,,,,,,1994-06-24,1713480538628,false
gdsets_posters,gdsets_posters_1994_09_01.jpg,,"Poster - 9/1,2/94",[],,https://gdsets.com/90posters/1994_09_01.jpg,,,,,,1994-09-01,1713480538700,false
gdsets_posters,gdsets_posters_1994_11_11a.jpg,,Poster - 11/11/94,[],,https://gdsets.com/90posters/1994_11_11a.jpg,,,,,,1994-11-11,1713480538793,true
gdsets_posters,gdsets_posters_1994_06_24.jpg,,Poster - 6/24-26/94 (OP1),[],,https://gdsets.com/90posters/1994_06_24.jpg,,,,,,1994-06-24,1713480538871,false
gdsets_posters,gdsets_posters_1994_11_11d.jpg,,Poster - 11/11/94,[],,https://gdsets.com/90posters/1994_11_11d.jpg,,,,,,1994-11-11,1713480538947,false
gdsets_posters,gdsets_posters_1994_11_11e.jpg,,Poster - 11/11/94,[],,https://gdsets.com/90posters/1994_11_11e.jpg,,,,,,1994-11-11,1713480538961,true
gdsets_posters,gdsets_posters_1994_11_11c.jpg,,Poster - 11/11/94,[],,https://gdsets.com/90posters/1994_11_11c.jpg,,,,,,1994-11-11,1713480538961,true
gdsets_posters,gdsets_posters_1994_11_11b.jpg,,Poster - 11/11/94,[],,https://gdsets.com/90posters/1994_11_11b.jpg,,,,,,1994-11-11,1713480538967,true
gdsets_posters,gdsets_posters_1994_11_11f.jpg,,Poster - 11/11/94,[],,https://gdsets.com/90posters/1994_11_11f.jpg,,,,,,1994-11-11,1713480539054,true
gdsets_posters,gdsets_posters_1994_11_11g.jpg,,Poster - 11/11/94,[],,https://gdsets.com/90posters/1994_11_11g.jpg,,,,,,1994-11-11,1713480539057,true
gdsets_posters,gdsets_posters_1994_12_08b.jpg,,Poster - 12/8-12/94,[],,https://gdsets.com/90posters/1994_12_08b.jpg,,,,,,1994-12-08,1713480539057,false
gdsets_posters,gdsets_posters_1994_12_08a.jpg,,Poster - 12/8-12/94,[],,https://gdsets.com/90posters/1994_12_08a.jpg,,,,,,1994-12-08,1713480539135,true
gdsets_posters,gdsets_posters_1994_12_08.jpg,,Poster - 12/8-12/94,[],,https://gdsets.com/90posters/1994_12_08.jpg,,,,,,1994-12-08,1713480539137,false
gdsets_posters,gdsets_posters_1994_12_11.jpg,,"Poster - 12/11,12/94",[],,https://gdsets.com/90posters/1994_12_11.jpg,,,,,,1994-12-11,1713480539137,false
gdsets_posters,gdsets_posters_1994_07_13.jpg,,Poster - 7/13/94,[],,https://gdsets.com/90posters/1994_07_13.jpg,,,,,,1994-07-13,1713480539189,false
gdsets_posters,gdsets_posters_1994_12_15b.jpg,,Poster - 12/15-19/94,[],,https://gdsets.com/90posters/1994_12_15b.jpg,,,,,,1994-12-15,1713480539228,true
gdsets_posters,gdsets_posters_1994_12_15a.jpg,,Poster - 12/15-19/94,[],,https://gdsets.com/90posters/1994_12_15a.jpg,,,,,,1994-12-15,1713480539236,true
gdsets_posters,gdsets_posters_1995_02_10.jpg,,Poster - 2/10-12/95(cancelled),[],,https://gdsets.com/90posters/1995_02_10.jpg,,,,,,1995-02-10,1713480539420,true
gdsets_posters,gdsets_posters_1995_01_13a.jpg,,Poster - 1/13-15/95,[],,https://gdsets.com/90posters/1995_01_13a.jpg,,,,,,1995-01-13,1713480539502,false
gdsets_posters,gdsets_posters_1995_01_01.jpg,,Poster - 1995 @ Calendar,[],,https://gdsets.com/90posters/1995_01_01.jpg,,,,,,1995-01-01,1713480539535,false
gdsets_posters,gdsets_posters_1995_02_10a.jpg,,Poster - 2/10-12/95(cancelled),[],,https://gdsets.com/90posters/1995_02_10a.jpg,,,,,,1995-02-10,1713480539537,false
gdsets_posters,gdsets_posters_1994_12_15.jpg,,Poster - 12/15-19/94,[],,https://gdsets.com/90posters/1994_12_15.jpg,,,,,,1994-12-15,1713480539594,false
gdsets_posters,gdsets_posters_1995_01_13.jpg,,Poster - 1/13-15/95,[],,https://gdsets.com/90posters/1995_01_13.jpg,,,,,,1995-01-13,1713480539673,false
gdsets_posters,gdsets_posters_1995_02_10c.jpg,,Poster - 2/10-12/95(cancelled),[],,https://gdsets.com/90posters/1995_02_10c.jpg,,,,,,1995-02-10,1713480539754,false
gdsets_posters,gdsets_posters_1995_02_24c.jpg,,Poster - 2/24-26/95,[],,https://gdsets.com/90posters/1995_02_24c.jpg,,,,,,1995-02-24,1713480539787,false
gdsets_posters,gdsets_posters_1995_02_24b.jpg,,Poster - 2/24-26/95,[],,https://gdsets.com/90posters/1995_02_24b.jpg,,,,,,1995-02-24,1713480539803,false
gdsets_posters,gdsets_posters_1995_02_19.jpg,,Poster - 2/19-21/95,[],,https://gdsets.com/90posters/1995_02_19.jpg,,,,,,1995-02-19,1713480539838,false
gdsets_posters,gdsets_posters_1995_03_05.jpg,,Poster - 3/5/95,[],,https://gdsets.com/90posters/1995_03_05.jpg,,,,,,1995-03-05,1713480539891,false
gdsets_posters,gdsets_posters_1995_01_13b.jpg,,Poster - 1/13-15/95,[],,https://gdsets.com/90posters/1995_01_13b.jpg,,,,,,1995-01-13,1713480539914,false
gdsets_posters,gdsets_posters_1995_02_24.jpg,,Poster - 2/24-26/95(OP1),[],,https://gdsets.com/90posters/1995_02_24.jpg,,,,,,1995-02-24,1713480539988,false
gdsets_posters,gdsets_posters_1995_03_04a.jpg,,"Poster - 3/4,5/95",[],,https://gdsets.com/90posters/1995_03_04a.jpg,,,,,,1995-03-04,1713480540086,true
gdsets_posters,gdsets_posters_1995_03_04b.jpg,,"Poster - 3/4,5/95",[],,https://gdsets.com/90posters/1995_03_04b.jpg,,,,,,1995-03-04,1713480540095,false
gdsets_posters,gdsets_posters_1995_02_10b.jpg,,Poster - 2/10-12/95(cancelled),[],,https://gdsets.com/90posters/1995_02_10b.jpg,,,,,,1995-02-10,1713480540103,false
gdsets_posters,gdsets_posters_1995_03_04.jpg,,"Poster - 3/4,5/95",[],,https://gdsets.com/90posters/1995_03_04.jpg,,,,,,1995-03-04,1713480540104,true
gdsets_posters,gdsets_posters_1995_04_21a.jpg,,Poster - 4/21-23/95,[],,https://gdsets.com/90posters/1995_04_21a.jpg,,,,,,1995-04-21,1713480540182,false
gdsets_posters,gdsets_posters_1995_03_04c.jpg,,"Poster - 3/4,5/95",[],,https://gdsets.com/90posters/1995_03_04c.jpg,,,,,,1995-03-04,1713480540392,true
gdsets_posters,gdsets_posters_1995_05_19d.jpg,,Poster - Spring 1995,[],,https://gdsets.com/90posters/1995_05_19d.jpg,,,,,,1995-05-19,1713480540494,false
gdsets_posters,gdsets_posters_1995_04_07.jpg,,Poster - 4/7/95,[],,https://gdsets.com/90posters/1995_04_07.jpg,,,,,,1995-04-07,1713480540498,false
gdsets_posters,gdsets_posters_1995_05_24.jpg,,Poster - 5/24-26/95,[],,https://gdsets.com/90posters/1995_05_24.jpg,,,,,,1995-05-24,1713480540607,false
gdsets_posters,gdsets_posters_1995_05_19f.jpg,,Poster - 5/19-21/95,[],,https://gdsets.com/90posters/1995_05_19f.jpg,,,,,,1995-05-19,1713480540697,false
gdsets_posters,gdsets_posters_1995_05_29.jpg,,Poster - 5/29/95,[],,https://gdsets.com/90posters/1995_05_29.jpg,,,,,,1995-05-29,1713480540806,false
gdsets_posters,gdsets_posters_1995_04_01.jpg,,"Poster - 4/1,2/95",[],,https://gdsets.com/90posters/1995_04_01.jpg,,,,,,1995-04-01,1713480540920,false
gdsets_posters,gdsets_posters_1995_05_19g.jpg,,Poster - 5/19-21/95,[],,https://gdsets.com/90posters/1995_05_19g.jpg,,,,,,1995-05-19,1713480540921,true
gdsets_posters,gdsets_posters_1995_05_19a.jpg,,Poster - Spring 1995,[],,https://gdsets.com/90posters/1995_05_19a.jpg,,,,,,1995-05-19,1713480540937,true
gdsets_posters,gdsets_posters_1995_05_19.jpg,,Poster - Spring 1995,[],,https://gdsets.com/90posters/1995_05_19.jpg,,,,,,1995-05-19,1713480540947,false
gdsets_posters,gdsets_posters_1995_05_28a.jpg,,"Poster - 5/28,29/95",[],,https://gdsets.com/90posters/1995_05_28a.jpg,,,,,,1995-05-28,1713480541032,false
gdsets_posters,gdsets_posters_1995_06_02b.jpg,,Poster - 6/2-4/95 @ Prototype Art,[],,https://gdsets.com/90posters/1995_06_02b.jpg,,,,,,1995-06-02,1713480541041,true
gdsets_posters,gdsets_posters_1995_05_19b.jpg,,Poster - Spring 1995 @ Proof,[],,https://gdsets.com/90posters/1995_05_19b.jpg,,,,,,1995-05-19,1713480541054,true
gdsets_posters,gdsets_posters_1995_06_02a.jpg,,Poster - 6/2-4/95 @ Original Art,[],,https://gdsets.com/90posters/1995_06_02a.jpg,,,,,,1995-06-02,1713480541160,false
gdsets_posters,gdsets_posters_1995_02_24a.jpg,,Poster - 2/24-26/95,[],,https://gdsets.com/90posters/1995_02_24a.jpg,,,,,,1995-02-24,1713480541333,false
gdsets_posters,gdsets_posters_1995_03_26.jpg,,Poster - 3/26-30/95,[],,https://gdsets.com/90posters/1995_03_26.jpg,,,,,,1995-03-26,1713480541456,false
gdsets_posters,gdsets_posters_1995_06_18.jpg,,"Poster - 6/18,19/95",[],,https://gdsets.com/90posters/1995_06_18.jpg,,,,,,1995-06-18,1713480541571,false
gdsets_posters,gdsets_posters_1995_05_28.jpg,,"Poster - 5/28,29/95",[],,https://gdsets.com/90posters/1995_05_28.jpg,,,,,,1995-05-28,1713480541582,false
gdsets_posters,gdsets_posters_1995_06_30.jpg,,Poster - 6/30/95 @ GDTS Flyer(front),[],,https://gdsets.com/90posters/1995_06_30.jpg,,,,,,1995-06-30,1713480541687,false
gdsets_posters,gdsets_posters_1995_06_30a.jpg,,Poster - 6/30/95 @ GDTS Flyer(back),[],,https://gdsets.com/90posters
gdsets_posters,gdsets_posters_1995_05_19e.jpg,,Poster - 5/19-21/95,[],,https://gdsets.com/90posters/1995_05_19e.jpg,,,,,,1995-05-19,1713480541749,false
gdsets_posters,gdsets_posters_1995_07_02a art.jpg,,"Poster - 7/2,3/95 @ Original Art",[],,https://gdsets.com/90posters/1995_07_02a
gdsets_posters,gdsets_posters_1995_05_19c.jpg,,Poster - Spring 1995 @ Proof,[],,https://gdsets.com/90posters/1995_05_19c.jpg,,,,,,1995-05-19,1713480541887,false
gdsets_posters,gdsets_posters_1995_07_08g.jpg,,"Poster - 7/8,9/95 @ GDTS Flyer(front)",[],,https://gdsets.com/90posters
gdsets_posters,gdsets_posters_1995_07_08h.jpg,,"Poster - 7/8,9/95 @ GDTS Flyer(back)",[],,https://gdsets.com/90posters
gdsets_posters,gdsets_posters_1995_06_15a.jpg,,Poster - Summer 1995(OP1 proof),[],,https://gdsets.com/90posters/1995_06_15a.jpg,,,,,,1995-06-15,1713480541977,false
gdsets_posters,gdsets_posters_1995_09_26.jpg,,Poster - Hundred Year Hall Trade Ad,[],,https://gdsets.com/90posters/1995_09_26.jpg,,,,,,1995-09-26,1713480542081,false
gdsets_posters,gdsets_posters_1995_07_08.jpg,,"Poster - 7/8,9/95",[],,https://gdsets.com/90posters/1995_07_08.jpg,,,,,,1995-07-08,1713480542083,false
gdsets_posters,gdsets_posters_1995_06_02.jpg,,Poster - 6/2-4/95(OP1),[],,https://gdsets.com/90posters/1995_06_02.jpg,,,,,,1995-06-02,1713480542198,false
gdsets_posters,gdsets_posters_1995_06_15c.jpg,,Poster - Summer 1995,[],,https://gdsets.com/90posters/1995_06_15c.jpg,,,,,,1995-06-15,1713480542271,false
gdsets_posters,gdsets_posters_1970_01_02.jpg,,"Poster - 1/2,3/70",[],,https://gdsets.com/70posters/1970_01_02.jpg,,,,,,1970-01-02,1713480542387,false
gdsets_posters,gdsets_posters_1970_01_02e.jpg,,"Poster - 1/2,3/70",[],,https://gdsets.com/70posters/1970_01_02e.jpg,,,,,,1970-01-02,1713480542387,false
gdsets_posters,gdsets_posters_1970_01_02a.jpg,,"Poster - 1/2,3/70",[],,https://gdsets.com/70posters/1970_01_02a.jpg,,,,,,1970-01-02,1713480542397,false
gdsets_posters,gdsets_posters_1995_07_02 (OP1).jpg,,"Poster - 7/2,3/95(OP1)",[],,https://gdsets.com/90posters/1995_07_02 (OP1).jpg,,,,,,1995-07-02,1713480542397,false
gdsets_posters,gdsets_posters_1995_06_15d.jpg,,Poster - 6/15/95,[],,https://gdsets.com/90posters/1995_06_15d.jpg,,,,,,1995-06-15,1713480542397,false
gdsets_posters,gdsets_posters_1970_01_07.jpg,,Poster - 1/7/70(cancelled),[],,https://gdsets.com/70posters/1970_01_07.jpg,,,,,,1970-01-07,1713480542490,false
gdsets_posters,gdsets_posters_1995_06_15b.jpg,,Poster - Summer 1995(reprint proof),[],,https://gdsets.com/90posters/1995_06_15b.jpg,,,,,,1995-06-15,1713480542497,true
gdsets_posters,gdsets_posters_1970_01_10 (AOR 4.120).jpg,,Poster - 1/10/70 (OP1)AOR 4.120,[],,https://gdsets.com/70posters/1970_01_10 (AOR
gdsets_posters,gdsets_posters_1970_01_02b.jpg,,"Poster - 1/2,3/70",[],,https://gdsets.com/70posters/1970_01_02b.jpg,,,,,,1970-01-02,1713480542572,false
gdsets_posters,gdsets_posters_1970_01_10b.jpg,,Poster - 1/10/70,[],,https://gdsets.com/70posters/1970_01_10b.jpg,,,,,,1970-01-10,1713480542629,true
gdsets_posters,gdsets_posters_1970_01_02f.jpg,,"Poster - 1/2,3/70",[],,https://gdsets.com/70posters/1970_01_02f.jpg,,,,,,1970-01-02,1713480542664,false
gdsets_posters,gdsets_posters_1970_01_10a (AOR 4.120 HB).jpg,,Poster - 1/10/70 (OHB)AOR 4.120,[],,https://gdsets.com/70posters/1970_01_10a (AOR 4.120
gdsets_posters,gdsets_posters_1970_01_02d.jpg,,"Poster - 1/2,3/70",[],,https://gdsets.com/70posters/1970_01_02d.jpg,,,,,,1970-01-02,1713480542754,false
gdsets_posters,gdsets_posters_1970_01_17.jpg,,Poster - 1/17/70,[],,https://gdsets.com/70posters/1970_01_17.jpg,,,,,,1970-01-17,1713480542845,false
gdsets_posters,gdsets_posters_1970_01_17a.jpg,,Poster - 1/17/70,[],,https://gdsets.com/70posters/1970_01_17a.jpg,,,,,,1970-01-17,1713480542845,false
gdsets_posters,gdsets_posters_1970_01_23b.jpg,,"Poster - 1/23,24/70",[],,https://gdsets.com/70posters/1970_01_23b.jpg,,,,,,1970-01-23,1713480542934,false
gdsets_posters,gdsets_posters_1970_01_23.jpg,,"Poster - 1/23,24/70(OHB front)",[],,https://gdsets.com/70posters/1970_01_23.jpg,,,,,,1970-01-23,1713480542944,false
gdsets_posters,gdsets_posters_1970_01_23a.jpg,,"Poster - 1/23,24/70(OHB back)",[],,https://gdsets.com/70posters/1970_01_23a.jpg,,,,,,1970-01-23,1713480543035,false
gdsets_posters,gdsets_posters_1995_09_13.jpg,,Poster - Fall 1995(cancelled),[],,https://gdsets.com/90posters/1995_09_13.jpg,,,,,,1995-09-13,1713480543048,false
gdsets_posters,gdsets_posters_1970_01_02c.jpg,,"Poster - 1/2,3/70",[],,https://gdsets.com/70posters/1970_01_02c.jpg,,,,,,1970-01-02,1713480543127,false
gdsets_posters,gdsets_posters_1970_02_02.jpg,,Poster - 2/2/70,[],,https://gdsets.com/70posters/1970_02_02.jpg,,,,,,1970-02-02,1713480543132,false
gdsets_posters,gdsets_posters_1970_02_05d.jpg,,Poster - 2/5-8/70,[],,https://gdsets.com/70posters/1970_02_05d.jpg,,,,,,1970-02-05,1713480543217,false
gdsets_posters,gdsets_posters_1970_02_11d.jpg,,Poster - 2/11-14/70 @ Program,[],,https://gdsets.com/70posters/1970_02_11d.jpg,,,,,,1970-02-11,1713480543556,false
gdsets_posters,gdsets_posters_1970_02_05a.jpg,,Poster - 2/5-8/70 @ BG216 (OPC-A),[],,https://gdsets.com/70posters/1970_02_05a.jpg,,,,,,1970-02-05,1713480543561,false
gdsets_posters,gdsets_posters_1970_02_20a.jpg,,Poster - 2/20/70 (OHB)AOR 4.161,[],,https://gdsets.com/70posters/1970_02_20a.jpg,,,,,,1970-02-20,1713480543569,true
gdsets_posters,gdsets_posters_1970_02_20b.jpg,,Poster - 2/20/70,[],,https://gdsets.com/70posters/1970_02_20b.jpg,,,,,,1970-02-20,1713480543601,false
gdsets_posters,gdsets_posters_1970_02_11c.jpg,,Poster - 2/11-14/70,[],,https://gdsets.com/70posters/1970_02_11c.jpg,,,,,,1970-02-11,1713480543682,false
gdsets_posters,gdsets_posters_1970_01_30.jpg,,"Poster - 1/30,31/70",[],,https://gdsets.com/70posters/1970_01_30.jpg,,,,,,1970-01-30,1713480543771,false
gdsets_posters,gdsets_posters_1970_02_05c.jpg,,Poster - 2/5-8/70 @ BG214/216(OPC-C),[],,https://gdsets.com/70posters
gdsets_posters,gdsets_posters_1970_02_05b.jpg,,Poster - 2/5-8/70 @ BG214/216(OPC-B),[],,https://gdsets.com/70posters
gdsets_posters,gdsets_posters_1970_02_23.jpg,,Poster - 2/23/70,[],,https://gdsets.com/70posters/1970_02_23.jpg,,,,,,1970-02-23,1713480543988,false
gdsets_posters,gdsets_posters_1970_01_30a.jpg,,"Poster - 1/30,31/70",[],,https://gdsets.com/70posters/1970_01_30a.jpg,,,,,,1970-01-30,1713480544208,false
gdsets_posters,gdsets_posters_1970_02_22a.jpg,,Poster - 2/22/70,[],,https://gdsets.com/70posters/1970_02_22a.jpg,,,,,,1970-02-22,1713480544208,true
gdsets_posters,gdsets_posters_1970_02_21a.jpg,,Poster - 2/21/70,[],,https://gdsets.com/70posters/1970_02_21a.jpg,,,,,,1970-02-21,1713480544308,false
gdsets_posters,gdsets_posters_1970_02_21b.jpg,,Poster - 2/21/70,[],,https://gdsets.com/70posters/1970_02_21b.jpg,,,,,,1970-02-21,1713480544410,false
gdsets_posters,gdsets_posters_1970_01_30b.jpg,,"Poster - 1/30,31/70",[],,https://gdsets.com/70posters/1970_01_30b.jpg,,,,,,1970-01-30,1713480544410,false
gdsets_posters,gdsets_posters_1970_02_21.jpg,,Poster - 2/21/70,[],,https://gdsets.com/70posters/1970_02_21.jpg,,,,,,1970-02-21,1713480544412,false
gdsets_posters,gdsets_posters_1970_02_23b (BG222OPC).jpg,,Poster - 2/23/70 @ BG222(OPC-A),[],,https://gdsets.com/70posters/1970_02_23b 
gdsets_posters,gdsets_posters_1970_02_22.jpg,,Poster - 2/22/70,[],,https://gdsets.com/70posters/1970_02_22.jpg,,,,,,1970-02-22,1713480544548,false
gdsets_posters,gdsets_posters_1970_02_23a (OP1).jpg,,Poster - 2/23/70 @ BG222 (OP1)(JA benefit for GD bust),[],,https://gdsets.com/70posters/1970_02_23a 
gdsets_posters,gdsets_posters_1970_03_08.jpg,,Poster - 3/8/70 (OHB),[],,https://gdsets.com/70posters/1970_03_08.jpg,,,,,,1970-03-08,1713480544641,false
gdsets_posters,gdsets_posters_1970_03_07a.jpg,,Poster - 3/7/70,[],,https://gdsets.com/70posters/1970_03_07a.jpg,,,,,,1970-03-07,1713480544653,false
gdsets_posters,gdsets_posters_1970_02_23a.jpg,,Poster - 2/23/70 @ BG222 (OP1),[],,https://gdsets.com/70posters/1970_02_23a.jpg,,,,,,1970-02-23,1713480544655,true
gdsets_posters,gdsets_posters_1970_01_16a (OHB).jpg,,Poster - 1/16/70 (OHB)AOR 4.136,[],,https://gdsets.com/70posters/1970_01_16a 
gdsets_posters,gdsets_posters_1970_02_27b.jpg,,Poster - 2/27-3/1/70,[],,https://gdsets.com/70posters/1970_02_27b.jpg,,,,,,1970-02-27,1713480544739,false
gdsets_posters,gdsets_posters_1970_02_27a.jpg,,Poster - 2/27-3/1/70,[],,https://gdsets.com/70posters/1970_02_27a.jpg,,,,,,1970-02-27,1713480544899,false
gdsets_posters,gdsets_posters_1970_03_17.jpg,,Poster - 3/17/70,[],,https://gdsets.com/70posters/1970_03_17.jpg,,,,,,1970-03-17,1713480544909,false
gdsets_posters,gdsets_posters_1970_02_27.jpg,,Poster - 2/27-3/1/70,[],,https://gdsets.com/70posters/1970_02_27.jpg,,,,,,1970-02-27,1713480544910,false
gdsets_posters,gdsets_posters_1970_02_20.jpg,,Poster - 2/20/70 (OP1)AOR 4.161,[],,https://gdsets.com/70posters/1970_02_20.jpg,,,,,,1970-02-20,1713480544920,false
gdsets_posters,gdsets_posters_1970_03_17a.jpg,,Poster - 3/17/70,[],,https://gdsets.com/70posters/1970_03_17a.jpg,,,,,,1970-03-17,1713480545001,false
gdsets_posters,gdsets_posters_1970_03_07.jpg,,Poster - 3/7/70,[],,https://gdsets.com/70posters/1970_03_07.jpg,,,,,,1970-03-07,1713480545072,false
gdsets_posters,gdsets_posters_1970_03_24.jpg,,"Poster - 3/22,23/70",[],,https://gdsets.com/70posters/1970_03_24.jpg,,,,,,1970-03-24,1713480545184,false
gdsets_posters,gdsets_posters_1970_03_24a.jpg,,"Poster - 3/22,23/70",[],,https://gdsets.com/70posters/1970_03_24a.jpg,,,,,,1970-03-24,1713480545280,false
gdsets_posters,gdsets_posters_1970_04_09c.jpg,,Poster - 4/9-12/70,[],,https://gdsets.com/70posters/1970_04_09c.jpg,,,,,,1970-04-09,1713480545285,false
gdsets_posters,gdsets_posters_1970_04_03b (OP).jpg,,Poster - 4/3/70 (OP1),[],,https://gdsets.com/70posters/1970_04_03b (OP).jpg,,,,,,1970-04-03,1713480545309,false
gdsets_posters,gdsets_posters_1970_02_23c (BG222 OP2).jpg,,Poster - 2/23/70 @ BG222(OP2),[],,https://gdsets.com/70posters/1970_02_23c (BG222
gdsets_posters,gdsets_posters_1970_04_03 (OHB).jpg,,Poster - 4/3/70 (OHB),[],,https://gdsets.com/70posters/1970_04_03 (OHB).jpg,,,,,,1970-04-03,1713480545484,false
gdsets_posters,gdsets_posters_1970_02_23d (BG222 OHB).jpg,,Poster - 2/23/70 @ BG222(OPC-B),[],,https://gdsets.com/70posters/1970_02_23d (BG222
gdsets_posters,gdsets_posters_1970_04_24.jpg,,Poster - 4/24/70,[],,https://gdsets.com/70posters/1970_04_24.jpg,,,,,,1970-04-24,1713480545642,false
gdsets_posters,gdsets_posters_1970_04_20.jpg,,Poster - 4/20/70,[],,https://gdsets.com/70posters/1970_04_20.jpg,,,,,,1970-04-20,1713480545744,false
gdsets_posters,gdsets_posters_1970_04_09a.jpg,,Poster - 4/9-12/70 @ BG227 (OPC-A),[],,https://gdsets.com/70posters/1970_04_09a.jpg,,,,,,1970-04-09,1713480545750,false
gdsets_posters,gdsets_posters_1970_04_17b.jpg,,Poster - 4/17-19/70(rescheduledfrom 4/10-12),[],,https://gdsets.com/70posters
gdsets_posters,gdsets_posters_1970_04_21.jpg,,"Poster - 4/21,22/70",[],,https://gdsets.com/70posters/1970_04_21.jpg,,,,,,1970-04-21,1713480545942,false
gdsets_posters,gdsets_posters_1970_04_17a.jpg,,Poster - 4/17-19/70,[],,https://gdsets.com/70posters/1970_04_17a.jpg,,,,,,1970-04-17,1713480546045,true
gdsets_posters,gdsets_posters_1970_04_26d.jpg,,Poster - 4/26/70,[],,https://gdsets.com/70posters/1970_04_26d.jpg,,,,,,1970-04-26,1713480546045,false
gdsets_posters,gdsets_posters_1970_04_27.jpg,,Poster - 4/27/70,[],,https://gdsets.com/70posters/1970_04_27.jpg,,,,,,1970-04-27,1713480546148,false
gdsets_posters,gdsets_posters_1970_04_26e.jpg,,Poster - 4/26/70,[],,https://gdsets.com/70posters/1970_04_26e.jpg,,,,,,1970-04-26,1713480546237,false
gdsets_posters,gdsets_posters_1970_04_09b.jpg,,Poster - 4/9-12/70 @ BG227/228(OPC-C),[],,https://gdsets.com/70posters
gdsets_posters,gdsets_posters_1970_04_26b.jpg,,Poster - 4/26/70,[],,https://gdsets.com/70posters/1970_04_26b.jpg,,,,,,1970-04-26,1713480546247,false
gdsets_posters,gdsets_posters_1970_05_01.jpg,,Poster - 5/1/70,[],,https://gdsets.com/70posters/1970_05_01.jpg,,,,,,1970-05-01,1713480546344,false
gdsets_posters,gdsets_posters_1970_04_26.jpg,,Poster - 4/26/70,[],,https://gdsets.com/70posters/1970_04_26.jpg,,,,,,1970-04-26,1713480546354,false
gdsets_posters,gdsets_posters_1970_03_27.jpg,,Poster - 3/27-29/70(cancelled),[],,https://gdsets.com/70posters/1970_03_27.jpg,,,,,,1970-03-27,1713480546435,false
gdsets_posters,gdsets_posters_1970_04_26a.jpg,,Poster - 4/26/70,[],,https://gdsets.com/70posters/1970_04_26a.jpg,,,,,,1970-04-26,1713480546455,false
gdsets_posters,gdsets_posters_1970_05_07.jpg,,Poster - 5/7/70 (OP1)AOR 4.232,[],,https://gdsets.com/70posters/1970_05_07.jpg,,,,,,1970-05-07,1713480546644,false
gdsets_posters,gdsets_posters_1970_05_16b.jpg,,Poster - 5/16/70,[],,https://gdsets.com/70posters/1970_05_16b.jpg,,,,,,1970-05-16,1713480546735,true
gdsets_posters,gdsets_posters_1970_04_26c.jpg,,Poster - 4/26/70,[],,https://gdsets.com/70posters/1970_04_26c.jpg,,,,,,1970-04-26,1713480546736,false
gdsets_posters,gdsets_posters_1970_05_24a.jpg,,Poster - 5/24/70,[],,https://gdsets.com/70posters/1970_05_24a.jpg,,,,,,1970-05-24,1713480546949,true
gdsets_posters,gdsets_posters_1970_05_24f.jpg,,Poster - 5/24/70,[],,https://gdsets.com/70posters/1970_05_24f.jpg,,,,,,1970-05-24,1713480546961,false
gdsets_posters,gdsets_posters_1970_05_24c.jpg,,Poster - 5/24/70 (OHB),[],,https://gdsets.com/70posters/1970_05_24c.jpg,,,,,,1970-05-24,1713480546971,false
gdsets_posters,gdsets_posters_1970_05_24h.jpg,,Poster - 5/24/70 @ Program,[],,https://gdsets.com/70posters/1970_05_24h.jpg,,,,,,1970-05-24,1713480547049,false
gdsets_posters,gdsets_posters_1970_05_16a.jpg,,Poster - 5/16/70,[],,https://gdsets.com/70posters/1970_05_16a.jpg,,,,,,1970-05-16,1713480547055,false
gdsets_posters,gdsets_posters_1970_05_24b.jpg,,Poster - 5/24/70,[],,https://gdsets.com/70posters/1970_05_24b.jpg,,,,,,1970-05-24,1713480547060,false
gdsets_posters,gdsets_posters_1970_05_16.jpg,,Poster - 5/16/70,[],,https://gdsets.com/70posters/1970_05_16.jpg,,,,,,1970-05-16,1713480547060,false
gdsets_posters,gdsets_posters_1970_05_24l.jpg,,Poster - 5/24/70,[],,https://gdsets.com/70posters/1970_05_24l.jpg,,,,,,1970-05-24,1713480547144,false
gdsets_posters,gdsets_posters_1970_05_24g.jpg,,Poster - 5/24/70,[],,https://gdsets.com/70posters/1970_05_24g.jpg,,,,,,1970-05-24,1713480547339,false
gdsets_posters,gdsets_posters_1970_05_24j.jpg,,Poster - 5/24/70 @ Clear Plastic,[],,https://gdsets.com/70posters/1970_05_24j.jpg,,,,,,1970-05-24,1713480547347,true
gdsets_posters,gdsets_posters_1970_06_04d.jpg,,Poster - 6/4-7/70 @ BG237 @ Original Art,[],,https://gdsets.com/70posters
gdsets_posters,gdsets_posters_1970_06_04b.jpg,,Poster - 6/4-7/70 @ BG237 (OPC-A),[],,https://gdsets.com/70posters/1970_06_04b.jpg,,,,,,1970-06-04,1713480547534,false
gdsets_posters,gdsets_posters_1970_05_24k.jpg,,Poster - 5/24/70 @ Clear Plastic,[],,https://gdsets.com/70posters/1970_05_24k.jpg,,,,,,1970-05-24,1713480547539,false
gdsets_posters,gdsets_posters_1970_06_04f.jpg,,Poster - 6/4-7/70,[],,https://gdsets.com/70posters/1970_06_04f.jpg,,,,,,1970-06-04,1713480547644,false
gdsets_posters,gdsets_posters_1970_06_12.jpg,,"Poster - 6/12,13/70 @ AOR 4.143",[],,https://gdsets.com/70posters/1970_06_12.jpg,,,,,,1970-06-12,1713480547647,false
gdsets_posters,gdsets_posters_1970_06_14b.jpg,,Poster - Workingman's Dead Promo,[],,https://gdsets.com/70posters/1970_06_14b.jpg,,,,,,1970-06-14,1713480547649,false
gdsets_posters,gdsets_posters_1970_05_10.jpg,,Poster - 5/10/70,[],,https://gdsets.com/70posters/1970_05_10.jpg,,,,,,1970-05-10,1713480547738,false
gdsets_posters,gdsets_posters_1970_05_10a.jpg,,Poster - 5/10/70,[],,https://gdsets.com/70posters/1970_05_10a.jpg,,,,,,1970-05-10,1713480547842,false
gdsets_posters,gdsets_posters_1970_06_14a.jpg,,Poster - Workingman's Dead Promo,[],,https://gdsets.com/70posters/1970_06_14a.jpg,,,,,,1970-06-14,1713480548046,false
gdsets_posters,gdsets_posters_1970_06_04.jpg,,Poster - 6/4-7/70 @ BG237 (OP1),[],,https://gdsets.com/70posters/1970_06_04.jpg,,,,,,1970-06-04,1713480548167,false
gdsets_posters,gdsets_posters_1970_04_09.jpg,,Poster - 4/9-12/70 @ BG227 (OP1),[],,https://gdsets.com/70posters/1970_04_09.jpg,,,,,,1970-04-09,1713480548224,false
gdsets_posters,gdsets_posters_1970_06_21.jpg,,Poster - 6/21/70,[],,https://gdsets.com/70posters/1970_06_21.jpg,,,,,,1970-06-21,1713480548261,false
gdsets_posters,gdsets_posters_1970_06_27b.jpg,,"Poster - 6/27,28/70",[],,https://gdsets.com/70posters/1970_06_27b.jpg,,,,,,1970-06-27,1713480548280,false
gdsets_posters,gdsets_posters_1970_06_27c.jpg,,"Poster - 6/27,28/70",[],,https://gdsets.com/70posters/1970_06_27c.jpg,,,,,,1970-06-27,1713480548398,false
gdsets_posters,gdsets_posters_1970_06_21a.jpg,,Poster - 6/21/70,[],,https://gdsets.com/70posters/1970_06_21a.jpg,,,,,,1970-06-21,1713480548486,false
gdsets_posters,gdsets_posters_1970_06_14c.jpg,,Poster - Workingman's Dead Newspaper Ad,[],,https://gdsets.com/70posters
gdsets_posters,gdsets_posters_1970_06_04c.jpg,,Poster - 6/4-7/70 @ BG237/238(OPC-C),[],,https://gdsets.com/70posters
gdsets_posters,gdsets_posters_1970_06_27.jpg,,"Poster - 6/27,28/70",[],,https://gdsets.com/70posters/1970_06_27.jpg,,,,,,1970-06-27,1713480548571,true
gdsets_posters,gdsets_posters_1970_07_01a.jpg,,Poster - 7/1/70,[],,https://gdsets.com/70posters/1970_07_01a.jpg,,,,,,1970-07-01,1713480548677,false
gdsets_posters,gdsets_posters_1970_06_27e.jpg,,"Poster - 6/27,28/70",[],,https://gdsets.com/70posters/1970_06_27e.jpg,,,,,,1970-06-27,1713480548691,false
gdsets_posters,gdsets_posters_1970_07_01b.jpg,,Poster - 7/1/70,[],,https://gdsets.com/70posters/1970_07_01b.jpg,,,,,,1970-07-01,1713480548771,false
gdsets_posters,gdsets_posters_1970_06_14.jpg,,Poster - Workingman's Dead Promo,[],,https://gdsets.com/70posters/1970_06_14.jpg,,,,,,1970-06-14,1713480548806,false
gdsets_posters,gdsets_posters_1970_06_27a.jpg,,"Poster - 6/27,28/70 (OP1)AOR 4.132",[],,https://gdsets.com/70posters
gdsets_posters,gdsets_posters_1970_07_04b.jpg,,"Poster - 7/4,5/70",[],,https://gdsets.com/70posters/1970_07_04b.jpg,,,,,,1970-07-04,1713480549199,false
gdsets_posters,gdsets_posters_1970_06_27aa.jpg,,"Poster - 6/27,28/70 (OP1)AOR 4.132",[],,https://gdsets.com/70posters
gdsets_posters,gdsets_posters_1970_07_03a.jpg,,Poster - 7/3/70(cancelled),[],,https://gdsets.com/70posters/1970_07_03a.jpg,,,,,,1970-07-03,1713480549287,false
gdsets_posters,gdsets_posters_1970_07_03b.jpg,,Poster - 7/3/70(cancelled),[],,https://gdsets.com/70posters/1970_07_03b.jpg,,,,,,1970-07-03,1713480549301,false
gdsets_posters,gdsets_posters_1970_07_08.jpg,,Poster - 7/8/70,[],,https://gdsets.com/70posters/1970_07_08.jpg,,,,,,1970-07-08,1713480549374,false
gdsets_posters,gdsets_posters_1970_07_01.jpg,,Poster - 7/1/70,[],,https://gdsets.com/70posters/1970_07_01.jpg,,,,,,1970-07-01,1713480549481,false
gdsets_posters,gdsets_posters_1970_07_09.jpg,,Poster - 7/9-12/70 (OPC),[],,https://gdsets.com/70posters/1970_07_09.jpg,,,,,,1970-07-09,1713480549564,false
gdsets_posters,gdsets_posters_1970_07_07.jpg,,Poster - 7/7/70,[],,https://gdsets.com/70posters/1970_07_07.jpg,,,,,,1970-07-07,1713480549606,false
gdsets_posters,gdsets_posters_1970_03_18.jpg,,Poster - 3/18/70,[],,https://gdsets.com/70posters/1970_03_18.jpg,,,,,,1970-03-18,1713480549647,false
gdsets_posters,gdsets_posters_1970_07_04a.jpg,,"Poster - 7/4,5/70",[],,https://gdsets.com/70posters/1970_07_04a.jpg,,,,,,1970-07-04,1713480549823,false
gdsets_posters,gdsets_posters_1970_07_07a.jpg,,Poster - 7/7/70,[],,https://gdsets.com/70posters/1970_07_07a.jpg,,,,,,1970-07-07,1713480549841,true
gdsets_posters,gdsets_posters_1970_07_03 (AOR 4.202).jpg,,Poster - 7/3/70 (OP1)AOR 4.202(cancelled),[],,https://gdsets.com/70posters/1970_07_03 (AOR
gdsets_posters,gdsets_posters_1970_06_27f.jpg,,"Poster - 6/27,28/70 @ Program",[],,https://gdsets.com/70posters/1970_06_27f.jpg,,,,,,1970-06-27,1713480549851,false
gdsets_posters,gdsets_posters_1970_07_13.jpg,,Poster - 7/13/70(cancelled),[],,https://gdsets.com/70posters/1970_07_13.jpg,,,,,,1970-07-13,1713480549935,false
gdsets_posters,gdsets_posters_1970_07_04.jpg,,"Poster - 7/4,5/70",[],,https://gdsets.com/70posters/1970_07_04.jpg,,,,,,1970-07-04,1713480549937,true
gdsets_posters,gdsets_posters_1970_07_13a.jpg,,Poster - 7/13/70(cancelled),[],,https://gdsets.com/70posters/1970_07_13a.jpg,,,,,,1970-07-13,1713480550041,false
gdsets_posters,gdsets_posters_1970_07_14b.jpg,,"Poster - 7/14,16/70 (OHB)AOR 4.93",[],,https://gdsets.com/70posters
gdsets_posters,gdsets_posters_1970_07_14d.jpg,,"Poster - 7/14,16/70",[],,https://gdsets.com/70posters/1970_07_14d.jpg,,,,,,1970-07-14,1713480550257,false
gdsets_posters,gdsets_posters_1970_08_17.jpg,,Poster - 8/17-19/70,[],,https://gdsets.com/70posters/1970_08_17.jpg,,,,,,1970-08-17,1713480550459,false
gdsets_posters,gdsets_posters_1970_07_14.jpg,,"Poster - 7/14,16/70 (OP1)AOR 4.93 @ First State",[],,https://gdsets.com/70posters
gdsets_posters,gdsets_posters_1970_08_28b.jpg,,"Poster - 8/28,29/70",[],,https://gdsets.com/70posters/1970_08_28b.jpg,,,,,,1970-08-28,1713480550790,false
gdsets_posters,gdsets_posters_1970_04_17.jpg,,Poster - 4/17-19/70,[],,https://gdsets.com/70posters/1970_04_17.jpg,,,,,,1970-04-17,1713480550943,false
gdsets_posters,gdsets_posters_1970_07_14c.jpg,,"Poster - 7/14,16/70 @ AOR 4.93 @ Blueline",[],,https://gdsets.com/70posters
gdsets_posters,gdsets_posters_1970_09_26a.jpg,,Poster - 9/26/70,[],,https://gdsets.com/70posters/1970_09_26a.jpg,,,,,,1970-09-26,1713480551031,false
gdsets_posters,gdsets_posters_1970_09_26.jpg,,Poster - 9/26/70,[],,https://gdsets.com/70posters/1970_09_26.jpg,,,,,,1970-09-26,1713480551045,false
gdsets_posters,gdsets_posters_1970_09_25a.jpg,,Poster - 9/25/70,[],,https://gdsets.com/70posters/1970_09_25a.jpg,,,,,,1970-09-25,1713480551131,false
gdsets_posters,gdsets_posters_1970_07_11cx.jpg,,Poster - 7/11/70(cancelled),[],,https://gdsets.com/70posters/1970_07_11cx.jpg,,,,,,1970-07-11,1713480551164,false
gdsets_posters,gdsets_posters_1970_09_17.jpg,,Poster - 9/17-20/70 @ Program,[],,https://gdsets.com/70posters/1970_09_17.jpg,,,,,,1970-09-17,1713480551407,false
gdsets_posters,gdsets_posters_1970_08_28.jpg,,"Poster - 8/28,29/70",[],,https://gdsets.com/70posters/1970_08_28.jpg,,,,,,1970-08-28,1713480551492,false
gdsets_posters,gdsets_posters_1970_10_04a.jpg,,"Poster - 10/4,5/70(OHB)",[],,https://gdsets.com/70posters/1970_10_04a.jpg,,,,,,1970-10-04,1713480551523,true
gdsets_posters,gdsets_posters_1970_10_04d.jpg,,"Poster - 10/4,5/70",[],,https://gdsets.com/70posters/1970_10_04d.jpg,,,,,,1970-10-04,1713480551820,false
gdsets_posters,gdsets_posters_1970_10_10.jpg,,Poster - 10/10/70,[],,https://gdsets.com/70posters/1970_10_10.jpg,,,,,,1970-10-10,1713480551837,false
gdsets_posters,gdsets_posters_1970_10_16b.jpg,,Poster - 10/16/70,[],,https://gdsets.com/70posters/1970_10_16b.jpg,,,,,,1970-10-16,1713480551928,false
gdsets_posters,gdsets_posters_1970_10_04b.jpg,,"Poster - 10/4,5/70 @ Program",[],,https://gdsets.com/70posters/1970_10_04b.jpg,,,,,,1970-10-04,1713480551979,false
gdsets_posters,gdsets_posters_1970_10_04.jpg,,"Poster - 10/4,5/70(OP1)",[],,https://gdsets.com/70posters/1970_10_04.jpg,,,,,,1970-10-04,1713480552159,false
gdsets_posters,gdsets_posters_1970_10_16a.jpg,,Poster - 10/16/70,[],,https://gdsets.com/70posters/1970_10_16a.jpg,,,,,,1970-10-16,1713480552179,false
gdsets_posters,gdsets_posters_1970_10_17.jpg,,Poster - 10/17/70,[],,https://gdsets.com/70posters/1970_10_17.jpg,,,,,,1970-10-17,1713480552219,false
gdsets_posters,gdsets_posters_1970_10_18.jpg,,Poster - 10/18/70,[],,https://gdsets.com/70posters/1970_10_18.jpg,,,,,,1970-10-18,1713480552317,false
gdsets_posters,gdsets_posters_1970_10_18a.jpg,,Poster - 10/18/70,[],,https://gdsets.com/70posters/1970_10_18a.jpg,,,,,,1970-10-18,1713480552350,false
gdsets_posters,gdsets_posters_1970_10_04c.jpg,,"Poster - 10/4,5/70 @ Program",[],,https://gdsets.com/70posters/1970_10_04c.jpg,,,,,,1970-10-04,1713480552580,false
gdsets_posters,gdsets_posters_1970_10_16.jpg,,Poster - 10/16/70,[],,https://gdsets.com/70posters/1970_10_16.jpg,,,,,,1970-10-16,1713480552589,false
gdsets_posters,gdsets_posters_1970_10_12.jpg,,Poster - 10/12-14/70,[],,https://gdsets.com/70posters/1970_10_12.jpg,,,,,,1970-10-12,1713480552593,false
gdsets_posters,gdsets_posters_1970_10_23.jpg,,Poster - 10/23/70,[],,https://gdsets.com/70posters/1970_10_23.jpg,,,,,,1970-10-23,1713480552690,false
gdsets_posters,gdsets_posters_1970_08_28a.jpg,,"Poster - 8/28,29/70",[],,https://gdsets.com/70posters/1970_08_28a.jpg,,,,,,1970-08-28,1713480552699,false
gdsets_posters,gdsets_posters_1970_10_23b.jpg,,Poster - 10/23/70,[],,https://gdsets.com/70posters/1970_10_23b.jpg,,,,,,1970-10-23,1713480553017,false
gdsets_posters,gdsets_posters_1970_10_30.jpg,,"Poster - 10/30,31/70",[],,https://gdsets.com/70posters/1970_10_30.jpg,,,,,,1970-10-30,1713480553021,false
gdsets_posters,gdsets_posters_1970_10_31.jpg,,Poster - 10/31/70,[],,https://gdsets.com/70posters/1970_10_31.jpg,,,,,,1970-10-31,1713480553034,false
gdsets_posters,gdsets_posters_1970_07_28.jpg,,Poster - 7/28/70,[],,https://gdsets.com/70posters/1970_07_28.jpg,,,,,,1970-07-28,1713480553246,false
gdsets_posters,gdsets_posters_1970_08_24.jpg,,Poster - 8/24/70,[],,https://gdsets.com/70posters/1970_08_24.jpg,,,,,,1970-08-24,1713480553247,false
gdsets_posters,gdsets_posters_1970_04_17c.jpg,,Poster - 4/17-19/70,[],,https://gdsets.com/70posters/1970_04_17c.jpg,,,,,,1970-04-17,1713480553373,false
gdsets_posters,gdsets_posters_1970_10_31a.jpg,,Poster - 10/31/70,[],,https://gdsets.com/70posters/1970_10_31a.jpg,,,,,,1970-10-31,1713480553493,false
gdsets_posters,gdsets_posters_1970_10_23a.jpg,,Poster - 10/23/70,[],,https://gdsets.com/70posters/1970_10_23a.jpg,,,,,,1970-10-23,1713480553580,false
gdsets_posters,gdsets_posters_1970_11_10.jpg,,Poster - 11/10/70,[],,https://gdsets.com/70posters/1970_11_10.jpg,,,,,,1970-11-10,1713480553681,false
gdsets_posters,gdsets_posters_1970_07_14a.jpg,,"Poster - 7/14,16/70 (OP1)AOR 4.93 @ Second State",[],,https://gdsets.com/70posters
gdsets_posters,gdsets_posters_1970_09_14.jpg,,Poster - 9/14/70,[],,https://gdsets.com/70posters/1970_09_14.jpg,,,,,,1970-09-14,1713480553811,false
gdsets_posters,gdsets_posters_1970_11_09.jpg,,"Poster - 11/9,10/70",[],,https://gdsets.com/70posters/1970_11_09.jpg,,,,,,1970-11-09,1713480553815,false
gdsets_posters,gdsets_posters_1970_10_26.jpg,,Poster - 10/26/70(cancelled?),[],,https://gdsets.com/70posters/1970_10_26.jpg,,,,,,1970-10-26,1713480553897,false
gdsets_posters,gdsets_posters_1970_11_05.jpg,,Poster - 11/5-8/70,[],,https://gdsets.com/70posters/1970_11_05.jpg,,,,,,1970-11-05,1713480553900,false
gdsets_posters,gdsets_posters_1970_11_11a.jpg,,Poster - 11/11-14/70,[],,https://gdsets.com/70posters/1970_11_11a.jpg,,,,,,1970-11-11,1713480553916,false
gdsets_posters,gdsets_posters_1970_11_15b.jpg,,Poster - 11/15/70(cancelled),[],,https://gdsets.com/70posters/1970_11_15b.jpg,,,,,,1970-11-15,1713480554011,false
gdsets_posters,gdsets_posters_1970_11_15a.jpg,,Poster - 11/15/70(cancelled),[],,https://gdsets.com/70posters/1970_11_15a.jpg,,,,,,1970-11-15,1713480554012,false
gdsets_posters,gdsets_posters_1970_11_11b.jpg,,Poster - 11/11-14/70,[],,https://gdsets.com/70posters/1970_11_11b.jpg,,,,,,1970-11-11,1713480554073,false
gdsets_posters,gdsets_posters_1970_11_11.jpg,,Poster - 11/11-14/70 @ AOR 4.235,[],,https://gdsets.com/70posters/1970_11_11.jpg,,,,,,1970-11-11,1713480554110,false
gdsets_posters,gdsets_posters_1970_11_15c.jpg,,Poster - 11/15/70(cancelled),[],,https://gdsets.com/70posters/1970_11_15c.jpg,,,,,,1970-11-15,1713480554114,false
gdsets_posters,gdsets_posters_1970_11_20.jpg,,Poster - 11/20/70,[],,https://gdsets.com/70posters/1970_11_20.jpg,,,,,,1970-11-20,1713480554216,false
gdsets_posters,gdsets_posters_1970_09_25.jpg,,Poster - 9/25/70,[],,https://gdsets.com/70posters/1970_09_25.jpg,,,,,,1970-09-25,1713480554216,false
gdsets_posters,gdsets_posters_1970_11_22b.jpg,,Poster - 11/22/70,[],,https://gdsets.com/70posters/1970_11_22b.jpg,,,,,,1970-11-22,1713480554518,false
gdsets_posters,gdsets_posters_1970_11_15.jpg,,Poster - 11/15/70(cancelled),[],,https://gdsets.com/70posters/1970_11_15.jpg,,,,,,1970-11-15,1713480554518,false
gdsets_posters,gdsets_posters_1970_11_23d.jpg,,Poster - 11/23/70 (OHB),[],,https://gdsets.com/70posters/1970_11_23d.jpg,,,,,,1970-11-23,1713480554605,true
gdsets_posters,gdsets_posters_1970_11_20a.jpg,,Poster - 11/20/70,[],,https://gdsets.com/70posters/1970_11_20a.jpg,,,,,,1970-11-20,1713480554699,false
gdsets_posters,gdsets_posters_1970_11_23c.jpg,,Poster - 11/23/70(Alternate OP1),[],,https://gdsets.com/70posters/1970_11_23c.jpg,,,,,,1970-11-23,1713480554699,false
gdsets_posters,gdsets_posters_1970_09_07.jpg,,Poster - 9/7/70,[],,https://gdsets.com/70posters/1970_09_07.jpg,,,,,,1970-09-07,1713480554702,false
gdsets_posters,gdsets_posters_1970_11_22a.jpg,,Poster - 11/22/70,[],,https://gdsets.com/70posters/1970_11_22a.jpg,,,,,,1970-11-22,1713480554702,false
gdsets_posters,gdsets_posters_1970_11_23e.jpg,,Poster - 11/23/70 (OHB),[],,https://gdsets.com/70posters/1970_11_23e.jpg,,,,,,1970-11-23,1713480554791,true
gdsets_posters,gdsets_posters_1970_11_22.jpg,,Poster - 11/22/70,[],,https://gdsets.com/70posters/1970_11_22.jpg,,,,,,1970-11-22,1713480554815,false
gdsets_posters,gdsets_posters_1970_11_27.jpg,,Poster - 11/27/70,[],,https://gdsets.com/70posters/1970_11_27.jpg,,,,,,1970-11-27,1713480554817,false
gdsets_posters,gdsets_posters_1970_11_23h.jpg,,Poster - 11/23/70 (OHB),[],,https://gdsets.com/70posters/1970_11_23h.jpg,,,,,,1970-11-23,1713480554916,true
gdsets_posters,gdsets_posters_1970_11_29.jpg,,Poster - 11/29/70,[],,https://gdsets.com/70posters/1970_11_29.jpg,,,,,,1970-11-29,1713480554949,false
gdsets_posters,gdsets_posters_1970_11_23a.jpg,,Poster - 11/23/70(Alternate OP1),[],,https://gdsets.com/70posters/1970_11_23a.jpg,,,,,,1970-11-23,1713480554996,true
gdsets_posters,gdsets_posters_1970_11_23.jpg,,Poster - 11/23/70 (OP1),[],,https://gdsets.com/70posters/1970_11_23.jpg,,,,,,1970-11-23,1713480554996,false
gdsets_posters,gdsets_posters_1970_11_01.jpg,,Poster - American Beauty Promo,[],,https://gdsets.com/70posters/1970_11_01.jpg,,,,,,1970-11-01,1713480555124,false
gdsets_posters,gdsets_posters_1970_11_23f.jpg,,Poster - 11/23/70 (OHB),[],,https://gdsets.com/70posters/1970_11_23f.jpg,,,,,,1970-11-23,1713480555130,true
gdsets_posters,gdsets_posters_1970_11_23b.jpg,,Poster - 11/23/70 (OP1),[],,https://gdsets.com/70posters/1970_11_23b.jpg,,,,,,1970-11-23,1713480555301,true
gdsets_posters,gdsets_posters_1970_12_18.jpg,,Poster - 12/18-20/70(cancelled),[],,https://gdsets.com/70posters/1970_12_18.jpg,,,,,,1970-12-18,1713480555354,false
gdsets_posters,gdsets_posters_1970_12_22a (OHB).jpg,,Poster - 12/22/70 (OHB)AOR 4.101,[],,https://gdsets.com/70posters/1970_12_22a 
gdsets_posters,gdsets_posters_1970_12_21.jpg,,Poster - 12/21/70,[],,https://gdsets.com/70posters/1970_12_21.jpg,,,,,,1970-12-21,1713480555545,false
gdsets_posters,gdsets_posters_1970_12_31c.jpg,,Poster - 12/31/70,[],,https://gdsets.com/70posters/1970_12_31c.jpg,,,,,,1970-12-31,1713480555571,false
gdsets_posters,gdsets_posters_1971_01_22.jpg,,Poster - 1/22/71,[],,https://gdsets.com/70posters/1971_01_22.jpg,,,,,,1971-01-22,1713480555671,false
gdsets_posters,gdsets_posters_1971_01_24.jpg,,Poster - 1/24/71,[],,https://gdsets.com/70posters/1971_01_24.jpg,,,,,,1971-01-24,1713480555781,false
gdsets_posters,gdsets_posters_1971_01_21.jpg,,Poster - 1/21/71 (OP1)AOR 4.108,[],,https://gdsets.com/70posters/1971_01_21.jpg,,,,,,1971-01-21,1713480555843,false
gdsets_posters,gdsets_posters_1971_01_24a.jpg,,Poster - 1/24/71,[],,https://gdsets.com/70posters/1971_01_24a.jpg,,,,,,1971-01-24,1713480555869,false
gdsets_posters,gdsets_posters_1970_12_22 (AOR 4.101).jpg,,Poster - 12/22/70 (OP1)AOR 4.101,[],,https://gdsets.com/70posters/1970_12_22 (AOR
gdsets_posters,gdsets_posters_1970_11_01a.jpg,,Poster - American Beauty Promo,[],,https://gdsets.com/70posters/1970_11_01a.jpg,,,,,,1970-11-01,1713480556157,false
gdsets_posters,gdsets_posters_1971_02_02.jpg,,"Poster - 2/2,3/71",[],,https://gdsets.com/70posters/1971_02_02.jpg,,,,,,1971-02-02,1713480556213,false
gdsets_posters,gdsets_posters_1971_02_18.jpg,,Poster - 2/18-24/71,[],,https://gdsets.com/70posters/1971_02_18.jpg,,,,,,1971-02-18,1713480556217,false
gdsets_posters,gdsets_posters_1970_12_31a.jpg,,Poster - 12/31/70 @ BG263 (OPC-A),[],,https://gdsets.com/70posters/1970_12_31a.jpg,,,,,,1970-12-31,1713480556231,false
gdsets_posters,gdsets_posters_1970_12_31b.jpg,,Poster - 12/31/70 @ BG263 (OPC-C),[],,https://gdsets.com/70posters/1970_12_31b.jpg,,,,,,1970-12-31,1713480556314,true
gdsets_posters,gdsets_posters_1970_10_19.jpg,,Poster - 10/19/70,[],,https://gdsets.com/70posters/1970_10_19.jpg,,,,,,1970-10-19,1713480556314,false
gdsets_posters,gdsets_posters_1970_11_23g.jpg,,Poster - 11/23/70 (OHB),[],,https://gdsets.com/70posters/1970_11_23g.jpg,,,,,,1970-11-23,1713480556334,false
gdsets_posters,gdsets_posters_1970_12_12.jpg,,Poster - 12/12/70 @ AOR 4.95,[],,https://gdsets.com/70posters/1970_12_12.jpg,,,,,,1970-12-12,1713480556581,false
gdsets_posters,gdsets_posters_1971_02_18a.jpg,,Poster - 2/18-24/71,[],,https://gdsets.com/70posters/1971_02_18a.jpg,,,,,,1971-02-18,1713480556666,true
gdsets_posters,gdsets_posters_1971_03_05b.jpg,,Poster - 3/5/71 (OHB)AOR 4.79,[],,https://gdsets.com/70posters/1971_03_05b.jpg,,,,,,1971-03-05,1713480556995,true
gdsets_posters,gdsets_posters_1971_03_05e.jpg,,Poster - 3/5/71 @ AOR 4.79,[],,https://gdsets.com/70posters/1971_03_05e.jpg,,,,,,1971-03-05,1713480557160,true
gdsets_posters,gdsets_posters_1971_03_05aa.jpg,,Poster - 3/5/71 (OP1)AOR 4.79,[],,https://gdsets.com/70posters/1971_03_05aa.jpg,,,,,,1971-03-05,1713480557250,true
gdsets_posters,gdsets_posters_1971_03_13a.jpg,,Poster - 3/13/71,[],,https://gdsets.com/70posters/1971_03_13a.jpg,,,,,,1971-03-13,1713480557289,false
gdsets_posters,gdsets_posters_1971_02_25a.jpg,,Poster - 2/25/71 @ BG271/272(OPC-C),[],,https://gdsets.com/70posters
gdsets_posters,gdsets_posters_1971_03_13b.jpg,,Poster - 3/13/71,[],,https://gdsets.com/70posters/1971_03_13b.jpg,,,,,,1971-03-13,1713480557491,false
gdsets_posters,gdsets_posters_1971_02_25.jpg,,Poster - 2/25/71 @ BG271 (OP1),[],,https://gdsets.com/70posters/1971_02_25.jpg,,,,,,1971-02-25,1713480557609,false
gdsets_posters,gdsets_posters_1970_12_21a.jpg,,Poster - 12/21/70,[],,https://gdsets.com/70posters/1970_12_21a.jpg,,,,,,1970-12-21,1713480557722,false
gdsets_posters,gdsets_posters_1971_03_14.jpg,,Poster - 3/14/71 (OP1),[],,https://gdsets.com/70posters/1971_03_14.jpg,,,,,,1971-03-14,1713480557772,true
gdsets_posters,gdsets_posters_1971_03_05c.jpg,,Poster - 3/5/71 @ AOR 4.79,[],,https://gdsets.com/70posters/1971_03_05c.jpg,,,,,,1971-03-05,1713480557775,true
gdsets_posters,gdsets_posters_1971_03_05d.jpg,,Poster - 3/5/71 @ AOR 4.79,[],,https://gdsets.com/70posters/1971_03_05d.jpg,,,,,,1971-03-05,1713480557815,true
gdsets_posters,gdsets_posters_1970_12_26.jpg,,Poster - 12/26-28/70,[],,https://gdsets.com/70posters/1970_12_26.jpg,,,,,,1970-12-26,1713480557834,false
gdsets_posters,gdsets_posters_1971_03_17a.jpg,,"Poster - 3/17,18/71",[],,https://gdsets.com/70posters/1971_03_17a.jpg,,,,,,1971-03-17,1713480558038,false
gdsets_posters,gdsets_posters_1971_03_20.jpg,,Poster - 3/20/71,[],,https://gdsets.com/70posters/1971_03_20.jpg,,,,,,1971-03-20,1713480558038,false
gdsets_posters,gdsets_posters_1971_03_17.jpg,,"Poster - 3/17,18/71",[],,https://gdsets.com/70posters/1971_03_17.jpg,,,,,,1971-03-17,1713480558106,false
gdsets_posters,gdsets_posters_1971_03_20a.jpg,,Poster - 3/20/71,[],,https://gdsets.com/70posters/1971_03_20a.jpg,,,,,,1971-03-20,1713480558165,true
gdsets_posters,gdsets_posters_1971_03_03 (AOR 2.171 OP).jpg,,Poster - 3/3/71 (OP1)AOR 2.171,[],,https://gdsets.com/70posters/1971_03_03 (AOR 2.171
gdsets_posters,gdsets_posters_1971_03_13.jpg,,Poster - 3/13/71 (OP1),[],,https://gdsets.com/70posters/1971_03_13.jpg,,,,,,1971-03-13,1713480558332,false
gdsets_posters,gdsets_posters_1971_03_21a.jpg,,Poster - 3/21/71,[],,https://gdsets.com/70posters/1971_03_21a.jpg,,,,,,1971-03-21,1713480558532,false
gdsets_posters,gdsets_posters_1970_12_31 (BG263 OP1).jpg,,Poster - 12/31/70 @ BG263 (OP1),[],,https://gdsets.com/70posters/1970_12_31 (BG263
gdsets_posters,gdsets_posters_1971_04_04a.jpg,,Poster - 4/4-6/71,[],,https://gdsets.com/70posters/1971_04_04a.jpg,,,,,,1971-04-04,1713480558648,false
gdsets_posters,gdsets_posters_1971_03_05a.jpg,,Poster - 3/5/71 (OP1)AOR 4.79,[],,https://gdsets.com/70posters/1971_03_05a.jpg,,,,,,1971-03-05,1713480558745,false
gdsets_posters,gdsets_posters_1971_04_04.jpg,,Poster - 4/4-6/71,[],,https://gdsets.com/70posters/1971_04_04.jpg,,,,,,1971-04-04,1713480558749,false
gdsets_posters,gdsets_posters_1971_04_01.jpg,,Poster - 4/1/71,[],,https://gdsets.com/70posters/1971_04_01.jpg,,,,,,1971-04-01,1713480558830,false
gdsets_posters,gdsets_posters_1971_04_10c.jpg,,Poster - 4/10/71,[],,https://gdsets.com/70posters/1971_04_10c.jpg,,,,,,1971-04-10,1713480558960,false
gdsets_posters,gdsets_posters_1970_12_01.jpg,,"Poster - 12/1,2/70",[],,https://gdsets.com/70posters/1970_12_01.jpg,,,,,,1970-12-01,1713480559070,false
gdsets_posters,gdsets_posters_1971_02_02a.jpg,,"Poster - 2/2,3/71",[],,https://gdsets.com/70posters/1971_02_02a.jpg,,,,,,1971-02-02,1713480559075,false
gdsets_posters,gdsets_posters_1971_03_21.jpg,,Poster - 3/21/71,[],,https://gdsets.com/70posters/1971_03_21.jpg,,,,,,1971-03-21,1713480559102,false
gdsets_posters,gdsets_posters_1971_04_12.jpg,,Poster - 4/12/71,[],,https://gdsets.com/70posters/1971_04_12.jpg,,,,,,1971-04-12,1713480559156,false
gdsets_posters,gdsets_posters_1971_04_13.jpg,,Poster - 4/13/71,[],,https://gdsets.com/70posters/1971_04_13.jpg,,,,,,1971-04-13,1713480559276,false
gdsets_posters,gdsets_posters_1971_03_21c.jpg,,Poster - 3/21/71,[],,https://gdsets.com/70posters/1971_03_21c.jpg,,,,,,1971-03-21,1713480559337,false
gdsets_posters,gdsets_posters_1971_04_13b.jpg,,Poster - 4/13/71,[],,https://gdsets.com/70posters/1971_04_13b.jpg,,,,,,1971-04-13,1713480559338,false
gdsets_posters,gdsets_posters_1971_04_13a.jpg,,Poster - 4/13/71,[],,https://gdsets.com/70posters/1971_04_13a.jpg,,,,,,1971-04-13,1713480559374,false
gdsets_posters,gdsets_posters_1971_03_21b.jpg,,Poster - 3/21/71,[],,https://gdsets.com/70posters/1971_03_21b.jpg,,,,,,1971-03-21,1713480559378,false
gdsets_posters,gdsets_posters_1971_04_10.jpg,,Poster - 4/10/71 (OP1)AOR 4.212,[],,https://gdsets.com/70posters/1971_04_10.jpg,,,,,,1971-04-10,1713480559463,false
gdsets_posters,gdsets_posters_1971_04_13d.jpg,,Poster - 4/13/71,[],,https://gdsets.com/70posters/1971_04_13d.jpg,,,,,,1971-04-13,1713480559466,false
gdsets_posters,gdsets_posters_1971_04_13e.jpg,,Poster - 4/13/71,[],,https://gdsets.com/70posters/1971_04_13e.jpg,,,,,,1971-04-13,1713480559547,false
gdsets_posters,gdsets_posters_1971_04_13f.jpg,,Poster - 4/13/71,[],,https://gdsets.com/70posters/1971_04_13f.jpg,,,,,,1971-04-13,1713480559558,false
gdsets_posters,gdsets_posters_1971_04_17.jpg,,Poster - 4/17/71 (OHB),[],,https://gdsets.com/70posters/1971_04_17.jpg,,,,,,1971-04-17,1713480559647,false
gdsets_posters,gdsets_posters_1971_04_17a.jpg,,Poster - 4/17/71 @ Front,[],,https://gdsets.com/70posters/1971_04_17a.jpg,,,,,,1971-04-17,1713480559650,false
gdsets_posters,gdsets_posters_1971_04_10b.jpg,,Poster - 4/10/71 (OP1)AOR 4.212(with stamp),[],,https://gdsets.com/70posters
gdsets_posters,gdsets_posters_1971_04_17b.jpg,,Poster - 4/17/71 @ Back,[],,https://gdsets.com/70posters/1971_04_17b.jpg,,,,,,1971-04-17,1713480559727,false
gdsets_posters,gdsets_posters_1971_03_14a.jpg,,Poster - 3/14/71 @ Newspaper Ad,[],,https://gdsets.com/70posters/1971_03_14a.jpg,,,,,,1971-03-14,1713480559810,false
gdsets_posters,gdsets_posters_1971_04_14.jpg,,Poster - 4/14/71,[],,https://gdsets.com/70posters/1971_04_14.jpg,,,,,,1971-04-14,1713480559835,false
gdsets_posters,gdsets_posters_1971_03_05f.jpg,,Poster - 3/5/71 @ AOR 4.79,[],,https://gdsets.com/70posters/1971_03_05f.jpg,,,,,,1971-03-05,1713480559843,true
gdsets_posters,gdsets_posters_1971_04_18.jpg,,Poster - 4/18/71,[],,https://gdsets.com/70posters/1971_04_18.jpg,,,,,,1971-04-18,1713480559932,false
gdsets_posters,gdsets_posters_1971_04_15.jpg,,Poster - 4/15/71,[],,https://gdsets.com/70posters/1971_04_15.jpg,,,,,,1971-04-15,1713480559982,false
gdsets_posters,gdsets_posters_1971_04_18c.jpg,,Poster - 4/18/71,[],,https://gdsets.com/70posters/1971_04_18c.jpg,,,,,,1971-04-18,1713480560020,false
gdsets_posters,gdsets_posters_1971_04_19a.jpg,,Poster - 4/19/71(cancelled),[],,https://gdsets.com/70posters/1971_04_19a.jpg,,,,,,1971-04-19,1713480560087,false
gdsets_posters,gdsets_posters_1971_04_18d.jpg,,Poster - 4/18/71,[],,https://gdsets.com/70posters/1971_04_18d.jpg,,,,,,1971-04-18,1713480560159,false
gdsets_posters,gdsets_posters_1971_04_18b.jpg,,Poster - 4/18/71,[],,https://gdsets.com/70posters/1971_04_18b.jpg,,,,,,1971-04-18,1713480560177,false
gdsets_posters,gdsets_posters_1971_04_19.jpg,,Poster - 4/19/71(cancelled),[],,https://gdsets.com/70posters/1971_04_19.jpg,,,,,,1971-04-19,1713480560183,false
gdsets_posters,gdsets_posters_1971_04_18a.jpg,,Poster - 4/18/71,[],,https://gdsets.com/70posters/1971_04_18a.jpg,,,,,,1971-04-18,1713480560196,false
gdsets_posters,gdsets_posters_1971_04_21.jpg,,Poster - 4/21/71,[],,https://gdsets.com/70posters/1971_04_21.jpg,,,,,,1971-04-21,1713480560258,false
gdsets_posters,gdsets_posters_1971_04_24.jpg,,Poster - 4/24/71,[],,https://gdsets.com/70posters/1971_04_24.jpg,,,,,,1971-04-24,1713480560285,false
gdsets_posters,gdsets_posters_1971_04_25.jpg,,Poster - 4/25-29/71,[],,https://gdsets.com/70posters/1971_04_25.jpg,,,,,,1971-04-25,1713480560286,false
gdsets_posters,gdsets_posters_1971_04_25a.jpg,,Poster - 4/25-29/71 @ Program,[],,https://gdsets.com/70posters/1971_04_25a.jpg,,,,,,1971-04-25,1713480560519,false
gdsets_posters,gdsets_posters_1971_06_12a.jpg,,"Poster - 6/12,13/71",[],,https://gdsets.com/70posters/1971_06_12a.jpg,,,,,,1971-06-12,1713480560531,false
gdsets_posters,gdsets_posters_1971_05_29b.jpg,,"Poster - 5/29,30/71 @ BG281/282(OPC-C)",[],,https://gdsets.com/70posters
gdsets_posters,gdsets_posters_1971_05_29d.jpg,,"Poster - 5/29,30/71",[],,https://gdsets.com/70posters/1971_05_29d.jpg,,,,,,1971-05-29,1713480560558,false
gdsets_posters,gdsets_posters_1971_04_22.jpg,,Poster - 4/22/71,[],,https://gdsets.com/70posters/1971_04_22.jpg,,,,,,1971-04-22,1713480560604,false
gdsets_posters,gdsets_posters_1971_07_31a.jpg,,Poster - 7/31/71,[],,https://gdsets.com/70posters/1971_07_31a.jpg,,,,,,1971-07-31,1713480560883,false
gdsets_posters,gdsets_posters_1971_07_30.jpg,,Poster - 7/30/71(rescheduled to8/26/71),[],,https://gdsets.com/70posters
gdsets_posters,gdsets_posters_1971_06_12.jpg,,Poster - 6/12-16/71,[],,https://gdsets.com/70posters/1971_06_12.jpg,,,,,,1971-06-12,1713480560885,false
gdsets_posters,gdsets_posters_1971_05_29a.jpg,,"Poster - 5/29,30/71 @ BG282 (OPC-A)",[],,https://gdsets.com/70posters
gdsets_posters,gdsets_posters_1971_02_08.jpg,,Poster - 2/8/71,[],,https://gdsets.com/70posters/1971_02_08.jpg,,,,,,1971-02-08,1713480561038,false
gdsets_posters,gdsets_posters_1971_08_05.jpg,,"Poster - 8/5,6/71",[],,https://gdsets.com/70posters/1971_08_05.jpg,,,,,,1971-08-05,1713480561054,true
gdsets_posters,gdsets_posters_1971_05_29c.jpg,,"Poster - 5/29,30/71 @ BG281/282 Proof",[],,https://gdsets.com/70posters
gdsets_posters,gdsets_posters_1971_08_05b.jpg,,"Poster - 8/5,6/71",[],,https://gdsets.com/70posters/1971_08_05b.jpg,,,,,,1971-08-05,1713480561138,false
gdsets_posters,gdsets_posters_1971_08_06.jpg,,Poster - 8/6/71,[],,https://gdsets.com/70posters/1971_08_06.jpg,,,,,,1971-08-06,1713480561169,false
gdsets_posters,gdsets_posters_1971_05_29.jpg,,"Poster - 5/29,30/71 @ BG282 (OP1)",[],,https://gdsets.com/70posters/1971_05_29.jpg,,,,,,1971-05-29,1713480561217,false
gdsets_posters,gdsets_posters_1971_07_31.jpg,,Poster - 7/31/71 @ Program,[],,https://gdsets.com/70posters/1971_07_31.jpg,,,,,,1971-07-31,1713480561287,false
gdsets_posters,gdsets_posters_1971_07_02a.jpg,,Poster - 7/2/71 @ BG287 @ Progressive Proof,[],,https://gdsets.com/70posters
gdsets_posters,gdsets_posters_1971_06_03.jpg,,Poster - 6/3/71,[],,https://gdsets.com/70posters/1971_06_03.jpg,,,,,,1971-06-03,1713480561572,false
gdsets_posters,gdsets_posters_1971_09_24b.jpg,,Poster - Skullfuck Promo,[],,https://gdsets.com/70posters/1971_09_24b.jpg,,,,,,1971-09-24,1713480561704,false
gdsets_posters,gdsets_posters_1971_09_03.jpg,,"Poster - 9/3,4/71(cancelled?)",[],,https://gdsets.com/70posters/1971_09_03.jpg,,,,,,1971-09-03,1713480561708,false
gdsets_posters,gdsets_posters_1971_08_26.jpg,,Poster - 8/26/71,[],,https://gdsets.com/70posters/1971_08_26.jpg,,,,,,1971-08-26,1713480561708,false
gdsets_posters,gdsets_posters_1971_09_17.jpg,,"Poster - 9/17,18/71",[],,https://gdsets.com/70posters/1971_09_17.jpg,,,,,,1971-09-17,1713480561761,false
gdsets_posters,gdsets_posters_1971_08_07.jpg,,Poster - 8/7/71,[],,https://gdsets.com/70posters/1971_08_07.jpg,,,,,,1971-08-07,1713480561794,false
gdsets_posters,gdsets_posters_1971_02_12.jpg,,"Poster - 2/12,13/71",[],,https://gdsets.com/70posters/1971_02_12.jpg,,,,,,1971-02-12,1713480561854,false
gdsets_posters,gdsets_posters_1971_08_14b.jpg,,"Poster - 8/14,15/71",[],,https://gdsets.com/70posters/1971_08_14b.jpg,,,,,,1971-08-14,1713480561886,false
gdsets_posters,gdsets_posters_1971_09_24a.jpg,,Poster - Skullfuck Promo,[],,https://gdsets.com/70posters/1971_09_24a.jpg,,,,,,1971-09-24,1713480561928,false
gdsets_posters,gdsets_posters_1971_08_14a.jpg,,"Poster - 8/14,15/71",[],,https://gdsets.com/70posters/1971_08_14a.jpg,,,,,,1971-08-14,1713480561936,true
gdsets_posters,gdsets_posters_1971_08_14.jpg,,"Poster - 8/14,15/71",[],,https://gdsets.com/70posters/1971_08_14.jpg,,,,,,1971-08-14,1713480562017,false
gdsets_posters,gdsets_posters_1971_08_20.jpg,,Poster - 8/20/71,[],,https://gdsets.com/70posters/1971_08_20.jpg,,,,,,1971-08-20,1713480562045,false
gdsets_posters,gdsets_posters_1971_10_19.jpg,,Poster - 10/19/71,[],,https://gdsets.com/70posters/1971_10_19.jpg,,,,,,1971-10-19,1713480562057,false
gdsets_posters,gdsets_posters_1971_03_24.jpg,,Poster - 3/24/71 (OP1),[],,https://gdsets.com/70posters/1971_03_24.jpg,,,,,,1971-03-24,1713480562095,false
gdsets_posters,gdsets_posters_1971_09_24.jpg,,Poster - Skullfuck Promo,[],,https://gdsets.com/70posters/1971_09_24.jpg,,,,,,1971-09-24,1713480562229,false
gdsets_posters,gdsets_posters_1971_10_19a.jpg,,Poster - 10/19/71,[],,https://gdsets.com/70posters/1971_10_19a.jpg,,,,,,1971-10-19,1713480562241,false
gdsets_posters,gdsets_posters_1971_10_19b.jpg,,Poster - 10/19/71,[],,https://gdsets.com/70posters/1971_10_19b.jpg,,,,,,1971-10-19,1713480562390,false
gdsets_posters,gdsets_posters_1971_10_21.jpg,,"Poster - 10/21,22/71",[],,https://gdsets.com/70posters/1971_10_21.jpg,,,,,,1971-10-21,1713480562424,false
gdsets_posters,gdsets_posters_1971_10_26.jpg,,"Poster - 10/26,27/71",[],,https://gdsets.com/70posters/1971_10_26.jpg,,,,,,1971-10-26,1713480562432,true
gdsets_posters,gdsets_posters_1971_10_26c.jpg,,"Poster - 10/26,27/71",[],,https://gdsets.com/70posters/1971_10_26c.jpg,,,,,,1971-10-26,1713480562436,true
gdsets_posters,gdsets_posters_1971_07_02 BG287(OP1).jpg,,Poster - 7/2/71 @ BG287 (OP1),[],,https://gdsets.com/70posters/1971_07_02 BG287
gdsets_posters,gdsets_posters_1971_10_26b.jpg,,"Poster - 10/26,27/71",[],,https://gdsets.com/70posters/1971_10_26b.jpg,,,,,,1971-10-26,1713480562487,true
gdsets_posters,gdsets_posters_1971_10_26a.jpg,,"Poster - 10/26,27/71",[],,https://gdsets.com/70posters/1971_10_26a.jpg,,,,,,1971-10-26,1713480562526,false
gdsets_posters,gdsets_posters_1971_10_26d.jpg,,"Poster - 10/26,27/71",[],,https://gdsets.com/70posters/1971_10_26d.jpg,,,,,,1971-10-26,1713480562527,true
gdsets_posters,gdsets_posters_1971_10_21a.jpg,,"Poster - 10/21,22/71",[],,https://gdsets.com/70posters/1971_10_21a.jpg,,,,,,1971-10-21,1713480562587,false
gdsets_posters,gdsets_posters_1971_10_30a.jpg,,Poster - 10/30/71,[],,https://gdsets.com/70posters/1971_10_30a.jpg,,,,,,1971-10-30,1713480562667,false
gdsets_posters,gdsets_posters_1971_10_30.jpg,,Poster - 10/30/71,[],,https://gdsets.com/70posters/1971_10_30.jpg,,,,,,1971-10-30,1713480562693,false
gdsets_posters,gdsets_posters_1971_11_11.jpg,,Poster - 11/11/71,[],,https://gdsets.com/70posters/1971_11_11.jpg,,,,,,1971-11-11,1713480562757,true
gdsets_posters,gdsets_posters_1971_08_05a.jpg,,"Poster - 8/5,6/71",[],,https://gdsets.com/70posters/1971_08_05a.jpg,,,,,,1971-08-05,1713480562871,false
gdsets_posters,gdsets_posters_1971_11_12.jpg,,Poster - 11/12/71,[],,https://gdsets.com/70posters/1971_11_12.jpg,,,,,,1971-11-12,1713480562934,true
gdsets_posters,gdsets_posters_1971_10_08.jpg,,Poster - 10/8/71,[],,https://gdsets.com/70posters/1971_10_08.jpg,,,,,,1971-10-08,1713480562966,false
gdsets_posters,gdsets_posters_1971_11_12a.jpg,,Poster - 11/12/71,[],,https://gdsets.com/70posters/1971_11_12a.jpg,,,,,,1971-11-12,1713480563069,false
gdsets_posters,gdsets_posters_1971_11_15a.jpg,,Poster - 11/15/71,[],,https://gdsets.com/70posters/1971_11_15a.jpg,,,,,,1971-11-15,1713480563076,true
gdsets_posters,gdsets_posters_1971_11_15.jpg,,Poster - 11/15/71,[],,https://gdsets.com/70posters/1971_11_15.jpg,,,,,,1971-11-15,1713480563086,true
gdsets_posters,gdsets_posters_1971_11_14a.jpg,,Poster - 11/14/71,[],,https://gdsets.com/70posters/1971_11_14a.jpg,,,,,,1971-11-14,1713480563100,false
gdsets_posters,gdsets_posters_1971_11_15b.jpg,,Poster - 11/15/71,[],,https://gdsets.com/70posters/1971_11_15b.jpg,,,,,,1971-11-15,1713480563135,true
gdsets_posters,gdsets_posters_1971_10_00.jpg,,Poster - Fall 1971 @ Blank Poster,[],,https://gdsets.com/70posters/1971_10_00.jpg,,,,,,1971-10-00,1713480563144,false
gdsets_posters,gdsets_posters_1971_10_23.jpg,,"Poster - 10/23,24/71",[],,https://gdsets.com/70posters/1971_10_23.jpg,,,,,,1971-10-23,1713480563229,false
gdsets_posters,gdsets_posters_1971_11_17.jpg,,Poster - 11/17/71,[],,https://gdsets.com/70posters/1971_11_17.jpg,,,,,,1971-11-17,1713480563331,false
gdsets_posters,gdsets_posters_1971_11_17b.jpg,,Poster - 11/17/71,[],,https://gdsets.com/70posters/1971_11_17b.jpg,,,,,,1971-11-17,1713480563352,true
gdsets_posters,gdsets_posters_1971_11_12b.jpg,,Poster - 11/12-17/71(Handbill proof),[],,https://gdsets.com/70posters
gdsets_posters,gdsets_posters_1971_11_17a.jpg,,Poster - 11/17/71,[],,https://gdsets.com/70posters/1971_11_17a.jpg,,,,,,1971-11-17,1713480563369,true
gdsets_posters,gdsets_posters_1971_11_11b.jpg,,Poster - 11/11/71,[],,https://gdsets.com/70posters/1971_11_11b.jpg,,,,,,1971-11-11,1713480563427,true
gdsets_posters,gdsets_posters_1971_11_11a.jpg,,Poster - 11/11/71,[],,https://gdsets.com/70posters/1971_11_11a.jpg,,,,,,1971-11-11,1713480563521,false
gdsets_posters,gdsets_posters_1971_11_20a.jpg,,Poster - 11/20/71,[],,https://gdsets.com/70posters/1971_11_20a.jpg,,,,,,1971-11-20,1713480563546,false
gdsets_posters,gdsets_posters_1971_10_29.jpg,,Poster - 10/29/71,[],,https://gdsets.com/70posters/1971_10_29.jpg,,,,,,1971-10-29,1713480563587,false
gdsets_posters,gdsets_posters_1971_11_15d.jpg,,Poster - 11/15/71,[],,https://gdsets.com/70posters/1971_11_15d.jpg,,,,,,1971-11-15,1713480563590,false
gdsets_posters,gdsets_posters_1971_12_04.jpg,,Poster - 12/4-7/71,[],,https://gdsets.com/70posters/1971_12_04.jpg,,,,,,1971-12-04,1713480563653,true
gdsets_posters,gdsets_posters_1971_12_09.jpg,,"Poster - 12/9,10/71",[],,https://gdsets.com/70posters/1971_12_09.jpg,,,,,,1971-12-09,1713480563687,false
gdsets_posters,gdsets_posters_1971_11_15c.jpg,,Poster - 11/15/71,[],,https://gdsets.com/70posters/1971_11_15c.jpg,,,,,,1971-11-15,1713480563710,false
gdsets_posters,gdsets_posters_1971_11_20b.jpg,,Poster - 11/20/71,[],,https://gdsets.com/70posters/1971_11_20b.jpg,,,,,,1971-11-20,1713480563736,false
gdsets_posters,gdsets_posters_1971_12_10a.jpg,,Poster - 12/10/71,[],,https://gdsets.com/70posters/1971_12_10a.jpg,,,,,,1971-12-10,1713480563736,false
gdsets_posters,gdsets_posters_1971_11_20c.jpg,,Poster - 11/20/71,[],,https://gdsets.com/70posters/1971_11_20c.jpg,,,,,,1971-11-20,1713480563771,false
gdsets_posters,gdsets_posters_1971_11_14.jpg,,Poster - 11/14/71,[],,https://gdsets.com/70posters/1971_11_14.jpg,,,,,,1971-11-14,1713480563772,false
gdsets_posters,gdsets_posters_1971_11_20.jpg,,Poster - 11/20/71,[],,https://gdsets.com/70posters/1971_11_20.jpg,,,,,,1971-11-20,1713480563796,false
gdsets_posters,gdsets_posters_1971_12_10.jpg,,Poster - 12/10/71,[],,https://gdsets.com/70posters/1971_12_10.jpg,,,,,,1971-12-10,1713480563815,false
gdsets_posters,gdsets_posters_1971_12_04a.jpg,,Poster - 12/4-7/71,[],,https://gdsets.com/70posters/1971_12_04a.jpg,,,,,,1971-12-04,1713480563871,false
gdsets_posters,gdsets_posters_1971_12_14d.jpg,,"Poster - 12/14,15/71",[],,https://gdsets.com/70posters/1971_12_14d.jpg,,,,,,1971-12-14,1713480564094,true
gdsets_posters,gdsets_posters_1971_12_14b.jpg,,"Poster - 12/14,15/71",[],,https://gdsets.com/70posters/1971_12_14b.jpg,,,,,,1971-12-14,1713480564130,false
gdsets_posters,gdsets_posters_1971_12_14c.jpg,,"Poster - 12/14,15/71",[],,https://gdsets.com/70posters/1971_12_14c.jpg,,,,,,1971-12-14,1713480564147,true
gdsets_posters,gdsets_posters_1971_12_31c.jpg,,Poster - 12/31/71,[],,https://gdsets.com/70posters/1971_12_31c.jpg,,,,,,1971-12-31,1713480564204,false
gdsets_posters,gdsets_posters_1972_01_23.jpg,,Poster - 1/23/72,[],,https://gdsets.com/70posters/1972_01_23.jpg,,,,,,1972-01-23,1713480564237,false
gdsets_posters,gdsets_posters_1971_12_31d.jpg,,Poster - 12/31/71,[],,https://gdsets.com/70posters/1971_12_31d.jpg,,,,,,1971-12-31,1713480564254,false
gdsets_posters,gdsets_posters_1972_01_21.jpg,,Poster - 1/21/72,[],,https://gdsets.com/70posters/1972_01_21.jpg,,,,,,1972-01-21,1713480564286,false
gdsets_posters,gdsets_posters_1972_01_29.jpg,,Poster - 1/29/72,[],,https://gdsets.com/70posters/1972_01_29.jpg,,,,,,1972-01-29,1713480564372,false
gdsets_posters,gdsets_posters_1972_01_26.jpg,,Poster - 1/26/72,[],,https://gdsets.com/70posters/1972_01_26.jpg,,,,,,1972-01-26,1713480564379,false
gdsets_posters,gdsets_posters_1972_03_25.jpg,,Poster - 3/25/72 (OP1)AOR 4.222,[],,https://gdsets.com/70posters/1972_03_25.jpg,,,,,,1972-03-25,1713480564400,false
gdsets_posters,gdsets_posters_1971_12_31.jpg,,Poster - 12/31/71,[],,https://gdsets.com/70posters/1971_12_31.jpg,,,,,,1971-12-31,1713480564431,false
gdsets_posters,gdsets_posters_1972_01_23a.jpg,,Poster - 1/23/72,[],,https://gdsets.com/70posters/1972_01_23a.jpg,,,,,,1972-01-23,1713480564481,false
gdsets_posters,gdsets_posters_1972_01_22.jpg,,Poster - 1/22/72,[],,https://gdsets.com/70posters/1972_01_22.jpg,,,,,,1972-01-22,1713480564481,false
gdsets_posters,gdsets_posters_1972_03_05.jpg,,Poster - 3/5/72(read fine print),[],,https://gdsets.com/70posters/1972_03_05.jpg,,,,,,1972-03-05,1713480564505,false
gdsets_posters,gdsets_posters_1972_04_00.jpg,,Poster - Europe '72 @ generic,[],,https://gdsets.com/70posters/1972_04_00.jpg,,,,,,1972-04-00,1713480564620,false
gdsets_posters,gdsets_posters_1971_12_14.jpg,,"Poster - 12/14,15/71 (OP1)AOR 4.187(no ticket outlets)",[],,https://gdsets.com/70posters
gdsets_posters,gdsets_posters_1972_04_16.jpg,,Poster - 4/16/72,[],,https://gdsets.com/70posters/1972_04_16.jpg,,,,,,1972-04-16,1713480564769,false
